,question,contexts,answer,ground_truth,faithfulness,answer_relevancy,context_precision,context_recall
0,Bis wann soll Deutschland klimaneutral sein?,"['Darin zeigt sich unser Anspruch eines modernen und \nkooperativen Regierens.\n2.1. Zukunftsmission I.  \nKlimaneutrales Deutschland\nDen Klimawandel zu stoppen, ist eine Menschheitsaufgabe. Unsere Politik richtet sich nach dem \nKlimaabkommen von Paris: Wir müssen die globale Erderwärmung auf möglichst 1,5 Grad Celsius \nbegrenzen. Darum haben wir uns zum Ziel gesetzt, in Deutschland bis spätestens 2045 komplett \nklimaneutral zu sein. Mit dem Klimaschutzgesetz haben wir dafür gesorgt, dass das Klimaab -\nkommen konkret wird: Es bietet einen wirkungsvollen Kontrollmechanismus zur Erreichung der \nKlimaziele. Dementsprechend werden wir im Einklang mit den europäischen Klimazielen unser \nMinderungsziel für 2030 deutlich (auf 65 %) anheben; auch für 2040 werden wir ein Minderungs-\nziel festschreiben (88 %).\nEs kommt jetzt darauf an, die Ziele in praktische Politik umzusetzen. Der Ausstieg aus der Atom-\nenergie ist Ende nächsten Jahres bereits vollzogen. Auch der Kohleausstieg ist beschlossene Sache. \nDabei gilt, je schneller der Ausbau der Stromerzeugung aus erneuerbaren Energien erfolgt und je \nschneller die nötigen Stromleitungen und Verteilnetze gebaut werden, desto eher kann auf fossile \nEnergieträger verzichtet werden. Wir haben in dieser Wahlperiode den Ausstieg aufs Gleis gesetzt \nund ihn mit umfassenden Strukturhilfen verbunden, die wir zügig umsetzen wollen. Das sind his-\ntorische Entscheidungen.'
 'Um in Deutschland bis spätestens 2045 treibhausgasneutral leben, arbeiten und wirtschaften \nzu können, werden wir dafür sorgen, dass wir unseren Strom spätestens bis zum Jahr 2040 voll-\nständig aus erneuerbaren Energien beziehen. Unser Strombedarf wird in den kommenden Jahren \nund Jahrzehnten deutlich steigen, weil wir anstatt fossiler Energieträger deutlich mehr Strom im \nVerkehr und der Industrie einsetzen werden. Allein bis 2030 brauchen wir jährlich ungefähr 10 \ntWh Strom zusätzlich - das entspricht dem Stromverbrauch von Hamburg. Wir brauchen deshalb \nein Jahrzehnt des entschlossenen Ausbaus der erneuerbaren Energien. Dafür müssen jetzt die \nrichtigen Entscheidungen getroffen werden: Beim Ausbau der erneuerbaren Energien und der \nDigitalisierung der Stromnetze, bei der Steigerung der Energieeffizienz, beim Aufbau von Speicher -\ntechnologien und einer Wasserstoffproduktion sowie eines Transportnetzes, bei Investitionen in \nklimafreundliche Produktionsprozesse in der Industrie, bei der Modernisierung von Wohngebäu-\nden, Fabriken und Schulen. \nErneuerbarer Strom wird in allen Sektoren eingesetzt. Dort, wo eine direkte Elektrifizierung nicht \nsinnvoll ist, werden wir große Mengen Wasserstoff aus erneuerbaren Energien benötigen. Wasser -\nstoff stößt bei der Verbrennung keinerlei Treibhausgase aus und ist gut speicherbar. Er ist reichlich \nvorhanden und lässt sich durch die Aufspaltung von Wasser in Sauerstoff und Wasserstoff erzeu-\ngen. Ohne sauberen Wasserstoff in großindustriell hergestelltem Maßstab ist Klimaneutralität \nnicht zu erreichen.'
 'Das Zukunftsprogramm der SPD\nKapitel 2\nSeite >9\nSPD-Parteivorstand 2021 \nDas Zukunftsprogramm der SPD\nKapitel 2\nUnser Ziel: Leben, Arbeiten und Wirtschaften hat spätestens 2045 keine negativen Auswirkungen \nmehr auf unser Klima. Die Energieversorgung Deutschlands basiert dann vollständig auf erneu-\nerbaren Energien, unsere Gebäude werden effizient mit erneuerbaren Energien beheizt. Unsere \nIndustrie ist auf den Weltmärkten weiterhin führend, gerade weil sie CO2-neutral produziert \nund Technologien exportiert, die die klimaneutrale Welt von morgen braucht. So sichern wir die \nArbeitsplätze für die Zukunft und erreichen gleichzeitig unsere ökologischen Ziele. Klimaschutz ist \ndie soziale Aufgabe der nächsten Jahrzehnte.\nUm in Deutschland bis spätestens 2045 treibhausgasneutral leben, arbeiten und wirtschaften \nzu können, werden wir dafür sorgen, dass wir unseren Strom spätestens bis zum Jahr 2040 voll-\nständig aus erneuerbaren Energien beziehen. Unser Strombedarf wird in den kommenden Jahren \nund Jahrzehnten deutlich steigen, weil wir anstatt fossiler Energieträger deutlich mehr Strom im \nVerkehr und der Industrie einsetzen werden. Allein bis 2030 brauchen wir jährlich ungefähr 10 \ntWh Strom zusätzlich - das entspricht dem Stromverbrauch von Hamburg. Wir brauchen deshalb \nein Jahrzehnt des entschlossenen Ausbaus der erneuerbaren Energien.']",Deutschland soll bis spätestens 2045 klimaneutral sein.,"Darum haben wir uns zum Ziel gesetzt, in Deutschland bis spätestens 2045 komplett klimaneutral zu sein.",1.0,0.9999999999999994,0.9999999999666667,1.0
1,Wie hoch soll das Minderungsziel für 2030 sein?,"['Darin zeigt sich unser Anspruch eines modernen und \nkooperativen Regierens.\n2.1. Zukunftsmission I.  \nKlimaneutrales Deutschland\nDen Klimawandel zu stoppen, ist eine Menschheitsaufgabe. Unsere Politik richtet sich nach dem \nKlimaabkommen von Paris: Wir müssen die globale Erderwärmung auf möglichst 1,5 Grad Celsius \nbegrenzen. Darum haben wir uns zum Ziel gesetzt, in Deutschland bis spätestens 2045 komplett \nklimaneutral zu sein. Mit dem Klimaschutzgesetz haben wir dafür gesorgt, dass das Klimaab -\nkommen konkret wird: Es bietet einen wirkungsvollen Kontrollmechanismus zur Erreichung der \nKlimaziele. Dementsprechend werden wir im Einklang mit den europäischen Klimazielen unser \nMinderungsziel für 2030 deutlich (auf 65 %) anheben; auch für 2040 werden wir ein Minderungs-\nziel festschreiben (88 %).\nEs kommt jetzt darauf an, die Ziele in praktische Politik umzusetzen. Der Ausstieg aus der Atom-\nenergie ist Ende nächsten Jahres bereits vollzogen. Auch der Kohleausstieg ist beschlossene Sache. \nDabei gilt, je schneller der Ausbau der Stromerzeugung aus erneuerbaren Energien erfolgt und je \nschneller die nötigen Stromleitungen und Verteilnetze gebaut werden, desto eher kann auf fossile \nEnergieträger verzichtet werden. Wir haben in dieser Wahlperiode den Ausstieg aufs Gleis gesetzt \nund ihn mit umfassenden Strukturhilfen verbunden, die wir zügig umsetzen wollen. Das sind his-\ntorische Entscheidungen.'
 'Das Zukunftsprogramm der SPD\nKapitel 3Seite >28\nSPD-Parteivorstand 2021Die Corona-Krise hat erneut gezeigt, dass die soziale Sicherung der Minijobs unzureichend ist. \nUnser Ziel ist, alle Beschäftigungsverhältnisse in die soziale Sicherung einzubeziehen. Dabei wird \nes Übergänge für bestehende Arbeitsverhältnisse und Ausnahmen für bestimmte Gruppen wie \nzum Beispiel Rentner*innen geben. Um die Nettoeinkommen von gering Verdienenden zu erhö-\nhen, heben wir die Gleitzone der Midi-Jobs auf 1.600 Euro an. In dieser Zone zahlen die Arbeitneh-\nmer*innen geringere Beiträge, ohne dass sie dadurch einen geringeren Rentenanspruch haben.\nDen Zugang zur Brückenteilzeit werden wir für mehr Beschäftigte möglich machen. \nCorona hat ein Schlaglicht darauf geworfen, wie groß bei manchen Berufsgruppen die Lücke \nzwischen Wert und Lohn ist. Dazu gehören die sozialen Dienstleistungsberufe. Es verdient große \nAnerkennung, dass immer mehr junge Menschen es sich vorstellen können, soziale Berufe zu er -\ngreifen, Mädchen genauso wie Jungen - es sind Berufe mit Bedeutung und Zukunft. Hier entstehen \ndie meisten Arbeitsplätze.\nIn der Pflege wird enorme und gesellschaftlich wertvolle Arbeit geleistet. Wir wollen die Lohn- und \nArbeitsbedingungen in der Altenpflege und Pflege von Menschen mit Behinderung schnell verbes-\nsern. Unsere Ziele sind allgemeinverbindliche Branchentarifverträge. Wie werden über die Pflege-\nmindestlohnkommission eine weitere Erhöhung der Mindestlöhne verfolgen.'
 'Für uns geht es um die Bewältigung von Zukunftsaufgaben.\nDaher benennen wir vier Zukunftsmissionen, die für uns eine zentrale Bedeutung haben. Das gilt \nfür den Kampf gegen den Klimawandel, für die Zukunft der Mobilität, für die Digitalisierung und \nfür das Gesundheitssystem. Wir werden diese vier Zukunftsmissionen anpacken, um die Wirt -\nschaft zu modernisieren, High-Tech in den Schlüsselbranchen zu fördern, unsere Lebensgrundla-\ngen zu erhalten und die Arbeitsplätze der Zukunft zu schaffen.\nDie Umsetzung dieser Missionen braucht ein hohes Niveau öffentlicher Investitionen und eine \nsozial-ökologisch ausgerichtete Wirtschafts- und Finanzpolitik. Wir werden diese Missionen im Zu-\nsammenwirken mit Gewerkschaften, Wissenschaft, Wirtschaft und Zivilgesellschaft voranbringen \nund den klimafreundlichen Infrastrukturausbau auf Grundlage eines neuen, gesamtgesellschaft -\nlichen Infrastrukturkonsenses gestalten. Darin zeigt sich unser Anspruch eines modernen und \nkooperativen Regierens.\n2.1. Zukunftsmission I.  \nKlimaneutrales Deutschland\nDen Klimawandel zu stoppen, ist eine Menschheitsaufgabe. Unsere Politik richtet sich nach dem \nKlimaabkommen von Paris: Wir müssen die globale Erderwärmung auf möglichst 1,5 Grad Celsius \nbegrenzen. Darum haben wir uns zum Ziel gesetzt, in Deutschland bis spätestens 2045 komplett \nklimaneutral zu sein. Mit dem Klimaschutzgesetz haben wir dafür gesorgt, dass das Klimaab -\nkommen konkret wird: Es bietet einen wirkungsvollen Kontrollmechanismus zur Erreichung der \nKlimaziele.']",Das Minderungsziel für 2030 soll auf 65 % angehoben werden.,Dementsprechend werden wir im Einklang mit den europäischen Klimazielen unser Minderungsziel für 2030 deutlich (auf 65 %) anheben.,1.0,0.957376546653152,0.9999999999,1.0
2,Wie hoch soll das Minderungsziel für 2040 sein?,"['Darin zeigt sich unser Anspruch eines modernen und \nkooperativen Regierens.\n2.1. Zukunftsmission I.  \nKlimaneutrales Deutschland\nDen Klimawandel zu stoppen, ist eine Menschheitsaufgabe. Unsere Politik richtet sich nach dem \nKlimaabkommen von Paris: Wir müssen die globale Erderwärmung auf möglichst 1,5 Grad Celsius \nbegrenzen. Darum haben wir uns zum Ziel gesetzt, in Deutschland bis spätestens 2045 komplett \nklimaneutral zu sein. Mit dem Klimaschutzgesetz haben wir dafür gesorgt, dass das Klimaab -\nkommen konkret wird: Es bietet einen wirkungsvollen Kontrollmechanismus zur Erreichung der \nKlimaziele. Dementsprechend werden wir im Einklang mit den europäischen Klimazielen unser \nMinderungsziel für 2030 deutlich (auf 65 %) anheben; auch für 2040 werden wir ein Minderungs-\nziel festschreiben (88 %).\nEs kommt jetzt darauf an, die Ziele in praktische Politik umzusetzen. Der Ausstieg aus der Atom-\nenergie ist Ende nächsten Jahres bereits vollzogen. Auch der Kohleausstieg ist beschlossene Sache. \nDabei gilt, je schneller der Ausbau der Stromerzeugung aus erneuerbaren Energien erfolgt und je \nschneller die nötigen Stromleitungen und Verteilnetze gebaut werden, desto eher kann auf fossile \nEnergieträger verzichtet werden. Wir haben in dieser Wahlperiode den Ausstieg aufs Gleis gesetzt \nund ihn mit umfassenden Strukturhilfen verbunden, die wir zügig umsetzen wollen. Das sind his-\ntorische Entscheidungen.'
 'Für uns geht es um die Bewältigung von Zukunftsaufgaben.\nDaher benennen wir vier Zukunftsmissionen, die für uns eine zentrale Bedeutung haben. Das gilt \nfür den Kampf gegen den Klimawandel, für die Zukunft der Mobilität, für die Digitalisierung und \nfür das Gesundheitssystem. Wir werden diese vier Zukunftsmissionen anpacken, um die Wirt -\nschaft zu modernisieren, High-Tech in den Schlüsselbranchen zu fördern, unsere Lebensgrundla-\ngen zu erhalten und die Arbeitsplätze der Zukunft zu schaffen.\nDie Umsetzung dieser Missionen braucht ein hohes Niveau öffentlicher Investitionen und eine \nsozial-ökologisch ausgerichtete Wirtschafts- und Finanzpolitik. Wir werden diese Missionen im Zu-\nsammenwirken mit Gewerkschaften, Wissenschaft, Wirtschaft und Zivilgesellschaft voranbringen \nund den klimafreundlichen Infrastrukturausbau auf Grundlage eines neuen, gesamtgesellschaft -\nlichen Infrastrukturkonsenses gestalten. Darin zeigt sich unser Anspruch eines modernen und \nkooperativen Regierens.\n2.1. Zukunftsmission I.  \nKlimaneutrales Deutschland\nDen Klimawandel zu stoppen, ist eine Menschheitsaufgabe. Unsere Politik richtet sich nach dem \nKlimaabkommen von Paris: Wir müssen die globale Erderwärmung auf möglichst 1,5 Grad Celsius \nbegrenzen. Darum haben wir uns zum Ziel gesetzt, in Deutschland bis spätestens 2045 komplett \nklimaneutral zu sein. Mit dem Klimaschutzgesetz haben wir dafür gesorgt, dass das Klimaab -\nkommen konkret wird: Es bietet einen wirkungsvollen Kontrollmechanismus zur Erreichung der \nKlimaziele.'
 'Das Zukunftsprogramm der SPD\nKapitel 2\nSeite >9\nSPD-Parteivorstand 2021 \nDas Zukunftsprogramm der SPD\nKapitel 2\nUnser Ziel: Leben, Arbeiten und Wirtschaften hat spätestens 2045 keine negativen Auswirkungen \nmehr auf unser Klima. Die Energieversorgung Deutschlands basiert dann vollständig auf erneu-\nerbaren Energien, unsere Gebäude werden effizient mit erneuerbaren Energien beheizt. Unsere \nIndustrie ist auf den Weltmärkten weiterhin führend, gerade weil sie CO2-neutral produziert \nund Technologien exportiert, die die klimaneutrale Welt von morgen braucht. So sichern wir die \nArbeitsplätze für die Zukunft und erreichen gleichzeitig unsere ökologischen Ziele. Klimaschutz ist \ndie soziale Aufgabe der nächsten Jahrzehnte.\nUm in Deutschland bis spätestens 2045 treibhausgasneutral leben, arbeiten und wirtschaften \nzu können, werden wir dafür sorgen, dass wir unseren Strom spätestens bis zum Jahr 2040 voll-\nständig aus erneuerbaren Energien beziehen. Unser Strombedarf wird in den kommenden Jahren \nund Jahrzehnten deutlich steigen, weil wir anstatt fossiler Energieträger deutlich mehr Strom im \nVerkehr und der Industrie einsetzen werden. Allein bis 2030 brauchen wir jährlich ungefähr 10 \ntWh Strom zusätzlich - das entspricht dem Stromverbrauch von Hamburg. Wir brauchen deshalb \nein Jahrzehnt des entschlossenen Ausbaus der erneuerbaren Energien.']",Das Minderungsziel für 2040 soll bei 88 % liegen.,Auch für 2040 werden wir ein Minderungsziel festschreiben (88 %).,1.0,0.977159442592833,0.9999999999,1.0
3,Bis wann soll Deutschland vollständig Strom aus erneuerbaren Energien beziehen?,"['Um in Deutschland bis spätestens 2045 treibhausgasneutral leben, arbeiten und wirtschaften \nzu können, werden wir dafür sorgen, dass wir unseren Strom spätestens bis zum Jahr 2040 voll-\nständig aus erneuerbaren Energien beziehen. Unser Strombedarf wird in den kommenden Jahren \nund Jahrzehnten deutlich steigen, weil wir anstatt fossiler Energieträger deutlich mehr Strom im \nVerkehr und der Industrie einsetzen werden. Allein bis 2030 brauchen wir jährlich ungefähr 10 \ntWh Strom zusätzlich - das entspricht dem Stromverbrauch von Hamburg. Wir brauchen deshalb \nein Jahrzehnt des entschlossenen Ausbaus der erneuerbaren Energien. Dafür müssen jetzt die \nrichtigen Entscheidungen getroffen werden: Beim Ausbau der erneuerbaren Energien und der \nDigitalisierung der Stromnetze, bei der Steigerung der Energieeffizienz, beim Aufbau von Speicher -\ntechnologien und einer Wasserstoffproduktion sowie eines Transportnetzes, bei Investitionen in \nklimafreundliche Produktionsprozesse in der Industrie, bei der Modernisierung von Wohngebäu-\nden, Fabriken und Schulen. \nErneuerbarer Strom wird in allen Sektoren eingesetzt. Dort, wo eine direkte Elektrifizierung nicht \nsinnvoll ist, werden wir große Mengen Wasserstoff aus erneuerbaren Energien benötigen. Wasser -\nstoff stößt bei der Verbrennung keinerlei Treibhausgase aus und ist gut speicherbar. Er ist reichlich \nvorhanden und lässt sich durch die Aufspaltung von Wasser in Sauerstoff und Wasserstoff erzeu-\ngen. Ohne sauberen Wasserstoff in großindustriell hergestelltem Maßstab ist Klimaneutralität \nnicht zu erreichen.'
 'Das Zukunftsprogramm der SPD\nKapitel 2\nSeite >9\nSPD-Parteivorstand 2021 \nDas Zukunftsprogramm der SPD\nKapitel 2\nUnser Ziel: Leben, Arbeiten und Wirtschaften hat spätestens 2045 keine negativen Auswirkungen \nmehr auf unser Klima. Die Energieversorgung Deutschlands basiert dann vollständig auf erneu-\nerbaren Energien, unsere Gebäude werden effizient mit erneuerbaren Energien beheizt. Unsere \nIndustrie ist auf den Weltmärkten weiterhin führend, gerade weil sie CO2-neutral produziert \nund Technologien exportiert, die die klimaneutrale Welt von morgen braucht. So sichern wir die \nArbeitsplätze für die Zukunft und erreichen gleichzeitig unsere ökologischen Ziele. Klimaschutz ist \ndie soziale Aufgabe der nächsten Jahrzehnte.\nUm in Deutschland bis spätestens 2045 treibhausgasneutral leben, arbeiten und wirtschaften \nzu können, werden wir dafür sorgen, dass wir unseren Strom spätestens bis zum Jahr 2040 voll-\nständig aus erneuerbaren Energien beziehen. Unser Strombedarf wird in den kommenden Jahren \nund Jahrzehnten deutlich steigen, weil wir anstatt fossiler Energieträger deutlich mehr Strom im \nVerkehr und der Industrie einsetzen werden. Allein bis 2030 brauchen wir jährlich ungefähr 10 \ntWh Strom zusätzlich - das entspricht dem Stromverbrauch von Hamburg. Wir brauchen deshalb \nein Jahrzehnt des entschlossenen Ausbaus der erneuerbaren Energien.'
 'Darin zeigt sich unser Anspruch eines modernen und \nkooperativen Regierens.\n2.1. Zukunftsmission I.  \nKlimaneutrales Deutschland\nDen Klimawandel zu stoppen, ist eine Menschheitsaufgabe. Unsere Politik richtet sich nach dem \nKlimaabkommen von Paris: Wir müssen die globale Erderwärmung auf möglichst 1,5 Grad Celsius \nbegrenzen. Darum haben wir uns zum Ziel gesetzt, in Deutschland bis spätestens 2045 komplett \nklimaneutral zu sein. Mit dem Klimaschutzgesetz haben wir dafür gesorgt, dass das Klimaab -\nkommen konkret wird: Es bietet einen wirkungsvollen Kontrollmechanismus zur Erreichung der \nKlimaziele. Dementsprechend werden wir im Einklang mit den europäischen Klimazielen unser \nMinderungsziel für 2030 deutlich (auf 65 %) anheben; auch für 2040 werden wir ein Minderungs-\nziel festschreiben (88 %).\nEs kommt jetzt darauf an, die Ziele in praktische Politik umzusetzen. Der Ausstieg aus der Atom-\nenergie ist Ende nächsten Jahres bereits vollzogen. Auch der Kohleausstieg ist beschlossene Sache. \nDabei gilt, je schneller der Ausbau der Stromerzeugung aus erneuerbaren Energien erfolgt und je \nschneller die nötigen Stromleitungen und Verteilnetze gebaut werden, desto eher kann auf fossile \nEnergieträger verzichtet werden. Wir haben in dieser Wahlperiode den Ausstieg aufs Gleis gesetzt \nund ihn mit umfassenden Strukturhilfen verbunden, die wir zügig umsetzen wollen. Das sind his-\ntorische Entscheidungen.']",Deutschland soll bis zum Jahr 2040 vollständig Strom aus erneuerbaren Energien beziehen.,"Wir werden dafür sorgen, dass wir unseren Strom spätestens bis zum Jahr 2040 vollständig aus erneuerbaren Energien beziehen.",1.0,0.9999999999999997,0.99999999995,1.0
4,Wie sollen Bürger*innen und Gemeinden in die Energiewende einbezogen werden?,"['In einem Zukunftspakt zwischen Bund, Ländern, Kommunen und kommunalen Spitzenverbänden \nvereinbaren wir verbindliche Ausbauziele für erneuerbare Energien wie Sonne, Wind und Geother -\nmie. Damit die Energiewende vor Ort zur Win-Win-Situation für alle wird, laden wir Bürger*innen \nund Gemeinden zum Mitmachen ein, indem wir Mieterstrom und gemeinschaftliche Eigenver -\nsorgung stärken, kommunale Beteiligungsmodelle ausweiten und nachhaltige Stromanleihen \nauflegen. Uns ist ebenso klar, dass wir Verantwortung für die Zukunft der Menschen in den Bran-\nchen und Regionen tragen. Es gilt, was wir beschlossen haben: Strukturhilfen für die vom Ausstieg \nbetroffenen Bergbauregionen, aber auch darüber hinaus. Die verlässliche Unterstützung beim \nAufbau neuer Wertschöpfung und zukunftsfähiger Arbeitsplätze hat oberste Priorität - ebenso die \nWiedernutzbarmachung und Nachsorge bergbaulicher Flächen.\nWir wollen dafür sorgen, dass alle dazu geeigneten Dächer eine Solaranlage bekommen. In einem \nersten Schritt sorgen wir dafür, dass auf öffentlichen Gebäuden und gewerblichen Neubauten \nSolar-Strom erzeugt wird. Unser Ziel ist eine Solaranlage auf jedem Supermarkt, jeder Schule und \njedem Rathaus. Wir werden innovative Formen der erneuerbaren Stromerzeugung wie integrierte \nPhotovoltaik in der Gebäudehülle und auf landwirtschaftlichen Flächen gezielt fördern und neue \nstrategische Energiepartnerschaften aufbauen. \nMit dem Umstieg auf erneuerbare Energien müssen wir Energie zugleich effizienter nutzen. Wir \nwerden die Energieeffizienzziele und -standards weiterentwickeln.'
 'Erneuerbarer Strom wird in allen Sektoren eingesetzt. Dort, wo eine direkte Elektrifizierung nicht \nsinnvoll ist, werden wir große Mengen Wasserstoff aus erneuerbaren Energien benötigen. Wasser -\nstoff stößt bei der Verbrennung keinerlei Treibhausgase aus und ist gut speicherbar. Er ist reichlich \nvorhanden und lässt sich durch die Aufspaltung von Wasser in Sauerstoff und Wasserstoff erzeu-\ngen. Ohne sauberen Wasserstoff in großindustriell hergestelltem Maßstab ist Klimaneutralität \nnicht zu erreichen. \nWir brauchen mehr Tempo beim Ausbau der Stromnetze, Bahnstrecken, Wasserstoffleitungen und \nLadesäulen für Elektroautos. Der Ausbau dieser Infrastrukturen muss dem Bedarf vorausgehen. \nUnsere Planungen für den Aufbau einer nachhaltigen Infrastruktur müssen über das Jahr 2025 \nhinausreichen. Der massive Ausbau der erneuerbaren Energien und die Beteiligung der Bürger*in-\nnen vor Ort, beispielsweise durch Energiegenossenschaften, werden das Herzstück unserer Klima-\nschutz- und Energiepolitik.\nIn einem Zukunftspakt zwischen Bund, Ländern, Kommunen und kommunalen Spitzenverbänden \nvereinbaren wir verbindliche Ausbauziele für erneuerbare Energien wie Sonne, Wind und Geother -\nmie. Damit die Energiewende vor Ort zur Win-Win-Situation für alle wird, laden wir Bürger*innen \nund Gemeinden zum Mitmachen ein, indem wir Mieterstrom und gemeinschaftliche Eigenver -\nsorgung stärken, kommunale Beteiligungsmodelle ausweiten und nachhaltige Stromanleihen \nauflegen. Uns ist ebenso klar, dass wir Verantwortung für die Zukunft der Menschen in den Bran-\nchen und Regionen tragen.'
 'Es kommt jetzt darauf an, die Ziele in praktische Politik umzusetzen. Der Ausstieg aus der Atom-\nenergie ist Ende nächsten Jahres bereits vollzogen. Auch der Kohleausstieg ist beschlossene Sache. \nDabei gilt, je schneller der Ausbau der Stromerzeugung aus erneuerbaren Energien erfolgt und je \nschneller die nötigen Stromleitungen und Verteilnetze gebaut werden, desto eher kann auf fossile \nEnergieträger verzichtet werden. Wir haben in dieser Wahlperiode den Ausstieg aufs Gleis gesetzt \nund ihn mit umfassenden Strukturhilfen verbunden, die wir zügig umsetzen wollen. Das sind his-\ntorische Entscheidungen. Unser Arbeitsmarkt hat eine starke industrielle Basis, die aus dem Um-\nbau noch stärker hervorgehen kann – wenn wir gezielt in Infrastruktur und Innovationen investie-\nren. So wird unsere Zukunftsmission „klimaneutrales Deutschland“ zum Jobmotor. Auch werden \nwir – nicht nur im Rahmen unserer Klimapolitik – die Grundlagen dafür schaffen, dass alle bei der \nBewältigung des Klimawandels mit anpacken können, alle von den Chancen profitieren und nicht \ndiejenigen das Nachsehen haben, die den geringsten Einfluss auf ihre CO2-Bilanz haben.']","Bürger*innen und Gemeinden werden durch den Ausbau erneuerbarer Energien, die Förderung von Mieterstrom und gemeinschaftlicher Eigenversorgung, die Stärkung von kommunalen Beteiligungsmodellen und die Einführung nachhaltiger Stromanleihen in die Energiewende einbezogen. Es wird ein Zukunftspakt zwischen Bund, Ländern, Kommunen und kommunalen Spitzenverbänden geschlossen, um verbindliche Ausbauziele für erneuerbare Energien festzulegen und die Beteiligung vor Ort zu fördern. Die Installation von Solaranlagen auf geeigneten Dächern und die Förderung innovativer Formen der erneuerbaren Stromerzeugung sind weitere Maßnahmen zur Einbeziehung von Bürger*innen und Gemeinden.","Damit die Energiewende vor Ort zur Win-Win-Situation für alle wird, laden wir Bürger*innen und Gemeinden zum Mitmachen ein, indem wir Mieterstrom und gemeinschaftliche Eigenversorgung stärken, kommunale Beteiligungsmodelle ausweiten und nachhaltige Stromanleihen auflegen.",0.8,0.993207970269288,0.99999999995,1.0
5,Welche Unterstützung wird den vom Ausstieg betroffenen Bergbauregionen zugesichert?,"['Es kommt jetzt darauf an, die Ziele in praktische Politik umzusetzen. Der Ausstieg aus der Atom-\nenergie ist Ende nächsten Jahres bereits vollzogen. Auch der Kohleausstieg ist beschlossene Sache. \nDabei gilt, je schneller der Ausbau der Stromerzeugung aus erneuerbaren Energien erfolgt und je \nschneller die nötigen Stromleitungen und Verteilnetze gebaut werden, desto eher kann auf fossile \nEnergieträger verzichtet werden. Wir haben in dieser Wahlperiode den Ausstieg aufs Gleis gesetzt \nund ihn mit umfassenden Strukturhilfen verbunden, die wir zügig umsetzen wollen. Das sind his-\ntorische Entscheidungen. Unser Arbeitsmarkt hat eine starke industrielle Basis, die aus dem Um-\nbau noch stärker hervorgehen kann – wenn wir gezielt in Infrastruktur und Innovationen investie-\nren. So wird unsere Zukunftsmission „klimaneutrales Deutschland“ zum Jobmotor. Auch werden \nwir – nicht nur im Rahmen unserer Klimapolitik – die Grundlagen dafür schaffen, dass alle bei der \nBewältigung des Klimawandels mit anpacken können, alle von den Chancen profitieren und nicht \ndiejenigen das Nachsehen haben, die den geringsten Einfluss auf ihre CO2-Bilanz haben.'
 'Damit halten wir den Betroffe-\nnen den Rücken frei, um sich auf das Wesentliche konzentrieren zu können: Neue Arbeit zu finden, \num wieder auf eigenen Beinen zu stehen.\nWir schaffen ein Recht auf Weiterbildung und beruflichen Neustart in allen Lebensphasen. Jede*r \neinzelne wird bei den bevorstehenden Veränderungen unterstützt. Wir werden ein Recht schaffen, \ndas es Arbeitnehmer*innen auch mit 40plus ermöglicht, noch einmal einen ganz neuen Beruf zu \nerlernen.\nMit unserem Modell der geförderten Bildungszeit und Bildungsteilzeit werden wir ermöglichen, \ndass alle Erwerbstätigen im Lauf ihres Erwerbslebens auf eigene Initiative und mit staatlicher \nUnterstützung unabhängig vom Betrieb sich weiterbilden oder umschulen können. Wer Bildungs-\nzeit oder Bildungsteilzeit beantragt, erhält ein Recht, sich von seinem Beruf freistellen zu lassen \noder die Arbeitszeit zu reduzieren. Die Bildungszeiten werden wir mit einer finanziellen Förde-\nrung ausgestalten, die Lohneinbußen während der Weiterbildung oder Umschulung angemessen \nkompensiert – und zwar lange genug, um anerkannte Abschlüsse zu erwerben. Bei den Kosten für \ndie Weiterbildungsmaßnahme werden wir diejenigen unterstützen, die die Mittel nicht oder nicht \nvollständig aus eigener Tasche aufbringen können.'
 'Das bedeutet: 15 Monate Anspruch \nauf Unterstützung (Lohnersatz) bei einer Arbeitszeitreduzierung für jeden nahen Angehörigen \nab Pflegegrad 2, auf mehrere Pflegepersonen aufteilbar mit einer Mindestarbeitszeit von 15 bis \n20 Stunden. Wichtig ist, dass Unternehmen gezielt auch die Männer ermutigen, dieses Modell zu \nnutzen. \nWir werden dafür sorgen, dass alle Kinder und Jugendlichen unabhängig von ihrer Herkunft die \ngleichen Chancen haben, das Bestmögliche aus ihrem Leben zu machen. Jedes Kind soll gut und \ngeborgen aufwachsen und alle jungen Menschen sollen gut ins Erwachsenenleben starten. Die \nUnterstützung von Kindern und Familien in Deutschland ist vielfältig. Aber genau dort, wo sie be-\nsonders gebraucht wird, kommt sie oft nicht an. \nWir haben deshalb ein Konzept der Kindergrundsicherung entwickelt, das aus zwei zentralen Be-\nreichen besteht. Zum einen aus einer Infrastruktur, die gerechte Bildung und Teilhabe für alle Kin-\nder ermöglicht. Sie beinhaltet gute und beitragsfreie Kitas, ein Ganztagsangebot für Schulkinder, \neine soziale Infrastruktur für Kinder und Jugendliche und freie Fahrt in Bus und Bahn im Nahver -\nkehr sowie ein Recht auf Mobilität vor allem für den ländlichen Raum. Die Kindergrundsicherung \nbesteht zum anderen aus einem neuen existenzsichernden, automatisch ausgezahlten Kindergeld, \ndas nach Einkommen der Familie gestaffelt ist – je höher der Unterstützungsbedarf, desto höher \ndas Kindergeld. Damit machen wir das Leben der Familien leichter, die es besonders schwer haben.']","Den vom Ausstieg betroffenen Bergbauregionen werden umfassende Strukturhilfen zugesichert, um den Umbau der industriellen Basis zu unterstützen. Diese historischen Entscheidungen sollen den Arbeitsmarkt stärken und in Infrastruktur sowie Innovationen investieren, um die Regionen zu fördern. Es wird darauf hingewiesen, dass der Ausstieg aus der Atomenergie und der Kohle bereits beschlossene Sache ist und mit dem Ausbau erneuerbarer Energien vorangetrieben wird.","Es gilt, was wir beschlossen haben: Strukturhilfen für die vom Ausstieg betroffenen Bergbauregionen, aber auch darüber hinaus. Die verlässliche Unterstützung beim Aufbau neuer Wertschöpfung und zukunftsfähiger Arbeitsplätze hat oberste Priorität - ebenso die Wiedernutzbarmachung und Nachsorge bergbaulicher Flächen.",0.8888888888888888,0.9734430940815066,0.9999999999,0.5
6,Wie wird die EEG-Umlage zukünftig finanziert?,"['Das Zukunftsprogramm der SPD\nKapitel 2\nSeite >10\nSPD-Parteivorstand 2021 \nDas Zukunftsprogramm der SPD\nKapitel 2\nSeit Anfang 2021 gilt im Zuge des nationalen Emissionshandels ein CO2-Preis. In Kombination mit \nanderen Maßnahmen wie dem Umweltbonus beim Kauf eines Elektroautos oder Förderprogram-\nmen zum Heizungstausch sorgt er dafür, dass klimafreundliche Alternativen attraktiver werden. \nUm den Einsatz erneuerbarer Energien im Verkehr und der Gebäudewärme zu unterstützen („Sek -\ntorenkopplung“), werden wir die EEG-Umlage in der bestehenden Form bis 2025 abschaffen und \naus dem Bundeshaushalt finanzieren. Dazu dienen auch die Einnahmen aus der CO2-Bepreisung. \nDiese Maßnahme leistet auch einen Beitrag zur sozial gerechten Finanzierung der Energiewende, \nweil dadurch die Stromrechnung deutlich sinkt. Wir werden dafür sorgen, dass Bürger*innen mit \nniedrigen Einkommen nicht ins Hintertreffen geraten. Mit dem Ansteigen des CO2-Preises werden \nwir für weitere sozial gerechte Ausgleichsmaßnahmen sorgen. Einen Pro-Kopf-Bonus werden wir \nprüfen.\nAuch der Gebäudesektor muss schrittweise CO2-neutral werden. Mit dem CO2-Preis wollen wir vor \nallem Investitionen lenken und Vermieter*innen zur Modernisierung motivieren. Gerade im Be-\nstands-Mietwohnungsbau gibt es noch viel zu tun. Wir haben das Ziel, dass bis 2030 fünf Millio-\nnen Häuser über innovative Heiz- und Energiesysteme (z.B. Wärmepumpen) versorgt werden.'
 'Das Zukunftsprogramm der SPD\nKapitel 3Seite >40\nSPD-Parteivorstand 2021Der monatliche Basisbetrag dieses neuen Kindergeldes wird bei zirka 250 Euro liegen. Der Höchst -\nbetrag wird sich an den Ausgaben von Familien mit mittleren Einkommen für Bildung und Teilha-\nbe orientieren und mindestens doppelt so hoch sein wie der Basisbetrag. Im Höchstbetrag sind das \nsächliche Existenzminimum inklusive Wohnkostenpauschale sowie Bildungs- und Teilhabekosten \nenthalten. Das neue Kindergeld ersetzt so den Kinderfreibetrag und bündelt bisherige Leistungen.\nJunge Menschen in Ausbildung sollen durch direkte, elternunabhängige Auszahlung des neuen \nKindergeldes finanziell abgesichert werden - mit einem zusätzlichen, auskömmlichen Fördersatz \nan BAföG obendrauf. Wir wollen Hilfen für Kinder, Jugendliche und Familien bündeln, die von \nKrankheit oder Behinderung betroffen sind. Kinder, Jugendliche, junge Erwachsene und Eltern \nmüssen einen einfachen Zugang zu Unterstützungsleistungen haben. Dafür sind weitere Schritte \nnotwendig. Der Kampf gegen Bildungsbenachteiligung muss in allen Systemen konsequent statt -\nfinden. Die erste Bildungseinrichtung im Leben eines Kindes ist heute die Kita. Deshalb werden wir \ndie frühkindliche Bildung weiter ausbauen. \nOhne bezahlbare Wohnheimangebote ist für viele Auszubildende und Studierende eine erfolgrei-\nche Ausbildung nicht möglich. Wir werden sie ausbauen und zudem das Jugendwohnen im Rah-\nmen der Kinder- und Jugendhilfe zukünftig für junge Menschen bis 27 Jahre ermöglichen sowie \nmehr Räume für Jugendarbeit schaffen.'
 'Gleich-\nzeitig wird es hohe persönliche Freibeträge geben, so dass sich die Steuerbelastung auf besonders \nvermögende Teile der Bevölkerung konzentriert. Wir stellen sicher, dass mit der Vermögenssteuer \nkeine Arbeitsplätze gefährdet werden. Die Grundlage von Betrieben wird bei der Vermögenssteuer \nverschont. \nDie Erbschaftssteuer ist reformbedürftig. In ihrer gegenwärtigen Form ist sie ungerecht, da sie ver -\nmögende Unternehmenserben bevorzugt. Mit einer effektiven Mindestbesteuerung werden wir \ndie Überprivilegierung großer Betriebsvermögen abschaffen. Auch für vermögenshaltende Fami-\nlienstiftungen werden wir eine Mindestbesteuerung einführen. \nWir werden eine Finanztransaktionssteuer einführen, möglichst im Einklang mit unseren europäi-\nschen Partnern. Zugleich werden wir die von uns maßgeblich mit unterstützten internationalen \nVerhandlungen zur Einführung einer effektiven Mindestbesteuerung und einer fairen Besteuerung \nso genannter Digitalunternehmen zum Abschluss bringen und in Deutschland und Europa umset -\nzen. Google, Amazon, Facebook und andere große Digitalunternehmen müssen einen angemesse-\nnen Beitrag zur Finanzierung des Gemeinwesens leisten. \nWir brauchen einen leistungsfähigen, sicheren und fairen Finanzmarkt, um den Wandel in eine \ndigitale und nachhaltige Wirtschaft finanzieren zu können. Er muss ordentlich reguliert und über -\nwacht werden. Wir werden sicherstellen, dass den Verbraucher*innen die Finanzierungsdienst -\nleistungen kostengünstig angeboten werden und Investitionen in  nachhaltige, klimafreundliche \nProdukte und Produktionsverfahren fördern.']","Die EEG-Umlage wird bis 2025 abgeschafft und aus dem Bundeshaushalt finanziert, um den Einsatz erneuerbarer Energien im Verkehr und der Gebäudewärme zu unterstützen. Die Finanzierung erfolgt auch durch Einnahmen aus der CO2-Bepreisung.",Wir werden die EEG-Umlage in der bestehenden Form bis 2025 abschaffen und aus dem Bundeshaushalt finanzieren.,1.0,0.9408566904639771,0.9999999999,1.0
7,Welches Ziel wird bis 2030 im Bestand-Mietwohnungsbau verfolgt?,"['Um die Spekulation mit Wohnraum einzudämmen, werden wir die Eigentü-\nmerstrukturen über ein zentrales Immobilienregister transparent machen.\nWohneigentum dient nicht nur der Versorgung mit Wohnraum, sondern auch der Vermögens- \nund Alterssicherung. Um insbesondere jungen Familien den Weg zu den eigenen vier Wänden zu \nerleichtern, werden wir in angespannten Wohnlagen den Erwerb von Genossenschaftsanteilen \nerleichtern. Wir werden Mietkaufmodelle fördern und ein Programm „Jung-Kauft-Alt“ für den Er -\nwerb von Bestandsimmobilien insbesondere in vom Leerstand betroffenen Ortskernen auflegen.\nMenschen, die in Obdachlosigkeit abgerutscht sind, müssen wir als Gesellschaft nachhaltig helfen. \nDeshalb wollen wir eine flächendeckende Umsetzung von Housing-First-Konzepten in den Städ-\nten und Kommunen voranbringen. Die sehr hohen Erfolgsquoten dieser Projekte ermöglichen die \nRückkehr in die eigene Wohnung und damit ein Leben in Würde.'
 'Daneben führen wir eine neue Wohnungsgemeinnützig-\nkeit ein und fördern damit ein zusätzliches nicht gewinnorientiertes Segment auf dem Wohnungs-\nmarkt.\nIn angespannten Wohnlagen werden wir daneben ein zeitlich befristetes Mietenmoratorium ein-\nführen, das bedeutet: Mieten können für eine bestimmte Zeit nur im Rahmen der Inflationsrate \nerhöht werden. Mietwucher werden wir wirksam unterbinden. Wir werden außerdem die Miet -\npreisbremse entfristen und Schlupflöcher schließen. Das Instrument des qualifizierten Mietspie-\ngels wollen wir bundesweit nach einheitlichen und damit rechtssicheren Kriterien ausgestalten \nund seine Bedeutung stärken. Mietspiegel dürfen keine bloßen Neumietenspiegel sein. Deshalb \nwerden wir künftig mindestens die vertraglich vereinbarten Mieten der vergangenen acht Jahre \nbei ihrer Aufstellung heranziehen.\nUnsere Bodenpolitik wird am Gemeinwohl orientiert. Bund, Länder und Kommunen sollen öf -\nfentliches Eigentum an Grundstücken sichern und vermehren, um die Spekulation mit Grund und \nBoden zu stoppen. Dazu ist das Vorkaufsrecht für Kommunen zu fairen Preisen wichtig.\nWir werden dazu beitragen, dass kommunale Wohnbauflächen nicht veräußert werden, Flächen \nzurückerworben werden und öffentliches Bauland nur auf dem Weg der Erbpacht für den Woh-\nnungsbau zur Verfügung gestellt wird. Mit der Schaffung von Bodenfonds unter Einbeziehung \nbundeseigener Grundstücke erhalten Kommunen ein Instrument für die nachhaltige Stadtent -\nwicklung und bezahlbaren Wohnungsbau.'
 'Das Zukunftsprogramm der SPD\nKapitel 3Seite >37\nSPD-Parteivorstand 20213.6. Bezahlbares Wohnen\nEine Wohnung zu finden wird in vielen Lagen zu einer immer größeren Herausforderung – selbst \nmit mittlerem Einkommen.\nWir werden bezahlbaren Wohnraum erhalten und neuen schaffen. Dazu werden wir alle Betei-\nligten an einen Tisch bringen. Kommunale Wohnungsunternehmen und Genossenschaften, aber \nauch private Wohnungsunternehmen und Vermieter*innen, die sich einer sozialverträglichen Ver -\nmietung verpflichtet fühlen, sollten dabei sein wie auch die Bauwirtschaft und die Gewerkschaf -\nten.\nEs gibt eine gemeinsame Verantwortung aller Beteiligten vor allem für den erforderlichen Neubau \nsowie die Quartiersentwicklung und den Klimaschutz. Nach wie vor ist der Neubau von 100.000 \nSozialwohnungen jährlich erforderlich. Daneben führen wir eine neue Wohnungsgemeinnützig-\nkeit ein und fördern damit ein zusätzliches nicht gewinnorientiertes Segment auf dem Wohnungs-\nmarkt.\nIn angespannten Wohnlagen werden wir daneben ein zeitlich befristetes Mietenmoratorium ein-\nführen, das bedeutet: Mieten können für eine bestimmte Zeit nur im Rahmen der Inflationsrate \nerhöht werden. Mietwucher werden wir wirksam unterbinden. Wir werden außerdem die Miet -\npreisbremse entfristen und Schlupflöcher schließen. Das Instrument des qualifizierten Mietspie-\ngels wollen wir bundesweit nach einheitlichen und damit rechtssicheren Kriterien ausgestalten \nund seine Bedeutung stärken. Mietspiegel dürfen keine bloßen Neumietenspiegel sein.']","Bis 2030 wird im Bestand-Mietwohnungsbau das Ziel verfolgt, ein zusätzliches nicht gewinnorientiertes Segment auf dem Wohnungsmarkt durch die Einführung einer neuen Wohnungsgemeinnützigkeit zu fördern. Dies soll dazu beitragen, bezahlbaren Wohnraum zu erhalten und zu schaffen.",Bis 2030 sollen fünf Millionen Häuser über innovative Heiz- und Energiesysteme (z.B. Wärmepumpen) versorgt werden.,0.75,0.9412690256523549,0.0,0.0
8,Wie wird der Umstieg auf klimaschonende Produktionsprozesse unterstützt?,"['Zugleich werden wir Investi-\ntionen in Wärmenetze und Quartierskonzepte staatlich fördern. \nWir werden mit einer langfristig angelegten Industriestrategie Planungssicherheit für den sozial-\nökologischen Umbau unserer Wirtschaft schaffen. Diese Industriestrategie wird in Verbindung mit \ndem European Green Deal in eine gesamteuropäische Lösung eingebettet sein. \nDen Umstieg auf klimaschonende Produktionsprozesse werden wir durch direkte Investitionsför -\nderung staatlich unterstützen und die derzeitigen höheren Kosten von klimaschonenden Techno-\nlogien ausgleichen; klima- und umweltschädliche Subventionen werden wir abbauen. Wir werden \neinen Markt für umweltfreundliche Ausgangsmaterialien schaffen. Die öffentliche Hand als großer \nBauherr von Straßen und Gebäuden wird bis 2030 schrittweise immer mehr und ab 2030 aus-\nschließlich klimaneutrale Grundmaterialien für Bauten beschaffen. Wir werden unsere Industrien \nsichern und die Verlagerung von Produktion und Emissionen ins Ausland durch maßgeschneiderte \nInstrumente unattraktiver machen. Außerdem werden wir dafür sorgen, dass für Unternehmen, \ndie im internationalen Wettbewerb stehen, auch der Industriestrompreis wettbewerbsfähig ist.\nMit Ressourcen werden wir nicht länger verschwenderisch umgehen. Wir werden unsere Wirt -\nschaft zur Kreislaufwirtschaft umbauen. Die Menge an Abfall, die wir in Deutschland produzieren, \nmuss deutlich weniger werden. Neben dem Recycling werden wir ein Rohstoffsicherungskonzept \nerarbeiten, um eine sichere Lieferung der für die umweltfreundliche Produktion nötigen Rohstoffe \nzu gewährleisten.'
 'Wir werden unsere Industrien \nsichern und die Verlagerung von Produktion und Emissionen ins Ausland durch maßgeschneiderte \nInstrumente unattraktiver machen. Außerdem werden wir dafür sorgen, dass für Unternehmen, \ndie im internationalen Wettbewerb stehen, auch der Industriestrompreis wettbewerbsfähig ist.\nMit Ressourcen werden wir nicht länger verschwenderisch umgehen. Wir werden unsere Wirt -\nschaft zur Kreislaufwirtschaft umbauen. Die Menge an Abfall, die wir in Deutschland produzieren, \nmuss deutlich weniger werden. Neben dem Recycling werden wir ein Rohstoffsicherungskonzept \nerarbeiten, um eine sichere Lieferung der für die umweltfreundliche Produktion nötigen Rohstoffe \nzu gewährleisten. \nWir werden Schlüsselindustrien auf ihrem Weg zur Klimaneutralität unterstützen und konkrete \nTransformationsziele entwickeln und fördern. Wir werden Deutschland bis 2030 zum Leitmarkt \nfür Wasserstofftechnologien machen – für die klimaneutrale Erzeugung von Stahl, für CO2-arme \nPKWs, LKWs und den Schiffs- und Flugverkehr.'
 'Wir sehen in dieser Jahrhundertaufgabe riesige Potenziale für \ngute und sichere Arbeitsplätze. Deutschland ist erfolgreich als Exporteur umweltfreundlicher Tech-\nnologien, weil es gelungen ist, Produktionsprozesse nachhaltig und die 20er zu einem Jahrzehnt \nder erneuerbaren Energien zu machen.\xa0\nDen sozial-ökologischen Umbau der Wirtschaft meistern wir, wenn wir wirtschaftlichen Erfolg zu-\nkünftig nicht nur am Bruttoinlandsprodukt messen, sondern am Wohlergehen der gesamten Ge-\nsellschaft und der Natur. Wir richten unsere Politik an den Nachhaltigkeitszielen der Vereinten Na-\ntionen (SDG) aus und werden dazu die Deutsche Nachhaltigkeitsstrategie weiterentwickeln.\xa0Wenn \nder Staat maßgebliche Impulse gibt, durch kluge Spielregeln, die soziale und technische Innovatio-\nnen hervorbringen, durch Förderung von Wissenschaft und Forschung, durch massive und stetige \nInvestitionen in eine moderne Infrastruktur, durch aktive Förderung der Regionen im Wandel und \ndurch Beteiligung der Bürger*innen im Allgemeinen und der Beschäftigten im Besonderen. So wer -\nden Arbeitsplätze zukunftsfähig und neue gute Arbeitsplätze geschaffen. So sichern wir Einkom-\nmen und Perspektiven für alle. Wir wollen einen neuen sozial-ökologischen Gesellschaftsvertrag, \nder dafür sorgt, dass im Wandel niemand abgehängt wird.']","Der Umstieg auf klimaschonende Produktionsprozesse wird durch direkte Investitionsförderung staatlich unterstützt, um die derzeitigen höheren Kosten von klimaschonenden Technologien auszugleichen. Zudem werden klima- und umweltschädliche Subventionen abgebaut und ein Markt für umweltfreundliche Ausgangsmaterialien geschaffen. Die öffentliche Hand wird schrittweise bis 2030 immer mehr und ab 2030 ausschließlich klimaneutrale Grundmaterialien für Bauten beschaffen.",Der Umstieg auf klimaschonende Produktionsprozesse wird durch direkte Investitionsförderung staatlich unterstützt und die derzeitigen höheren Kosten von klimaschonenden Technologien werden ausgeglichen.,1.0,0.9742871148476429,0.8333333332916666,1.0
9,"Wie sollen Bürger*innen schnell, zuverlässig und klimafreundlich von A nach B gelangen können?","['Unser Ziel ist eine Mobilitätsgarantie: Jede*r Bürger*in – in der Stadt und auf dem Land - soll einen \nwohnortnahen Anschluss an den öffentlichen Verkehr haben. Dazu nutzen wir die Möglichkeiten \nder Digitalisierung: mit neuen Mobilitätsdienstleistungen, die vernetzte Mobilitätsangebote auf \ndigitalen Plattformen nutzbar machen. Modelle wie das 365-Euro-Ticket oder Modellprojekte für \neinen ticketfreien Nahverkehr unterstützen wir.\xa0\nWir werden einen Mobilitätsplan 2030 auf den Weg bringen, der den öffentlichen Personennah-\nverkehr und den Schienenverkehr auf ein neues Niveau bringt. Der Bund wird durch Austauschpro-\ngramme seinen Beitrag leisten, damit alle neuen Busse und Bahnen bis 2030 in den Kommunen \nklimaneutral fahren und die vorhandenen Flotten modernisiert sind. Förderprogramme und ein \ngeändertes Straßenverkehrsrecht sollen Kommunen dabei unterstützen, in Städten mehr Fläche \nfür öffentlichen Verkehr, Fußgänger*innen und Radfahrer*innen zu schaffen. Wir werden den \nStraßenverkehr im Sinne der Vision Zero sicherer machen, insbesondere auch für die vielen Rad-\nfahrer*innen.\nAn Knotenpunkten werden wir die Einrichtung von barrierefreien Mobilitätsstationen für nachhal-\ntige urbane Mobilität fördern, damit möglichst viele vom Auto auf umweltfreundliche Verkehrs-\nmittel umsteigen. Wir werden eine nationale Leitstelle Mobilität einrichten, die die Erarbeitung \nregionaler Mobilitätspläne unterstützt und eine frühzeitige Beteiligung vor Ort sicherstellt.\xa0\nDer Schienenverkehr ist ein Schwerpunkt unserer verkehrspolitischen Agenda.'
 'Das Zukunftsprogramm der SPD\nKapitel 2\nSeite >11\nSPD-Parteivorstand 2021 \nDas Zukunftsprogramm der SPD\nKapitel 2\n2.2. Zukunftsmission II.  \nModernstes Mobilitätssystem Europas\nAlle Bürger*innen müssen schnell, zuverlässig und klimafreundlich von A nach B gelangen können. \nDafür denken wir Mobilität neu: Nachhaltig, bezahlbar, barrierefrei und verlässlich. Und immer \nmehr Bürger*innen steigen auf Bus, Bahn oder das Rad um. Dennoch bleibt das Auto für viele \nMenschen wichtig. Aber der Schadstoffausstoß wird auf null reduziert sein. Unsere Mission ist \neine klimaneutrale Mobilität für alle.\xa0\nWir werden die Verkehrswende voranbringen und bis 2030 das modernste und klimafreundlichste \nMobilitätssystem Europas aufbauen. Das ist eine gesamtstaatliche Aufgabe, zu der die Bundes-\nregierung ihren Beitrag leisten wird, die aber auch Länder und Kommunen in die Pflicht nimmt. \nUnser Ziel ist eine Mobilitätsgarantie: Jede*r Bürger*in – in der Stadt und auf dem Land - soll einen \nwohnortnahen Anschluss an den öffentlichen Verkehr haben. Dazu nutzen wir die Möglichkeiten \nder Digitalisierung: mit neuen Mobilitätsdienstleistungen, die vernetzte Mobilitätsangebote auf \ndigitalen Plattformen nutzbar machen. Modelle wie das 365-Euro-Ticket oder Modellprojekte für \neinen ticketfreien Nahverkehr unterstützen wir.\xa0\nWir werden einen Mobilitätsplan 2030 auf den Weg bringen, der den öffentlichen Personennah-\nverkehr und den Schienenverkehr auf ein neues Niveau bringt.'
 'Für uns geht es um die Bewältigung von Zukunftsaufgaben.\nDaher benennen wir vier Zukunftsmissionen, die für uns eine zentrale Bedeutung haben. Das gilt \nfür den Kampf gegen den Klimawandel, für die Zukunft der Mobilität, für die Digitalisierung und \nfür das Gesundheitssystem. Wir werden diese vier Zukunftsmissionen anpacken, um die Wirt -\nschaft zu modernisieren, High-Tech in den Schlüsselbranchen zu fördern, unsere Lebensgrundla-\ngen zu erhalten und die Arbeitsplätze der Zukunft zu schaffen.\nDie Umsetzung dieser Missionen braucht ein hohes Niveau öffentlicher Investitionen und eine \nsozial-ökologisch ausgerichtete Wirtschafts- und Finanzpolitik. Wir werden diese Missionen im Zu-\nsammenwirken mit Gewerkschaften, Wissenschaft, Wirtschaft und Zivilgesellschaft voranbringen \nund den klimafreundlichen Infrastrukturausbau auf Grundlage eines neuen, gesamtgesellschaft -\nlichen Infrastrukturkonsenses gestalten. Darin zeigt sich unser Anspruch eines modernen und \nkooperativen Regierens.\n2.1. Zukunftsmission I.  \nKlimaneutrales Deutschland\nDen Klimawandel zu stoppen, ist eine Menschheitsaufgabe. Unsere Politik richtet sich nach dem \nKlimaabkommen von Paris: Wir müssen die globale Erderwärmung auf möglichst 1,5 Grad Celsius \nbegrenzen. Darum haben wir uns zum Ziel gesetzt, in Deutschland bis spätestens 2045 komplett \nklimaneutral zu sein. Mit dem Klimaschutzgesetz haben wir dafür gesorgt, dass das Klimaab -\nkommen konkret wird: Es bietet einen wirkungsvollen Kontrollmechanismus zur Erreichung der \nKlimaziele.']","Bürger*innen sollen durch eine Mobilitätsgarantie mit wohnortnahem Anschluss an den öffentlichen Verkehr, Nutzung der Digitalisierung für vernetzte Mobilitätsangebote und Förderung von Modellen wie dem 365-Euro-Ticket und ticketfreiem Nahverkehr schnell, zuverlässig und klimafreundlich von A nach B gelangen können.","Mobilität wird neu gedacht: nachhaltig, bezahlbar, barrierefrei und verlässlich, mit einem Fokus auf den Ausbau von Bus, Bahn und Radverkehr sowie einer Reduktion des Schadstoffausstoßes von Autos auf null.",0.0,0.9999999999999987,0.99999999995,1.0
10,Wie soll die Mobilitätsgarantie für Bürger*innen in Stadt und Land umgesetzt werden?,"['Unser Ziel ist eine Mobilitätsgarantie: Jede*r Bürger*in – in der Stadt und auf dem Land - soll einen \nwohnortnahen Anschluss an den öffentlichen Verkehr haben. Dazu nutzen wir die Möglichkeiten \nder Digitalisierung: mit neuen Mobilitätsdienstleistungen, die vernetzte Mobilitätsangebote auf \ndigitalen Plattformen nutzbar machen. Modelle wie das 365-Euro-Ticket oder Modellprojekte für \neinen ticketfreien Nahverkehr unterstützen wir.\xa0\nWir werden einen Mobilitätsplan 2030 auf den Weg bringen, der den öffentlichen Personennah-\nverkehr und den Schienenverkehr auf ein neues Niveau bringt. Der Bund wird durch Austauschpro-\ngramme seinen Beitrag leisten, damit alle neuen Busse und Bahnen bis 2030 in den Kommunen \nklimaneutral fahren und die vorhandenen Flotten modernisiert sind. Förderprogramme und ein \ngeändertes Straßenverkehrsrecht sollen Kommunen dabei unterstützen, in Städten mehr Fläche \nfür öffentlichen Verkehr, Fußgänger*innen und Radfahrer*innen zu schaffen. Wir werden den \nStraßenverkehr im Sinne der Vision Zero sicherer machen, insbesondere auch für die vielen Rad-\nfahrer*innen.\nAn Knotenpunkten werden wir die Einrichtung von barrierefreien Mobilitätsstationen für nachhal-\ntige urbane Mobilität fördern, damit möglichst viele vom Auto auf umweltfreundliche Verkehrs-\nmittel umsteigen. Wir werden eine nationale Leitstelle Mobilität einrichten, die die Erarbeitung \nregionaler Mobilitätspläne unterstützt und eine frühzeitige Beteiligung vor Ort sicherstellt.\xa0\nDer Schienenverkehr ist ein Schwerpunkt unserer verkehrspolitischen Agenda.'
 'Das Zukunftsprogramm der SPD\nKapitel 2\nSeite >11\nSPD-Parteivorstand 2021 \nDas Zukunftsprogramm der SPD\nKapitel 2\n2.2. Zukunftsmission II.  \nModernstes Mobilitätssystem Europas\nAlle Bürger*innen müssen schnell, zuverlässig und klimafreundlich von A nach B gelangen können. \nDafür denken wir Mobilität neu: Nachhaltig, bezahlbar, barrierefrei und verlässlich. Und immer \nmehr Bürger*innen steigen auf Bus, Bahn oder das Rad um. Dennoch bleibt das Auto für viele \nMenschen wichtig. Aber der Schadstoffausstoß wird auf null reduziert sein. Unsere Mission ist \neine klimaneutrale Mobilität für alle.\xa0\nWir werden die Verkehrswende voranbringen und bis 2030 das modernste und klimafreundlichste \nMobilitätssystem Europas aufbauen. Das ist eine gesamtstaatliche Aufgabe, zu der die Bundes-\nregierung ihren Beitrag leisten wird, die aber auch Länder und Kommunen in die Pflicht nimmt. \nUnser Ziel ist eine Mobilitätsgarantie: Jede*r Bürger*in – in der Stadt und auf dem Land - soll einen \nwohnortnahen Anschluss an den öffentlichen Verkehr haben. Dazu nutzen wir die Möglichkeiten \nder Digitalisierung: mit neuen Mobilitätsdienstleistungen, die vernetzte Mobilitätsangebote auf \ndigitalen Plattformen nutzbar machen. Modelle wie das 365-Euro-Ticket oder Modellprojekte für \neinen ticketfreien Nahverkehr unterstützen wir.\xa0\nWir werden einen Mobilitätsplan 2030 auf den Weg bringen, der den öffentlichen Personennah-\nverkehr und den Schienenverkehr auf ein neues Niveau bringt.'
 'Dadurch können sich die Be-\nhörden und die Betroffenen in den ersten Monaten mit voller Energie auf eine sinnvolle Wieder -\naufnahme der Beschäftigung konzentrieren. Die guten Erfahrungen aus diesen vorübergehenden \nMaßnahmen haben uns darin bestätigt, dafür zu sorgen, dass auch in Zukunft Vermögen und \nWohnungsgröße innerhalb der ersten zwei Jahre nicht überprüft werden und das Schonvermögen \nerhöht wird. Das Bürgergeld beinhaltet Mitwirkungspflichten, setzt aber konsequent auf Hilfe und \nErmutigung. Eingliederungsvereinbarungen werden durch eine gemeinsame und auf Augenhöhe \nerarbeitete Teilhabevereinbarung ersetzt. Bei ihrer Umsetzung setzen wir auf Befähigung und Be-\nstärkung und nicht auf Vorgaben und Zwang. Sinnwidrige und unwürdige Sanktionen schaffen wir \nab. Das sozioökonomische und soziokulturelle Existenzminimum muss jederzeit gesichert sein.\nDie Leistungen des Sozialstaates sind soziale Rechte – wer sie benötigt, sollte nicht lange suchen \nmüssen. Unser Ziel ist es, die Leistungen ohne Hürden und Umwege zugänglich zu machen. Wir \nwollen einen Bürgerservice, der nach Lebenslagen berät und alle Leistungen aus einer Hand zu-\ngänglich macht. Er ist digital und aufsuchend, wo der Weg zu beschwerlich ist. Ein zugewandter \nSozialstaat hilft, Rechtsansprüche geltend zu machen, und begleitet auch danach beratend alle \nSchritte.']","Die Mobilitätsgarantie wird durch einen wohnortnahen Anschluss an den öffentlichen Verkehr für alle Bürger*innen in Stadt und Land umgesetzt. Dies wird durch die Nutzung der Digitalisierung ermöglicht, um vernetzte Mobilitätsangebote bereitzustellen und Modelle wie das 365-Euro-Ticket zu unterstützen. Es wird auch ein Mobilitätsplan 2030 entwickelt, um den öffentlichen Personennahverkehr und den Schienenverkehr zu verbessern.","Jede*r Bürger*in soll einen wohnortnahen Anschluss an den öffentlichen Verkehr haben, unterstützt durch neue Mobilitätsdienstleistungen und digitale Plattformen.",0.875,0.9881526007496554,0.99999999995,1.0
11,Welche Modelle werden zur Förderung des Nahverkehrs unterstützt?,"['Unser Ziel ist eine Mobilitätsgarantie: Jede*r Bürger*in – in der Stadt und auf dem Land - soll einen \nwohnortnahen Anschluss an den öffentlichen Verkehr haben. Dazu nutzen wir die Möglichkeiten \nder Digitalisierung: mit neuen Mobilitätsdienstleistungen, die vernetzte Mobilitätsangebote auf \ndigitalen Plattformen nutzbar machen. Modelle wie das 365-Euro-Ticket oder Modellprojekte für \neinen ticketfreien Nahverkehr unterstützen wir.\xa0\nWir werden einen Mobilitätsplan 2030 auf den Weg bringen, der den öffentlichen Personennah-\nverkehr und den Schienenverkehr auf ein neues Niveau bringt. Der Bund wird durch Austauschpro-\ngramme seinen Beitrag leisten, damit alle neuen Busse und Bahnen bis 2030 in den Kommunen \nklimaneutral fahren und die vorhandenen Flotten modernisiert sind. Förderprogramme und ein \ngeändertes Straßenverkehrsrecht sollen Kommunen dabei unterstützen, in Städten mehr Fläche \nfür öffentlichen Verkehr, Fußgänger*innen und Radfahrer*innen zu schaffen. Wir werden den \nStraßenverkehr im Sinne der Vision Zero sicherer machen, insbesondere auch für die vielen Rad-\nfahrer*innen.\nAn Knotenpunkten werden wir die Einrichtung von barrierefreien Mobilitätsstationen für nachhal-\ntige urbane Mobilität fördern, damit möglichst viele vom Auto auf umweltfreundliche Verkehrs-\nmittel umsteigen. Wir werden eine nationale Leitstelle Mobilität einrichten, die die Erarbeitung \nregionaler Mobilitätspläne unterstützt und eine frühzeitige Beteiligung vor Ort sicherstellt.\xa0\nDer Schienenverkehr ist ein Schwerpunkt unserer verkehrspolitischen Agenda.'
 'Wir werden den \nStraßenverkehr im Sinne der Vision Zero sicherer machen, insbesondere auch für die vielen Rad-\nfahrer*innen.\nAn Knotenpunkten werden wir die Einrichtung von barrierefreien Mobilitätsstationen für nachhal-\ntige urbane Mobilität fördern, damit möglichst viele vom Auto auf umweltfreundliche Verkehrs-\nmittel umsteigen. Wir werden eine nationale Leitstelle Mobilität einrichten, die die Erarbeitung \nregionaler Mobilitätspläne unterstützt und eine frühzeitige Beteiligung vor Ort sicherstellt.\xa0\nDer Schienenverkehr ist ein Schwerpunkt unserer verkehrspolitischen Agenda. Bahnfahren soll in-\nnereuropäisch günstiger und attraktiver als Fliegen sein. Wir wollen rasch einen Deutschlandtakt \numsetzen und einen Europatakt aufbauen. Hierfür werden wir investieren: in den Aus- und Neu-\nbau des Schienennetzes, in den Lärmschutz und den Ausbau und die Attraktivitätssteigerung von \nBahnhöfen. Wir haben das Ziel, alle Großstädte wieder ans Fernverkehrsnetz anzuschließen und \nneue schnelle Zug- und Nachtzugverbindungen in unsere Nachbarländer zu etablieren. Vor allem \nwerden wir die Attraktivität des Nahverkehrs verbessern, durch Investitionen in das Angebot und \ndie Qualität von Zügen und Bussen und durch die Reaktivierung alter Bahnstrecken. Wir werden \nengere, verlässliche Taktungen, komfortablere Züge mit flächendeckendem W-LAN und eine Reser -\nvierungsmöglichkeit für Sitzplätze ermöglichen.'
 'Wir haben das Ziel, alle Großstädte wieder ans Fernverkehrsnetz anzuschließen und \nneue schnelle Zug- und Nachtzugverbindungen in unsere Nachbarländer zu etablieren. Vor allem \nwerden wir die Attraktivität des Nahverkehrs verbessern, durch Investitionen in das Angebot und \ndie Qualität von Zügen und Bussen und durch die Reaktivierung alter Bahnstrecken. Wir werden \nengere, verlässliche Taktungen, komfortablere Züge mit flächendeckendem W-LAN und eine Reser -\nvierungsmöglichkeit für Sitzplätze ermöglichen.\xa0\nBis 2030 wollen wir mindestens 75 Prozent des Schienennetzes elektrifizieren, die Schiene weiter \ndigitalisieren und für nicht elektrifizierte Strecken verbindliche Nutzungen wie den Einsatz von \nwasserstoffbetriebenen Zügen unterstützen. Die Deutsche Bahn AG ist für uns ein Garant verläss-\nlicher Mobilität. Wir werden sie als integrierten Konzern in öffentlichem Eigentum erhalten. Mit \nder Verpflichtung zur Tariftreue, zum Personalübergang für alle Beschäftigten bei Betreiberwech-\nsel und der Gewährleistung guter Arbeitsbedingungen im Vergaberecht sorgen wir für Fairness auf \ndem Markt für Mobilitätsdienstleistungen.']",Modelle wie das 365-Euro-Ticket und ticketfreier Nahverkehr werden zur Förderung des Nahverkehrs unterstützt. Es wird auch ein Mobilitätsplan 2030 für den öffentlichen Personennahverkehr und Schienenverkehr entwickelt. Der Schienenverkehr wird als Schwerpunkt in der verkehrspolitischen Agenda behandelt.,Modelle wie das 365-Euro-Ticket oder Modellprojekte für einen ticketfreien Nahverkehr werden unterstützt.,1.0,0.9389431261875562,0.9999999999,1.0
12,Welches Ziel wird für elektrische PKW bis 2030 gesetzt?,"['Wir wollen die Elektrifizierung des \nVerkehrs massiv voranbringen. 2030 sollen mindestens 15 Millionen PKW in Deutschland voll \nelektrisch fahren.\xa0\nWir werden Deutschland zu einem Zentrum der Batteriezellenfertigung und des Recyclings ge-\nbrauchter Batterien machen. Im Schwerlastverkehr wird auch die Wasserstoff-Brennstoffzelle eine \nwichtige Rolle spielen. Die weitere Forschung hierzu werden wir unterstützen. Wir unterstützen \ndie Automobil-Zulieferindustrie bei der Umstellung ihrer Produktionsprozesse und der Erschlie-\nßung neuer Geschäftsfelder. Gemeinsam mit Sozialpartnern und lokalen Akteuren werden wir re-\ngionale Transformationscluster aufbauen, um neue, qualifizierte und gut bezahlte Beschäftigung \nin den Regionen zu schaffen.\xa0\nWir machen das Stromtanken so einfach wie bisher das Tanken von Benzin und Diesel. Den Fort -\nschritt beim Ausbau der Ladesäulen für Elektroautos wollen wir vierteljährlich evaluieren und wo \nnötig mit Versorgungsauflagen und staatlichem Ausbau die notwendige verlässliche Erreichbar -\nkeit von Ladepunkten herstellen.\xa0\nWir werden ein Tempolimit von 130 km/h auf Bundesautobahnen einführen. Das schützt die \nUmwelt und senkt die Unfallzahlen deutlich. Zusätzlich werden wir Forschung, Entwicklung und \nPilotprojekte vorantreiben, damit Schiffe, Flugzeuge und Laster kein klimaschädliches CO2 mehr \nausstoßen. Wir verbinden das mit Projekten zum Aufbau einer umweltfreundlichen Wasserstoff -\nwirtschaft.'
 'Darin zeigt sich unser Anspruch eines modernen und \nkooperativen Regierens.\n2.1. Zukunftsmission I.  \nKlimaneutrales Deutschland\nDen Klimawandel zu stoppen, ist eine Menschheitsaufgabe. Unsere Politik richtet sich nach dem \nKlimaabkommen von Paris: Wir müssen die globale Erderwärmung auf möglichst 1,5 Grad Celsius \nbegrenzen. Darum haben wir uns zum Ziel gesetzt, in Deutschland bis spätestens 2045 komplett \nklimaneutral zu sein. Mit dem Klimaschutzgesetz haben wir dafür gesorgt, dass das Klimaab -\nkommen konkret wird: Es bietet einen wirkungsvollen Kontrollmechanismus zur Erreichung der \nKlimaziele. Dementsprechend werden wir im Einklang mit den europäischen Klimazielen unser \nMinderungsziel für 2030 deutlich (auf 65 %) anheben; auch für 2040 werden wir ein Minderungs-\nziel festschreiben (88 %).\nEs kommt jetzt darauf an, die Ziele in praktische Politik umzusetzen. Der Ausstieg aus der Atom-\nenergie ist Ende nächsten Jahres bereits vollzogen. Auch der Kohleausstieg ist beschlossene Sache. \nDabei gilt, je schneller der Ausbau der Stromerzeugung aus erneuerbaren Energien erfolgt und je \nschneller die nötigen Stromleitungen und Verteilnetze gebaut werden, desto eher kann auf fossile \nEnergieträger verzichtet werden. Wir haben in dieser Wahlperiode den Ausstieg aufs Gleis gesetzt \nund ihn mit umfassenden Strukturhilfen verbunden, die wir zügig umsetzen wollen. Das sind his-\ntorische Entscheidungen.'
 'Um in Deutschland bis spätestens 2045 treibhausgasneutral leben, arbeiten und wirtschaften \nzu können, werden wir dafür sorgen, dass wir unseren Strom spätestens bis zum Jahr 2040 voll-\nständig aus erneuerbaren Energien beziehen. Unser Strombedarf wird in den kommenden Jahren \nund Jahrzehnten deutlich steigen, weil wir anstatt fossiler Energieträger deutlich mehr Strom im \nVerkehr und der Industrie einsetzen werden. Allein bis 2030 brauchen wir jährlich ungefähr 10 \ntWh Strom zusätzlich - das entspricht dem Stromverbrauch von Hamburg. Wir brauchen deshalb \nein Jahrzehnt des entschlossenen Ausbaus der erneuerbaren Energien. Dafür müssen jetzt die \nrichtigen Entscheidungen getroffen werden: Beim Ausbau der erneuerbaren Energien und der \nDigitalisierung der Stromnetze, bei der Steigerung der Energieeffizienz, beim Aufbau von Speicher -\ntechnologien und einer Wasserstoffproduktion sowie eines Transportnetzes, bei Investitionen in \nklimafreundliche Produktionsprozesse in der Industrie, bei der Modernisierung von Wohngebäu-\nden, Fabriken und Schulen. \nErneuerbarer Strom wird in allen Sektoren eingesetzt. Dort, wo eine direkte Elektrifizierung nicht \nsinnvoll ist, werden wir große Mengen Wasserstoff aus erneuerbaren Energien benötigen. Wasser -\nstoff stößt bei der Verbrennung keinerlei Treibhausgase aus und ist gut speicherbar. Er ist reichlich \nvorhanden und lässt sich durch die Aufspaltung von Wasser in Sauerstoff und Wasserstoff erzeu-\ngen. Ohne sauberen Wasserstoff in großindustriell hergestelltem Maßstab ist Klimaneutralität \nnicht zu erreichen.']","Das Ziel für elektrische PKW bis 2030 ist, dass mindestens 15 Millionen PKW in Deutschland voll elektrisch fahren sollen.",Bis 2030 sollen mindestens 15 Millionen PKW in Deutschland voll elektrisch fahren.,1.0,0.9705552025031122,0.9999999999,1.0
13,Welche Rolle wird Deutschland in der Batteriezellenfertigung und im Recycling gebrauchter Batterien spielen?,"['Wir wollen die Elektrifizierung des \nVerkehrs massiv voranbringen. 2030 sollen mindestens 15 Millionen PKW in Deutschland voll \nelektrisch fahren.\xa0\nWir werden Deutschland zu einem Zentrum der Batteriezellenfertigung und des Recyclings ge-\nbrauchter Batterien machen. Im Schwerlastverkehr wird auch die Wasserstoff-Brennstoffzelle eine \nwichtige Rolle spielen. Die weitere Forschung hierzu werden wir unterstützen. Wir unterstützen \ndie Automobil-Zulieferindustrie bei der Umstellung ihrer Produktionsprozesse und der Erschlie-\nßung neuer Geschäftsfelder. Gemeinsam mit Sozialpartnern und lokalen Akteuren werden wir re-\ngionale Transformationscluster aufbauen, um neue, qualifizierte und gut bezahlte Beschäftigung \nin den Regionen zu schaffen.\xa0\nWir machen das Stromtanken so einfach wie bisher das Tanken von Benzin und Diesel. Den Fort -\nschritt beim Ausbau der Ladesäulen für Elektroautos wollen wir vierteljährlich evaluieren und wo \nnötig mit Versorgungsauflagen und staatlichem Ausbau die notwendige verlässliche Erreichbar -\nkeit von Ladepunkten herstellen.\xa0\nWir werden ein Tempolimit von 130 km/h auf Bundesautobahnen einführen. Das schützt die \nUmwelt und senkt die Unfallzahlen deutlich. Zusätzlich werden wir Forschung, Entwicklung und \nPilotprojekte vorantreiben, damit Schiffe, Flugzeuge und Laster kein klimaschädliches CO2 mehr \nausstoßen. Wir verbinden das mit Projekten zum Aufbau einer umweltfreundlichen Wasserstoff -\nwirtschaft.'
 'Wir werden unsere Industrien \nsichern und die Verlagerung von Produktion und Emissionen ins Ausland durch maßgeschneiderte \nInstrumente unattraktiver machen. Außerdem werden wir dafür sorgen, dass für Unternehmen, \ndie im internationalen Wettbewerb stehen, auch der Industriestrompreis wettbewerbsfähig ist.\nMit Ressourcen werden wir nicht länger verschwenderisch umgehen. Wir werden unsere Wirt -\nschaft zur Kreislaufwirtschaft umbauen. Die Menge an Abfall, die wir in Deutschland produzieren, \nmuss deutlich weniger werden. Neben dem Recycling werden wir ein Rohstoffsicherungskonzept \nerarbeiten, um eine sichere Lieferung der für die umweltfreundliche Produktion nötigen Rohstoffe \nzu gewährleisten. \nWir werden Schlüsselindustrien auf ihrem Weg zur Klimaneutralität unterstützen und konkrete \nTransformationsziele entwickeln und fördern. Wir werden Deutschland bis 2030 zum Leitmarkt \nfür Wasserstofftechnologien machen – für die klimaneutrale Erzeugung von Stahl, für CO2-arme \nPKWs, LKWs und den Schiffs- und Flugverkehr.'
 'Das Zukunftsprogramm der SPD\nKapitel 2\nSeite >12\nSPD-Parteivorstand 2021 \nDas Zukunftsprogramm der SPD\nKapitel 2\nWir wollen, dass sich die Deutsche Bahn AG auf ihr Kerngeschäft des Transports von Personen und \nGütern auf der Schiene konzentriert und auf gemeinwohlorientierte Ziele ausrichtet. Den Schie-\nnengüterverkehr wollen wir ausbauen und modernisieren. Wir werden in die Erneuerung und \nDigitalisierung von Loks und Waggons investieren. Wir werden die Kostennachteile der Schiene \ngegenüber der Straße parallel zum Kapazitätsaufbau im Schienengüterverkehr verringern. Die \nPotenziale unserer Wasserstraßen werden wir stärker nutzen, um mehr Güterverkehr vom LKW \nauf die umweltfreundliche Binnenschifffahrt zu verlagern.\xa0\nDie Zukunft gehört den elektrischen Antrieben. Wir wollen diese Entwicklung aktiv gestalten, \ndamit die Automobilindustrie Leitindustrie bleibt und die Zukunft der vielen kleinen und mittel-\nständischen Zulieferer mit ihren Arbeitsplätzen gesichert ist. Wir wollen die Elektrifizierung des \nVerkehrs massiv voranbringen. 2030 sollen mindestens 15 Millionen PKW in Deutschland voll \nelektrisch fahren.\xa0\nWir werden Deutschland zu einem Zentrum der Batteriezellenfertigung und des Recyclings ge-\nbrauchter Batterien machen. Im Schwerlastverkehr wird auch die Wasserstoff-Brennstoffzelle eine \nwichtige Rolle spielen. Die weitere Forschung hierzu werden wir unterstützen. Wir unterstützen \ndie Automobil-Zulieferindustrie bei der Umstellung ihrer Produktionsprozesse und der Erschlie-\nßung neuer Geschäftsfelder.']","Deutschland wird eine wichtige Rolle in der Batteriezellenfertigung und im Recycling gebrauchter Batterien spielen, um sich als Zentrum in diesem Bereich zu etablieren. Die Wasserstoff-Brennstoffzelle wird auch im Schwerlastverkehr eine bedeutende Rolle spielen, und die Forschung in diesem Bereich wird unterstützt. Es werden Maßnahmen ergriffen, um die Automobil-Zulieferindustrie bei der Umstellung ihrer Produktionsprozesse zu unterstützen und neue Geschäftsfelder zu erschließen.",Deutschland soll zu einem Zentrum der Batteriezellenfertigung und des Recyclings gebrauchter Batterien gemacht werden.,1.0,0.9979994221677811,0.8333333332916666,1.0
14,Soll auf allen Autobahnen ein generelles Tempolimit gelten?,"['Wir wollen die Elektrifizierung des \nVerkehrs massiv voranbringen. 2030 sollen mindestens 15 Millionen PKW in Deutschland voll \nelektrisch fahren.\xa0\nWir werden Deutschland zu einem Zentrum der Batteriezellenfertigung und des Recyclings ge-\nbrauchter Batterien machen. Im Schwerlastverkehr wird auch die Wasserstoff-Brennstoffzelle eine \nwichtige Rolle spielen. Die weitere Forschung hierzu werden wir unterstützen. Wir unterstützen \ndie Automobil-Zulieferindustrie bei der Umstellung ihrer Produktionsprozesse und der Erschlie-\nßung neuer Geschäftsfelder. Gemeinsam mit Sozialpartnern und lokalen Akteuren werden wir re-\ngionale Transformationscluster aufbauen, um neue, qualifizierte und gut bezahlte Beschäftigung \nin den Regionen zu schaffen.\xa0\nWir machen das Stromtanken so einfach wie bisher das Tanken von Benzin und Diesel. Den Fort -\nschritt beim Ausbau der Ladesäulen für Elektroautos wollen wir vierteljährlich evaluieren und wo \nnötig mit Versorgungsauflagen und staatlichem Ausbau die notwendige verlässliche Erreichbar -\nkeit von Ladepunkten herstellen.\xa0\nWir werden ein Tempolimit von 130 km/h auf Bundesautobahnen einführen. Das schützt die \nUmwelt und senkt die Unfallzahlen deutlich. Zusätzlich werden wir Forschung, Entwicklung und \nPilotprojekte vorantreiben, damit Schiffe, Flugzeuge und Laster kein klimaschädliches CO2 mehr \nausstoßen. Wir verbinden das mit Projekten zum Aufbau einer umweltfreundlichen Wasserstoff -\nwirtschaft.'
 'Die Altersgrenzen im \nBAföG werden wir dazu in einem ersten Schritt aufheben. Und wir brauchen ein Neustart-BAföG, \ndas auch im Erwachsenenalter neue berufliche Wege öffnen und angemessen den Lebensunter -\nhalt sichert.\nBereits jetzt besteht die Möglichkeit, dass Arbeitnehmer*innen ihre geleisteten Arbeitsstunden \nauf Langzeitkonten ansparen. Allerdings besteht bislang kein rechtlicher Anspruch darauf und nur \nein kleiner Teil der Unternehmen und Arbeitnehmer*innen nutzt Langzeitkonten. Wir werden das \nInstrument zu einem persönlichen Zeitkonto weiterentwickeln, um zusätzlich individuelle Ge-\nstaltungsmöglichkeiten entlang des Lebenslaufs zu schaffen. Basis eines solchen Zeitkontos sind \nZeiteinzahlungen der Beschäftigten – auf diese Weise gehen Überstunden nicht verloren, sondern \nverwandeln sich in ein Zeitguthaben, das per Tarifvertrag oder durch den Staat nach dem Prinzip \neines Chancenkontos aufgestockt werden kann.'
 'Das Zukunftsprogramm der SPD\nKapitel 2\nSeite >11\nSPD-Parteivorstand 2021 \nDas Zukunftsprogramm der SPD\nKapitel 2\n2.2. Zukunftsmission II.  \nModernstes Mobilitätssystem Europas\nAlle Bürger*innen müssen schnell, zuverlässig und klimafreundlich von A nach B gelangen können. \nDafür denken wir Mobilität neu: Nachhaltig, bezahlbar, barrierefrei und verlässlich. Und immer \nmehr Bürger*innen steigen auf Bus, Bahn oder das Rad um. Dennoch bleibt das Auto für viele \nMenschen wichtig. Aber der Schadstoffausstoß wird auf null reduziert sein. Unsere Mission ist \neine klimaneutrale Mobilität für alle.\xa0\nWir werden die Verkehrswende voranbringen und bis 2030 das modernste und klimafreundlichste \nMobilitätssystem Europas aufbauen. Das ist eine gesamtstaatliche Aufgabe, zu der die Bundes-\nregierung ihren Beitrag leisten wird, die aber auch Länder und Kommunen in die Pflicht nimmt. \nUnser Ziel ist eine Mobilitätsgarantie: Jede*r Bürger*in – in der Stadt und auf dem Land - soll einen \nwohnortnahen Anschluss an den öffentlichen Verkehr haben. Dazu nutzen wir die Möglichkeiten \nder Digitalisierung: mit neuen Mobilitätsdienstleistungen, die vernetzte Mobilitätsangebote auf \ndigitalen Plattformen nutzbar machen. Modelle wie das 365-Euro-Ticket oder Modellprojekte für \neinen ticketfreien Nahverkehr unterstützen wir.\xa0\nWir werden einen Mobilitätsplan 2030 auf den Weg bringen, der den öffentlichen Personennah-\nverkehr und den Schienenverkehr auf ein neues Niveau bringt.']","Ja, die Partei plant die Einführung eines Tempolimits von 130 km/h auf Bundesautobahnen gemäß ihrem Wahlprogramm.",Wir werden ein Tempolimit von 130 km/h auf Bundesautobahnen einführen.,0.5,0.9129625922101292,0.9999999999,1.0
15,Was ist das Ziel für Deutschlands digitale Infrastruktur bis 2030?,"['Das Zukunftsprogramm der SPD\nKapitel 2Seite >13\nSPD-Parteivorstand 20212.3. Zukunftsmission III.  \nDigitale Souveränität in Deutschland und Europa \nDeutschland soll 2030 über eine digitale Infrastruktur auf Weltniveau verfügen, über eine voll-\nständig und durchgängig digitalisierte Verwaltung und ein Bildungssystem, in dem für das Leben \nin einer digitalen Welt gelernt werden kann. Die Selbstbestimmung und digitale Mündigkeit der \nBürger*innen ist unser Leitbild, damit die Digitalisierung allen zugutekommen kann.\xa0\nEin schneller, sicherer und bezahlbarer Internetzugang ist im 21. Jahrhundert unverzichtbar. In \nden 2020er Jahren muss Deutschland zur “Gigabit-Gesellschaft” werden. Gerade mittelständische \nUnternehmen im ländlichen Raum, die oft global agieren, sind auf schnelles Internet angewiesen, \num wettbewerbsfähig zu bleiben. Um dieses Versprechen einzuhalten, werden wir die Versorgung \naller Haushalte und Unternehmen mit einer Bandbreite von mindestens einem Gigabit pro Sekun-\nde garantieren – durch konkrete, gesetzlich festgelegte Ausbau- und Versorgungsverpflichtungen \nund entsprechende Zwischenziele. Hier stehen auch die Netzbetreiber in der Verantwortung.\xa0\nUnser Ziel ist ein moderner, bürgernaher Staat, der allen Bürger*innen einen einfachen, digitalen \nZugang zu seinen Dienstleistungen bietet. Wir werden daher die Verpflichtung von Bund, Ländern \nund Kommunen zur Bereitstellung digitaler Verwaltungsdienstleistungen ausbauen, damit alle \nVerwaltungsleistungen möglichst schnell auch digital verfügbar sind.'
 'Um dieses Versprechen einzuhalten, werden wir die Versorgung \naller Haushalte und Unternehmen mit einer Bandbreite von mindestens einem Gigabit pro Sekun-\nde garantieren – durch konkrete, gesetzlich festgelegte Ausbau- und Versorgungsverpflichtungen \nund entsprechende Zwischenziele. Hier stehen auch die Netzbetreiber in der Verantwortung.\xa0\nUnser Ziel ist ein moderner, bürgernaher Staat, der allen Bürger*innen einen einfachen, digitalen \nZugang zu seinen Dienstleistungen bietet. Wir werden daher die Verpflichtung von Bund, Ländern \nund Kommunen zur Bereitstellung digitaler Verwaltungsdienstleistungen ausbauen, damit alle \nVerwaltungsleistungen möglichst schnell auch digital verfügbar sind. Jede*r Bürger*in soll ohne \nZusatzkosten und Extrageräte die Möglichkeit haben, diese Leistungen freiwillig und datenschutz -\nkonform mit einer digitalen Identität zu nutzen. Wer Anspruch auf eine Leistung hat, muss diese \n– wenn möglich – automatisch, ohne Antrag erhalten oder in einfacher Form ‘mit einem Klick’ \nbeantragen können. Bürger*innen sollen, nach dem Modell einer digitalen Life-Chain, Berechtigun-\ngen selbst vergeben und auch wieder löschen können und somit kontrollieren, wer wann auf ihre \nDaten zugreift. Öffentlich finanzierte Software sollte, wo möglich, als Open-Source transparent \nentwickelt und öffentlich zugänglich gemacht werden.\nWir verfolgen das Ziel, dass alle Schulen in Deutschland erstklassig ausgestattet sind. Jedem/r \nSchüler*in muss ein digitales Endgerät und Zugang zum Internet zur Verfügung stehen. Mit dem \nDigitalPakt Schule und dem Konjunkturpaket haben Bund und Länder bereits einen großen Schritt \nzu einer digitalen Lehrmittelfreiheit getan.'
 'Bürger*innen sollen, nach dem Modell einer digitalen Life-Chain, Berechtigun-\ngen selbst vergeben und auch wieder löschen können und somit kontrollieren, wer wann auf ihre \nDaten zugreift. Öffentlich finanzierte Software sollte, wo möglich, als Open-Source transparent \nentwickelt und öffentlich zugänglich gemacht werden.\nWir verfolgen das Ziel, dass alle Schulen in Deutschland erstklassig ausgestattet sind. Jedem/r \nSchüler*in muss ein digitales Endgerät und Zugang zum Internet zur Verfügung stehen. Mit dem \nDigitalPakt Schule und dem Konjunkturpaket haben Bund und Länder bereits einen großen Schritt \nzu einer digitalen Lehrmittelfreiheit getan. Wir werden hier weiter investieren und ein Moderni-\nsierungsprogramm des Bundes aufsetzen, das sowohl den Sanierungsbedarf der Schulgebäude als \nauch die digitale Ausstattung umfasst. Wir werden dafür sorgen, dass eine einfache, unbürokra-\ntische Umsetzung der digitalen Grundausstattung für alle Schulen möglich ist. Einen besonderen \nSchwerpunkt werden wir auf die Ganztagsschule legen.\nNeben der Infrastruktur brauchen wir auch eine bessere Koordinierung des Unterrichts selbst. Wir \nbrauchen Lehr- und Lernmaterialien für inklusive, ganzheitliche Bildung. Auf einer Open-Source-\nPlattform, die bereits durch den Digitalpakt beauftragt und finanziert ist, sollen künftig länder -\nübergreifend Lehr- und Lernmaterialien und Unterrichtskonzepte für alle zugänglich sein: offen, \ndezentral, sicher und vernetzt. Die Förderung der Medienkompetenz von Kindern und Jugendli-\nchen ist dabei ein zentrales Ziel.\xa0\nNotwendig ist darüber hinaus ein System, das die Qualität der eingestellten Medien auf solchen \noffenen Plattformen prüft und sichert.']","Das Ziel für Deutschlands digitale Infrastruktur bis 2030 ist, eine digitale Infrastruktur auf Weltniveau zu schaffen, eine vollständig digitalisierte Verwaltung zu gewährleisten und ein Bildungssystem anzubieten, das auf das Leben in einer digitalen Welt vorbereitet. Dies soll die digitale Souveränität der Bürger stärken und allen zugutekommen.","Deutschland soll 2030 über eine digitale Infrastruktur auf Weltniveau verfügen, eine vollständig digitalisierte Verwaltung und ein Bildungssystem, das auf das Leben in einer digitalen Welt vorbereitet.",1.0,1.0000000000000009,0.99999999995,1.0
16,Wie wird der schnelle Internetzugang in Deutschland bis 2030 sichergestellt?,"['Um dieses Versprechen einzuhalten, werden wir die Versorgung \naller Haushalte und Unternehmen mit einer Bandbreite von mindestens einem Gigabit pro Sekun-\nde garantieren – durch konkrete, gesetzlich festgelegte Ausbau- und Versorgungsverpflichtungen \nund entsprechende Zwischenziele. Hier stehen auch die Netzbetreiber in der Verantwortung.\xa0\nUnser Ziel ist ein moderner, bürgernaher Staat, der allen Bürger*innen einen einfachen, digitalen \nZugang zu seinen Dienstleistungen bietet. Wir werden daher die Verpflichtung von Bund, Ländern \nund Kommunen zur Bereitstellung digitaler Verwaltungsdienstleistungen ausbauen, damit alle \nVerwaltungsleistungen möglichst schnell auch digital verfügbar sind. Jede*r Bürger*in soll ohne \nZusatzkosten und Extrageräte die Möglichkeit haben, diese Leistungen freiwillig und datenschutz -\nkonform mit einer digitalen Identität zu nutzen. Wer Anspruch auf eine Leistung hat, muss diese \n– wenn möglich – automatisch, ohne Antrag erhalten oder in einfacher Form ‘mit einem Klick’ \nbeantragen können. Bürger*innen sollen, nach dem Modell einer digitalen Life-Chain, Berechtigun-\ngen selbst vergeben und auch wieder löschen können und somit kontrollieren, wer wann auf ihre \nDaten zugreift. Öffentlich finanzierte Software sollte, wo möglich, als Open-Source transparent \nentwickelt und öffentlich zugänglich gemacht werden.\nWir verfolgen das Ziel, dass alle Schulen in Deutschland erstklassig ausgestattet sind. Jedem/r \nSchüler*in muss ein digitales Endgerät und Zugang zum Internet zur Verfügung stehen. Mit dem \nDigitalPakt Schule und dem Konjunkturpaket haben Bund und Länder bereits einen großen Schritt \nzu einer digitalen Lehrmittelfreiheit getan.'
 'Das Zukunftsprogramm der SPD\nKapitel 2Seite >13\nSPD-Parteivorstand 20212.3. Zukunftsmission III.  \nDigitale Souveränität in Deutschland und Europa \nDeutschland soll 2030 über eine digitale Infrastruktur auf Weltniveau verfügen, über eine voll-\nständig und durchgängig digitalisierte Verwaltung und ein Bildungssystem, in dem für das Leben \nin einer digitalen Welt gelernt werden kann. Die Selbstbestimmung und digitale Mündigkeit der \nBürger*innen ist unser Leitbild, damit die Digitalisierung allen zugutekommen kann.\xa0\nEin schneller, sicherer und bezahlbarer Internetzugang ist im 21. Jahrhundert unverzichtbar. In \nden 2020er Jahren muss Deutschland zur “Gigabit-Gesellschaft” werden. Gerade mittelständische \nUnternehmen im ländlichen Raum, die oft global agieren, sind auf schnelles Internet angewiesen, \num wettbewerbsfähig zu bleiben. Um dieses Versprechen einzuhalten, werden wir die Versorgung \naller Haushalte und Unternehmen mit einer Bandbreite von mindestens einem Gigabit pro Sekun-\nde garantieren – durch konkrete, gesetzlich festgelegte Ausbau- und Versorgungsverpflichtungen \nund entsprechende Zwischenziele. Hier stehen auch die Netzbetreiber in der Verantwortung.\xa0\nUnser Ziel ist ein moderner, bürgernaher Staat, der allen Bürger*innen einen einfachen, digitalen \nZugang zu seinen Dienstleistungen bietet. Wir werden daher die Verpflichtung von Bund, Ländern \nund Kommunen zur Bereitstellung digitaler Verwaltungsdienstleistungen ausbauen, damit alle \nVerwaltungsleistungen möglichst schnell auch digital verfügbar sind.'
 'Wir haben das Ziel, alle Großstädte wieder ans Fernverkehrsnetz anzuschließen und \nneue schnelle Zug- und Nachtzugverbindungen in unsere Nachbarländer zu etablieren. Vor allem \nwerden wir die Attraktivität des Nahverkehrs verbessern, durch Investitionen in das Angebot und \ndie Qualität von Zügen und Bussen und durch die Reaktivierung alter Bahnstrecken. Wir werden \nengere, verlässliche Taktungen, komfortablere Züge mit flächendeckendem W-LAN und eine Reser -\nvierungsmöglichkeit für Sitzplätze ermöglichen.\xa0\nBis 2030 wollen wir mindestens 75 Prozent des Schienennetzes elektrifizieren, die Schiene weiter \ndigitalisieren und für nicht elektrifizierte Strecken verbindliche Nutzungen wie den Einsatz von \nwasserstoffbetriebenen Zügen unterstützen. Die Deutsche Bahn AG ist für uns ein Garant verläss-\nlicher Mobilität. Wir werden sie als integrierten Konzern in öffentlichem Eigentum erhalten. Mit \nder Verpflichtung zur Tariftreue, zum Personalübergang für alle Beschäftigten bei Betreiberwech-\nsel und der Gewährleistung guter Arbeitsbedingungen im Vergaberecht sorgen wir für Fairness auf \ndem Markt für Mobilitätsdienstleistungen.']","Die Sicherstellung des schnellen Internetzugangs bis 2030 erfolgt durch gesetzlich festgelegte Ausbau- und Versorgungsverpflichtungen, um eine Bandbreite von mindestens einem Gigabit pro Sekunde für alle Haushalte und Unternehmen zu gewährleisten. Netzbetreiber sind ebenfalls in der Verantwortung, um dieses Ziel zu erreichen.","Deutschland soll zur 'Gigabit-Gesellschaft' werden, indem die Versorgung aller Haushalte und Unternehmen mit einer Bandbreite von mindestens einem Gigabit pro Sekunde durch gesetzlich festgelegte Ausbau- und Versorgungsverpflichtungen und entsprechende Zwischenziele garantiert wird.",1.0,0.9883995395392001,0.99999999995,1.0
17,Wie soll der Zugang zu digitalen Verwaltungsdienstleistungen verbessert werden?,"['Um dieses Versprechen einzuhalten, werden wir die Versorgung \naller Haushalte und Unternehmen mit einer Bandbreite von mindestens einem Gigabit pro Sekun-\nde garantieren – durch konkrete, gesetzlich festgelegte Ausbau- und Versorgungsverpflichtungen \nund entsprechende Zwischenziele. Hier stehen auch die Netzbetreiber in der Verantwortung.\xa0\nUnser Ziel ist ein moderner, bürgernaher Staat, der allen Bürger*innen einen einfachen, digitalen \nZugang zu seinen Dienstleistungen bietet. Wir werden daher die Verpflichtung von Bund, Ländern \nund Kommunen zur Bereitstellung digitaler Verwaltungsdienstleistungen ausbauen, damit alle \nVerwaltungsleistungen möglichst schnell auch digital verfügbar sind. Jede*r Bürger*in soll ohne \nZusatzkosten und Extrageräte die Möglichkeit haben, diese Leistungen freiwillig und datenschutz -\nkonform mit einer digitalen Identität zu nutzen. Wer Anspruch auf eine Leistung hat, muss diese \n– wenn möglich – automatisch, ohne Antrag erhalten oder in einfacher Form ‘mit einem Klick’ \nbeantragen können. Bürger*innen sollen, nach dem Modell einer digitalen Life-Chain, Berechtigun-\ngen selbst vergeben und auch wieder löschen können und somit kontrollieren, wer wann auf ihre \nDaten zugreift. Öffentlich finanzierte Software sollte, wo möglich, als Open-Source transparent \nentwickelt und öffentlich zugänglich gemacht werden.\nWir verfolgen das Ziel, dass alle Schulen in Deutschland erstklassig ausgestattet sind. Jedem/r \nSchüler*in muss ein digitales Endgerät und Zugang zum Internet zur Verfügung stehen. Mit dem \nDigitalPakt Schule und dem Konjunkturpaket haben Bund und Länder bereits einen großen Schritt \nzu einer digitalen Lehrmittelfreiheit getan.'
 'Wir \nbrauchen eine Modernisierungsoffensive für den öffentlichen Dienst und eine bessere Zusammen-\narbeit der Verwaltung. In die Entwicklung, Umsetzung und Evaluation von Projekten wollen wir \nwissenschaftliche und wirtschaftliche Expertise, Verbände und die Zivilgesellschaft einbinden und \ndas Parlament in seiner Kontrollfunktion stärken.\nDie demokratische Gestaltung des digitalen Wandels, die alle Lebensbereiche umfasst, alle gesell-\nschaftlichen, wirtschaftlichen und politischen Felder und Ebenen, ist ein Beispiel für die Überfor -\nderung herkömmlicher Organisationsformen mit den Aufgaben unserer Zeit.\nZum nachhaltigen Regieren gehört, dass Regierungsvorhaben, Projekte und Gesetze in ihrer Um-\nsetzung kommunikativ begleitet werden. Außerdem muss die Umsetzung in den zuständigen \nVerwaltungseinheiten, durch hinreichende Personalausstattung und geeignete Fortbildungsmaß-\nnahmen sichergestellt werden.\nDie Prinzipien offenen Regierungshandelns - Transparenz, Partizipation und Zusammenarbeit - \nsind für uns handlungsleitend. Wir werden die Nationalen Aktionspläne im Rahmen der Open \nGovernment Partnership Deutschlands umsetzen und weiterentwickeln.\nWir werden die Erfahrungen mit Bürgerräten aufgreifen und es uns zur Aufgabe machen, neue \nWege der unmittelbaren Beteiligung an staatlichen Entscheidungen zu gehen. Durch eine syste-\nmatische und frühzeitige Beteiligung der Bürger*innen an staatlichen Projekten können Rechtswe-\nge verkürzt und Verfahren beschleunigt werden.\nDas Informationsfreiheitsrecht werden wir zu einem wirksamen Transparenzrecht weiterentwi-\nckeln und ausbauen. Wir werden öffentliche Daten und Informationen kostenlos und diskrimi-\nnierungsfrei bereitstellen.'
 'Bürger*innen sollen, nach dem Modell einer digitalen Life-Chain, Berechtigun-\ngen selbst vergeben und auch wieder löschen können und somit kontrollieren, wer wann auf ihre \nDaten zugreift. Öffentlich finanzierte Software sollte, wo möglich, als Open-Source transparent \nentwickelt und öffentlich zugänglich gemacht werden.\nWir verfolgen das Ziel, dass alle Schulen in Deutschland erstklassig ausgestattet sind. Jedem/r \nSchüler*in muss ein digitales Endgerät und Zugang zum Internet zur Verfügung stehen. Mit dem \nDigitalPakt Schule und dem Konjunkturpaket haben Bund und Länder bereits einen großen Schritt \nzu einer digitalen Lehrmittelfreiheit getan. Wir werden hier weiter investieren und ein Moderni-\nsierungsprogramm des Bundes aufsetzen, das sowohl den Sanierungsbedarf der Schulgebäude als \nauch die digitale Ausstattung umfasst. Wir werden dafür sorgen, dass eine einfache, unbürokra-\ntische Umsetzung der digitalen Grundausstattung für alle Schulen möglich ist. Einen besonderen \nSchwerpunkt werden wir auf die Ganztagsschule legen.\nNeben der Infrastruktur brauchen wir auch eine bessere Koordinierung des Unterrichts selbst. Wir \nbrauchen Lehr- und Lernmaterialien für inklusive, ganzheitliche Bildung. Auf einer Open-Source-\nPlattform, die bereits durch den Digitalpakt beauftragt und finanziert ist, sollen künftig länder -\nübergreifend Lehr- und Lernmaterialien und Unterrichtskonzepte für alle zugänglich sein: offen, \ndezentral, sicher und vernetzt. Die Förderung der Medienkompetenz von Kindern und Jugendli-\nchen ist dabei ein zentrales Ziel.\xa0\nNotwendig ist darüber hinaus ein System, das die Qualität der eingestellten Medien auf solchen \noffenen Plattformen prüft und sichert.']","Der Zugang zu digitalen Verwaltungsdienstleistungen soll verbessert werden, indem die Verpflichtung von Bund, Ländern und Kommunen zur Bereitstellung digitaler Dienstleistungen ausgebaut wird. Bürger*innen sollen diese Dienstleistungen freiwillig und datenschutzkonform mit einer digitalen Identität nutzen können. Es wird angestrebt, Leistungen automatisch oder mit einem Klick verfügbar zu machen.","Der Zugang soll verbessert werden, indem Bund, Länder und Kommunen zur Bereitstellung digitaler Verwaltungsdienstleistungen verpflichtet werden und diese Leistungen datenschutzkonform mit einer digitalen Identität nutzbar sind.",1.0,1.0000000000000004,0.9999999999,1.0
18,"Welche Maßnahmen werden ergriffen, um den Zugang zum Netz für Bürger*innen mit geringem Einkommen, Schüler*innen und Studierende zu ermöglichen?","['Um dieses Versprechen einzuhalten, werden wir die Versorgung \naller Haushalte und Unternehmen mit einer Bandbreite von mindestens einem Gigabit pro Sekun-\nde garantieren – durch konkrete, gesetzlich festgelegte Ausbau- und Versorgungsverpflichtungen \nund entsprechende Zwischenziele. Hier stehen auch die Netzbetreiber in der Verantwortung.\xa0\nUnser Ziel ist ein moderner, bürgernaher Staat, der allen Bürger*innen einen einfachen, digitalen \nZugang zu seinen Dienstleistungen bietet. Wir werden daher die Verpflichtung von Bund, Ländern \nund Kommunen zur Bereitstellung digitaler Verwaltungsdienstleistungen ausbauen, damit alle \nVerwaltungsleistungen möglichst schnell auch digital verfügbar sind. Jede*r Bürger*in soll ohne \nZusatzkosten und Extrageräte die Möglichkeit haben, diese Leistungen freiwillig und datenschutz -\nkonform mit einer digitalen Identität zu nutzen. Wer Anspruch auf eine Leistung hat, muss diese \n– wenn möglich – automatisch, ohne Antrag erhalten oder in einfacher Form ‘mit einem Klick’ \nbeantragen können. Bürger*innen sollen, nach dem Modell einer digitalen Life-Chain, Berechtigun-\ngen selbst vergeben und auch wieder löschen können und somit kontrollieren, wer wann auf ihre \nDaten zugreift. Öffentlich finanzierte Software sollte, wo möglich, als Open-Source transparent \nentwickelt und öffentlich zugänglich gemacht werden.\nWir verfolgen das Ziel, dass alle Schulen in Deutschland erstklassig ausgestattet sind. Jedem/r \nSchüler*in muss ein digitales Endgerät und Zugang zum Internet zur Verfügung stehen. Mit dem \nDigitalPakt Schule und dem Konjunkturpaket haben Bund und Länder bereits einen großen Schritt \nzu einer digitalen Lehrmittelfreiheit getan.'
 'Dadurch können sich die Be-\nhörden und die Betroffenen in den ersten Monaten mit voller Energie auf eine sinnvolle Wieder -\naufnahme der Beschäftigung konzentrieren. Die guten Erfahrungen aus diesen vorübergehenden \nMaßnahmen haben uns darin bestätigt, dafür zu sorgen, dass auch in Zukunft Vermögen und \nWohnungsgröße innerhalb der ersten zwei Jahre nicht überprüft werden und das Schonvermögen \nerhöht wird. Das Bürgergeld beinhaltet Mitwirkungspflichten, setzt aber konsequent auf Hilfe und \nErmutigung. Eingliederungsvereinbarungen werden durch eine gemeinsame und auf Augenhöhe \nerarbeitete Teilhabevereinbarung ersetzt. Bei ihrer Umsetzung setzen wir auf Befähigung und Be-\nstärkung und nicht auf Vorgaben und Zwang. Sinnwidrige und unwürdige Sanktionen schaffen wir \nab. Das sozioökonomische und soziokulturelle Existenzminimum muss jederzeit gesichert sein.\nDie Leistungen des Sozialstaates sind soziale Rechte – wer sie benötigt, sollte nicht lange suchen \nmüssen. Unser Ziel ist es, die Leistungen ohne Hürden und Umwege zugänglich zu machen. Wir \nwollen einen Bürgerservice, der nach Lebenslagen berät und alle Leistungen aus einer Hand zu-\ngänglich macht. Er ist digital und aufsuchend, wo der Weg zu beschwerlich ist. Ein zugewandter \nSozialstaat hilft, Rechtsansprüche geltend zu machen, und begleitet auch danach beratend alle \nSchritte.'
 'Bürger*innen sollen, nach dem Modell einer digitalen Life-Chain, Berechtigun-\ngen selbst vergeben und auch wieder löschen können und somit kontrollieren, wer wann auf ihre \nDaten zugreift. Öffentlich finanzierte Software sollte, wo möglich, als Open-Source transparent \nentwickelt und öffentlich zugänglich gemacht werden.\nWir verfolgen das Ziel, dass alle Schulen in Deutschland erstklassig ausgestattet sind. Jedem/r \nSchüler*in muss ein digitales Endgerät und Zugang zum Internet zur Verfügung stehen. Mit dem \nDigitalPakt Schule und dem Konjunkturpaket haben Bund und Länder bereits einen großen Schritt \nzu einer digitalen Lehrmittelfreiheit getan. Wir werden hier weiter investieren und ein Moderni-\nsierungsprogramm des Bundes aufsetzen, das sowohl den Sanierungsbedarf der Schulgebäude als \nauch die digitale Ausstattung umfasst. Wir werden dafür sorgen, dass eine einfache, unbürokra-\ntische Umsetzung der digitalen Grundausstattung für alle Schulen möglich ist. Einen besonderen \nSchwerpunkt werden wir auf die Ganztagsschule legen.\nNeben der Infrastruktur brauchen wir auch eine bessere Koordinierung des Unterrichts selbst. Wir \nbrauchen Lehr- und Lernmaterialien für inklusive, ganzheitliche Bildung. Auf einer Open-Source-\nPlattform, die bereits durch den Digitalpakt beauftragt und finanziert ist, sollen künftig länder -\nübergreifend Lehr- und Lernmaterialien und Unterrichtskonzepte für alle zugänglich sein: offen, \ndezentral, sicher und vernetzt. Die Förderung der Medienkompetenz von Kindern und Jugendli-\nchen ist dabei ein zentrales Ziel.\xa0\nNotwendig ist darüber hinaus ein System, das die Qualität der eingestellten Medien auf solchen \noffenen Plattformen prüft und sichert.']","Um den Zugang zum Netz für Bürger*innen mit geringem Einkommen, Schüler*innen und Studierende zu ermöglichen, werden digitale Endgeräte und Internetzugang für alle Schüler*innen bereitgestellt. Dies wird durch Programme wie den DigitalPakt Schule und das Konjunkturpaket unterstützt. Es wird angestrebt, eine digitale Grundausstattung für Schulen zu gewährleisten, um allen Schüler*innen den Zugang zum Internet zu ermöglichen.","Für Bürger*innen mit geringem Einkommen, für Schüler*innen und Studierende werden wir darum einen Sozialtarif für den Netzzugang schaffen.",0.6666666666666666,0.9691545596462641,0.0,0.0
19,Wie sollen globale Plattformkonzerne reguliert werden?,"['Diese Plattform soll in der Folge auch für Partnerschaften mit Museen und anderen Kultur -\neinrichtungen zugänglich sein. Ebenfalls begrüßen wir die verstärkte Veröffentlichung von Inhal-\nten unter offenen und freien Lizenzen, um die Nutzung der Inhalte zum Beispiel im Rahmen freier \nWissensprojekte (Wikipedia) oder auch im Schulunterricht leichter möglich zu machen.\xa0\nWir stehen für die digitale Souveränität von Bürger*innen und Verbraucher*innen ein. Wo globale \nPlattformkonzerne zu Monopolisten werden, bedrohen sie digitale Vielfalt und neigen dazu, natio-\nnalstaatliche Regeln zu umgehen. Wir werden deshalb gemeinsam mit den EU-Mitgliedsstaaten \neine starke und präzise Regulierung schaffen, den Wettbewerb sichern und alternative Angebote \nfördern. Es braucht mehr Angebote mit hoher Datensouveränität.\nEs muss Alternativen zu den großen Plattformen geben – mit echten Chancen für lokale Anbieter. \nNutzerdaten müssen geschützt sein und die Nutzer*innen müssen darüber bestimmen können, \nwas mit ihren Daten geschieht.\xa0\nZu viel Marktmacht einzelner schadet dem Wettbewerb und damit letztlich den Verbraucher*in-\nnen. Wir wollen Entwicklungen am Markt voraus sein und ein präventives und proaktives Wettbe-\nwerbs- und Kartellrecht schaffen. In das Kartellrecht werden wir verstärkt vorbeugende Kontrollen \nintegrieren. Zudem werden wir weitere, neue europäische Instrumente entwickeln, um die über -\nmächtigen Plattformen zu zähmen oder notfalls zu entflechten. Grundlegend notwendig hierfür \nist die Bewahrung der Netzneutralität, für welche wir einstehen werden.'
 'Nutzerdaten müssen geschützt sein und die Nutzer*innen müssen darüber bestimmen können, \nwas mit ihren Daten geschieht.\xa0\nZu viel Marktmacht einzelner schadet dem Wettbewerb und damit letztlich den Verbraucher*in-\nnen. Wir wollen Entwicklungen am Markt voraus sein und ein präventives und proaktives Wettbe-\nwerbs- und Kartellrecht schaffen. In das Kartellrecht werden wir verstärkt vorbeugende Kontrollen \nintegrieren. Zudem werden wir weitere, neue europäische Instrumente entwickeln, um die über -\nmächtigen Plattformen zu zähmen oder notfalls zu entflechten. Grundlegend notwendig hierfür \nist die Bewahrung der Netzneutralität, für welche wir einstehen werden.\nEs muss möglich sein, zwischen verschiedenen Messenger-Diensten, sozialen Netzwerken und \ndigitalen Diensten und Plattformen zu kommunizieren oder zu wechseln. Diese Interoperabilität \nwerden wir gesetzlich vorschreiben.\xa0\nWir brauchen in Europa eine selbstbestimmte Entwicklung und Herstellung der notwendigen \nKomponenten und Bauteile, damit nicht ausschließlich US- und chinesische Hersteller über den \nErfolg und die Netzwerksicherheit digitaler Infrastrukturen in Europa entscheiden. Dafür wollen \nwir einen gemeinsamen Kraftakt in Europa, der eine gemeinsame europäische Entwicklung und \nProduktion solcher Komponenten strategisch und langfristig aufbaut.'
 'Internationale Steuerkooperation kann verhindern, dass Vermögen und Unternehmensgewinne \nder Besteuerung entzogen werden. Darum brauchen wir ein globales Register für mehr Transpa-\nrenz. Global agierende Konzerne müssen sich an der Finanzierung des Gemeinwesens beteiligen. \nDafür muss der weltweite Dumpingsteuerwettbewerb um die niedrigsten Unternehmenssteuern \nbeendet werden. Deshalb hat die SPD in der Bundesregierung das Konzept einer globalen Min-\ndestbesteuerung für Unternehmen entwickelt und internationale Verhandlungen hierzu initiiert. \nDie neue US-Regierung hat sich nun hinter dieses Konzept gestellt. Wir werden diese historische \nChance für eine globale Steuerreform ergreifen. Wir werden den Aufbau einer globalen Steuerko-\nordinationsstelle bei der UN und die OECD in ihrem Kampf gegen Gewinnverkürzung und Gewinn-\nverlagerung unterstützen. Unser Ziel ist es, Steueroasen trockenzulegen und gerechte Steuersyste-\nme unter angemessener Beteiligung auch der Eliten im Globalen Süden zu fördern und fordern.\nDeutschland ist wie kaum ein anderes Land auf offene Märkte und eine funktionsfähige sowie \nregelbasierte globale Wirtschaft angewiesen. Unser Ziel ist es ein stabiles, faires und demokrati-\nsches Handelssystem zu etablieren. \nWir werden die Instrumente der Handels- und Investitionspolitik modernisieren – vor allem mit \nBlick auf Nachhaltigkeit und die Durchsetzung gemeinsamer multilateraler Regeln – und uns für \neine Stärkung der Welthandelsorganisation (WTO) einsetzen. Hierfür werden wir das Regelwerk \nerweitern, die Nachhaltigkeitsziele der Vereinten Nationen einbeziehen sowie die Durchsetzungs-\nmöglichkeiten verbessern.']","Globale Plattformkonzerne sollen durch eine starke und präzise Regulierung reguliert werden, um den Wettbewerb zu sichern und alternative Angebote zu fördern. Es wird nach Alternativen zu den großen Plattformen gesucht, um lokale Anbieter zu unterstützen. Der Schutz von Nutzerdaten und die Kontrolle darüber werden betont.","Wir werden deshalb gemeinsam mit den EU-Mitgliedsstaaten eine starke und präzise Regulierung schaffen, den Wettbewerb sichern und alternative Angebote fördern.",1.0,0.9689381517263742,0.9999999999666667,1.0
20,Wie soll das Wettbewerbs- und Kartellrecht weiterentwickelt werden?,"['Diese Plattform soll in der Folge auch für Partnerschaften mit Museen und anderen Kultur -\neinrichtungen zugänglich sein. Ebenfalls begrüßen wir die verstärkte Veröffentlichung von Inhal-\nten unter offenen und freien Lizenzen, um die Nutzung der Inhalte zum Beispiel im Rahmen freier \nWissensprojekte (Wikipedia) oder auch im Schulunterricht leichter möglich zu machen.\xa0\nWir stehen für die digitale Souveränität von Bürger*innen und Verbraucher*innen ein. Wo globale \nPlattformkonzerne zu Monopolisten werden, bedrohen sie digitale Vielfalt und neigen dazu, natio-\nnalstaatliche Regeln zu umgehen. Wir werden deshalb gemeinsam mit den EU-Mitgliedsstaaten \neine starke und präzise Regulierung schaffen, den Wettbewerb sichern und alternative Angebote \nfördern. Es braucht mehr Angebote mit hoher Datensouveränität.\nEs muss Alternativen zu den großen Plattformen geben – mit echten Chancen für lokale Anbieter. \nNutzerdaten müssen geschützt sein und die Nutzer*innen müssen darüber bestimmen können, \nwas mit ihren Daten geschieht.\xa0\nZu viel Marktmacht einzelner schadet dem Wettbewerb und damit letztlich den Verbraucher*in-\nnen. Wir wollen Entwicklungen am Markt voraus sein und ein präventives und proaktives Wettbe-\nwerbs- und Kartellrecht schaffen. In das Kartellrecht werden wir verstärkt vorbeugende Kontrollen \nintegrieren. Zudem werden wir weitere, neue europäische Instrumente entwickeln, um die über -\nmächtigen Plattformen zu zähmen oder notfalls zu entflechten. Grundlegend notwendig hierfür \nist die Bewahrung der Netzneutralität, für welche wir einstehen werden.'
 'Nutzerdaten müssen geschützt sein und die Nutzer*innen müssen darüber bestimmen können, \nwas mit ihren Daten geschieht.\xa0\nZu viel Marktmacht einzelner schadet dem Wettbewerb und damit letztlich den Verbraucher*in-\nnen. Wir wollen Entwicklungen am Markt voraus sein und ein präventives und proaktives Wettbe-\nwerbs- und Kartellrecht schaffen. In das Kartellrecht werden wir verstärkt vorbeugende Kontrollen \nintegrieren. Zudem werden wir weitere, neue europäische Instrumente entwickeln, um die über -\nmächtigen Plattformen zu zähmen oder notfalls zu entflechten. Grundlegend notwendig hierfür \nist die Bewahrung der Netzneutralität, für welche wir einstehen werden.\nEs muss möglich sein, zwischen verschiedenen Messenger-Diensten, sozialen Netzwerken und \ndigitalen Diensten und Plattformen zu kommunizieren oder zu wechseln. Diese Interoperabilität \nwerden wir gesetzlich vorschreiben.\xa0\nWir brauchen in Europa eine selbstbestimmte Entwicklung und Herstellung der notwendigen \nKomponenten und Bauteile, damit nicht ausschließlich US- und chinesische Hersteller über den \nErfolg und die Netzwerksicherheit digitaler Infrastrukturen in Europa entscheiden. Dafür wollen \nwir einen gemeinsamen Kraftakt in Europa, der eine gemeinsame europäische Entwicklung und \nProduktion solcher Komponenten strategisch und langfristig aufbaut.'
 'Deutschland ist wie kaum ein anderes Land auf offene Märkte und eine funktionsfähige sowie \nregelbasierte globale Wirtschaft angewiesen. Unser Ziel ist es ein stabiles, faires und demokrati-\nsches Handelssystem zu etablieren. \nWir werden die Instrumente der Handels- und Investitionspolitik modernisieren – vor allem mit \nBlick auf Nachhaltigkeit und die Durchsetzung gemeinsamer multilateraler Regeln – und uns für \neine Stärkung der Welthandelsorganisation (WTO) einsetzen. Hierfür werden wir das Regelwerk \nerweitern, die Nachhaltigkeitsziele der Vereinten Nationen einbeziehen sowie die Durchsetzungs-\nmöglichkeiten verbessern. Alle Instanzen des WTO-Streitschlichtungsmechanismus sollen wieder \nbeschlussfähig sein. Deshalb ist eine starke WTO mit einem modernen Regelwerk, das die nachhal-\ntigen Entwicklungsbedürfnisse des Globalen Südens ebenso wie die des Nordens fair und partner -\nschaftlich anerkennt und fördert, so wichtig.\nViele Länder befanden sich schon vor der Corona-Pandemie in einer Schuldenkrise, die jetzt noch \nvergrößert wird. Zentrale Säulen der Entwicklungsfinanzierung sind zusammengebrochen und \nFinanzströme ausgetrocknet. Das kurzfristige Aussetzen des Schuldendienstes im Rahmen der \nG20 und des IWF brachte Erleichterung. Wir unterstützen eine Initiative für ein globales Staatenin-\nsolvenzverfahren, das staatliche und vor allem private Gläubiger miteinbezieht und das Schulden-\nerlasse für besonders gefährdete Ländergruppen formuliert und umsetzt.\nDie friedenspolitischen Herausforderungen nehmen zu.']","Das Wettbewerbs- und Kartellrecht soll durch die Schaffung eines präventiven und proaktiven Rahmens mit verstärkten vorbeugenden Kontrollen und neuen europäischen Instrumenten weiterentwickelt werden, um die übermächtigen Plattformen zu zähmen oder notfalls zu entflechten. Die Bewahrung der Netzneutralität wird als grundlegend notwendig angesehen. Es wird angestrebt, mehr Angebote mit hoher Datensouveränität zu schaffen.",Wir wollen Entwicklungen am Markt voraus sein und ein präventives und proaktives Wettbewerbs- und Kartellrecht schaffen. In das Kartellrecht werden wir verstärkt vorbeugende Kontrollen integrieren.,1.0,0.9631453653054617,0.99999999995,1.0
21,Wie soll das Wettbewerbs- und Kartellrecht weiterentwickelt werden?,"['Diese Plattform soll in der Folge auch für Partnerschaften mit Museen und anderen Kultur -\neinrichtungen zugänglich sein. Ebenfalls begrüßen wir die verstärkte Veröffentlichung von Inhal-\nten unter offenen und freien Lizenzen, um die Nutzung der Inhalte zum Beispiel im Rahmen freier \nWissensprojekte (Wikipedia) oder auch im Schulunterricht leichter möglich zu machen.\xa0\nWir stehen für die digitale Souveränität von Bürger*innen und Verbraucher*innen ein. Wo globale \nPlattformkonzerne zu Monopolisten werden, bedrohen sie digitale Vielfalt und neigen dazu, natio-\nnalstaatliche Regeln zu umgehen. Wir werden deshalb gemeinsam mit den EU-Mitgliedsstaaten \neine starke und präzise Regulierung schaffen, den Wettbewerb sichern und alternative Angebote \nfördern. Es braucht mehr Angebote mit hoher Datensouveränität.\nEs muss Alternativen zu den großen Plattformen geben – mit echten Chancen für lokale Anbieter. \nNutzerdaten müssen geschützt sein und die Nutzer*innen müssen darüber bestimmen können, \nwas mit ihren Daten geschieht.\xa0\nZu viel Marktmacht einzelner schadet dem Wettbewerb und damit letztlich den Verbraucher*in-\nnen. Wir wollen Entwicklungen am Markt voraus sein und ein präventives und proaktives Wettbe-\nwerbs- und Kartellrecht schaffen. In das Kartellrecht werden wir verstärkt vorbeugende Kontrollen \nintegrieren. Zudem werden wir weitere, neue europäische Instrumente entwickeln, um die über -\nmächtigen Plattformen zu zähmen oder notfalls zu entflechten. Grundlegend notwendig hierfür \nist die Bewahrung der Netzneutralität, für welche wir einstehen werden.'
 'Nutzerdaten müssen geschützt sein und die Nutzer*innen müssen darüber bestimmen können, \nwas mit ihren Daten geschieht.\xa0\nZu viel Marktmacht einzelner schadet dem Wettbewerb und damit letztlich den Verbraucher*in-\nnen. Wir wollen Entwicklungen am Markt voraus sein und ein präventives und proaktives Wettbe-\nwerbs- und Kartellrecht schaffen. In das Kartellrecht werden wir verstärkt vorbeugende Kontrollen \nintegrieren. Zudem werden wir weitere, neue europäische Instrumente entwickeln, um die über -\nmächtigen Plattformen zu zähmen oder notfalls zu entflechten. Grundlegend notwendig hierfür \nist die Bewahrung der Netzneutralität, für welche wir einstehen werden.\nEs muss möglich sein, zwischen verschiedenen Messenger-Diensten, sozialen Netzwerken und \ndigitalen Diensten und Plattformen zu kommunizieren oder zu wechseln. Diese Interoperabilität \nwerden wir gesetzlich vorschreiben.\xa0\nWir brauchen in Europa eine selbstbestimmte Entwicklung und Herstellung der notwendigen \nKomponenten und Bauteile, damit nicht ausschließlich US- und chinesische Hersteller über den \nErfolg und die Netzwerksicherheit digitaler Infrastrukturen in Europa entscheiden. Dafür wollen \nwir einen gemeinsamen Kraftakt in Europa, der eine gemeinsame europäische Entwicklung und \nProduktion solcher Komponenten strategisch und langfristig aufbaut.'
 'Deutschland ist wie kaum ein anderes Land auf offene Märkte und eine funktionsfähige sowie \nregelbasierte globale Wirtschaft angewiesen. Unser Ziel ist es ein stabiles, faires und demokrati-\nsches Handelssystem zu etablieren. \nWir werden die Instrumente der Handels- und Investitionspolitik modernisieren – vor allem mit \nBlick auf Nachhaltigkeit und die Durchsetzung gemeinsamer multilateraler Regeln – und uns für \neine Stärkung der Welthandelsorganisation (WTO) einsetzen. Hierfür werden wir das Regelwerk \nerweitern, die Nachhaltigkeitsziele der Vereinten Nationen einbeziehen sowie die Durchsetzungs-\nmöglichkeiten verbessern. Alle Instanzen des WTO-Streitschlichtungsmechanismus sollen wieder \nbeschlussfähig sein. Deshalb ist eine starke WTO mit einem modernen Regelwerk, das die nachhal-\ntigen Entwicklungsbedürfnisse des Globalen Südens ebenso wie die des Nordens fair und partner -\nschaftlich anerkennt und fördert, so wichtig.\nViele Länder befanden sich schon vor der Corona-Pandemie in einer Schuldenkrise, die jetzt noch \nvergrößert wird. Zentrale Säulen der Entwicklungsfinanzierung sind zusammengebrochen und \nFinanzströme ausgetrocknet. Das kurzfristige Aussetzen des Schuldendienstes im Rahmen der \nG20 und des IWF brachte Erleichterung. Wir unterstützen eine Initiative für ein globales Staatenin-\nsolvenzverfahren, das staatliche und vor allem private Gläubiger miteinbezieht und das Schulden-\nerlasse für besonders gefährdete Ländergruppen formuliert und umsetzt.\nDie friedenspolitischen Herausforderungen nehmen zu.']","Das Wettbewerbs- und Kartellrecht soll durch die Schaffung eines präventiven und proaktiven Rahmens mit verstärkten vorbeugenden Kontrollen und neuen europäischen Instrumenten weiterentwickelt werden. Ziel ist es, die übermäßige Marktmacht einzelner zu begrenzen, den Wettbewerb zu fördern und die Verbraucher zu schützen. Die Bewahrung der Netzneutralität wird als grundlegend notwendig angesehen.",Wir wollen Entwicklungen am Markt voraus sein und ein präventives und proaktives Wettbewerbs- und Kartellrecht schaffen. In das Kartellrecht werden wir verstärkt vorbeugende Kontrollen integrieren.,1.0,0.999999999999999,0.99999999995,1.0
22,Wie soll die Interoperabilität zwischen verschiedenen digitalen Diensten gewährleistet werden?,"['Grundlegend notwendig hierfür \nist die Bewahrung der Netzneutralität, für welche wir einstehen werden.\nEs muss möglich sein, zwischen verschiedenen Messenger-Diensten, sozialen Netzwerken und \ndigitalen Diensten und Plattformen zu kommunizieren oder zu wechseln. Diese Interoperabilität \nwerden wir gesetzlich vorschreiben.\xa0\nWir brauchen in Europa eine selbstbestimmte Entwicklung und Herstellung der notwendigen \nKomponenten und Bauteile, damit nicht ausschließlich US- und chinesische Hersteller über den \nErfolg und die Netzwerksicherheit digitaler Infrastrukturen in Europa entscheiden. Dafür wollen \nwir einen gemeinsamen Kraftakt in Europa, der eine gemeinsame europäische Entwicklung und \nProduktion solcher Komponenten strategisch und langfristig aufbaut.\xa0\nWir setzen uns für eine gezielte und koordinierte Unterstützung der deutschen und europäischen \nDigitalwirtschaft auf allen Technologie-Ebenen und entlang der gesamten Wertschöpfungsketten \nein: von der Halbleiter-Fertigung und der Quantentechnologie über die Cloud und Künstliche Intel-\nligenz und Edge-Computing bis zur Cyber-Sicherheit, sicherer und vertrauenswürdiger Hard- und \nSoftware sowie Netzwerktechnik und datenbasierten Geschäftsmodellen.\xa0 \nGroße Bedeutung für europäische Unternehmen kommt hierbei Open Source-basierten Modellen \nzu. Wir setzen uns ein für eine europäische Cloud-Infrastruktur.'
 'Diese Plattform soll in der Folge auch für Partnerschaften mit Museen und anderen Kultur -\neinrichtungen zugänglich sein. Ebenfalls begrüßen wir die verstärkte Veröffentlichung von Inhal-\nten unter offenen und freien Lizenzen, um die Nutzung der Inhalte zum Beispiel im Rahmen freier \nWissensprojekte (Wikipedia) oder auch im Schulunterricht leichter möglich zu machen.\xa0\nWir stehen für die digitale Souveränität von Bürger*innen und Verbraucher*innen ein. Wo globale \nPlattformkonzerne zu Monopolisten werden, bedrohen sie digitale Vielfalt und neigen dazu, natio-\nnalstaatliche Regeln zu umgehen. Wir werden deshalb gemeinsam mit den EU-Mitgliedsstaaten \neine starke und präzise Regulierung schaffen, den Wettbewerb sichern und alternative Angebote \nfördern. Es braucht mehr Angebote mit hoher Datensouveränität.\nEs muss Alternativen zu den großen Plattformen geben – mit echten Chancen für lokale Anbieter. \nNutzerdaten müssen geschützt sein und die Nutzer*innen müssen darüber bestimmen können, \nwas mit ihren Daten geschieht.\xa0\nZu viel Marktmacht einzelner schadet dem Wettbewerb und damit letztlich den Verbraucher*in-\nnen. Wir wollen Entwicklungen am Markt voraus sein und ein präventives und proaktives Wettbe-\nwerbs- und Kartellrecht schaffen. In das Kartellrecht werden wir verstärkt vorbeugende Kontrollen \nintegrieren. Zudem werden wir weitere, neue europäische Instrumente entwickeln, um die über -\nmächtigen Plattformen zu zähmen oder notfalls zu entflechten. Grundlegend notwendig hierfür \nist die Bewahrung der Netzneutralität, für welche wir einstehen werden.'
 'Um dieses Versprechen einzuhalten, werden wir die Versorgung \naller Haushalte und Unternehmen mit einer Bandbreite von mindestens einem Gigabit pro Sekun-\nde garantieren – durch konkrete, gesetzlich festgelegte Ausbau- und Versorgungsverpflichtungen \nund entsprechende Zwischenziele. Hier stehen auch die Netzbetreiber in der Verantwortung.\xa0\nUnser Ziel ist ein moderner, bürgernaher Staat, der allen Bürger*innen einen einfachen, digitalen \nZugang zu seinen Dienstleistungen bietet. Wir werden daher die Verpflichtung von Bund, Ländern \nund Kommunen zur Bereitstellung digitaler Verwaltungsdienstleistungen ausbauen, damit alle \nVerwaltungsleistungen möglichst schnell auch digital verfügbar sind. Jede*r Bürger*in soll ohne \nZusatzkosten und Extrageräte die Möglichkeit haben, diese Leistungen freiwillig und datenschutz -\nkonform mit einer digitalen Identität zu nutzen. Wer Anspruch auf eine Leistung hat, muss diese \n– wenn möglich – automatisch, ohne Antrag erhalten oder in einfacher Form ‘mit einem Klick’ \nbeantragen können. Bürger*innen sollen, nach dem Modell einer digitalen Life-Chain, Berechtigun-\ngen selbst vergeben und auch wieder löschen können und somit kontrollieren, wer wann auf ihre \nDaten zugreift. Öffentlich finanzierte Software sollte, wo möglich, als Open-Source transparent \nentwickelt und öffentlich zugänglich gemacht werden.\nWir verfolgen das Ziel, dass alle Schulen in Deutschland erstklassig ausgestattet sind. Jedem/r \nSchüler*in muss ein digitales Endgerät und Zugang zum Internet zur Verfügung stehen. Mit dem \nDigitalPakt Schule und dem Konjunkturpaket haben Bund und Länder bereits einen großen Schritt \nzu einer digitalen Lehrmittelfreiheit getan.']","Die Interoperabilität zwischen verschiedenen digitalen Diensten wird gesetzlich vorgeschrieben, um die Kommunikation und den Wechsel zwischen Messenger-Diensten, sozialen Netzwerken und digitalen Plattformen zu ermöglichen. Es wird eine europäische Entwicklung und Herstellung von Komponenten für digitale Infrastrukturen angestrebt, um die Abhängigkeit von US- und chinesischen Herstellern zu verringern. Eine gezielte Unterstützung der deutschen und europäischen Digitalwirtschaft auf verschiedenen Technologie-Ebenen wird angestrebt, wobei Open Source-basierte Modelle eine wichtige Rolle spielen.","Es muss möglich sein, zwischen verschiedenen Messenger-Diensten, sozialen Netzwerken und digitalen Diensten und Plattformen zu kommunizieren oder zu wechseln. Diese Interoperabilität werden wir gesetzlich vorschreiben.",0.9090909090909091,0.943207577794083,0.9999999999,1.0
23,Welche Bereiche der Digitalwirtschaft sollen gezielt unterstützt werden?,"['Um dieses Versprechen einzuhalten, werden wir die Versorgung \naller Haushalte und Unternehmen mit einer Bandbreite von mindestens einem Gigabit pro Sekun-\nde garantieren – durch konkrete, gesetzlich festgelegte Ausbau- und Versorgungsverpflichtungen \nund entsprechende Zwischenziele. Hier stehen auch die Netzbetreiber in der Verantwortung.\xa0\nUnser Ziel ist ein moderner, bürgernaher Staat, der allen Bürger*innen einen einfachen, digitalen \nZugang zu seinen Dienstleistungen bietet. Wir werden daher die Verpflichtung von Bund, Ländern \nund Kommunen zur Bereitstellung digitaler Verwaltungsdienstleistungen ausbauen, damit alle \nVerwaltungsleistungen möglichst schnell auch digital verfügbar sind. Jede*r Bürger*in soll ohne \nZusatzkosten und Extrageräte die Möglichkeit haben, diese Leistungen freiwillig und datenschutz -\nkonform mit einer digitalen Identität zu nutzen. Wer Anspruch auf eine Leistung hat, muss diese \n– wenn möglich – automatisch, ohne Antrag erhalten oder in einfacher Form ‘mit einem Klick’ \nbeantragen können. Bürger*innen sollen, nach dem Modell einer digitalen Life-Chain, Berechtigun-\ngen selbst vergeben und auch wieder löschen können und somit kontrollieren, wer wann auf ihre \nDaten zugreift. Öffentlich finanzierte Software sollte, wo möglich, als Open-Source transparent \nentwickelt und öffentlich zugänglich gemacht werden.\nWir verfolgen das Ziel, dass alle Schulen in Deutschland erstklassig ausgestattet sind. Jedem/r \nSchüler*in muss ein digitales Endgerät und Zugang zum Internet zur Verfügung stehen. Mit dem \nDigitalPakt Schule und dem Konjunkturpaket haben Bund und Länder bereits einen großen Schritt \nzu einer digitalen Lehrmittelfreiheit getan.'
 'Diese Plattform soll in der Folge auch für Partnerschaften mit Museen und anderen Kultur -\neinrichtungen zugänglich sein. Ebenfalls begrüßen wir die verstärkte Veröffentlichung von Inhal-\nten unter offenen und freien Lizenzen, um die Nutzung der Inhalte zum Beispiel im Rahmen freier \nWissensprojekte (Wikipedia) oder auch im Schulunterricht leichter möglich zu machen.\xa0\nWir stehen für die digitale Souveränität von Bürger*innen und Verbraucher*innen ein. Wo globale \nPlattformkonzerne zu Monopolisten werden, bedrohen sie digitale Vielfalt und neigen dazu, natio-\nnalstaatliche Regeln zu umgehen. Wir werden deshalb gemeinsam mit den EU-Mitgliedsstaaten \neine starke und präzise Regulierung schaffen, den Wettbewerb sichern und alternative Angebote \nfördern. Es braucht mehr Angebote mit hoher Datensouveränität.\nEs muss Alternativen zu den großen Plattformen geben – mit echten Chancen für lokale Anbieter. \nNutzerdaten müssen geschützt sein und die Nutzer*innen müssen darüber bestimmen können, \nwas mit ihren Daten geschieht.\xa0\nZu viel Marktmacht einzelner schadet dem Wettbewerb und damit letztlich den Verbraucher*in-\nnen. Wir wollen Entwicklungen am Markt voraus sein und ein präventives und proaktives Wettbe-\nwerbs- und Kartellrecht schaffen. In das Kartellrecht werden wir verstärkt vorbeugende Kontrollen \nintegrieren. Zudem werden wir weitere, neue europäische Instrumente entwickeln, um die über -\nmächtigen Plattformen zu zähmen oder notfalls zu entflechten. Grundlegend notwendig hierfür \nist die Bewahrung der Netzneutralität, für welche wir einstehen werden.'
 'Das Zukunftsprogramm der SPD\nKapitel 2Seite >14\nSPD-Parteivorstand 2021Die Digitalisierung darf die Gesellschaft nicht spalten. Der Zugang zum Netz muss bezahlbar sein. \nFür Bürger*innen mit geringem Einkommen, für Schüler*innen und Studierende werden wir darum \neinen Sozialtarif für den Netzzugang schaffen. Zur digitalen Teilhabe gehört die Barrierefreiheit. \nAlle Bürger*innen sollen zur digitalen Selbstbestimmung befähigt werden. Wir brauchen ein Recht \nauf digitale Bildung und Weiterbildung für alle Generationen. Gerade die Volkshochschulen sind \nideale Orte, um digitale Bildung für alle Bürger*innen zu ermöglichen - kostengünstig, barrierefrei, \ninklusiv. Wir werden die Volkshochschulen mit einem Förderprogramm des Bundes in ihrer Ent -\nwicklung unterstützen.\xa0\nWir begrüßen die Überlegungen zu einer europäischen Medienplattform, die die Qualitätsinhalte \nder öffentlich-rechtlichen Medien Europas für alle Bürger*innen grenzüberschreitend zugänglich \nmacht. Diese Plattform soll in der Folge auch für Partnerschaften mit Museen und anderen Kultur -\neinrichtungen zugänglich sein. Ebenfalls begrüßen wir die verstärkte Veröffentlichung von Inhal-\nten unter offenen und freien Lizenzen, um die Nutzung der Inhalte zum Beispiel im Rahmen freier \nWissensprojekte (Wikipedia) oder auch im Schulunterricht leichter möglich zu machen.\xa0\nWir stehen für die digitale Souveränität von Bürger*innen und Verbraucher*innen ein. Wo globale \nPlattformkonzerne zu Monopolisten werden, bedrohen sie digitale Vielfalt und neigen dazu, natio-\nnalstaatliche Regeln zu umgehen.']","Die Bereiche der Digitalwirtschaft, die gezielt unterstützt werden sollen, umfassen die Breitbandversorgung, digitale Verwaltungsdienstleistungen, digitale Identität, Datenschutz, digitale Life-Chain, Open-Source-Software und die digitale Ausstattung von Schulen.","Wir setzen uns für eine gezielte und koordinierte Unterstützung der deutschen und europäischen Digitalwirtschaft auf allen Technologie-Ebenen und entlang der gesamten Wertschöpfungsketten ein: von der Halbleiter-Fertigung und der Quantentechnologie über die Cloud und Künstliche Intelligenz und Edge-Computing bis zur Cyber-Sicherheit, sicherer und vertrauenswürdiger Hard- und Software sowie Netzwerktechnik und datenbasierten Geschäftsmodellen.",1.0,0.999997992000654,0.0,0.0
24,Wie will man gegen Straftaten im Internet entgegenwirken?,"['Das Zukunftsprogramm der SPD\nKapitel 2Seite >16\nSPD-Parteivorstand 2021Für den Schutz unserer Demokratie und die Sicherheit Einzelner benötigen wir auch im Netz ein \nkonsequentes Vorgehen gegen Hasskriminalität, Betrug und andere Straftaten. Zur Verfolgung von \naus dem oder im Internet begangenen Straftaten braucht es technisch und personell hinreichend \nausgestattete Strafverfolgungsbehörden. Bei hinreichenden tatsächlichen Anhaltspunkten auf \neine Straftat müssen Verdächtige identifiziert werden können. Wir werden die nationalen Schutz -\nvorschriften im Strafgesetzbuch und Netzwerkdurchsetzungsgesetz weiterentwickeln und setzen \nuns für verbindliche Regelungen auf europäischer Ebene (Digital Service Act) ein.\xa0\nEs braucht aber neben den rechtlichen Vorgaben auch ziviles Engagement, um dem Respekt zwi-\nschen den Bürger*innen in der digitalen Kommunikation wieder mehr Geltung zu verschaffen. Or -\nganisationen, die gegen Hass und Hetze im Netz aktiv sind, sichern wir unsere Unterstützung zu.'
 'Wir werden weiterhin konsequent gegen Steuerbetrug \nim Onlinehandel vorgehen. Maßnahmen gegen Lohn-, Sozial- und Umweltdumping werden wir \nvorantreiben.\nJeden Tag bekommen wir Dinge von Algorithmen vorgeschlagen: Neue Songs, Turnschuhe oder \nRouten von A nach B. Selbstlernende Systeme und Algorithmen treffen Entscheidungen für eine \nVielzahl von Menschen. Sie können unser Leben und unseren Alltag erleichtern. Aber sie müssen \ntransparent und diskriminierungsfrei angelegt werden. Die Zielsetzung einer algorithmischen Ent -\nscheidung muss klar und überprüfbar definiert sein. Hierfür brauchen wir eine stringente Regulie-\nrung und Aufsicht.\xa0\nCybersicherheit ist die Grundlage für eine erfolgreiche Digitalisierung. Das Bundesamt für Sicher -\nheit in der Informationstechnik als zentrale, unabhängige und ausschließlich präventiv ausgerich-\ntete Cybersicherheitsbehörde werden wir stärken und die Verschlüsselungsforschung ausbauen. \nWir wollen Hersteller darauf verpflichten, Softwareprodukte, digitale Dienste und technische \nGeräte so zu konzipieren, dass sie sicher sind (Security by Design) und dass sie bei den Standard-\neinstellungen die sicherste Variante wählen (Security by Default). Digitale Hintertüren sollen nicht \noffen gehalten werden.\nDas Recht auf informationelle Selbstbestimmung werden wir schützen. Die Datenschutzgrund-\nverordnung ist ein wichtiger Meilenstein und muss in ihrer Durchsetzung praxisnah verbessert \nwerden. Wir brauchen daher gut ausgestattete, effektiv arbeitende Datenschutzaufsichtsbehör -\nden. Privatheit und Datenschutz schaffen Vertrauen und sichern individuelle und kollektive Frei-\nheitsräume.'
 'In Gefängnissen sollen Täter*innen ihre Strafe verbüßen. Sie sollen immer auch Orte der Resozia-\nlisierung sein. Mit den Bundesländern werden wir Maßnahmen zum Schutz vor Radikalisierung \nund zur Deradikalisierung von Straftäter*innen voranbringen. Um gezielter vorbeugen zu können, \nmüssen wir mehr wissen über Kriminalitätsentwicklungen. Dafür werden wir den Periodischen \nSicherheitsbericht wieder regelmäßig erarbeiten lassen. \nWir haben in Deutschland ein leistungsfähiges Hilfesystem für Katastrophen. Ehrenamtliche \nbilden gerade im ländlichen Raum das Herzstück dieser Strukturen. Wir werden dieses unverzicht -\nbare Engagement weiter unterstützen. \nGleichzeitig zeigen sich hier neue wie bereits bekannte Herausforderungen: Cyberattacken, Des-\ninformation und Terrorismus stellen erhebliche Bedrohungen dar, die schnell weite Teile Bevölke-\nrung betreffen können. Wir sorgen dafür, dass Bund, Länder und Kommunen besser und schneller \nHand in Hand arbeiten können.']","Die SPD plant, gegen Straftaten im Internet vorzugehen, indem sie technisch und personell ausgestattete Strafverfolgungsbehörden einsetzt und nationale Schutzvorschriften weiterentwickelt sowie verbindliche Regelungen auf europäischer Ebene anstrebt. Ziviles Engagement wird ebenfalls betont, um Respekt in der digitalen Kommunikation zu fördern.",Wir werden die nationalen Schutzvorschriften im Strafgesetzbuch und Netzwerkdurchsetzungsgesetz weiterentwickeln und setzen uns für verbindliche Regelungen auf europäischer Ebene (Digital Service Act) ein.,1.0,0.9397801867592214,0.9999999999,1.0
25,Welches Ziel wird im Bereich Medizin verfolgt?,"['Deutschland muss wieder seine Innovationskraft einsetzen, um neue Therapieoptionen zu finden. \nDass die gezielte Förderung von Innovationen und neuen Methoden\xa0erfolgreich sein kann, hat ak -\ntuell das Beispiel BioNtech gezeigt. Es zeigt auch, dass\xa0die Gesundheitswirtschaft kein reiner Markt \nist und eine aktive Rolle des Staates\xa0Leben retten kann. Wir wollen ein System, das in Krisensitua-\ntionen die Produktion, Bereithaltung und Verteilung von notwendiger Arznei und Medizinproduk -\nten sicherstellt. Wir sehen es als unsere Pflicht dafür zu sorgen, dass die Medikamente, die hier \nentwickelt werden, in ärmeren Ländern nicht überteuert und knapp sind.\nEines unserer Ziele ist die Förderung der Forschung zur personalisierten Medizin. Diese muss zu \nerschwinglichen Preisen für alle zugänglich sein. Maßgefertigte Produkte statt Präparate “von der \nStange” sind Anfang einer neuen Gesundheitswirtschaft und einer neuen Zeit der adaptiven Zu-\nlassung von Medikamenten. Personalisierte Medizin bewirkt eine Veränderung im Verhältnis von \nBehandlung und Diagnostik. In der Zukunft wird es mehr Produkte geben, bei denen ein diagnos-\ntischer Test mit einem Medikament als Einheit angeboten wird. Diese Leistungen müssen allen \nBürger*innen zur Verfügung stehen - auch bei Medikamenten brauchen wir einen Sicherstellungs-\nauftrag.\nFrauen, Männer und Kinder haben besondere gesundheitliche Bedürfnisse, die bei ihrer\xa0Gesund-\nheitsversorgung und der Prävention berücksichtigt werden müssen. Doch die Gesundheitsfor -\nschung, Ausbildung und Versorgungspraxis orientieren sich zumeist an Daten von weißen, männli-\nchen erwachsenen Probanden– das werden wir ändern.'
 'Personalisierte Medizin bewirkt eine Veränderung im Verhältnis von \nBehandlung und Diagnostik. In der Zukunft wird es mehr Produkte geben, bei denen ein diagnos-\ntischer Test mit einem Medikament als Einheit angeboten wird. Diese Leistungen müssen allen \nBürger*innen zur Verfügung stehen - auch bei Medikamenten brauchen wir einen Sicherstellungs-\nauftrag.\nFrauen, Männer und Kinder haben besondere gesundheitliche Bedürfnisse, die bei ihrer\xa0Gesund-\nheitsversorgung und der Prävention berücksichtigt werden müssen. Doch die Gesundheitsfor -\nschung, Ausbildung und Versorgungspraxis orientieren sich zumeist an Daten von weißen, männli-\nchen erwachsenen Probanden– das werden wir ändern.\xa0Wir werden darüber hinaus Programme in \nden Bereichen Prävention und Krankheitsfrüherkennung fördern, die die Besonderheiten verschie-\ndener Altersgruppen und Geschlechter berücksichtigen.\nEine qualitativ hochwertige Gesundheitsversorgung kann am besten durch eine\xa0Neuordnung der \nRollenverteilung zwischen ambulantem und stationärem Sektor, durch\xa0eine Überwindung der Sek -\ntorengrenzen und eine gute Koordination und Kooperation der medizinischen, psychotherapeuti-\nschen und pflegerischen Berufe gelingen. Wir brauchen darum eine stärkere Öffnung von Kranken-\nhäusern für ambulante, teambasierte und interdisziplinäre Formen der Versorgung. \nDie Corona-Krise hat gezeigt: Der öffentliche Gesundheitsdienst braucht bessere\xa0Rahmenbedin-\ngungen, eine bessere Ausstattung, auch mit Blick auf die digitale\xa0Infrastruktur – Hardware eben-\nso wie Software, und eine konkurrenzfähige Vergütung.'
 'Das Zukunftsprogramm der SPD\nKapitel 2Seite >17\nSPD-Parteivorstand 20212.4. Zukunftsmission IV.  \nUpdate für die Gesundheit \n \nDer Gesundheitssektor braucht wieder mehr politische Aufmerksamkeit und Reformen. Wir brau-\nchen ein klares Leitbild für die nächsten Jahrzehnte.\nDeutschland galt für Jahrzehnte als „Apotheke der Welt“ . Die klügsten Forscher*innen\xa0fanden sich \nin deutschen Instituten, dort sammelten sie Nobelpreise, die unumstritten\xa0weltbeste Medizinin-\ndustrie wurde hierzulande aufgebaut. Deutschland versorgte Kranke\xa0in aller Welt mit allen denk -\nbaren Heilmitteln, von Aspirin bis zum Impfstoff gegen\xa0Tuberkulose. Durch die Corona-Krise wurde \ndeutlich, dass die Abwanderung der\xa0Arzneimittelproduktion ins Ausland und die damit zuneh-\nmende Abhängigkeit zu\xa0Lieferengpässen oder gar Versorgungsengpässen führen kann.\nDeutschland muss wieder seine Innovationskraft einsetzen, um neue Therapieoptionen zu finden. \nDass die gezielte Förderung von Innovationen und neuen Methoden\xa0erfolgreich sein kann, hat ak -\ntuell das Beispiel BioNtech gezeigt. Es zeigt auch, dass\xa0die Gesundheitswirtschaft kein reiner Markt \nist und eine aktive Rolle des Staates\xa0Leben retten kann. Wir wollen ein System, das in Krisensitua-\ntionen die Produktion, Bereithaltung und Verteilung von notwendiger Arznei und Medizinproduk -\nten sicherstellt. Wir sehen es als unsere Pflicht dafür zu sorgen, dass die Medikamente, die hier \nentwickelt werden, in ärmeren Ländern nicht überteuert und knapp sind.']","Im Bereich Medizin wird das Ziel verfolgt, die Innovationskraft Deutschlands zu nutzen, um neue Therapieoptionen zu finden, die personalisierte Medizin zu fördern und sicherzustellen, dass Medikamente in ärmeren Ländern erschwinglich und verfügbar sind.",Eines unserer Ziele ist die Förderung der Forschung zur personalisierten Medizin. Diese muss zu erschwinglichen Preisen für alle zugänglich sein.,1.0,0.9369332629704598,0.9999999999666667,1.0
26,"Wie soll sich die Gesundheitsforschung, Ausbildung und Versorgungspraxis ändern?","['Personalisierte Medizin bewirkt eine Veränderung im Verhältnis von \nBehandlung und Diagnostik. In der Zukunft wird es mehr Produkte geben, bei denen ein diagnos-\ntischer Test mit einem Medikament als Einheit angeboten wird. Diese Leistungen müssen allen \nBürger*innen zur Verfügung stehen - auch bei Medikamenten brauchen wir einen Sicherstellungs-\nauftrag.\nFrauen, Männer und Kinder haben besondere gesundheitliche Bedürfnisse, die bei ihrer\xa0Gesund-\nheitsversorgung und der Prävention berücksichtigt werden müssen. Doch die Gesundheitsfor -\nschung, Ausbildung und Versorgungspraxis orientieren sich zumeist an Daten von weißen, männli-\nchen erwachsenen Probanden– das werden wir ändern.\xa0Wir werden darüber hinaus Programme in \nden Bereichen Prävention und Krankheitsfrüherkennung fördern, die die Besonderheiten verschie-\ndener Altersgruppen und Geschlechter berücksichtigen.\nEine qualitativ hochwertige Gesundheitsversorgung kann am besten durch eine\xa0Neuordnung der \nRollenverteilung zwischen ambulantem und stationärem Sektor, durch\xa0eine Überwindung der Sek -\ntorengrenzen und eine gute Koordination und Kooperation der medizinischen, psychotherapeuti-\nschen und pflegerischen Berufe gelingen. Wir brauchen darum eine stärkere Öffnung von Kranken-\nhäusern für ambulante, teambasierte und interdisziplinäre Formen der Versorgung. \nDie Corona-Krise hat gezeigt: Der öffentliche Gesundheitsdienst braucht bessere\xa0Rahmenbedin-\ngungen, eine bessere Ausstattung, auch mit Blick auf die digitale\xa0Infrastruktur – Hardware eben-\nso wie Software, und eine konkurrenzfähige Vergütung.'
 'Deutschland muss wieder seine Innovationskraft einsetzen, um neue Therapieoptionen zu finden. \nDass die gezielte Förderung von Innovationen und neuen Methoden\xa0erfolgreich sein kann, hat ak -\ntuell das Beispiel BioNtech gezeigt. Es zeigt auch, dass\xa0die Gesundheitswirtschaft kein reiner Markt \nist und eine aktive Rolle des Staates\xa0Leben retten kann. Wir wollen ein System, das in Krisensitua-\ntionen die Produktion, Bereithaltung und Verteilung von notwendiger Arznei und Medizinproduk -\nten sicherstellt. Wir sehen es als unsere Pflicht dafür zu sorgen, dass die Medikamente, die hier \nentwickelt werden, in ärmeren Ländern nicht überteuert und knapp sind.\nEines unserer Ziele ist die Förderung der Forschung zur personalisierten Medizin. Diese muss zu \nerschwinglichen Preisen für alle zugänglich sein. Maßgefertigte Produkte statt Präparate “von der \nStange” sind Anfang einer neuen Gesundheitswirtschaft und einer neuen Zeit der adaptiven Zu-\nlassung von Medikamenten. Personalisierte Medizin bewirkt eine Veränderung im Verhältnis von \nBehandlung und Diagnostik. In der Zukunft wird es mehr Produkte geben, bei denen ein diagnos-\ntischer Test mit einem Medikament als Einheit angeboten wird. Diese Leistungen müssen allen \nBürger*innen zur Verfügung stehen - auch bei Medikamenten brauchen wir einen Sicherstellungs-\nauftrag.\nFrauen, Männer und Kinder haben besondere gesundheitliche Bedürfnisse, die bei ihrer\xa0Gesund-\nheitsversorgung und der Prävention berücksichtigt werden müssen. Doch die Gesundheitsfor -\nschung, Ausbildung und Versorgungspraxis orientieren sich zumeist an Daten von weißen, männli-\nchen erwachsenen Probanden– das werden wir ändern.'
 'Wir werden eine Bürgerversicherung\xa0einführen. Das bedeutet: Gleich guter \nZugang zur medizinischen Versorgung für alle,\xa0eine solidarische Finanzierung und hohe Qualität \nder Leistungen. Gesundheit ist keine\xa0Ware, deshalb müssen in unserem Gesundheitssystem die \nBürger*innen im Mittelpunkt\xa0stehen. Der Staat muss deshalb sicherstellen, dass die Leistungen \nder\xa0Gesundheitsversorgung den Bedürfnissen derer entsprechen, die sie benötigen. Gute\xa0Arbeits-\nbedingungen und vernünftige Löhne in der Pflege sind dafür eine wichtige\xa0Grundlage.\xa0\nProfessionelle Pflege ist ein höchst anspruchsvoller Beruf. Gute Arbeitsbedingungen und ver -\nnünftige Löhne sind dafür eine wichtige Grundlage. Maßnahmen zur Überwindung\xa0des Personal-\nmangels dürfen nicht dazu führen, dass die Stellen in der Pflege abgewertet werden. Wir wollen \ndie Kommerzialisierung im Gesundheitswesen beenden, denn sie wirkt sich negativ auf die Ver -\nsorgung der Patient*innen und die Arbeitsbedingungen der Beschäftigten aus. Gewinne, die aus \nMitteln der Solidargemeinschaft erwirtschaftet werden, sollen verpflichtend und weitestgehend \nwieder in das Gesundheitssystem zurückfließen. Wir stärken die Kommunen bei der Einrichtung \nund beim Betreiben der integrierten medizinischen Versorgungszentren. Das System der Fallpau-\nschalen werden wir auf den Prüfstand stellen, die Pauschalen überarbeiten und wo nötig abschaf -\nfen. Die Grundkosten der Krankenhäuser und der integrierten medizinischen Versorgungszentren \nwerden wir angemessen finanzieren.']","Die Gesundheitsforschung, Ausbildung und Versorgungspraxis sollen sich nicht nur auf weiße, männliche erwachsene Probanden konzentrieren, sondern die Bedürfnisse von Frauen, Männern und Kindern berücksichtigen. Es wird angestrebt, personalisierte Medizin zu fördern und den Zugang zu maßgeschneiderten Produkten für alle Bürger zu gewährleisten. Eine bessere Gesundheitsversorgung erfordert eine Neuordnung der Rollenverteilung zwischen ambulantem und stationärem Sektor sowie eine stärkere Öffnung von Krankenhäusern für interdisziplinäre Versorgungsformen.","Doch die Gesundheitsforschung, Ausbildung und Versorgungspraxis orientieren sich zumeist an Daten von weißen, männlichen erwachsenen Probanden - das werden wir ändern.",1.0,0.9743185862313037,0.99999999995,1.0
27,Welche Programme in den Bereichen Prävention und Krankheitsfrüherkennung sollen gefördert werden?,"['Deutschland muss wieder seine Innovationskraft einsetzen, um neue Therapieoptionen zu finden. \nDass die gezielte Förderung von Innovationen und neuen Methoden\xa0erfolgreich sein kann, hat ak -\ntuell das Beispiel BioNtech gezeigt. Es zeigt auch, dass\xa0die Gesundheitswirtschaft kein reiner Markt \nist und eine aktive Rolle des Staates\xa0Leben retten kann. Wir wollen ein System, das in Krisensitua-\ntionen die Produktion, Bereithaltung und Verteilung von notwendiger Arznei und Medizinproduk -\nten sicherstellt. Wir sehen es als unsere Pflicht dafür zu sorgen, dass die Medikamente, die hier \nentwickelt werden, in ärmeren Ländern nicht überteuert und knapp sind.\nEines unserer Ziele ist die Förderung der Forschung zur personalisierten Medizin. Diese muss zu \nerschwinglichen Preisen für alle zugänglich sein. Maßgefertigte Produkte statt Präparate “von der \nStange” sind Anfang einer neuen Gesundheitswirtschaft und einer neuen Zeit der adaptiven Zu-\nlassung von Medikamenten. Personalisierte Medizin bewirkt eine Veränderung im Verhältnis von \nBehandlung und Diagnostik. In der Zukunft wird es mehr Produkte geben, bei denen ein diagnos-\ntischer Test mit einem Medikament als Einheit angeboten wird. Diese Leistungen müssen allen \nBürger*innen zur Verfügung stehen - auch bei Medikamenten brauchen wir einen Sicherstellungs-\nauftrag.\nFrauen, Männer und Kinder haben besondere gesundheitliche Bedürfnisse, die bei ihrer\xa0Gesund-\nheitsversorgung und der Prävention berücksichtigt werden müssen. Doch die Gesundheitsfor -\nschung, Ausbildung und Versorgungspraxis orientieren sich zumeist an Daten von weißen, männli-\nchen erwachsenen Probanden– das werden wir ändern.'
 'Personalisierte Medizin bewirkt eine Veränderung im Verhältnis von \nBehandlung und Diagnostik. In der Zukunft wird es mehr Produkte geben, bei denen ein diagnos-\ntischer Test mit einem Medikament als Einheit angeboten wird. Diese Leistungen müssen allen \nBürger*innen zur Verfügung stehen - auch bei Medikamenten brauchen wir einen Sicherstellungs-\nauftrag.\nFrauen, Männer und Kinder haben besondere gesundheitliche Bedürfnisse, die bei ihrer\xa0Gesund-\nheitsversorgung und der Prävention berücksichtigt werden müssen. Doch die Gesundheitsfor -\nschung, Ausbildung und Versorgungspraxis orientieren sich zumeist an Daten von weißen, männli-\nchen erwachsenen Probanden– das werden wir ändern.\xa0Wir werden darüber hinaus Programme in \nden Bereichen Prävention und Krankheitsfrüherkennung fördern, die die Besonderheiten verschie-\ndener Altersgruppen und Geschlechter berücksichtigen.\nEine qualitativ hochwertige Gesundheitsversorgung kann am besten durch eine\xa0Neuordnung der \nRollenverteilung zwischen ambulantem und stationärem Sektor, durch\xa0eine Überwindung der Sek -\ntorengrenzen und eine gute Koordination und Kooperation der medizinischen, psychotherapeuti-\nschen und pflegerischen Berufe gelingen. Wir brauchen darum eine stärkere Öffnung von Kranken-\nhäusern für ambulante, teambasierte und interdisziplinäre Formen der Versorgung. \nDie Corona-Krise hat gezeigt: Der öffentliche Gesundheitsdienst braucht bessere\xa0Rahmenbedin-\ngungen, eine bessere Ausstattung, auch mit Blick auf die digitale\xa0Infrastruktur – Hardware eben-\nso wie Software, und eine konkurrenzfähige Vergütung.'
 'Wir werden eine Bürgerversicherung\xa0einführen. Das bedeutet: Gleich guter \nZugang zur medizinischen Versorgung für alle,\xa0eine solidarische Finanzierung und hohe Qualität \nder Leistungen. Gesundheit ist keine\xa0Ware, deshalb müssen in unserem Gesundheitssystem die \nBürger*innen im Mittelpunkt\xa0stehen. Der Staat muss deshalb sicherstellen, dass die Leistungen \nder\xa0Gesundheitsversorgung den Bedürfnissen derer entsprechen, die sie benötigen. Gute\xa0Arbeits-\nbedingungen und vernünftige Löhne in der Pflege sind dafür eine wichtige\xa0Grundlage.\xa0\nProfessionelle Pflege ist ein höchst anspruchsvoller Beruf. Gute Arbeitsbedingungen und ver -\nnünftige Löhne sind dafür eine wichtige Grundlage. Maßnahmen zur Überwindung\xa0des Personal-\nmangels dürfen nicht dazu führen, dass die Stellen in der Pflege abgewertet werden. Wir wollen \ndie Kommerzialisierung im Gesundheitswesen beenden, denn sie wirkt sich negativ auf die Ver -\nsorgung der Patient*innen und die Arbeitsbedingungen der Beschäftigten aus. Gewinne, die aus \nMitteln der Solidargemeinschaft erwirtschaftet werden, sollen verpflichtend und weitestgehend \nwieder in das Gesundheitssystem zurückfließen. Wir stärken die Kommunen bei der Einrichtung \nund beim Betreiben der integrierten medizinischen Versorgungszentren. Das System der Fallpau-\nschalen werden wir auf den Prüfstand stellen, die Pauschalen überarbeiten und wo nötig abschaf -\nfen. Die Grundkosten der Krankenhäuser und der integrierten medizinischen Versorgungszentren \nwerden wir angemessen finanzieren.']","Programme zur Förderung der Prävention und Krankheitsfrüherkennung sollen gefördert werden, um die besonderen gesundheitlichen Bedürfnisse verschiedener Altersgruppen und Geschlechter zu berücksichtigen. Dies ist Teil des Ziels, personalisierte Medizin zu erforschen und zugänglich zu machen. Die Förderung von Innovationen in der Gesundheitswirtschaft kann dazu beitragen, neue Therapieoptionen zu finden.","Wir werden darüber hinaus Programme in den Bereichen Prävention und Krankheitsfrüherkennung fördern, die die Besonderheiten verschiedener Altersgruppen und Geschlechter berücksichtigen.",0.6666666666666666,0.9477386472707238,0.49999999995,1.0
28,Welche Priorität wird dem Schutz der Patientendaten eingeräumt?,"['Das Zukunftsprogramm der SPD\nKapitel 2Seite >18\nSPD-Parteivorstand 2021Wir wollen Datenschutz gewährleisten und geeignete Rahmenbedingungen, damit nicht die\xa0gro-\nßen Plattformen auch die Gesundheitswirtschaft dominieren. Für uns ist aber klar,\xa0dass die Di-\ngitalisierung unser hervorragendes und engagiertes medizinisches, psychotherapeutisches und \npflegerisches Personal nicht ersetzen wird. Hinter guter medizinischer und psychotherapeutischer \nVersorgung und Pflege stehen immer Menschen. Damit vom Pfleger bis zur niedergelassenen \nÄrztin alle die digitale Transformation bewältigen können, sind flächendeckende Weiterbildungs- \nund\xa0Unterstützungsangebote unerlässlich.\xa0Wir wollen zudem dem Schutz der Patientendaten \nhöchste Priorität einräumen.\xa0\nEin leistungsfähiges Gesundheitssystem braucht eine stabile und solidarische\xa0Finanzierung. Steu-\nerzuschüsse und Investitionsmittel sollten mit klaren Zielvorgaben\xa0für die Reform des Systems \nverbunden werden. Wir werden eine Bürgerversicherung\xa0einführen. Das bedeutet: Gleich guter \nZugang zur medizinischen Versorgung für alle,\xa0eine solidarische Finanzierung und hohe Qualität \nder Leistungen. Gesundheit ist keine\xa0Ware, deshalb müssen in unserem Gesundheitssystem die \nBürger*innen im Mittelpunkt\xa0stehen. Der Staat muss deshalb sicherstellen, dass die Leistungen \nder\xa0Gesundheitsversorgung den Bedürfnissen derer entsprechen, die sie benötigen. Gute\xa0Arbeits-\nbedingungen und vernünftige Löhne in der Pflege sind dafür eine wichtige\xa0Grundlage.\xa0\nProfessionelle Pflege ist ein höchst anspruchsvoller Beruf.'
 'Wir wollen Hersteller darauf verpflichten, Softwareprodukte, digitale Dienste und technische \nGeräte so zu konzipieren, dass sie sicher sind (Security by Design) und dass sie bei den Standard-\neinstellungen die sicherste Variante wählen (Security by Default). Digitale Hintertüren sollen nicht \noffen gehalten werden.\nDas Recht auf informationelle Selbstbestimmung werden wir schützen. Die Datenschutzgrund-\nverordnung ist ein wichtiger Meilenstein und muss in ihrer Durchsetzung praxisnah verbessert \nwerden. Wir brauchen daher gut ausgestattete, effektiv arbeitende Datenschutzaufsichtsbehör -\nden. Privatheit und Datenschutz schaffen Vertrauen und sichern individuelle und kollektive Frei-\nheitsräume. Das Bundesverfassungsgericht hat geurteilt, dass „die Freiheitswahrnehmung der \nBürger“ durch die Summe der staatlichen Überwachungsmaßnahmen „nicht total erfasst und \nregistriert werden“ darf. Wir werden ein dauerhaftes, regelmäßiges und unabhängiges Monitoring \nder Gesetze im Sicherheitsbereich schaffen.\xa0\nDie anonyme und pseudonyme Nutzung des Netzes schützt viele Journalist*innen und Freiheits-\nkämpfer*innen in aller Welt vor Verfolgung und Bedrohung. Wir sind gegen eine Klarnamenpflicht \nim Netz und setzen uns weiterhin für die Möglichkeit einer anonymen und pseudonymen Nutzung \nein. Das ist eine wichtige Voraussetzung für eine freie Meinungsäußerung und der beste Schutz \nvor Diskriminierungen. Eine technisch sichere Ende-zu-Ende-Verschlüsselung ist für uns selbstver -\nständlich.'
 'Personalisierte Medizin bewirkt eine Veränderung im Verhältnis von \nBehandlung und Diagnostik. In der Zukunft wird es mehr Produkte geben, bei denen ein diagnos-\ntischer Test mit einem Medikament als Einheit angeboten wird. Diese Leistungen müssen allen \nBürger*innen zur Verfügung stehen - auch bei Medikamenten brauchen wir einen Sicherstellungs-\nauftrag.\nFrauen, Männer und Kinder haben besondere gesundheitliche Bedürfnisse, die bei ihrer\xa0Gesund-\nheitsversorgung und der Prävention berücksichtigt werden müssen. Doch die Gesundheitsfor -\nschung, Ausbildung und Versorgungspraxis orientieren sich zumeist an Daten von weißen, männli-\nchen erwachsenen Probanden– das werden wir ändern.\xa0Wir werden darüber hinaus Programme in \nden Bereichen Prävention und Krankheitsfrüherkennung fördern, die die Besonderheiten verschie-\ndener Altersgruppen und Geschlechter berücksichtigen.\nEine qualitativ hochwertige Gesundheitsversorgung kann am besten durch eine\xa0Neuordnung der \nRollenverteilung zwischen ambulantem und stationärem Sektor, durch\xa0eine Überwindung der Sek -\ntorengrenzen und eine gute Koordination und Kooperation der medizinischen, psychotherapeuti-\nschen und pflegerischen Berufe gelingen. Wir brauchen darum eine stärkere Öffnung von Kranken-\nhäusern für ambulante, teambasierte und interdisziplinäre Formen der Versorgung. \nDie Corona-Krise hat gezeigt: Der öffentliche Gesundheitsdienst braucht bessere\xa0Rahmenbedin-\ngungen, eine bessere Ausstattung, auch mit Blick auf die digitale\xa0Infrastruktur – Hardware eben-\nso wie Software, und eine konkurrenzfähige Vergütung.']","Dem Schutz der Patientendaten wird höchste Priorität eingeräumt, wie im Wahlprogramm der SPD festgelegt.",Wir wollen zudem dem Schutz der Patientendaten höchste Priorität einräumen.,0.5,0.9619450009738265,0.99999999995,1.0
29,Was ist das Ziel der Bürgerversicherung?,"['Wir werden eine Bürgerversicherung\xa0einführen. Das bedeutet: Gleich guter \nZugang zur medizinischen Versorgung für alle,\xa0eine solidarische Finanzierung und hohe Qualität \nder Leistungen. Gesundheit ist keine\xa0Ware, deshalb müssen in unserem Gesundheitssystem die \nBürger*innen im Mittelpunkt\xa0stehen. Der Staat muss deshalb sicherstellen, dass die Leistungen \nder\xa0Gesundheitsversorgung den Bedürfnissen derer entsprechen, die sie benötigen. Gute\xa0Arbeits-\nbedingungen und vernünftige Löhne in der Pflege sind dafür eine wichtige\xa0Grundlage.\xa0\nProfessionelle Pflege ist ein höchst anspruchsvoller Beruf. Gute Arbeitsbedingungen und ver -\nnünftige Löhne sind dafür eine wichtige Grundlage. Maßnahmen zur Überwindung\xa0des Personal-\nmangels dürfen nicht dazu führen, dass die Stellen in der Pflege abgewertet werden. Wir wollen \ndie Kommerzialisierung im Gesundheitswesen beenden, denn sie wirkt sich negativ auf die Ver -\nsorgung der Patient*innen und die Arbeitsbedingungen der Beschäftigten aus. Gewinne, die aus \nMitteln der Solidargemeinschaft erwirtschaftet werden, sollen verpflichtend und weitestgehend \nwieder in das Gesundheitssystem zurückfließen. Wir stärken die Kommunen bei der Einrichtung \nund beim Betreiben der integrierten medizinischen Versorgungszentren. Das System der Fallpau-\nschalen werden wir auf den Prüfstand stellen, die Pauschalen überarbeiten und wo nötig abschaf -\nfen. Die Grundkosten der Krankenhäuser und der integrierten medizinischen Versorgungszentren \nwerden wir angemessen finanzieren.'
 'Unser ist Ziel ist, dass deutlich\xa0mehr Beschäftigte in \neiner betrieblichen Altersversorgung abgesichert sind. Dabei\xa0sollten tarifvertraglich vereinbarte \nkollektive Altersversorgungsformen bevorzugt\xa0werden. Zudem setzen wir uns für die vollständi-\nge Abschaffung der Vollverbeitragung\xa0sowie\xa0 der Doppelverbeitragung von Betriebsrenten in der \ngesetzlichen\xa0Krankenversicherung ein.\xa0\nWir wollen allen gesetzlich verpflichtet Versicherten zusätzlich die Möglichkeit\xa0einräumen, sich \nin angemessenem Umfang ergänzend freiwillig in der gesetzlichen\xa0Rentenversicherung zu versi-\nchern.\nEine ergänzende private Altersvorsorge ist kein Ersatz für die gesetzliche Rente. Die\xa0bisherigen Er -\ngebnisse der Riester-Rente sind nicht zufriedenstellend. Wir wollen\xa0daher bei klassischen privaten \nAngeboten der Altersvorsorge bürokratische Hemmnisse\xa0abbauen und Kosten senken. Um den \nBürgerinnen und Bürgern eine attraktive private\xa0Altersvorsorge zu ermöglichen, setzen wir uns für \nein neues standardisiertes Angebot\xa0ein, das kostengünstig ist, digital und grenzüberschreitend \nund (nach schwedischem\xa0Vorbild) auch von einer öffentlichen Institution angeboten wird. Die För -\nderung neuer\xa0Verträge werden wir in Form von Zuschüssen auf untere und mittlere Einkommens-\ngruppen\xa0beschränken.'
 'Das Zukunftsprogramm der SPD\nKapitel 3Seite >30\nSPD-Parteivorstand 2021Wer Neues wagt, braucht Sicherheit. Die bestehende freiwillige Weiterversicherung in der Arbeits-\nlosenversicherung bietet ein solches Netz. Wir werden den Zugang verbessern und mehr Sicher -\nheit im Bedarfsfall schaffen. Die Regelungen für die ständigen und nicht ständig Beschäftigten \nzum Beispiel im Bereich des Films und der Theater werden wir deutlich vereinfachen und die \nsozialversicherungspflichtige Beschäftigung stärken und ausbauen. Wir werden eine grundsätz -\nliche Pflicht zur Altersvorsorge einführen und Selbständige schrittweise in die gesetzliche Renten-\nversicherung integrieren. Die Mindestbeiträge zur Krankenversicherung für Selbständige haben \nwir bereits um mehr als die Hälfte gesenkt. Unser Ziel sind einkommensabhängige Beiträge wie \nbei abhängig Beschäftigten.\nWir werden auch Solo-Selbständige besser absichern, deren Geschäftsmodell sie grundsätzlich \nträgt, wo jedoch unvorhersehbare erhebliche Einnahmeausfälle, etwa durch den kurzfristigen \nWegfall von Auftraggebern, zu Notlagen führt. Mit einem Sicherungsgeld schaffen wir einen \nneuen Weg der solidarischen Absicherung für Selbständige in Notlagen, die über branchen- und \nsaisonübliche Schwankungen hinausgehen, durch die Bundesagentur für Arbeit. Das Sicherungs-\ngeld soll mit Leistungen der Arbeitslosenversicherung vergleichbar sein. Das durch Beiträge der \nSelbständigen finanzierte Sicherungsgeld hat dabei Vorrang vor Leistungen der Grundsicherung.']","Das Ziel der Bürgerversicherung ist es, einen gleichberechtigten Zugang zur medizinischen Versorgung für alle Bürger zu gewährleisten, eine solidarische Finanzierung des Gesundheitssystems sicherzustellen und die Qualität der Leistungen zu verbessern.","Wir werden eine Bürgerversicherung einführen. Das bedeutet: Gleich guter Zugang zur medizinischen Versorgung für alle, eine solidarische Finanzierung und hohe Qualität der Leistungen.",1.0,1.0000000000000002,0.9999999999,1.0
30,Wie hoch sollen die öffentlichen Investitionen des Bundes pro Jahr sein?,"['Das Zukunftsprogramm der SPD\nKapitel 2Seite >19\nSPD-Parteivorstand 20212.5. Wie wir eine zukunftsfähige Wirtschaft  \nfördern wollen \nViele bahnbrechende Entwicklungen der vergangenen Jahrzehnte hätte es ohne eine aktive und \nvorausschauend handelnde Politik nicht gegeben. Die Politik muss die langen Linien und die Rich-\ntung beschreiben und sich als Innovationstreiber verstehen. Sie muss die für die Wettbewerbsfä-\nhigkeit und die nachhaltige Beschäftigung wesentlichen Ziele formulieren, auf die sich die Kräfte \nkonzentrieren sollen. Wir brauchen den Staat als strategischen Investor, als Ordnungs- und Gestal-\ntungskraft zur Bewältigung der Herausforderungen unserer Zeit. Staat und Verwaltung müssen \nzum Innovationstreiber werden und ihre Nachfragemacht einsetzen.\nDie Investitionen der öffentlichen Hand in wichtige Zukunftsfelder haben eine zentrale Bedeu-\ntung. Wir werden das, in dieser Legislaturperiode von uns durchgesetzte, hohe Investitionsniveau \ndes Bundes mit mindestens 50 Milliarden Euro pro Jahr weiter fortsetzen und zudem dazu bei-\ntragen, dass sich alle staatlichen Ebenen mit großer Investitionskraft beteiligen. Wir werden die \nUnterstützung von strukturschwachen Regionen durch die Gemeinschaftsaufgabe Verbesserung \nder regionalen Wirtschaftsstruktur (GRW) verstetigen. Ein zentraler Akteur beim Investitionsge-\nschehen sind die Kommunen – ihre Investitionskraft müssen wir erhalten und stärken. Gleichwer -\ntige Lebensverhältnisse zu sichern heißt auch: Soziale Dienstleistungen dürfen nicht abhängig von \nder finanziellen Leistungsfähigkeit der Kommune sein.'
 'In Deutschland werden gegenwärtig jährlich über 300 Milliarden Euro im Rahmen der öffentlichen \nAuftragsvergabe umgesetzt. Gerade die öffentliche Hand muss als große Abnehmerin von Produk -\nten und Dienstleistungen Verantwortung übernehmen. Wir werden die öffentliche Beschaffung \nso ausrichten, dass sie Innovationsimpulse setzt und den Zielen des sozial-ökologischen Wandels \ndient. Hierfür sollten die Vergabekriterien stärker auf Innovation, Tarifbindung, Geschlechterge-\nrechtigkeit und klimafreundliche Nachhaltigkeit ausgerichtet werden.\nProduktentwicklungen müssen sich auf den Staat als Nachfrager verlassen können. \nWir müssen besser darin werden, aus Ideen auch Produkte und Dienstleistungen zu machen und \nStart-ups zu fördern. Wir werden dabei die Erkenntnisse aus der Forschung schneller und breiter in \nInnovationen und Investitionen übersetzten. \nEine wichtige Rolle nimmt dabei die Kreditanstalt für Wiederaufbau (KfW) ein, die Mittel am Kapi-\ntalmarkt aufnimmt und diese zusammen mit den Förderbanken der Länder in strategisch wichtige \nZukunftsbranchen lenkt, die den sozial-ökologischen Umbau der Wirtschaft unterstützt und auch \nStart-ups fördert. Wir werden sie zu einer modernen Innovations- und Investitionsagentur weiter -\nentwickeln. \nWir stehen an der Seite der vielen Unternehmen, die ihre soziale, gesellschaftliche und ökolo-\ngische Verantwortung ernst nehmen. Das Handwerk ist der entscheidende Partner, damit die \nKlimawende vor Ort gelingt. Wir werden das Handwerk fördern, indem wir Gebühren für Techni-\nker*innen- und Meister*innenkurse abschaffen und uns für die Tarifbindung im Handwerk ein-\nsetzen.'
 'Zugleich werden wir Investi-\ntionen in Wärmenetze und Quartierskonzepte staatlich fördern. \nWir werden mit einer langfristig angelegten Industriestrategie Planungssicherheit für den sozial-\nökologischen Umbau unserer Wirtschaft schaffen. Diese Industriestrategie wird in Verbindung mit \ndem European Green Deal in eine gesamteuropäische Lösung eingebettet sein. \nDen Umstieg auf klimaschonende Produktionsprozesse werden wir durch direkte Investitionsför -\nderung staatlich unterstützen und die derzeitigen höheren Kosten von klimaschonenden Techno-\nlogien ausgleichen; klima- und umweltschädliche Subventionen werden wir abbauen. Wir werden \neinen Markt für umweltfreundliche Ausgangsmaterialien schaffen. Die öffentliche Hand als großer \nBauherr von Straßen und Gebäuden wird bis 2030 schrittweise immer mehr und ab 2030 aus-\nschließlich klimaneutrale Grundmaterialien für Bauten beschaffen. Wir werden unsere Industrien \nsichern und die Verlagerung von Produktion und Emissionen ins Ausland durch maßgeschneiderte \nInstrumente unattraktiver machen. Außerdem werden wir dafür sorgen, dass für Unternehmen, \ndie im internationalen Wettbewerb stehen, auch der Industriestrompreis wettbewerbsfähig ist.\nMit Ressourcen werden wir nicht länger verschwenderisch umgehen. Wir werden unsere Wirt -\nschaft zur Kreislaufwirtschaft umbauen. Die Menge an Abfall, die wir in Deutschland produzieren, \nmuss deutlich weniger werden. Neben dem Recycling werden wir ein Rohstoffsicherungskonzept \nerarbeiten, um eine sichere Lieferung der für die umweltfreundliche Produktion nötigen Rohstoffe \nzu gewährleisten.']","Die öffentlichen Investitionen des Bundes sollen mindestens 50 Milliarden Euro pro Jahr betragen, wie von der SPD in dieser Legislaturperiode vorgeschlagen.","Wir werden das, in dieser Legislaturperiode von uns durchgesetzte, hohe Investitionsniveau des Bundes mit mindestens 50 Milliarden Euro pro Jahr weiter fortsetzen.",0.5,0.9567550640402759,0.9999999999,1.0
31,"Welche Schritte sind geplant, um hoch verschuldete Kommunen zu entlasten?","['Dadurch können sich die Be-\nhörden und die Betroffenen in den ersten Monaten mit voller Energie auf eine sinnvolle Wieder -\naufnahme der Beschäftigung konzentrieren. Die guten Erfahrungen aus diesen vorübergehenden \nMaßnahmen haben uns darin bestätigt, dafür zu sorgen, dass auch in Zukunft Vermögen und \nWohnungsgröße innerhalb der ersten zwei Jahre nicht überprüft werden und das Schonvermögen \nerhöht wird. Das Bürgergeld beinhaltet Mitwirkungspflichten, setzt aber konsequent auf Hilfe und \nErmutigung. Eingliederungsvereinbarungen werden durch eine gemeinsame und auf Augenhöhe \nerarbeitete Teilhabevereinbarung ersetzt. Bei ihrer Umsetzung setzen wir auf Befähigung und Be-\nstärkung und nicht auf Vorgaben und Zwang. Sinnwidrige und unwürdige Sanktionen schaffen wir \nab. Das sozioökonomische und soziokulturelle Existenzminimum muss jederzeit gesichert sein.\nDie Leistungen des Sozialstaates sind soziale Rechte – wer sie benötigt, sollte nicht lange suchen \nmüssen. Unser Ziel ist es, die Leistungen ohne Hürden und Umwege zugänglich zu machen. Wir \nwollen einen Bürgerservice, der nach Lebenslagen berät und alle Leistungen aus einer Hand zu-\ngänglich macht. Er ist digital und aufsuchend, wo der Weg zu beschwerlich ist. Ein zugewandter \nSozialstaat hilft, Rechtsansprüche geltend zu machen, und begleitet auch danach beratend alle \nSchritte.'
 'Wir werden die \nUnterstützung von strukturschwachen Regionen durch die Gemeinschaftsaufgabe Verbesserung \nder regionalen Wirtschaftsstruktur (GRW) verstetigen. Ein zentraler Akteur beim Investitionsge-\nschehen sind die Kommunen – ihre Investitionskraft müssen wir erhalten und stärken. Gleichwer -\ntige Lebensverhältnisse zu sichern heißt auch: Soziale Dienstleistungen dürfen nicht abhängig von \nder finanziellen Leistungsfähigkeit der Kommune sein. Dazu brauchen wir flächendeckend starke \nund handlungsfähige Kommunen. Im Zuge der Corona-Pandemie haben wir bereits weitere Schrit -\nte getan, um Kommunen von Sozialausgaben zu entlasten. Ein nötiger Schritt ist, den besonders \nhoch verschuldeten Kommunen einmalig hohe Altschulden abzunehmen. Zudem werden wir das \nProblem der Altschulden vor allem ostdeutscher Wohnungsbaugesellschaften lösen.\nIn Deutschland werden gegenwärtig jährlich über 300 Milliarden Euro im Rahmen der öffentlichen \nAuftragsvergabe umgesetzt. Gerade die öffentliche Hand muss als große Abnehmerin von Produk -\nten und Dienstleistungen Verantwortung übernehmen. Wir werden die öffentliche Beschaffung \nso ausrichten, dass sie Innovationsimpulse setzt und den Zielen des sozial-ökologischen Wandels \ndient. Hierfür sollten die Vergabekriterien stärker auf Innovation, Tarifbindung, Geschlechterge-\nrechtigkeit und klimafreundliche Nachhaltigkeit ausgerichtet werden.\nProduktentwicklungen müssen sich auf den Staat als Nachfrager verlassen können. \nWir müssen besser darin werden, aus Ideen auch Produkte und Dienstleistungen zu machen und \nStart-ups zu fördern.'
 'Google, Amazon, Facebook und andere große Digitalunternehmen müssen einen angemesse-\nnen Beitrag zur Finanzierung des Gemeinwesens leisten. \nWir brauchen einen leistungsfähigen, sicheren und fairen Finanzmarkt, um den Wandel in eine \ndigitale und nachhaltige Wirtschaft finanzieren zu können. Er muss ordentlich reguliert und über -\nwacht werden. Wir werden sicherstellen, dass den Verbraucher*innen die Finanzierungsdienst -\nleistungen kostengünstig angeboten werden und Investitionen in  nachhaltige, klimafreundliche \nProdukte und Produktionsverfahren fördern. \nFür das Vertrauen in die Funktionstüchtigkeit und Sicherheit von Finanzmarktakteuren und \nFinanzprodukten ist es gerade für Kleinanleger*innen wichtig, dass sie eine unabhängige und an \nihren Interessen orientierte Beratung erhalten können. \nÜberschuldeten Privatpersonen werden wir besser aus einer nicht aus eigener Kraft überwindba-\nren finanziellen Not helfen. Die Schuldnerberatung werden wir stärken. Durch ausgeweitete vor -\nsorgende Beratungsmöglichkeiten soll der Weg in die Überschuldung am besten von vornherein \nvermieden werden.']","Die geplanten Schritte zur Entlastung hoch verschuldeter Kommunen beinhalten die einmalige Übernahme hoher Altschulden sowie die Stärkung der Investitionskraft der Kommunen, um gleichwertige Lebensverhältnisse sicherzustellen. Zudem sollen Kommunen von Sozialausgaben entlastet werden, um ihre finanzielle Leistungsfähigkeit zu verbessern.","Ein nötiger Schritt ist, den besonders hoch verschuldeten Kommunen einmalig hohe Altschulden abzunehmen.",0.8,0.9941166960791471,0.49999999995,1.0
32,Auf welche Kriterien sollten die Vergabekriterien für die öffentliche Beschaffung ausgerichtet werden?,"['In Deutschland werden gegenwärtig jährlich über 300 Milliarden Euro im Rahmen der öffentlichen \nAuftragsvergabe umgesetzt. Gerade die öffentliche Hand muss als große Abnehmerin von Produk -\nten und Dienstleistungen Verantwortung übernehmen. Wir werden die öffentliche Beschaffung \nso ausrichten, dass sie Innovationsimpulse setzt und den Zielen des sozial-ökologischen Wandels \ndient. Hierfür sollten die Vergabekriterien stärker auf Innovation, Tarifbindung, Geschlechterge-\nrechtigkeit und klimafreundliche Nachhaltigkeit ausgerichtet werden.\nProduktentwicklungen müssen sich auf den Staat als Nachfrager verlassen können. \nWir müssen besser darin werden, aus Ideen auch Produkte und Dienstleistungen zu machen und \nStart-ups zu fördern. Wir werden dabei die Erkenntnisse aus der Forschung schneller und breiter in \nInnovationen und Investitionen übersetzten. \nEine wichtige Rolle nimmt dabei die Kreditanstalt für Wiederaufbau (KfW) ein, die Mittel am Kapi-\ntalmarkt aufnimmt und diese zusammen mit den Förderbanken der Länder in strategisch wichtige \nZukunftsbranchen lenkt, die den sozial-ökologischen Umbau der Wirtschaft unterstützt und auch \nStart-ups fördert. Wir werden sie zu einer modernen Innovations- und Investitionsagentur weiter -\nentwickeln. \nWir stehen an der Seite der vielen Unternehmen, die ihre soziale, gesellschaftliche und ökolo-\ngische Verantwortung ernst nehmen. Das Handwerk ist der entscheidende Partner, damit die \nKlimawende vor Ort gelingt. Wir werden das Handwerk fördern, indem wir Gebühren für Techni-\nker*innen- und Meister*innenkurse abschaffen und uns für die Tarifbindung im Handwerk ein-\nsetzen.'
 'Wir werden die \nUnterstützung von strukturschwachen Regionen durch die Gemeinschaftsaufgabe Verbesserung \nder regionalen Wirtschaftsstruktur (GRW) verstetigen. Ein zentraler Akteur beim Investitionsge-\nschehen sind die Kommunen – ihre Investitionskraft müssen wir erhalten und stärken. Gleichwer -\ntige Lebensverhältnisse zu sichern heißt auch: Soziale Dienstleistungen dürfen nicht abhängig von \nder finanziellen Leistungsfähigkeit der Kommune sein. Dazu brauchen wir flächendeckend starke \nund handlungsfähige Kommunen. Im Zuge der Corona-Pandemie haben wir bereits weitere Schrit -\nte getan, um Kommunen von Sozialausgaben zu entlasten. Ein nötiger Schritt ist, den besonders \nhoch verschuldeten Kommunen einmalig hohe Altschulden abzunehmen. Zudem werden wir das \nProblem der Altschulden vor allem ostdeutscher Wohnungsbaugesellschaften lösen.\nIn Deutschland werden gegenwärtig jährlich über 300 Milliarden Euro im Rahmen der öffentlichen \nAuftragsvergabe umgesetzt. Gerade die öffentliche Hand muss als große Abnehmerin von Produk -\nten und Dienstleistungen Verantwortung übernehmen. Wir werden die öffentliche Beschaffung \nso ausrichten, dass sie Innovationsimpulse setzt und den Zielen des sozial-ökologischen Wandels \ndient. Hierfür sollten die Vergabekriterien stärker auf Innovation, Tarifbindung, Geschlechterge-\nrechtigkeit und klimafreundliche Nachhaltigkeit ausgerichtet werden.\nProduktentwicklungen müssen sich auf den Staat als Nachfrager verlassen können. \nWir müssen besser darin werden, aus Ideen auch Produkte und Dienstleistungen zu machen und \nStart-ups zu fördern.'
 'Wir \nbrauchen eine Modernisierungsoffensive für den öffentlichen Dienst und eine bessere Zusammen-\narbeit der Verwaltung. In die Entwicklung, Umsetzung und Evaluation von Projekten wollen wir \nwissenschaftliche und wirtschaftliche Expertise, Verbände und die Zivilgesellschaft einbinden und \ndas Parlament in seiner Kontrollfunktion stärken.\nDie demokratische Gestaltung des digitalen Wandels, die alle Lebensbereiche umfasst, alle gesell-\nschaftlichen, wirtschaftlichen und politischen Felder und Ebenen, ist ein Beispiel für die Überfor -\nderung herkömmlicher Organisationsformen mit den Aufgaben unserer Zeit.\nZum nachhaltigen Regieren gehört, dass Regierungsvorhaben, Projekte und Gesetze in ihrer Um-\nsetzung kommunikativ begleitet werden. Außerdem muss die Umsetzung in den zuständigen \nVerwaltungseinheiten, durch hinreichende Personalausstattung und geeignete Fortbildungsmaß-\nnahmen sichergestellt werden.\nDie Prinzipien offenen Regierungshandelns - Transparenz, Partizipation und Zusammenarbeit - \nsind für uns handlungsleitend. Wir werden die Nationalen Aktionspläne im Rahmen der Open \nGovernment Partnership Deutschlands umsetzen und weiterentwickeln.\nWir werden die Erfahrungen mit Bürgerräten aufgreifen und es uns zur Aufgabe machen, neue \nWege der unmittelbaren Beteiligung an staatlichen Entscheidungen zu gehen. Durch eine syste-\nmatische und frühzeitige Beteiligung der Bürger*innen an staatlichen Projekten können Rechtswe-\nge verkürzt und Verfahren beschleunigt werden.\nDas Informationsfreiheitsrecht werden wir zu einem wirksamen Transparenzrecht weiterentwi-\nckeln und ausbauen. Wir werden öffentliche Daten und Informationen kostenlos und diskrimi-\nnierungsfrei bereitstellen.']","Die Vergabekriterien sollten auf Innovation, Tarifbindung, Geschlechtergerechtigkeit und klimafreundliche Nachhaltigkeit ausgerichtet werden.","Hierfür sollten die Vergabekriterien stärker auf Innovation, Tarifbindung, Geschlechtergerechtigkeit und klimafreundliche Nachhaltigkeit ausgerichtet werden.",1.0,0.9734254271805708,0.99999999995,1.0
33,Wie sollen mehr Unternehmensgründungen angeregt werden?,"['Das Zukunftsprogramm der SPD\nKapitel 2Seite >20\nSPD-Parteivorstand 2021Start-up-Unternehmen sind wichtige Wachstumsmotoren für die Wirtschaft. Wir wollen Deutsch-\nland zu einem führenden Start-up-Standort Europas machen, und so hochwertige Arbeitsplätze in \nden Regionen schaffen. Um mehr Unternehmensgründungen anzuregen und mittelständischen \nUnternehmen eine sinnvolle Nachfolgeplanung zu ermöglichen, setzen wir auf drei Kernpunkte: \nOrganisatorische Unterstützung wie One-Stop-Agenturen für Gründer*innen, erleichterter Zugang \nzu Kapital durch Projektförderung sowie öffentliche Fonds für Wagniskapital und eine “Kultur der \nzweiten Chance”, auch im Insolvenzrecht. Existenzgründungen von Frauen und in der Fläche wer -\nden wir mit eigenen Programmen gezielt fördern. \nWir wollen Unternehmen unterstützen, für die der Sinn ihrer wirtschaftlichen Aktivität und der \nlangfristige Bestand ihres Unternehmens wichtiger sind als der kurzfristige Gewinn. Dazu werden \nwir eine nationale Strategie für die Förderung gemeinwohlorientierter Unternehmen und sozialer \nInnovationen entwickeln. Die rechtlichen Rahmenbedingungen für gemeinwohlorientiertes Wirt -\nschaften, wie zum Beispiel für Genossenschaften, Sozialunternehmen, Integrationsunternehmen \nund Unternehmen in Verantwortungseigentum, werden wir verbessern.'
 'Existenzgründungen von Frauen und in der Fläche wer -\nden wir mit eigenen Programmen gezielt fördern. \nWir wollen Unternehmen unterstützen, für die der Sinn ihrer wirtschaftlichen Aktivität und der \nlangfristige Bestand ihres Unternehmens wichtiger sind als der kurzfristige Gewinn. Dazu werden \nwir eine nationale Strategie für die Förderung gemeinwohlorientierter Unternehmen und sozialer \nInnovationen entwickeln. Die rechtlichen Rahmenbedingungen für gemeinwohlorientiertes Wirt -\nschaften, wie zum Beispiel für Genossenschaften, Sozialunternehmen, Integrationsunternehmen \nund Unternehmen in Verantwortungseigentum, werden wir verbessern. Für die Förderung einer \nsozialökologischen und digitalen Transformation unserer Wirtschaft gibt es bereits dezentrale \nStrukturen – wir wollen sie zu Transformationszentren als Werkstätten des Wandels bündeln und \nweiterentwickeln, die sich sowohl an etablierte Unternehmen als auch an Sozialunternehmen \nund nicht-exit-orientierte Start-ups sowie an Beschäftigte, Gewerkschaften und Zivilgesellschaft \nrichten. \nSolidarität werden wir weiterhin den Wirtschaftsbereichen zukommen lassen, die in der Corona-\nPandemie zugunsten der Gesundheit aller besondere Einbußen hinnehmen mussten. Das gilt für \ndie Kulturwirtschaft, ebenso für die Tourismuswirtschaft, inklusive des Hotel- und Gaststätten-\nwesens, die nach der Pandemie andere sein werden als zuvor. Viel stärker als bisher wird sich der \nFokus auf den inländischen Tourismus richten. Darin steckt eine Chance, diesen zentralen Wirt -\nschaftszweig nachhaltig, klimabewusst und modern auszurichten.'
 'Wir werden die Rahmenbedingen auf den Märkten \nfür Kultur- und Kreativwirtschaft so gestalten, dass entsprechende Geschäfts- und Erlösmodelle \ngestärkt werden.\xa0\nWir verbessern die Filmförderung durch die Filmförderanstalt (FFA), sichern mit der Novelle des \nFilmfördergesetzes die Einnahmebasis des Filmschaffenden, unterstützen die internationale \nAusstrahlung deutscher Filme, bewahren das Filmerbe und gestalten die Entscheidungsgremien \neffizienter. Wir wollen die Produktion von audiovisuellen Inhalten am Standort Deutschland \nfördern, um so zukunftsfähige Arbeitsplätze zu erhalten und neue zu schaffen. Eine nachhaltige \nFinanzierungsbasis der Kinoförderung ist nötig, um Kinos erfolgreich in die Zukunft zu führen und \nihre regionale Präsenz als Kulturorte sicherzustellen. Wir werden Zukunftskonzepte für die Filmför -\nderung mit der Film-Community entwickeln.\xa0\nGames sind Kulturgut, Innovationsmotor und Wirtschaftsfaktor. Die Potentiale von Games in der \ndigitalen Bildung aber auch von eSports in Vereinen und Schulen werden jedoch noch unzurei-\nchend genutzt. Die Förderung von Computerspielen wollen wir darum dauerhaft verankern. Wir \nwerden die Entwicklung von eSports in Deutschland weiter unterstützen, beispielsweise dadurch, \ndass er gemeinnützig wird. Wir werden allen Bürger*innen den Zugang zu Kunst und Kultur er -\nmöglichen, unabhängig von Herkunft, Bildung, sozialer Lage und finanziellen Mittel. Wir werden \nuns darum kümmern, dass sich Kultureinrichtungen weiter öffnen können. Wir werden die Vielfalt \nin den kulturellen Einrichtungen stärken.']","Mehr Unternehmensgründungen sollen durch organisatorische Unterstützung wie One-Stop-Agenturen, erleichterten Zugang zu Kapital durch Projektförderung und öffentliche Fonds für Wagniskapital sowie eine Kultur der zweiten Chance im Insolvenzrecht angeregt werden. Existenzgründungen von Frauen und in ländlichen Gebieten werden gezielt gefördert, und eine nationale Strategie für gemeinwohlorientierte Unternehmen und soziale Innovationen wird entwickelt. Die rechtlichen Rahmenbedingungen für gemeinwohlorientiertes Wirtschaften, wie Genossenschaften und Sozialunternehmen, sollen verbessert werden.","Um mehr Unternehmensgründungen anzuregen und mittelständischen Unternehmen eine sinnvolle Nachfolgeplanung zu ermöglichen, setzen wir auf drei Kernpunkte: Organisatorische Unterstützung wie One-Stop-Agenturen für Gründer*innen, erleichterter Zugang zu Kapital durch Projektförderung sowie öffentliche Fonds für Wagniskapital und eine “Kultur der zweiten Chance”, auch im Insolvenzrecht.",1.0,0.9999999999999992,0.9999999999,1.0
34,Welche Wirtschaftsbereiche sollen nach der Pandemie weiterhin Unterstützung erhalten?,"['Nehmen wir die Gestaltung des digitalen Wandels als demokratische Gesellschaft selbst in die \nHand oder bleibt es dabei, dass die Entwicklung der digitalen Welt von wenigen Technologiekon-\nzernen diktiert wird?\xa0\nSorgen wir für gleiche Teilhabe und mehr Zusammenhalt? Oder nehmen wir es hin, dass unsere \nGesellschaft immer weiter auseinanderdriftet, so dass Populisten und Nationalisten leichtes Spiel \nhaben?\xa0\nDas neue Jahrzehnt beginnt mit der Herausforderung der Corona-Pandemie. Für viele Bürger*in-\nnen und Unternehmen bedeutet diese Krise harte Einschränkungen. Umso bemerkenswerter ist \ndie Bereitschaft, Solidarität zu üben, um uns alle zu schützen und dafür auch Einschnitte in die \npersönliche Freiheit zu akzeptieren.\xa0\nDie nächsten Monate werden uns die Rückkehr in eine neue Normalität ermöglichen, die die Be-\nschränkungen des öffentlichen und des privaten Lebens Zug um Zug überwindet. Doch auch dann \nwird uns Corona noch begleiten. Vieles wird anders. Die Erfahrung dieser Krise wird sich ins kollek -\ntive Gedächtnis einschreiben.\xa0\nWir alle haben erfahren, dass nichts eine persönliche Begegnung auf Dauer ersetzen kann. Wir ha-\nben aber auch gelernt, wie wir digital zusammenarbeiten und kommunizieren können. Außerdem \nhaben mittlerweile alle erkannt, wie unabdingbar die Arbeit vieler Menschen für unser tägliches \nLeben und Überleben ist, die aber bisher nicht die Wertschätzung und schon gar nicht die Bezah-\nlung und Sicherheit bekommen, die sie verdienen. Es hat sich eindringlich bestätigt, dass Familien \nauf eine krisenfeste, verlässliche Infrastruktur an Bildung, Betreuung und Angeboten der Kinder- \nund Jugendarbeit angewiesen sind.'
 'Das Zukunftsprogramm der SPD\nKapitel 3Seite >38\nSPD-Parteivorstand 2021Die Corona-Pandemie verstärkt die Strukturveränderungen in unseren Innenstädten und Stadt -\nteilzentren. Das betrifft den Einzelhandel, die Gastronomie und das Hotelgewerbe ebenso wie \nMuseen, Theater, Büchereien und Kinos. Die gemeinsam mit den Ländern getragene Städtebau-\nförderung sichern wir ab. Wir unterstützen die Städte dabei, die Innenstädte lebendig zu halten \nund notwendige Nutzungsänderungen mitgestalten zu können, unter anderem durch eine Miet -\npreisbegrenzung, einen Mieterschutz im Gewerbeimmobilienbereich, durch Konzepte zur Re-\nvitalisierung von Standorten und die Förderung von Co-Working-Spaces in den Innenstädten. Ein \nbesonderes Augenmerk werden wir auf die Entwicklung im ländlichen Raum legen. Wir werden \ngenerationenübergreifende, alternative und barrierefreie Wohnform en in Städten und Quartieren \nfördern.'
 'Deutschland ist wie kaum ein anderes Land auf offene Märkte und eine funktionsfähige sowie \nregelbasierte globale Wirtschaft angewiesen. Unser Ziel ist es ein stabiles, faires und demokrati-\nsches Handelssystem zu etablieren. \nWir werden die Instrumente der Handels- und Investitionspolitik modernisieren – vor allem mit \nBlick auf Nachhaltigkeit und die Durchsetzung gemeinsamer multilateraler Regeln – und uns für \neine Stärkung der Welthandelsorganisation (WTO) einsetzen. Hierfür werden wir das Regelwerk \nerweitern, die Nachhaltigkeitsziele der Vereinten Nationen einbeziehen sowie die Durchsetzungs-\nmöglichkeiten verbessern. Alle Instanzen des WTO-Streitschlichtungsmechanismus sollen wieder \nbeschlussfähig sein. Deshalb ist eine starke WTO mit einem modernen Regelwerk, das die nachhal-\ntigen Entwicklungsbedürfnisse des Globalen Südens ebenso wie die des Nordens fair und partner -\nschaftlich anerkennt und fördert, so wichtig.\nViele Länder befanden sich schon vor der Corona-Pandemie in einer Schuldenkrise, die jetzt noch \nvergrößert wird. Zentrale Säulen der Entwicklungsfinanzierung sind zusammengebrochen und \nFinanzströme ausgetrocknet. Das kurzfristige Aussetzen des Schuldendienstes im Rahmen der \nG20 und des IWF brachte Erleichterung. Wir unterstützen eine Initiative für ein globales Staatenin-\nsolvenzverfahren, das staatliche und vor allem private Gläubiger miteinbezieht und das Schulden-\nerlasse für besonders gefährdete Ländergruppen formuliert und umsetzt.\nDie friedenspolitischen Herausforderungen nehmen zu.']","Die Wirtschaftsbereiche, die nach der Pandemie weiterhin Unterstützung erhalten sollen, sind der Einzelhandel, die Gastronomie, das Hotelgewerbe, Museen, Theater, Bühne, Bibliotheken und Kinos. Es wird auch eine Förderung von Co-Working-Spaces in den Innenstädten angestrebt.","Solidarität werden wir weiterhin den Wirtschaftsbereichen zukommen lassen, die in der Corona-Pandemie zugunsten der Gesundheit aller besondere Einbußen hinnehmen mussten. Das gilt für die Kulturwirtschaft, ebenso für die Tourismuswirtschaft, inklusive des Hotel- und Gaststättenwesens.",0.8888888888888888,0.9999991912056534,0.99999999995,1.0
35,Welche Zukunftstechnologien sollen in Deutschland gefördert werden?,"['Wir sehen in dieser Jahrhundertaufgabe riesige Potenziale für \ngute und sichere Arbeitsplätze. Deutschland ist erfolgreich als Exporteur umweltfreundlicher Tech-\nnologien, weil es gelungen ist, Produktionsprozesse nachhaltig und die 20er zu einem Jahrzehnt \nder erneuerbaren Energien zu machen.\xa0\nDen sozial-ökologischen Umbau der Wirtschaft meistern wir, wenn wir wirtschaftlichen Erfolg zu-\nkünftig nicht nur am Bruttoinlandsprodukt messen, sondern am Wohlergehen der gesamten Ge-\nsellschaft und der Natur. Wir richten unsere Politik an den Nachhaltigkeitszielen der Vereinten Na-\ntionen (SDG) aus und werden dazu die Deutsche Nachhaltigkeitsstrategie weiterentwickeln.\xa0Wenn \nder Staat maßgebliche Impulse gibt, durch kluge Spielregeln, die soziale und technische Innovatio-\nnen hervorbringen, durch Förderung von Wissenschaft und Forschung, durch massive und stetige \nInvestitionen in eine moderne Infrastruktur, durch aktive Förderung der Regionen im Wandel und \ndurch Beteiligung der Bürger*innen im Allgemeinen und der Beschäftigten im Besonderen. So wer -\nden Arbeitsplätze zukunftsfähig und neue gute Arbeitsplätze geschaffen. So sichern wir Einkom-\nmen und Perspektiven für alle. Wir wollen einen neuen sozial-ökologischen Gesellschaftsvertrag, \nder dafür sorgt, dass im Wandel niemand abgehängt wird.'
 'Das Zukunftsprogramm der SPD\nKapitel 2Seite >21\nSPD-Parteivorstand 20212.6. Wie wir Wissenschaft und Forschung innovativ  \nund  zukunftsfähig halten\nUm auch in Zukunft innovativ zu bleiben, werden wir die Stärken des deutschen Wissenschafts-\nsystems in seiner ganzen Breite und Vielfalt und seiner internationalen Ausrichtung erhalten und \nweiterentwickeln. Dazu fördern wir Zukunftstechnologien wie zum Beispiel Quantentechnik, \nKünstliche Intelligenz, Alternativverfahren und Wasserstoff an vielen Orten im Land. Für den per -\nspektivischen Ausstieg aus den Tierversuchen werden wir eine Gesamtplanung aufsetzen und die \nEntwicklung von tierversuchsfreien Verfahren stärker fördern.\nWir werden die Universitäten und Fachhochschulen dabei unterstützen, die Digitalisierung voran-\nzutreiben, Innovationen in guter Lehre fördern und zugleich ihre forschungspolitische Bedeutung, \ndie weit in die jeweiligen Regionen ausstrahlt, stärken. Um aktuelle und kommende gesellschaft -\nliche Herausforderungen zu meistern, braucht es neben technischen auch kulturelle und soziale \nInnovationen. Daher werden wir die geistes-, sozial-, und kulturwissenschaftliche Forschung ge-\nzielt fördern. Die Exzellenzstrategie entwickeln wir weiter und ergänzen sie um die Unterstützung \nregionaler Kooperationen von Hochschulen und Forschungseinrichtungen. Das wird auch dazu bei-\ntragen, dass die ausgezeichnete Forschungslandschaft, die die ostdeutschen Länder in den vergan-\ngenen Jahrzehnten aufgebaut haben, ihr Exzellenzpotential weiter entfalten kann, insbesondere \nin Bezug auf die Erforschung innovativer Technologien. \nGute Wissenschaft braucht gute Arbeitsbedingungen.'
 'Für uns geht es um die Bewältigung von Zukunftsaufgaben.\nDaher benennen wir vier Zukunftsmissionen, die für uns eine zentrale Bedeutung haben. Das gilt \nfür den Kampf gegen den Klimawandel, für die Zukunft der Mobilität, für die Digitalisierung und \nfür das Gesundheitssystem. Wir werden diese vier Zukunftsmissionen anpacken, um die Wirt -\nschaft zu modernisieren, High-Tech in den Schlüsselbranchen zu fördern, unsere Lebensgrundla-\ngen zu erhalten und die Arbeitsplätze der Zukunft zu schaffen.\nDie Umsetzung dieser Missionen braucht ein hohes Niveau öffentlicher Investitionen und eine \nsozial-ökologisch ausgerichtete Wirtschafts- und Finanzpolitik. Wir werden diese Missionen im Zu-\nsammenwirken mit Gewerkschaften, Wissenschaft, Wirtschaft und Zivilgesellschaft voranbringen \nund den klimafreundlichen Infrastrukturausbau auf Grundlage eines neuen, gesamtgesellschaft -\nlichen Infrastrukturkonsenses gestalten. Darin zeigt sich unser Anspruch eines modernen und \nkooperativen Regierens.\n2.1. Zukunftsmission I.  \nKlimaneutrales Deutschland\nDen Klimawandel zu stoppen, ist eine Menschheitsaufgabe. Unsere Politik richtet sich nach dem \nKlimaabkommen von Paris: Wir müssen die globale Erderwärmung auf möglichst 1,5 Grad Celsius \nbegrenzen. Darum haben wir uns zum Ziel gesetzt, in Deutschland bis spätestens 2045 komplett \nklimaneutral zu sein. Mit dem Klimaschutzgesetz haben wir dafür gesorgt, dass das Klimaab -\nkommen konkret wird: Es bietet einen wirkungsvollen Kontrollmechanismus zur Erreichung der \nKlimaziele.']","Die Zukunftstechnologien, die in Deutschland gefördert werden sollen, umfassen Quantentechnik, Künstliche Intelligenz, Alternativverfahren, Wasserstoff und erneuerbare Energien. Die Förderung dieser Technologien ist Teil eines umfassenden Plans zur Modernisierung der Wirtschaft und Schaffung zukunftsfähiger Arbeitsplätze. Die Politik zielt darauf ab, die Wissenschaft und Forschung zu unterstützen, um Innovationen voranzutreiben und gesellschaftliche Herausforderungen zu bewältigen.","Dazu fördern wir Zukunftstechnologien wie zum Beispiel Quantentechnik, Künstliche Intelligenz, Alternativverfahren und Wasserstoff an vielen Orten im Land.",0.9090909090909091,0.9999999999999994,0.99999999995,1.0
36,Wie soll der Ausstieg aus Tierversuchen gelingen?,"['Wir werden im Lebensmittelhandel unfairen Handels-\npraktiken einen Riegel vorschieben, denn sie schaden Verbraucher*innen, Landwirt*innen und fair \nhandelnden Wettbewerbern. Wir setzen uns für anständige Löhne und gute Arbeitsbedingungen \nder Beschäftigten in Land- und Fortwirtschaft ein. Wanderarbeiter*innen in Saisonbetrieben der \nLandwirtschaft sind unverzichtbar für die Sicherung der Lebensmittelversorgung. Prekäre Arbeits- \nund Lebensbedingungen von Wanderarbeitnehmer*innen werden wir bekämpfen.\xa0\nDer Boden, als wichtigstes Gut in der Landwirtschaft, steht den selbst wirtschaftenden Betrieben \nvor Ort zu. Er darf kein Spekulationsobjekt sein. Wir werden ihn vor Investoren ohne Agrarbezug \nschützen. \nTierleid ist nicht zu rechtfertigen, auch nicht aus wirtschaftlichem Interesse. In der Nutztierhal-\ntung setzen wir konsequent auf die Verbesserung des Tierwohls bei Einführung einer flächenbezo-\ngenen Obergrenze. Den Antibiotikaeinsatz werden wir reduzieren. Wir werden für die Einführung \neines verpflichtenden staatlichen Tierwohllabels mit nachvollziehbaren Regeln sorgen und den \nTransport von lebenden Tieren auf acht Stunden begrenzen.\nFür immer mehr Menschen ist die Qualität der Nahrungserzeugung und ihre Wirkung auf Umwelt \nund Klima relevant. Unser Ziel ist es, gesunde und nachhaltige Ernährung für alle zu ermöglichen. \nWir wollen in staatlich finanzierten Einrichtungen eine den Standards der Deutschen Gesellschaft \nfür Ernährung entsprechende gesundheitsfördernde Gemeinschaftsverpflegung umsetzen.'
 'Darin zeigt sich unser Anspruch eines modernen und \nkooperativen Regierens.\n2.1. Zukunftsmission I.  \nKlimaneutrales Deutschland\nDen Klimawandel zu stoppen, ist eine Menschheitsaufgabe. Unsere Politik richtet sich nach dem \nKlimaabkommen von Paris: Wir müssen die globale Erderwärmung auf möglichst 1,5 Grad Celsius \nbegrenzen. Darum haben wir uns zum Ziel gesetzt, in Deutschland bis spätestens 2045 komplett \nklimaneutral zu sein. Mit dem Klimaschutzgesetz haben wir dafür gesorgt, dass das Klimaab -\nkommen konkret wird: Es bietet einen wirkungsvollen Kontrollmechanismus zur Erreichung der \nKlimaziele. Dementsprechend werden wir im Einklang mit den europäischen Klimazielen unser \nMinderungsziel für 2030 deutlich (auf 65 %) anheben; auch für 2040 werden wir ein Minderungs-\nziel festschreiben (88 %).\nEs kommt jetzt darauf an, die Ziele in praktische Politik umzusetzen. Der Ausstieg aus der Atom-\nenergie ist Ende nächsten Jahres bereits vollzogen. Auch der Kohleausstieg ist beschlossene Sache. \nDabei gilt, je schneller der Ausbau der Stromerzeugung aus erneuerbaren Energien erfolgt und je \nschneller die nötigen Stromleitungen und Verteilnetze gebaut werden, desto eher kann auf fossile \nEnergieträger verzichtet werden. Wir haben in dieser Wahlperiode den Ausstieg aufs Gleis gesetzt \nund ihn mit umfassenden Strukturhilfen verbunden, die wir zügig umsetzen wollen. Das sind his-\ntorische Entscheidungen.'
 'Es kommt jetzt darauf an, die Ziele in praktische Politik umzusetzen. Der Ausstieg aus der Atom-\nenergie ist Ende nächsten Jahres bereits vollzogen. Auch der Kohleausstieg ist beschlossene Sache. \nDabei gilt, je schneller der Ausbau der Stromerzeugung aus erneuerbaren Energien erfolgt und je \nschneller die nötigen Stromleitungen und Verteilnetze gebaut werden, desto eher kann auf fossile \nEnergieträger verzichtet werden. Wir haben in dieser Wahlperiode den Ausstieg aufs Gleis gesetzt \nund ihn mit umfassenden Strukturhilfen verbunden, die wir zügig umsetzen wollen. Das sind his-\ntorische Entscheidungen. Unser Arbeitsmarkt hat eine starke industrielle Basis, die aus dem Um-\nbau noch stärker hervorgehen kann – wenn wir gezielt in Infrastruktur und Innovationen investie-\nren. So wird unsere Zukunftsmission „klimaneutrales Deutschland“ zum Jobmotor. Auch werden \nwir – nicht nur im Rahmen unserer Klimapolitik – die Grundlagen dafür schaffen, dass alle bei der \nBewältigung des Klimawandels mit anpacken können, alle von den Chancen profitieren und nicht \ndiejenigen das Nachsehen haben, die den geringsten Einfluss auf ihre CO2-Bilanz haben.']",Der Ausstieg aus Tierversuchen soll durch die Verbesserung des Tierwohls in der Nutztierhaltung und die Reduzierung des Antibiotikaeinsatzes erfolgen. Es wird ein verpflichtendes staatliches Tierwohllabel eingeführt und der Transport von lebenden Tieren auf acht Stunden begrenzt.,Für den perspektivischen Ausstieg aus den Tierversuchen werden wir eine Gesamtplanung aufsetzen und die Entwicklung von tierversuchsfreien Verfahren stärker fördern.,0.5,0.9921311563709919,0.0,0.0
37,Wie sollen die Arbeitsbedingungen in der Wissenschaft verbessert werden?,"['Wir werden uns für verlässliche Karrierewe-\nge und weniger Befristungen in der Wissenschaft einsetzen. Wir wollen, dass Promovierende für \nihre tatsächliche Arbeitszeit bezahlt werden, unabhängig vom Fach. Es muss gelten: 100 Prozent \nGehalt für 100 Prozent Arbeit. Wir werden für eine deutlich bessere Vereinbarkeit von Familie und \nBeruf sorgen, neue, dauerhafte Beschäftigungsmöglichkeiten unterhalb der Professur schaffen \nund den Tenure-Track ausweiten.\nWir haben den Zielwert gesamtstaatlicher, also öffentlicher und privater Ausgaben für Forschung \nund Entwicklung, von drei Prozent des BIP bereits in den letzten Jahren übertroffen und wollen ihn \nweiter auf mindestens 3,5 Prozent steigern. Wir werden dazu die Innovationsförderung aufsto-\ncken, die Forschung in die mittelständische Praxis mit Partnerschafts- und Kooperationsförderun-\ngen vorantreiben und die Förder- und Kreditprogramme für den Mittelstand im Bereich Umwelt-, \nKlima- und Ressourcenschutz ausbauen. Kleine und mittlere Unternehmen (KMU) werden einen \nniederschwelligen Zugang zu Fördermitteln erhalten. \nEine besondere Bedeutung kommt dem Austausch von wissenschaftlichen Erkenntnissen mit der \nGesellschaft zu. Wir werden deshalb mehr Fördergelder für Open Science und Wissenschaftskom-\nmunikation bereithalten.\nDamit Europa im internationalen technologischen Wettbewerb bestehen und seine Souveränität \nbehaupten kann, werden wir in der Europäischen Union gemeinsam weiter geschlossen voran-\ngehen. Wir setzen uns für ein neu geordnetes Wettbewerbs- und Beihilferecht ein, das Wettbe-\nwerbsnachteile gegenüber anderen großen Wirtschaftsräumen verringert.'
 'Um aktuelle und kommende gesellschaft -\nliche Herausforderungen zu meistern, braucht es neben technischen auch kulturelle und soziale \nInnovationen. Daher werden wir die geistes-, sozial-, und kulturwissenschaftliche Forschung ge-\nzielt fördern. Die Exzellenzstrategie entwickeln wir weiter und ergänzen sie um die Unterstützung \nregionaler Kooperationen von Hochschulen und Forschungseinrichtungen. Das wird auch dazu bei-\ntragen, dass die ausgezeichnete Forschungslandschaft, die die ostdeutschen Länder in den vergan-\ngenen Jahrzehnten aufgebaut haben, ihr Exzellenzpotential weiter entfalten kann, insbesondere \nin Bezug auf die Erforschung innovativer Technologien. \nGute Wissenschaft braucht gute Arbeitsbedingungen. Wir werden uns für verlässliche Karrierewe-\nge und weniger Befristungen in der Wissenschaft einsetzen. Wir wollen, dass Promovierende für \nihre tatsächliche Arbeitszeit bezahlt werden, unabhängig vom Fach. Es muss gelten: 100 Prozent \nGehalt für 100 Prozent Arbeit. Wir werden für eine deutlich bessere Vereinbarkeit von Familie und \nBeruf sorgen, neue, dauerhafte Beschäftigungsmöglichkeiten unterhalb der Professur schaffen \nund den Tenure-Track ausweiten.\nWir haben den Zielwert gesamtstaatlicher, also öffentlicher und privater Ausgaben für Forschung \nund Entwicklung, von drei Prozent des BIP bereits in den letzten Jahren übertroffen und wollen ihn \nweiter auf mindestens 3,5 Prozent steigern.'
 'Das Zukunftsprogramm der SPD\nKapitel 2Seite >21\nSPD-Parteivorstand 20212.6. Wie wir Wissenschaft und Forschung innovativ  \nund  zukunftsfähig halten\nUm auch in Zukunft innovativ zu bleiben, werden wir die Stärken des deutschen Wissenschafts-\nsystems in seiner ganzen Breite und Vielfalt und seiner internationalen Ausrichtung erhalten und \nweiterentwickeln. Dazu fördern wir Zukunftstechnologien wie zum Beispiel Quantentechnik, \nKünstliche Intelligenz, Alternativverfahren und Wasserstoff an vielen Orten im Land. Für den per -\nspektivischen Ausstieg aus den Tierversuchen werden wir eine Gesamtplanung aufsetzen und die \nEntwicklung von tierversuchsfreien Verfahren stärker fördern.\nWir werden die Universitäten und Fachhochschulen dabei unterstützen, die Digitalisierung voran-\nzutreiben, Innovationen in guter Lehre fördern und zugleich ihre forschungspolitische Bedeutung, \ndie weit in die jeweiligen Regionen ausstrahlt, stärken. Um aktuelle und kommende gesellschaft -\nliche Herausforderungen zu meistern, braucht es neben technischen auch kulturelle und soziale \nInnovationen. Daher werden wir die geistes-, sozial-, und kulturwissenschaftliche Forschung ge-\nzielt fördern. Die Exzellenzstrategie entwickeln wir weiter und ergänzen sie um die Unterstützung \nregionaler Kooperationen von Hochschulen und Forschungseinrichtungen. Das wird auch dazu bei-\ntragen, dass die ausgezeichnete Forschungslandschaft, die die ostdeutschen Länder in den vergan-\ngenen Jahrzehnten aufgebaut haben, ihr Exzellenzpotential weiter entfalten kann, insbesondere \nin Bezug auf die Erforschung innovativer Technologien. \nGute Wissenschaft braucht gute Arbeitsbedingungen.']","Die Arbeitsbedingungen in der Wissenschaft sollen verbessert werden, indem verlässliche Karrierewege geschaffen und Befristungen reduziert werden. Zudem soll Promovierenden für ihre tatsächliche Arbeitszeit bezahlt werden, unabhängig vom Fach, um eine bessere Vereinbarkeit von Familie und Beruf zu gewährleisten. Es wird angestrebt, die Ausgaben für Forschung und Entwicklung auf mindestens 3,5 Prozent des BIP zu erhöhen.",Gute Wissenschaft braucht gute Arbeitsbedingungen. Wir werden uns für verlässliche Karrierewege und weniger Befristungen in der Wissenschaft einsetzen.,1.0,0.9999999999999997,0.9999999999666667,1.0
38,Wie soll die Steuervermeidung großer Unternehmen eingedämmt werden?,"['Gleich-\nzeitig wird es hohe persönliche Freibeträge geben, so dass sich die Steuerbelastung auf besonders \nvermögende Teile der Bevölkerung konzentriert. Wir stellen sicher, dass mit der Vermögenssteuer \nkeine Arbeitsplätze gefährdet werden. Die Grundlage von Betrieben wird bei der Vermögenssteuer \nverschont. \nDie Erbschaftssteuer ist reformbedürftig. In ihrer gegenwärtigen Form ist sie ungerecht, da sie ver -\nmögende Unternehmenserben bevorzugt. Mit einer effektiven Mindestbesteuerung werden wir \ndie Überprivilegierung großer Betriebsvermögen abschaffen. Auch für vermögenshaltende Fami-\nlienstiftungen werden wir eine Mindestbesteuerung einführen. \nWir werden eine Finanztransaktionssteuer einführen, möglichst im Einklang mit unseren europäi-\nschen Partnern. Zugleich werden wir die von uns maßgeblich mit unterstützten internationalen \nVerhandlungen zur Einführung einer effektiven Mindestbesteuerung und einer fairen Besteuerung \nso genannter Digitalunternehmen zum Abschluss bringen und in Deutschland und Europa umset -\nzen. Google, Amazon, Facebook und andere große Digitalunternehmen müssen einen angemesse-\nnen Beitrag zur Finanzierung des Gemeinwesens leisten. \nWir brauchen einen leistungsfähigen, sicheren und fairen Finanzmarkt, um den Wandel in eine \ndigitale und nachhaltige Wirtschaft finanzieren zu können. Er muss ordentlich reguliert und über -\nwacht werden. Wir werden sicherstellen, dass den Verbraucher*innen die Finanzierungsdienst -\nleistungen kostengünstig angeboten werden und Investitionen in  nachhaltige, klimafreundliche \nProdukte und Produktionsverfahren fördern.'
 'Für bestehende Ehen werden wir zudem ein \nWahlrecht einführen.\nDie steuerliche Abzugsfähigkeit von Manager*innengehältern werden wir begrenzen, und zwar \nauf das 15-fache des Durchschnittseinkommens der Beschäftigten in dem Betrieb, in dem die \n Manager*in beschäftigt ist. \nBislang gilt bei förderwürdigen Aufwendungen wie zum Beispiel Spenden: Je höher das Einkom-\nmen, desto höher die Steuerrückerstattung. Zukünftig soll jede*r eine einkommensunabhängige \nSteuerminderung erhalten. \nWir wollen die Vermögensteuer wieder in Kraft setzen, auch um die Finanzkraft der Länder für \nwichtige Zukunftsaufgaben zu verbessern. Wer sehr viel Vermögen hat, muss einen größeren Bei-\ntrag zur Finanzierung unseres Gemeinwesens leisten. Deshalb werden wir unter anderem einen \nmaßvollen, einheitlichen Steuersatz von einem Prozent für sehr hohe Vermögen einführen. Gleich-\nzeitig wird es hohe persönliche Freibeträge geben, so dass sich die Steuerbelastung auf besonders \nvermögende Teile der Bevölkerung konzentriert. Wir stellen sicher, dass mit der Vermögenssteuer \nkeine Arbeitsplätze gefährdet werden. Die Grundlage von Betrieben wird bei der Vermögenssteuer \nverschont. \nDie Erbschaftssteuer ist reformbedürftig. In ihrer gegenwärtigen Form ist sie ungerecht, da sie ver -\nmögende Unternehmenserben bevorzugt. Mit einer effektiven Mindestbesteuerung werden wir \ndie Überprivilegierung großer Betriebsvermögen abschaffen. Auch für vermögenshaltende Fami-\nlienstiftungen werden wir eine Mindestbesteuerung einführen.'
 'Die öffentliche Transparenz ist ein gutes Mittel, um \nUnternehmen in die Pflicht zu nehmen. Wir werden Steuervermeidung mit einem öffentlichen \nReporting großer, international agierender Unternehmen eindämmen (Public Country-by-Country-\nReporting). \nDie Besteuerung von Einkommen werden wir gerechter gestalten. Das aktuelle Steuersystem \nnimmt gerade mittlere Einkommen zu stark in Anspruch. Die finanziellen Lasten der Krisenbewäl-\ntigung dürfen für die ohnehin stark strapazierte große Mehrheit der Bürger*innen nicht zu einer \nsteuerlichen Mehrbelastung führen. Im Gegenteil: Wir wollen die Steuern für die Mehrheit senken. \nWir werden eine Einkommensteuerreform vornehmen, die kleine und mittlere Einkommen besser -\nstellt, die Kaufkraft stärkt und dafür im Gegenzug die oberen fünf Prozent stärker für die Finanzie-\nrung der wichtigen öffentlichen Aufgaben heranzieht.\nFür diejenigen, die besonders viel verdienen, halten wir zudem an dem Aufschlag von drei Pro-\nzentpunkten zur Einkommensteuer fest. Er soll künftig bei Verheirateten für den zu versteuernden \nEinkommensanteil oberhalb von 500.000 Euro im Jahr, bei Ledigen ab 250.000 Euro im Jahr gelten.\nWir wollen die Bemessungsgrenze zur Erhebung der Beiträge zur gesetzlichen Kranken-, Pflege-, \nRenten- und Arbeitslosenversicherung regelmäßig anpassen. \nDen Solidaritätszuschlag haben wir für die allermeisten Bürger*innen abgeschafft. Die Einnahmen \naus dem verbliebenen Solidaritätszuschlag, den nur noch die Spitzenverdiener*innen zahlen, wer -\nden wir weiter brauchen. Er ist ein gerechter Beitrag zu einem stabilen Gemeinwesen, das allen \nnutzt.']","Die Steuervermeidung großer Unternehmen soll durch die Einführung einer Finanztransaktionssteuer und einer angemessenen Besteuerung von Digitalunternehmen wie Google, Amazon und Facebook eingedämmt werden. Zudem wird betont, dass der Finanzmarkt ordentlich reguliert und überwacht werden muss, um den Wandel in eine digitale und nachhaltige Wirtschaft zu finanzieren.","Wir werden Steuervermeidung mit einem öffentlichen Reporting großer, international agierender Unternehmen eindämmen (Public Country-by-Country-Reporting).",0.8,1.0,0.3333333333,1.0
39,Wie soll die Besteuerung von Einkommen gerechter gestaltet werden?,"['Die gerechte Verteilung von Einkommen und Vermögen ist eine Grundvorausset -\nzung für den Zusammenhalt unserer Gesellschaft. Die extrem ungleiche Verteilung von Einkom-\nmen und Vermögen ist nicht nur sozialpolitisch bedenklich, sie ist auch ökonomisch unvernünftig. \nDie hohe und weiterwachsende Konzentration des Vermögens auf einige Hochvermögende ver -\nhindert nachhaltiges Wachstum und verschenkt wertvolle Potenziale. \nWir werden der Steuergerechtigkeit Geltung verschaffen – Steuerhinterziehung ist kein Kavaliers-\ndelikt. Gegen Steuerhinterziehung, Steuervermeidung und Steuerbetrug werden wir konsequent \nvorgehen. Wir haben grenzüberschreitende Steuergestaltungsmodelle der Anzeigepflicht unter -\nworfen und werden eine nationale Anzeigepflicht einführen. Wir werden die Umgehung der \nGrunderwerbsteuer (Share Deals) beenden. Der Umsatzsteuerbetrug bei Karussellgeschäften auf \neuropäischer Ebene muss beendet werden. Die öffentliche Transparenz ist ein gutes Mittel, um \nUnternehmen in die Pflicht zu nehmen. Wir werden Steuervermeidung mit einem öffentlichen \nReporting großer, international agierender Unternehmen eindämmen (Public Country-by-Country-\nReporting). \nDie Besteuerung von Einkommen werden wir gerechter gestalten. Das aktuelle Steuersystem \nnimmt gerade mittlere Einkommen zu stark in Anspruch. Die finanziellen Lasten der Krisenbewäl-\ntigung dürfen für die ohnehin stark strapazierte große Mehrheit der Bürger*innen nicht zu einer \nsteuerlichen Mehrbelastung führen. Im Gegenteil: Wir wollen die Steuern für die Mehrheit senken.'
 'Gleich-\nzeitig wird es hohe persönliche Freibeträge geben, so dass sich die Steuerbelastung auf besonders \nvermögende Teile der Bevölkerung konzentriert. Wir stellen sicher, dass mit der Vermögenssteuer \nkeine Arbeitsplätze gefährdet werden. Die Grundlage von Betrieben wird bei der Vermögenssteuer \nverschont. \nDie Erbschaftssteuer ist reformbedürftig. In ihrer gegenwärtigen Form ist sie ungerecht, da sie ver -\nmögende Unternehmenserben bevorzugt. Mit einer effektiven Mindestbesteuerung werden wir \ndie Überprivilegierung großer Betriebsvermögen abschaffen. Auch für vermögenshaltende Fami-\nlienstiftungen werden wir eine Mindestbesteuerung einführen. \nWir werden eine Finanztransaktionssteuer einführen, möglichst im Einklang mit unseren europäi-\nschen Partnern. Zugleich werden wir die von uns maßgeblich mit unterstützten internationalen \nVerhandlungen zur Einführung einer effektiven Mindestbesteuerung und einer fairen Besteuerung \nso genannter Digitalunternehmen zum Abschluss bringen und in Deutschland und Europa umset -\nzen. Google, Amazon, Facebook und andere große Digitalunternehmen müssen einen angemesse-\nnen Beitrag zur Finanzierung des Gemeinwesens leisten. \nWir brauchen einen leistungsfähigen, sicheren und fairen Finanzmarkt, um den Wandel in eine \ndigitale und nachhaltige Wirtschaft finanzieren zu können. Er muss ordentlich reguliert und über -\nwacht werden. Wir werden sicherstellen, dass den Verbraucher*innen die Finanzierungsdienst -\nleistungen kostengünstig angeboten werden und Investitionen in  nachhaltige, klimafreundliche \nProdukte und Produktionsverfahren fördern.'
 'Für bestehende Ehen werden wir zudem ein \nWahlrecht einführen.\nDie steuerliche Abzugsfähigkeit von Manager*innengehältern werden wir begrenzen, und zwar \nauf das 15-fache des Durchschnittseinkommens der Beschäftigten in dem Betrieb, in dem die \n Manager*in beschäftigt ist. \nBislang gilt bei förderwürdigen Aufwendungen wie zum Beispiel Spenden: Je höher das Einkom-\nmen, desto höher die Steuerrückerstattung. Zukünftig soll jede*r eine einkommensunabhängige \nSteuerminderung erhalten. \nWir wollen die Vermögensteuer wieder in Kraft setzen, auch um die Finanzkraft der Länder für \nwichtige Zukunftsaufgaben zu verbessern. Wer sehr viel Vermögen hat, muss einen größeren Bei-\ntrag zur Finanzierung unseres Gemeinwesens leisten. Deshalb werden wir unter anderem einen \nmaßvollen, einheitlichen Steuersatz von einem Prozent für sehr hohe Vermögen einführen. Gleich-\nzeitig wird es hohe persönliche Freibeträge geben, so dass sich die Steuerbelastung auf besonders \nvermögende Teile der Bevölkerung konzentriert. Wir stellen sicher, dass mit der Vermögenssteuer \nkeine Arbeitsplätze gefährdet werden. Die Grundlage von Betrieben wird bei der Vermögenssteuer \nverschont. \nDie Erbschaftssteuer ist reformbedürftig. In ihrer gegenwärtigen Form ist sie ungerecht, da sie ver -\nmögende Unternehmenserben bevorzugt. Mit einer effektiven Mindestbesteuerung werden wir \ndie Überprivilegierung großer Betriebsvermögen abschaffen. Auch für vermögenshaltende Fami-\nlienstiftungen werden wir eine Mindestbesteuerung einführen.']","Die Besteuerung von Einkommen soll gerechter gestaltet werden, indem die finanziellen Lasten der Krisenbewältigung nicht zu einer Mehrbelastung für die Mehrheit der Bürger*innen führen und die Steuern für die Mehrheit gesenkt werden. Es wird angestrebt, die Steuerlast auf besonders vermögende Teile der Bevölkerung zu konzentrieren und die Besteuerung von Einkommen insgesamt gerechter zu gestalten. Es werden Maßnahmen ergriffen, um die Steuergerechtigkeit zu fördern und gegen Steuerhinterziehung, Steuervermeidung und Steuerbetrug vorzugehen.","Wir werden eine Einkommensteuerreform vornehmen, die kleine und mittlere Einkommen besserstellt, die Kaufkraft stärkt und dafür im Gegenzug die oberen fünf Prozent stärker für die Finanzierung der wichtigen öffentlichen Aufgaben heranzieht.",1.0,0.9999999999999997,0.8333333332916666,1.0
40,Wie soll sich die Einkommensteuer für Spitzenverdiener*innen ändern?,"['Das Zukunftsprogramm der SPD\nKapitel 2Seite >23\nSPD-Parteivorstand 2021Das geltende Steuerrecht befördert die klassische Arbeitsteilung zwischen Männern und Frauen. \nDas werden wir ändern und das Steuerrecht stärker auf Partnerschaftlichkeit ausrichten sowie \ndie Steuerlast bei unterschiedlich hohen Einkommen zwischen den Eheleuten gerecht verteilen. \nDas Ehegattensplitting bildet die gesellschaftliche Realität nicht mehr ab und schließt viele Haus-\nhalte mit Kindern von dem gewährten Steuervorteil aus. Nutznießer sind stattdessen vor allem \nAlleinverdiener-Ehepaare mit hohen Einkommen unabhängig von der Kinderzahl. Wir werden das \nEhegattensplitting für neu geschlossene Ehen ändern. Die allermeisten Haushalte mit Kindern \nwerden durch die Kindergrundsicherung finanziell bessergestellt werden. Normalverdienende \nauch ohne Kinder werden keine Einbußen erleiden. Für bestehende Ehen werden wir zudem ein \nWahlrecht einführen.\nDie steuerliche Abzugsfähigkeit von Manager*innengehältern werden wir begrenzen, und zwar \nauf das 15-fache des Durchschnittseinkommens der Beschäftigten in dem Betrieb, in dem die \n Manager*in beschäftigt ist. \nBislang gilt bei förderwürdigen Aufwendungen wie zum Beispiel Spenden: Je höher das Einkom-\nmen, desto höher die Steuerrückerstattung. Zukünftig soll jede*r eine einkommensunabhängige \nSteuerminderung erhalten. \nWir wollen die Vermögensteuer wieder in Kraft setzen, auch um die Finanzkraft der Länder für \nwichtige Zukunftsaufgaben zu verbessern.'
 'Für bestehende Ehen werden wir zudem ein \nWahlrecht einführen.\nDie steuerliche Abzugsfähigkeit von Manager*innengehältern werden wir begrenzen, und zwar \nauf das 15-fache des Durchschnittseinkommens der Beschäftigten in dem Betrieb, in dem die \n Manager*in beschäftigt ist. \nBislang gilt bei förderwürdigen Aufwendungen wie zum Beispiel Spenden: Je höher das Einkom-\nmen, desto höher die Steuerrückerstattung. Zukünftig soll jede*r eine einkommensunabhängige \nSteuerminderung erhalten. \nWir wollen die Vermögensteuer wieder in Kraft setzen, auch um die Finanzkraft der Länder für \nwichtige Zukunftsaufgaben zu verbessern. Wer sehr viel Vermögen hat, muss einen größeren Bei-\ntrag zur Finanzierung unseres Gemeinwesens leisten. Deshalb werden wir unter anderem einen \nmaßvollen, einheitlichen Steuersatz von einem Prozent für sehr hohe Vermögen einführen. Gleich-\nzeitig wird es hohe persönliche Freibeträge geben, so dass sich die Steuerbelastung auf besonders \nvermögende Teile der Bevölkerung konzentriert. Wir stellen sicher, dass mit der Vermögenssteuer \nkeine Arbeitsplätze gefährdet werden. Die Grundlage von Betrieben wird bei der Vermögenssteuer \nverschont. \nDie Erbschaftssteuer ist reformbedürftig. In ihrer gegenwärtigen Form ist sie ungerecht, da sie ver -\nmögende Unternehmenserben bevorzugt. Mit einer effektiven Mindestbesteuerung werden wir \ndie Überprivilegierung großer Betriebsvermögen abschaffen. Auch für vermögenshaltende Fami-\nlienstiftungen werden wir eine Mindestbesteuerung einführen.'
 'Gleich-\nzeitig wird es hohe persönliche Freibeträge geben, so dass sich die Steuerbelastung auf besonders \nvermögende Teile der Bevölkerung konzentriert. Wir stellen sicher, dass mit der Vermögenssteuer \nkeine Arbeitsplätze gefährdet werden. Die Grundlage von Betrieben wird bei der Vermögenssteuer \nverschont. \nDie Erbschaftssteuer ist reformbedürftig. In ihrer gegenwärtigen Form ist sie ungerecht, da sie ver -\nmögende Unternehmenserben bevorzugt. Mit einer effektiven Mindestbesteuerung werden wir \ndie Überprivilegierung großer Betriebsvermögen abschaffen. Auch für vermögenshaltende Fami-\nlienstiftungen werden wir eine Mindestbesteuerung einführen. \nWir werden eine Finanztransaktionssteuer einführen, möglichst im Einklang mit unseren europäi-\nschen Partnern. Zugleich werden wir die von uns maßgeblich mit unterstützten internationalen \nVerhandlungen zur Einführung einer effektiven Mindestbesteuerung und einer fairen Besteuerung \nso genannter Digitalunternehmen zum Abschluss bringen und in Deutschland und Europa umset -\nzen. Google, Amazon, Facebook und andere große Digitalunternehmen müssen einen angemesse-\nnen Beitrag zur Finanzierung des Gemeinwesens leisten. \nWir brauchen einen leistungsfähigen, sicheren und fairen Finanzmarkt, um den Wandel in eine \ndigitale und nachhaltige Wirtschaft finanzieren zu können. Er muss ordentlich reguliert und über -\nwacht werden. Wir werden sicherstellen, dass den Verbraucher*innen die Finanzierungsdienst -\nleistungen kostengünstig angeboten werden und Investitionen in  nachhaltige, klimafreundliche \nProdukte und Produktionsverfahren fördern.']","Die Einkommensteuer für Spitzenverdiener*innen soll begrenzt werden, indem die steuerliche Abzugsfähigkeit von Manager*innengehältern auf das 15-fache des Durchschnittseinkommens begrenzt wird. Zudem soll eine einkommensunabhängige Steuerminderung für alle eingeführt werden.","Für diejenigen, die besonders viel verdienen, halten wir zudem an dem Aufschlag von drei Prozentpunkten zur Einkommensteuer fest. Er soll künftig bei Verheirateten für den zu versteuernden Einkommensanteil oberhalb von 500.000 Euro im Jahr, bei Ledigen ab 250.000 Euro im Jahr gelten.",0.6666666666666666,0.9688546263953546,0.9999999999,0.0
41,Wie soll das Steuerrecht geändert werden?,"['Für bestehende Ehen werden wir zudem ein \nWahlrecht einführen.\nDie steuerliche Abzugsfähigkeit von Manager*innengehältern werden wir begrenzen, und zwar \nauf das 15-fache des Durchschnittseinkommens der Beschäftigten in dem Betrieb, in dem die \n Manager*in beschäftigt ist. \nBislang gilt bei förderwürdigen Aufwendungen wie zum Beispiel Spenden: Je höher das Einkom-\nmen, desto höher die Steuerrückerstattung. Zukünftig soll jede*r eine einkommensunabhängige \nSteuerminderung erhalten. \nWir wollen die Vermögensteuer wieder in Kraft setzen, auch um die Finanzkraft der Länder für \nwichtige Zukunftsaufgaben zu verbessern. Wer sehr viel Vermögen hat, muss einen größeren Bei-\ntrag zur Finanzierung unseres Gemeinwesens leisten. Deshalb werden wir unter anderem einen \nmaßvollen, einheitlichen Steuersatz von einem Prozent für sehr hohe Vermögen einführen. Gleich-\nzeitig wird es hohe persönliche Freibeträge geben, so dass sich die Steuerbelastung auf besonders \nvermögende Teile der Bevölkerung konzentriert. Wir stellen sicher, dass mit der Vermögenssteuer \nkeine Arbeitsplätze gefährdet werden. Die Grundlage von Betrieben wird bei der Vermögenssteuer \nverschont. \nDie Erbschaftssteuer ist reformbedürftig. In ihrer gegenwärtigen Form ist sie ungerecht, da sie ver -\nmögende Unternehmenserben bevorzugt. Mit einer effektiven Mindestbesteuerung werden wir \ndie Überprivilegierung großer Betriebsvermögen abschaffen. Auch für vermögenshaltende Fami-\nlienstiftungen werden wir eine Mindestbesteuerung einführen.'
 'Das Zukunftsprogramm der SPD\nKapitel 2Seite >23\nSPD-Parteivorstand 2021Das geltende Steuerrecht befördert die klassische Arbeitsteilung zwischen Männern und Frauen. \nDas werden wir ändern und das Steuerrecht stärker auf Partnerschaftlichkeit ausrichten sowie \ndie Steuerlast bei unterschiedlich hohen Einkommen zwischen den Eheleuten gerecht verteilen. \nDas Ehegattensplitting bildet die gesellschaftliche Realität nicht mehr ab und schließt viele Haus-\nhalte mit Kindern von dem gewährten Steuervorteil aus. Nutznießer sind stattdessen vor allem \nAlleinverdiener-Ehepaare mit hohen Einkommen unabhängig von der Kinderzahl. Wir werden das \nEhegattensplitting für neu geschlossene Ehen ändern. Die allermeisten Haushalte mit Kindern \nwerden durch die Kindergrundsicherung finanziell bessergestellt werden. Normalverdienende \nauch ohne Kinder werden keine Einbußen erleiden. Für bestehende Ehen werden wir zudem ein \nWahlrecht einführen.\nDie steuerliche Abzugsfähigkeit von Manager*innengehältern werden wir begrenzen, und zwar \nauf das 15-fache des Durchschnittseinkommens der Beschäftigten in dem Betrieb, in dem die \n Manager*in beschäftigt ist. \nBislang gilt bei förderwürdigen Aufwendungen wie zum Beispiel Spenden: Je höher das Einkom-\nmen, desto höher die Steuerrückerstattung. Zukünftig soll jede*r eine einkommensunabhängige \nSteuerminderung erhalten. \nWir wollen die Vermögensteuer wieder in Kraft setzen, auch um die Finanzkraft der Länder für \nwichtige Zukunftsaufgaben zu verbessern.'
 'Gleich-\nzeitig wird es hohe persönliche Freibeträge geben, so dass sich die Steuerbelastung auf besonders \nvermögende Teile der Bevölkerung konzentriert. Wir stellen sicher, dass mit der Vermögenssteuer \nkeine Arbeitsplätze gefährdet werden. Die Grundlage von Betrieben wird bei der Vermögenssteuer \nverschont. \nDie Erbschaftssteuer ist reformbedürftig. In ihrer gegenwärtigen Form ist sie ungerecht, da sie ver -\nmögende Unternehmenserben bevorzugt. Mit einer effektiven Mindestbesteuerung werden wir \ndie Überprivilegierung großer Betriebsvermögen abschaffen. Auch für vermögenshaltende Fami-\nlienstiftungen werden wir eine Mindestbesteuerung einführen. \nWir werden eine Finanztransaktionssteuer einführen, möglichst im Einklang mit unseren europäi-\nschen Partnern. Zugleich werden wir die von uns maßgeblich mit unterstützten internationalen \nVerhandlungen zur Einführung einer effektiven Mindestbesteuerung und einer fairen Besteuerung \nso genannter Digitalunternehmen zum Abschluss bringen und in Deutschland und Europa umset -\nzen. Google, Amazon, Facebook und andere große Digitalunternehmen müssen einen angemesse-\nnen Beitrag zur Finanzierung des Gemeinwesens leisten. \nWir brauchen einen leistungsfähigen, sicheren und fairen Finanzmarkt, um den Wandel in eine \ndigitale und nachhaltige Wirtschaft finanzieren zu können. Er muss ordentlich reguliert und über -\nwacht werden. Wir werden sicherstellen, dass den Verbraucher*innen die Finanzierungsdienst -\nleistungen kostengünstig angeboten werden und Investitionen in  nachhaltige, klimafreundliche \nProdukte und Produktionsverfahren fördern.']","Das Steuerrecht soll geändert werden, indem die steuerliche Abzugsfähigkeit von Managergehältern begrenzt wird, eine einkommensunabhängige Steuerminderung für förderwürdige Aufwendungen eingeführt wird und die Vermögensteuer mit einem maßvollen Steuersatz für sehr hohe Vermögen wieder eingeführt wird.",Das geltende Steuerrecht befördert die klassische Arbeitsteilung zwischen Männern und Frauen. Das werden wir ändern und das Steuerrecht stärker auf Partnerschaftlichkeit ausrichten sowie die Steuerlast bei unterschiedlich hohen Einkommen zwischen den Eheleuten gerecht verteilen.,1.0,1.0000000000000007,0.49999999995,1.0
42,Soll auf hohe Vermögen wieder eine Steuer erhoben werden?,"['Für bestehende Ehen werden wir zudem ein \nWahlrecht einführen.\nDie steuerliche Abzugsfähigkeit von Manager*innengehältern werden wir begrenzen, und zwar \nauf das 15-fache des Durchschnittseinkommens der Beschäftigten in dem Betrieb, in dem die \n Manager*in beschäftigt ist. \nBislang gilt bei förderwürdigen Aufwendungen wie zum Beispiel Spenden: Je höher das Einkom-\nmen, desto höher die Steuerrückerstattung. Zukünftig soll jede*r eine einkommensunabhängige \nSteuerminderung erhalten. \nWir wollen die Vermögensteuer wieder in Kraft setzen, auch um die Finanzkraft der Länder für \nwichtige Zukunftsaufgaben zu verbessern. Wer sehr viel Vermögen hat, muss einen größeren Bei-\ntrag zur Finanzierung unseres Gemeinwesens leisten. Deshalb werden wir unter anderem einen \nmaßvollen, einheitlichen Steuersatz von einem Prozent für sehr hohe Vermögen einführen. Gleich-\nzeitig wird es hohe persönliche Freibeträge geben, so dass sich die Steuerbelastung auf besonders \nvermögende Teile der Bevölkerung konzentriert. Wir stellen sicher, dass mit der Vermögenssteuer \nkeine Arbeitsplätze gefährdet werden. Die Grundlage von Betrieben wird bei der Vermögenssteuer \nverschont. \nDie Erbschaftssteuer ist reformbedürftig. In ihrer gegenwärtigen Form ist sie ungerecht, da sie ver -\nmögende Unternehmenserben bevorzugt. Mit einer effektiven Mindestbesteuerung werden wir \ndie Überprivilegierung großer Betriebsvermögen abschaffen. Auch für vermögenshaltende Fami-\nlienstiftungen werden wir eine Mindestbesteuerung einführen.'
 'Gleich-\nzeitig wird es hohe persönliche Freibeträge geben, so dass sich die Steuerbelastung auf besonders \nvermögende Teile der Bevölkerung konzentriert. Wir stellen sicher, dass mit der Vermögenssteuer \nkeine Arbeitsplätze gefährdet werden. Die Grundlage von Betrieben wird bei der Vermögenssteuer \nverschont. \nDie Erbschaftssteuer ist reformbedürftig. In ihrer gegenwärtigen Form ist sie ungerecht, da sie ver -\nmögende Unternehmenserben bevorzugt. Mit einer effektiven Mindestbesteuerung werden wir \ndie Überprivilegierung großer Betriebsvermögen abschaffen. Auch für vermögenshaltende Fami-\nlienstiftungen werden wir eine Mindestbesteuerung einführen. \nWir werden eine Finanztransaktionssteuer einführen, möglichst im Einklang mit unseren europäi-\nschen Partnern. Zugleich werden wir die von uns maßgeblich mit unterstützten internationalen \nVerhandlungen zur Einführung einer effektiven Mindestbesteuerung und einer fairen Besteuerung \nso genannter Digitalunternehmen zum Abschluss bringen und in Deutschland und Europa umset -\nzen. Google, Amazon, Facebook und andere große Digitalunternehmen müssen einen angemesse-\nnen Beitrag zur Finanzierung des Gemeinwesens leisten. \nWir brauchen einen leistungsfähigen, sicheren und fairen Finanzmarkt, um den Wandel in eine \ndigitale und nachhaltige Wirtschaft finanzieren zu können. Er muss ordentlich reguliert und über -\nwacht werden. Wir werden sicherstellen, dass den Verbraucher*innen die Finanzierungsdienst -\nleistungen kostengünstig angeboten werden und Investitionen in  nachhaltige, klimafreundliche \nProdukte und Produktionsverfahren fördern.'
 'Das Zukunftsprogramm der SPD\nKapitel 2Seite >23\nSPD-Parteivorstand 2021Das geltende Steuerrecht befördert die klassische Arbeitsteilung zwischen Männern und Frauen. \nDas werden wir ändern und das Steuerrecht stärker auf Partnerschaftlichkeit ausrichten sowie \ndie Steuerlast bei unterschiedlich hohen Einkommen zwischen den Eheleuten gerecht verteilen. \nDas Ehegattensplitting bildet die gesellschaftliche Realität nicht mehr ab und schließt viele Haus-\nhalte mit Kindern von dem gewährten Steuervorteil aus. Nutznießer sind stattdessen vor allem \nAlleinverdiener-Ehepaare mit hohen Einkommen unabhängig von der Kinderzahl. Wir werden das \nEhegattensplitting für neu geschlossene Ehen ändern. Die allermeisten Haushalte mit Kindern \nwerden durch die Kindergrundsicherung finanziell bessergestellt werden. Normalverdienende \nauch ohne Kinder werden keine Einbußen erleiden. Für bestehende Ehen werden wir zudem ein \nWahlrecht einführen.\nDie steuerliche Abzugsfähigkeit von Manager*innengehältern werden wir begrenzen, und zwar \nauf das 15-fache des Durchschnittseinkommens der Beschäftigten in dem Betrieb, in dem die \n Manager*in beschäftigt ist. \nBislang gilt bei förderwürdigen Aufwendungen wie zum Beispiel Spenden: Je höher das Einkom-\nmen, desto höher die Steuerrückerstattung. Zukünftig soll jede*r eine einkommensunabhängige \nSteuerminderung erhalten. \nWir wollen die Vermögensteuer wieder in Kraft setzen, auch um die Finanzkraft der Länder für \nwichtige Zukunftsaufgaben zu verbessern.']","Ja, die Partei plant die Wiedereinführung der Vermögensteuer mit einem maßvollen Steuersatz für sehr hohe Vermögen.","Wir wollen die Vermögensteuer wieder in Kraft setzen, auch um die Finanzkraft der Länder für wichtige Zukunftsaufgaben zu verbessern. Wer sehr viel Vermögen hat, muss einen größeren Beitrag zur Finanzierung unseres Gemeinwesens leisten.",0.75,0.8931337124114975,0.9999999999666667,1.0
43,Wie soll die Erbschaftssteuer reformiert werden?,"['Für bestehende Ehen werden wir zudem ein \nWahlrecht einführen.\nDie steuerliche Abzugsfähigkeit von Manager*innengehältern werden wir begrenzen, und zwar \nauf das 15-fache des Durchschnittseinkommens der Beschäftigten in dem Betrieb, in dem die \n Manager*in beschäftigt ist. \nBislang gilt bei förderwürdigen Aufwendungen wie zum Beispiel Spenden: Je höher das Einkom-\nmen, desto höher die Steuerrückerstattung. Zukünftig soll jede*r eine einkommensunabhängige \nSteuerminderung erhalten. \nWir wollen die Vermögensteuer wieder in Kraft setzen, auch um die Finanzkraft der Länder für \nwichtige Zukunftsaufgaben zu verbessern. Wer sehr viel Vermögen hat, muss einen größeren Bei-\ntrag zur Finanzierung unseres Gemeinwesens leisten. Deshalb werden wir unter anderem einen \nmaßvollen, einheitlichen Steuersatz von einem Prozent für sehr hohe Vermögen einführen. Gleich-\nzeitig wird es hohe persönliche Freibeträge geben, so dass sich die Steuerbelastung auf besonders \nvermögende Teile der Bevölkerung konzentriert. Wir stellen sicher, dass mit der Vermögenssteuer \nkeine Arbeitsplätze gefährdet werden. Die Grundlage von Betrieben wird bei der Vermögenssteuer \nverschont. \nDie Erbschaftssteuer ist reformbedürftig. In ihrer gegenwärtigen Form ist sie ungerecht, da sie ver -\nmögende Unternehmenserben bevorzugt. Mit einer effektiven Mindestbesteuerung werden wir \ndie Überprivilegierung großer Betriebsvermögen abschaffen. Auch für vermögenshaltende Fami-\nlienstiftungen werden wir eine Mindestbesteuerung einführen.'
 'Gleich-\nzeitig wird es hohe persönliche Freibeträge geben, so dass sich die Steuerbelastung auf besonders \nvermögende Teile der Bevölkerung konzentriert. Wir stellen sicher, dass mit der Vermögenssteuer \nkeine Arbeitsplätze gefährdet werden. Die Grundlage von Betrieben wird bei der Vermögenssteuer \nverschont. \nDie Erbschaftssteuer ist reformbedürftig. In ihrer gegenwärtigen Form ist sie ungerecht, da sie ver -\nmögende Unternehmenserben bevorzugt. Mit einer effektiven Mindestbesteuerung werden wir \ndie Überprivilegierung großer Betriebsvermögen abschaffen. Auch für vermögenshaltende Fami-\nlienstiftungen werden wir eine Mindestbesteuerung einführen. \nWir werden eine Finanztransaktionssteuer einführen, möglichst im Einklang mit unseren europäi-\nschen Partnern. Zugleich werden wir die von uns maßgeblich mit unterstützten internationalen \nVerhandlungen zur Einführung einer effektiven Mindestbesteuerung und einer fairen Besteuerung \nso genannter Digitalunternehmen zum Abschluss bringen und in Deutschland und Europa umset -\nzen. Google, Amazon, Facebook und andere große Digitalunternehmen müssen einen angemesse-\nnen Beitrag zur Finanzierung des Gemeinwesens leisten. \nWir brauchen einen leistungsfähigen, sicheren und fairen Finanzmarkt, um den Wandel in eine \ndigitale und nachhaltige Wirtschaft finanzieren zu können. Er muss ordentlich reguliert und über -\nwacht werden. Wir werden sicherstellen, dass den Verbraucher*innen die Finanzierungsdienst -\nleistungen kostengünstig angeboten werden und Investitionen in  nachhaltige, klimafreundliche \nProdukte und Produktionsverfahren fördern.'
 'Das Zukunftsprogramm der SPD\nKapitel 2Seite >23\nSPD-Parteivorstand 2021Das geltende Steuerrecht befördert die klassische Arbeitsteilung zwischen Männern und Frauen. \nDas werden wir ändern und das Steuerrecht stärker auf Partnerschaftlichkeit ausrichten sowie \ndie Steuerlast bei unterschiedlich hohen Einkommen zwischen den Eheleuten gerecht verteilen. \nDas Ehegattensplitting bildet die gesellschaftliche Realität nicht mehr ab und schließt viele Haus-\nhalte mit Kindern von dem gewährten Steuervorteil aus. Nutznießer sind stattdessen vor allem \nAlleinverdiener-Ehepaare mit hohen Einkommen unabhängig von der Kinderzahl. Wir werden das \nEhegattensplitting für neu geschlossene Ehen ändern. Die allermeisten Haushalte mit Kindern \nwerden durch die Kindergrundsicherung finanziell bessergestellt werden. Normalverdienende \nauch ohne Kinder werden keine Einbußen erleiden. Für bestehende Ehen werden wir zudem ein \nWahlrecht einführen.\nDie steuerliche Abzugsfähigkeit von Manager*innengehältern werden wir begrenzen, und zwar \nauf das 15-fache des Durchschnittseinkommens der Beschäftigten in dem Betrieb, in dem die \n Manager*in beschäftigt ist. \nBislang gilt bei förderwürdigen Aufwendungen wie zum Beispiel Spenden: Je höher das Einkom-\nmen, desto höher die Steuerrückerstattung. Zukünftig soll jede*r eine einkommensunabhängige \nSteuerminderung erhalten. \nWir wollen die Vermögensteuer wieder in Kraft setzen, auch um die Finanzkraft der Länder für \nwichtige Zukunftsaufgaben zu verbessern.']","Die Erbschaftssteuer soll reformiert werden, um die Überprivilegierung großer Betriebsvermögen abzuschaffen und eine Mindestbesteuerung für vermögenshaltende Familienstiftungen einzuführen.",Mit einer effektiven Mindestbesteuerung werden wir die Überprivilegierung großer Betriebsvermögen abschaffen. Auch für vermögenshaltende Familienstiftungen werden wir eine Mindestbesteuerung einführen.,1.0,0.9799904989126503,0.99999999995,1.0
44,Welche zusätzlichen Kompetenzen soll die BaFin erhalten?,"['Das Zukunftsprogramm der SPD\nKapitel 2Seite >24\nSPD-Parteivorstand 2021Um den Finanzstandort Deutschland zum Motor einer nachhaltigen Transformation der Finanz- \nund Realwirtschaft in Einklang mit den Pariser Klimaschutzzielen zu machen, werden wir künf -\ntig noch mehr nachhaltige Staatsanleihen auflegen und auf weitere als nachhaltig zertifizierte \nFinanzprodukte hinwirken. Das Ziel ist, private Kapitalflüsse in den Auf- und Ausbau nachhaltiger \nWirtschaftsstrukturen zu lenken. \nDer Wettbewerb im Finanzsektor soll erhalten bleiben und die Bankenregulierung muss bewirken, \ndass staatliche Rettungsschirme für einzelne Banken nicht notwendig werden. Wir unterstützen \ndie EU-Kommission dabei, darauf im Rahmen der europäischen Fusionskontrolle zu achten. \nWir haben dafür gesorgt, dass die Bundesanstalt für Finanzdienstleistungsaufsicht (BaFin) stärke-\nre Kontroll-Kompetenzen erhält. Wir haben bei der Prüfung von Jahresabschlüssen der Unterneh-\nmen eine Überprüfung unmittelbar durch die BaFin ermöglicht. Sie kann nun hoheitlich prüfen, \nda Jahresabschlüsse die wichtigste Informationsquelle für Anleger*innen und Verbraucher*innen \nsind. Zudem haben wir die Aufsicht über die Wirtschaftsprüfer*innen verschärft und geregelt, \ndamit sie häufiger als bisher gewechselt werden müssen. Darüber hinaus setzen wir uns dafür ein, \ndass die BaFin mehr Kompetenzen bei der Geldwäscheaufsicht auch für große Unternehmen über \nihre bisherige Aufsichtszuständigkeit hinaus erhält. Schmutziges Geld darf in Deutschland keine \nHeimat finden.'
 'Wir haben bei der Prüfung von Jahresabschlüssen der Unterneh-\nmen eine Überprüfung unmittelbar durch die BaFin ermöglicht. Sie kann nun hoheitlich prüfen, \nda Jahresabschlüsse die wichtigste Informationsquelle für Anleger*innen und Verbraucher*innen \nsind. Zudem haben wir die Aufsicht über die Wirtschaftsprüfer*innen verschärft und geregelt, \ndamit sie häufiger als bisher gewechselt werden müssen. Darüber hinaus setzen wir uns dafür ein, \ndass die BaFin mehr Kompetenzen bei der Geldwäscheaufsicht auch für große Unternehmen über \nihre bisherige Aufsichtszuständigkeit hinaus erhält. Schmutziges Geld darf in Deutschland keine \nHeimat finden.\nDer Zoll ist neben der Polizei eine wichtige Institution im Kampf gegen Geldwäsche und Kriminali-\ntät. Wir werden die Kompetenzen des Zolls weiter stärken und die für dessen Wahrnehmung der \nAufgaben verbundene Personalausstattung und Ausrüstung im Bereich illegale Beschäftigung und \nSchwarzarbeit, organisierte Kriminalität, Geldwäsche wirkungsvoll unterstützen.\nWir lehnen eine Privatisierung von Währungen ab. Dies gilt auch für private digitale Währungen, \ndie in ihrem Wert künstlich stabil gehalten werden (Stablecoins).'
 'Google, Amazon, Facebook und andere große Digitalunternehmen müssen einen angemesse-\nnen Beitrag zur Finanzierung des Gemeinwesens leisten. \nWir brauchen einen leistungsfähigen, sicheren und fairen Finanzmarkt, um den Wandel in eine \ndigitale und nachhaltige Wirtschaft finanzieren zu können. Er muss ordentlich reguliert und über -\nwacht werden. Wir werden sicherstellen, dass den Verbraucher*innen die Finanzierungsdienst -\nleistungen kostengünstig angeboten werden und Investitionen in  nachhaltige, klimafreundliche \nProdukte und Produktionsverfahren fördern. \nFür das Vertrauen in die Funktionstüchtigkeit und Sicherheit von Finanzmarktakteuren und \nFinanzprodukten ist es gerade für Kleinanleger*innen wichtig, dass sie eine unabhängige und an \nihren Interessen orientierte Beratung erhalten können. \nÜberschuldeten Privatpersonen werden wir besser aus einer nicht aus eigener Kraft überwindba-\nren finanziellen Not helfen. Die Schuldnerberatung werden wir stärken. Durch ausgeweitete vor -\nsorgende Beratungsmöglichkeiten soll der Weg in die Überschuldung am besten von vornherein \nvermieden werden.']",Die BaFin soll zusätzliche Kontroll-Kompetenzen bei der Geldwäscheaufsicht für große Unternehmen erhalten.,"Darüber hinaus setzen wir uns dafür ein, dass die BaFin mehr Kompetenzen bei der Geldwäscheaufsicht auch für große Unternehmen über ihre bisherige Aufsichtszuständigkeit hinaus erhält.",1.0,0.9390463384695001,0.99999999995,1.0
45,Was ist die Position zur Privatisierung von Währungen und privaten digitalen Währungen?,"['Wir haben bei der Prüfung von Jahresabschlüssen der Unterneh-\nmen eine Überprüfung unmittelbar durch die BaFin ermöglicht. Sie kann nun hoheitlich prüfen, \nda Jahresabschlüsse die wichtigste Informationsquelle für Anleger*innen und Verbraucher*innen \nsind. Zudem haben wir die Aufsicht über die Wirtschaftsprüfer*innen verschärft und geregelt, \ndamit sie häufiger als bisher gewechselt werden müssen. Darüber hinaus setzen wir uns dafür ein, \ndass die BaFin mehr Kompetenzen bei der Geldwäscheaufsicht auch für große Unternehmen über \nihre bisherige Aufsichtszuständigkeit hinaus erhält. Schmutziges Geld darf in Deutschland keine \nHeimat finden.\nDer Zoll ist neben der Polizei eine wichtige Institution im Kampf gegen Geldwäsche und Kriminali-\ntät. Wir werden die Kompetenzen des Zolls weiter stärken und die für dessen Wahrnehmung der \nAufgaben verbundene Personalausstattung und Ausrüstung im Bereich illegale Beschäftigung und \nSchwarzarbeit, organisierte Kriminalität, Geldwäsche wirkungsvoll unterstützen.\nWir lehnen eine Privatisierung von Währungen ab. Dies gilt auch für private digitale Währungen, \ndie in ihrem Wert künstlich stabil gehalten werden (Stablecoins).'
 'Gleich-\nzeitig wird es hohe persönliche Freibeträge geben, so dass sich die Steuerbelastung auf besonders \nvermögende Teile der Bevölkerung konzentriert. Wir stellen sicher, dass mit der Vermögenssteuer \nkeine Arbeitsplätze gefährdet werden. Die Grundlage von Betrieben wird bei der Vermögenssteuer \nverschont. \nDie Erbschaftssteuer ist reformbedürftig. In ihrer gegenwärtigen Form ist sie ungerecht, da sie ver -\nmögende Unternehmenserben bevorzugt. Mit einer effektiven Mindestbesteuerung werden wir \ndie Überprivilegierung großer Betriebsvermögen abschaffen. Auch für vermögenshaltende Fami-\nlienstiftungen werden wir eine Mindestbesteuerung einführen. \nWir werden eine Finanztransaktionssteuer einführen, möglichst im Einklang mit unseren europäi-\nschen Partnern. Zugleich werden wir die von uns maßgeblich mit unterstützten internationalen \nVerhandlungen zur Einführung einer effektiven Mindestbesteuerung und einer fairen Besteuerung \nso genannter Digitalunternehmen zum Abschluss bringen und in Deutschland und Europa umset -\nzen. Google, Amazon, Facebook und andere große Digitalunternehmen müssen einen angemesse-\nnen Beitrag zur Finanzierung des Gemeinwesens leisten. \nWir brauchen einen leistungsfähigen, sicheren und fairen Finanzmarkt, um den Wandel in eine \ndigitale und nachhaltige Wirtschaft finanzieren zu können. Er muss ordentlich reguliert und über -\nwacht werden. Wir werden sicherstellen, dass den Verbraucher*innen die Finanzierungsdienst -\nleistungen kostengünstig angeboten werden und Investitionen in  nachhaltige, klimafreundliche \nProdukte und Produktionsverfahren fördern.'
 'Deutschland ist wie kaum ein anderes Land auf offene Märkte und eine funktionsfähige sowie \nregelbasierte globale Wirtschaft angewiesen. Unser Ziel ist es ein stabiles, faires und demokrati-\nsches Handelssystem zu etablieren. \nWir werden die Instrumente der Handels- und Investitionspolitik modernisieren – vor allem mit \nBlick auf Nachhaltigkeit und die Durchsetzung gemeinsamer multilateraler Regeln – und uns für \neine Stärkung der Welthandelsorganisation (WTO) einsetzen. Hierfür werden wir das Regelwerk \nerweitern, die Nachhaltigkeitsziele der Vereinten Nationen einbeziehen sowie die Durchsetzungs-\nmöglichkeiten verbessern. Alle Instanzen des WTO-Streitschlichtungsmechanismus sollen wieder \nbeschlussfähig sein. Deshalb ist eine starke WTO mit einem modernen Regelwerk, das die nachhal-\ntigen Entwicklungsbedürfnisse des Globalen Südens ebenso wie die des Nordens fair und partner -\nschaftlich anerkennt und fördert, so wichtig.\nViele Länder befanden sich schon vor der Corona-Pandemie in einer Schuldenkrise, die jetzt noch \nvergrößert wird. Zentrale Säulen der Entwicklungsfinanzierung sind zusammengebrochen und \nFinanzströme ausgetrocknet. Das kurzfristige Aussetzen des Schuldendienstes im Rahmen der \nG20 und des IWF brachte Erleichterung. Wir unterstützen eine Initiative für ein globales Staatenin-\nsolvenzverfahren, das staatliche und vor allem private Gläubiger miteinbezieht und das Schulden-\nerlasse für besonders gefährdete Ländergruppen formuliert und umsetzt.\nDie friedenspolitischen Herausforderungen nehmen zu.']","Die Partei lehnt die Privatisierung von Währungen ab, einschließlich privater digitaler Währungen, die künstlich stabil gehalten werden.","Wir lehnen eine Privatisierung von Währungen ab. Dies gilt auch für private digitale Währungen, die in ihrem Wert künstlich stabil gehalten werden (Stablecoins).",1.0,0.9298298431306055,0.9999999999,1.0
46,Wie will die SPD regieren?,"['Das Zukunftsprogramm der SPD\nKapitel 2Seite >25\nSPD-Parteivorstand 20212.8. Wie wir regieren wollen\nWir wollen vorausschauender, wirksamer, agiler und nachhaltiger regieren und dabei mehr Trans-\nparenz, mehr Beteiligung, mehr Demokratie wagen.\nUnsere föderale Struktur ist eine unserer demokratischen Stärken. Im Bund, den Ländern, Städten, \nLandkreisen und Gemeinden wird die Zukunft ausgehandelt. Zugleich besteht die große Heraus-\nforderung darin, gemeinsame Ziele für unsere Zukunft zu verfolgen. Wir werden daher alle, die \nVerantwortung tragen, in die Umsetzung unserer großen Ziele mit einbeziehen.\nDas Silodenken der politischen Ebenen und Ressorts wollen wir überwinden und innovativ Re-\ngierungsprojekte in Plattformen organisieren. Denken außerhalb alter Muster ist gefragt. Wir \nbrauchen eine Modernisierungsoffensive für den öffentlichen Dienst und eine bessere Zusammen-\narbeit der Verwaltung. In die Entwicklung, Umsetzung und Evaluation von Projekten wollen wir \nwissenschaftliche und wirtschaftliche Expertise, Verbände und die Zivilgesellschaft einbinden und \ndas Parlament in seiner Kontrollfunktion stärken.\nDie demokratische Gestaltung des digitalen Wandels, die alle Lebensbereiche umfasst, alle gesell-\nschaftlichen, wirtschaftlichen und politischen Felder und Ebenen, ist ein Beispiel für die Überfor -\nderung herkömmlicher Organisationsformen mit den Aufgaben unserer Zeit.\nZum nachhaltigen Regieren gehört, dass Regierungsvorhaben, Projekte und Gesetze in ihrer Um-\nsetzung kommunikativ begleitet werden.'
 'Das Zukunftsprogramm der SPD\nKapitel 3Seite >52\nSPD-Parteivorstand 20213.14. Gesundheitsschutz, Jugendschutz und   \nEntkrimi  na lisierung bestimmen unsere Drogenpolitik\nWie Alkohol ist auch Cannabis eine gesellschaftliche Realität, mit der wir einen\xa0adäquaten politi-\nschen Umgang finden müssen. Verbote und Kriminalisierung haben den Konsum nicht gesenkt, \nsie stehen einer effektiven Suchtprävention und Jugendschutz entgegen und binden enorme Res-\nsourcen bei Justiz und Polizei. Eine regulierte Abgabe von Cannabis an Erwachsene soll in Modell-\nprojekten von Ländern und Kommunen erprobt werden können, begleitet durch Maßnahmen der \nPrävention, Beratung und Behandlung im Jugendbereich. Zudem werden wir bundeseinheitlich \nregeln, dass der Besitz kleiner Mengen von Cannabis strafrechtlich nicht mehr verfolgt wird.\n3.15. Natur respektieren  \nWir wollen unseren natürlichen Lebensraum erhalten. Dazu müssen wir raus aus der Wegwerfge-\nsellschaft. Der Kreislaufwirtschaft gehört die Zukunft. Insbesondere die Verschmutzung der Meere \ndurch Plastik ist alarmierend. Wir müssen die zunehmende Plastikflut zurückdrängen. Das gelingt \nnur, wenn wir unnötiges Plastik vermeiden und abschaffen. Dort, wo Einweg-Kunststoff nicht ver -\nmeidbar ist, werden wir umweltfreundliche und recycelbare Lösungen einfordern. Möglichst viel \nKunststoff muss aufbereitet und wiederverwendet werden. Wir wollen die Hersteller noch stärker \nin die Pflicht nehmen.'
 'Das Zukunftsprogramm der SPD\nKapitel 1Seite >4\nSPD-Parteivorstand 2021In der Corona-Krise wird einmal mehr überaus deutlich, dass Gewinnmaximierung und Kosten-\nminimierung nicht das Maß aller Dinge sein dürfen. In der Wirtschaft, im Gesundhei tssystem, im \nBildungssystem, der Justiz und anderen wichtigen Bereichen wurde zu viel „auf Kante genäht“ . Aber unsere \nGesellschaft ist stabil – auch unter widrigen Umständen und in krisenhaften Situationen. Wir müssen alles \ndransetzen, dass es so bleibt. Die Stabilität verdanken wir der beeindruckenden Solidarität und den demo-\nkratischen Grundwerten unserer Gesellschaft. Neue Akzeptanz und neue Begeisterung sowie neuer Respekt \nfür demokratische Institutionen entstehen durch mehr Transparenz und Beteiligung.\xa0\nFür den Zusammenhalt unserer Gesellschaft ist der Respekt vor der Verschiedenheit der Menschen und ihrer \nLebensentwürfe eine der wichtigsten Grundlagen. Diese Vielfalt ist ein unschätzbarer Gewinn, und wir wer -\nden dafür sorgen, dass sie sich in allen Bereichen unserer Gesellschaft, in unseren Parlamenten und in den \nFormaten der Beteiligung angemessen widerspiegelt.\xa0\nVielen in Deutschland geht es – auch im Vergleich mit anderen Ländern – wirtschaftlich gut. Aber das gilt \nnicht für alle und es fehlt vielen die Gewissheit, dass das auch morgen so sein wird. Mit unserer Politik \nwerden wir dazu beitragen, dass die Ungleichheit überwunden wird, Sicherheit im Wandel garantiert ist und \nneue Zuversicht entsteht.\n1.1. Zukunft sichern \nEin kurzer Blick in die Zukunft: Spätestens 2045 werden wir klimaneutral wirtschaften.']","Die SPD plant, vorausschauendes, wirksames, agiles und nachhaltiges Regieren umzusetzen, indem sie mehr Transparenz, Beteiligung und Demokratie fördert. Sie strebt danach, das Silodenken der politischen Ebenen und Ressorts zu überwinden und innovative Regierungsprojekte in Plattformen zu organisieren. Die Partei plant, wissenschaftliche und wirtschaftliche Expertise, Verbände und die Zivilgesellschaft in die Entwicklung, Umsetzung und Evaluation von Projekten einzubeziehen.","Wir wollen vorausschauender, wirksamer, agiler und nachhaltiger regieren und dabei mehr Transparenz, mehr Beteiligung, mehr Demokratie wagen.",1.0,0.9172600944774295,0.8333333332916666,1.0
47,Welche Regeln sollen für die Einkünfte und Unternehmensbeteiligungen von Abgeordneten gelten?,"['Die Kriterien zur Regelsatzermittlung werden wir weiterentwickeln und Betrof -\nfene und Sozialverbände mit einbeziehen. \nDas Ziel muss sein, die hilfsbedürftige Lebenslage gemeinsam zu bezwingen und allen eine Be-\nschäftigung und, falls erforderlich, eine Qualifizierung und Weiterbildung zu ermöglichen. Wir set -\nzen auf eine umfassende und passgenaue Unterstützung, die die gesamte Bedarfsgemeinschaft \nin den Blick nimmt - auf Qualität und gute Netzwerke statt auf eine reine Kennzahlenlogik. Wir \nwerden die gesetzlichen, personellen und finanziellen Rahmenbedingungen weiter so verbessern, \ndass die Jobcenter und ihre Beschäftigten diesem Auftrag nachkommen können. Wir schaffen das \nRecht auf Förderung beim Nachholen eines Berufsabschlusses und führen einen Weiterbildungs-\nBonus ein, der die finanziellen Spielräume spürbar erweitert.\nWir haben wegen der Corona-Pandemie die Vermögensprüfung weitestgehend ausgesetzt. Man \nläuft nicht mehr Gefahr, aus der Wohnung ausziehen zu müssen. Dadurch können sich die Be-\nhörden und die Betroffenen in den ersten Monaten mit voller Energie auf eine sinnvolle Wieder -\naufnahme der Beschäftigung konzentrieren. Die guten Erfahrungen aus diesen vorübergehenden \nMaßnahmen haben uns darin bestätigt, dafür zu sorgen, dass auch in Zukunft Vermögen und \nWohnungsgröße innerhalb der ersten zwei Jahre nicht überprüft werden und das Schonvermögen \nerhöht wird. Das Bürgergeld beinhaltet Mitwirkungspflichten, setzt aber konsequent auf Hilfe und \nErmutigung. Eingliederungsvereinbarungen werden durch eine gemeinsame und auf Augenhöhe \nerarbeitete Teilhabevereinbarung ersetzt.'
 'Für bestehende Ehen werden wir zudem ein \nWahlrecht einführen.\nDie steuerliche Abzugsfähigkeit von Manager*innengehältern werden wir begrenzen, und zwar \nauf das 15-fache des Durchschnittseinkommens der Beschäftigten in dem Betrieb, in dem die \n Manager*in beschäftigt ist. \nBislang gilt bei förderwürdigen Aufwendungen wie zum Beispiel Spenden: Je höher das Einkom-\nmen, desto höher die Steuerrückerstattung. Zukünftig soll jede*r eine einkommensunabhängige \nSteuerminderung erhalten. \nWir wollen die Vermögensteuer wieder in Kraft setzen, auch um die Finanzkraft der Länder für \nwichtige Zukunftsaufgaben zu verbessern. Wer sehr viel Vermögen hat, muss einen größeren Bei-\ntrag zur Finanzierung unseres Gemeinwesens leisten. Deshalb werden wir unter anderem einen \nmaßvollen, einheitlichen Steuersatz von einem Prozent für sehr hohe Vermögen einführen. Gleich-\nzeitig wird es hohe persönliche Freibeträge geben, so dass sich die Steuerbelastung auf besonders \nvermögende Teile der Bevölkerung konzentriert. Wir stellen sicher, dass mit der Vermögenssteuer \nkeine Arbeitsplätze gefährdet werden. Die Grundlage von Betrieben wird bei der Vermögenssteuer \nverschont. \nDie Erbschaftssteuer ist reformbedürftig. In ihrer gegenwärtigen Form ist sie ungerecht, da sie ver -\nmögende Unternehmenserben bevorzugt. Mit einer effektiven Mindestbesteuerung werden wir \ndie Überprivilegierung großer Betriebsvermögen abschaffen. Auch für vermögenshaltende Fami-\nlienstiftungen werden wir eine Mindestbesteuerung einführen.'
 'Die gerechte Verteilung von Einkommen und Vermögen ist eine Grundvorausset -\nzung für den Zusammenhalt unserer Gesellschaft. Die extrem ungleiche Verteilung von Einkom-\nmen und Vermögen ist nicht nur sozialpolitisch bedenklich, sie ist auch ökonomisch unvernünftig. \nDie hohe und weiterwachsende Konzentration des Vermögens auf einige Hochvermögende ver -\nhindert nachhaltiges Wachstum und verschenkt wertvolle Potenziale. \nWir werden der Steuergerechtigkeit Geltung verschaffen – Steuerhinterziehung ist kein Kavaliers-\ndelikt. Gegen Steuerhinterziehung, Steuervermeidung und Steuerbetrug werden wir konsequent \nvorgehen. Wir haben grenzüberschreitende Steuergestaltungsmodelle der Anzeigepflicht unter -\nworfen und werden eine nationale Anzeigepflicht einführen. Wir werden die Umgehung der \nGrunderwerbsteuer (Share Deals) beenden. Der Umsatzsteuerbetrug bei Karussellgeschäften auf \neuropäischer Ebene muss beendet werden. Die öffentliche Transparenz ist ein gutes Mittel, um \nUnternehmen in die Pflicht zu nehmen. Wir werden Steuervermeidung mit einem öffentlichen \nReporting großer, international agierender Unternehmen eindämmen (Public Country-by-Country-\nReporting). \nDie Besteuerung von Einkommen werden wir gerechter gestalten. Das aktuelle Steuersystem \nnimmt gerade mittlere Einkommen zu stark in Anspruch. Die finanziellen Lasten der Krisenbewäl-\ntigung dürfen für die ohnehin stark strapazierte große Mehrheit der Bürger*innen nicht zu einer \nsteuerlichen Mehrbelastung führen. Im Gegenteil: Wir wollen die Steuern für die Mehrheit senken.']","Die Regeln für die Einkünfte und Unternehmensbeteiligungen von Abgeordneten sollen transparent und gerecht sein, um Interessenkonflikte zu vermeiden und das Vertrauen der Öffentlichkeit zu wahren. Es sollten klare Offenlegungspflichten und Beschränkungen gelten, um mögliche Interessenkonflikte zu verhindern und die Integrität des politischen Prozesses zu gewährleisten. Es ist wichtig, dass Abgeordnete keine finanziellen Vorteile aus ihrer politischen Position ziehen können.","Wir werden dafür sorgen, dass Abgeordnete zukünftige ihre Einkommen auf Euro und Cent angeben müssen. Ebenso werden wir für Abgeordnete die Anzeigepflicht für Unternehmensbeteiligung und Aktienoptionen verschärfen und klar regeln, wann ein Interessenkonflikt zwischen parlamentarischer und wirtschaftlicher Arbeit vorliegt und wie er zu lösen ist.",0.0,0.9781716142111962,0.0,0.0
48,Welche Bedingung soll für die Vergabe öffentlicher Aufträge eingeführt werden?,"['In Deutschland werden gegenwärtig jährlich über 300 Milliarden Euro im Rahmen der öffentlichen \nAuftragsvergabe umgesetzt. Gerade die öffentliche Hand muss als große Abnehmerin von Produk -\nten und Dienstleistungen Verantwortung übernehmen. Wir werden die öffentliche Beschaffung \nso ausrichten, dass sie Innovationsimpulse setzt und den Zielen des sozial-ökologischen Wandels \ndient. Hierfür sollten die Vergabekriterien stärker auf Innovation, Tarifbindung, Geschlechterge-\nrechtigkeit und klimafreundliche Nachhaltigkeit ausgerichtet werden.\nProduktentwicklungen müssen sich auf den Staat als Nachfrager verlassen können. \nWir müssen besser darin werden, aus Ideen auch Produkte und Dienstleistungen zu machen und \nStart-ups zu fördern. Wir werden dabei die Erkenntnisse aus der Forschung schneller und breiter in \nInnovationen und Investitionen übersetzten. \nEine wichtige Rolle nimmt dabei die Kreditanstalt für Wiederaufbau (KfW) ein, die Mittel am Kapi-\ntalmarkt aufnimmt und diese zusammen mit den Förderbanken der Länder in strategisch wichtige \nZukunftsbranchen lenkt, die den sozial-ökologischen Umbau der Wirtschaft unterstützt und auch \nStart-ups fördert. Wir werden sie zu einer modernen Innovations- und Investitionsagentur weiter -\nentwickeln. \nWir stehen an der Seite der vielen Unternehmen, die ihre soziale, gesellschaftliche und ökolo-\ngische Verantwortung ernst nehmen. Das Handwerk ist der entscheidende Partner, damit die \nKlimawende vor Ort gelingt. Wir werden das Handwerk fördern, indem wir Gebühren für Techni-\nker*innen- und Meister*innenkurse abschaffen und uns für die Tarifbindung im Handwerk ein-\nsetzen.'
 'Dadurch können sich die Be-\nhörden und die Betroffenen in den ersten Monaten mit voller Energie auf eine sinnvolle Wieder -\naufnahme der Beschäftigung konzentrieren. Die guten Erfahrungen aus diesen vorübergehenden \nMaßnahmen haben uns darin bestätigt, dafür zu sorgen, dass auch in Zukunft Vermögen und \nWohnungsgröße innerhalb der ersten zwei Jahre nicht überprüft werden und das Schonvermögen \nerhöht wird. Das Bürgergeld beinhaltet Mitwirkungspflichten, setzt aber konsequent auf Hilfe und \nErmutigung. Eingliederungsvereinbarungen werden durch eine gemeinsame und auf Augenhöhe \nerarbeitete Teilhabevereinbarung ersetzt. Bei ihrer Umsetzung setzen wir auf Befähigung und Be-\nstärkung und nicht auf Vorgaben und Zwang. Sinnwidrige und unwürdige Sanktionen schaffen wir \nab. Das sozioökonomische und soziokulturelle Existenzminimum muss jederzeit gesichert sein.\nDie Leistungen des Sozialstaates sind soziale Rechte – wer sie benötigt, sollte nicht lange suchen \nmüssen. Unser Ziel ist es, die Leistungen ohne Hürden und Umwege zugänglich zu machen. Wir \nwollen einen Bürgerservice, der nach Lebenslagen berät und alle Leistungen aus einer Hand zu-\ngänglich macht. Er ist digital und aufsuchend, wo der Weg zu beschwerlich ist. Ein zugewandter \nSozialstaat hilft, Rechtsansprüche geltend zu machen, und begleitet auch danach beratend alle \nSchritte.'
 'Die Kriterien zur Regelsatzermittlung werden wir weiterentwickeln und Betrof -\nfene und Sozialverbände mit einbeziehen. \nDas Ziel muss sein, die hilfsbedürftige Lebenslage gemeinsam zu bezwingen und allen eine Be-\nschäftigung und, falls erforderlich, eine Qualifizierung und Weiterbildung zu ermöglichen. Wir set -\nzen auf eine umfassende und passgenaue Unterstützung, die die gesamte Bedarfsgemeinschaft \nin den Blick nimmt - auf Qualität und gute Netzwerke statt auf eine reine Kennzahlenlogik. Wir \nwerden die gesetzlichen, personellen und finanziellen Rahmenbedingungen weiter so verbessern, \ndass die Jobcenter und ihre Beschäftigten diesem Auftrag nachkommen können. Wir schaffen das \nRecht auf Förderung beim Nachholen eines Berufsabschlusses und führen einen Weiterbildungs-\nBonus ein, der die finanziellen Spielräume spürbar erweitert.\nWir haben wegen der Corona-Pandemie die Vermögensprüfung weitestgehend ausgesetzt. Man \nläuft nicht mehr Gefahr, aus der Wohnung ausziehen zu müssen. Dadurch können sich die Be-\nhörden und die Betroffenen in den ersten Monaten mit voller Energie auf eine sinnvolle Wieder -\naufnahme der Beschäftigung konzentrieren. Die guten Erfahrungen aus diesen vorübergehenden \nMaßnahmen haben uns darin bestätigt, dafür zu sorgen, dass auch in Zukunft Vermögen und \nWohnungsgröße innerhalb der ersten zwei Jahre nicht überprüft werden und das Schonvermögen \nerhöht wird. Das Bürgergeld beinhaltet Mitwirkungspflichten, setzt aber konsequent auf Hilfe und \nErmutigung. Eingliederungsvereinbarungen werden durch eine gemeinsame und auf Augenhöhe \nerarbeitete Teilhabevereinbarung ersetzt.']","Für die Vergabe öffentlicher Aufträge sollen die Kriterien stärker auf Innovation, Tarifbindung, Geschlechtergerechtigkeit und klimafreundliche Nachhaltigkeit ausgerichtet werden.","Ein öffentlicher Auftrag darf nur an Unternehmen vergeben werden, die nach Tarif bezahlen. Dazu schaffen wir ein Bundestariftreuegesetz.",1.0,0.9277372960405863,0.9999999999,0.5
49,Wie soll der gesetzliche Mindestlohn geändert werden?,"['Daher setzen wir uns für gerechte Löhne ein. Wir werden die Möglichkeit vereinfachen, Tarifver -\nträge für allgemein verbindlich zu erklären, damit sie für alle Beschäftigten und Arbeitgeber*innen \nin einer Branche gelten. Tarifverträge müssen auch weiter gelten, wenn Betriebe aufgespalten und \nausgelagert werden.\nWir wollen, dass möglichst viele Unternehmen sich an den Tarifverträgen beteiligen. Die Mitglied-\nschaft in Arbeitgeberverbänden ohne Tarifbindung ist unanständig. Wir werden diese Praxis zu-\nrückzudrängen. Ein öffentlicher Auftrag darf nur an Unternehmen vergeben werden, die nach Tarif \nbezahlen. Dazu schaffen wir ein Bundestariftreuegesetz. Eine bessere Tarifbindung ist darüber \nhinaus eine wichtige Voraussetzung, die Lohnangleichung zwischen Ost und West durchzusetzen.\nWer den ganzen Tag arbeitet, muss von seiner Arbeit ohne zusätzliche Unterstützung leben kön-\nnen. Auch das ist eine Frage des Respekts. Wir werden den gesetzlichen Mindestlohn zunächst \nauf mindestens zwölf Euro erhöhen und die Spielräume der Mindestlohnkommission für künftige \nErhöhungen ausweiten.\nDie Befristung von Arbeitsverhältnissen ohne einen Sachgrund werden wir abschaffen und die \nvom Gesetz akzeptierten Gründe für eine Befristung kritisch überprüfen. Leiharbeiter*innen wer -\nden ab dem ersten Tag den gleichen Lohn erhalten wie Festangestellte.'
 'Das Zukunftsprogramm der SPD\nKapitel 3Seite >28\nSPD-Parteivorstand 2021Die Corona-Krise hat erneut gezeigt, dass die soziale Sicherung der Minijobs unzureichend ist. \nUnser Ziel ist, alle Beschäftigungsverhältnisse in die soziale Sicherung einzubeziehen. Dabei wird \nes Übergänge für bestehende Arbeitsverhältnisse und Ausnahmen für bestimmte Gruppen wie \nzum Beispiel Rentner*innen geben. Um die Nettoeinkommen von gering Verdienenden zu erhö-\nhen, heben wir die Gleitzone der Midi-Jobs auf 1.600 Euro an. In dieser Zone zahlen die Arbeitneh-\nmer*innen geringere Beiträge, ohne dass sie dadurch einen geringeren Rentenanspruch haben.\nDen Zugang zur Brückenteilzeit werden wir für mehr Beschäftigte möglich machen. \nCorona hat ein Schlaglicht darauf geworfen, wie groß bei manchen Berufsgruppen die Lücke \nzwischen Wert und Lohn ist. Dazu gehören die sozialen Dienstleistungsberufe. Es verdient große \nAnerkennung, dass immer mehr junge Menschen es sich vorstellen können, soziale Berufe zu er -\ngreifen, Mädchen genauso wie Jungen - es sind Berufe mit Bedeutung und Zukunft. Hier entstehen \ndie meisten Arbeitsplätze.\nIn der Pflege wird enorme und gesellschaftlich wertvolle Arbeit geleistet. Wir wollen die Lohn- und \nArbeitsbedingungen in der Altenpflege und Pflege von Menschen mit Behinderung schnell verbes-\nsern. Unsere Ziele sind allgemeinverbindliche Branchentarifverträge. Wie werden über die Pflege-\nmindestlohnkommission eine weitere Erhöhung der Mindestlöhne verfolgen.'
 'Die Altersgrenzen im \nBAföG werden wir dazu in einem ersten Schritt aufheben. Und wir brauchen ein Neustart-BAföG, \ndas auch im Erwachsenenalter neue berufliche Wege öffnen und angemessen den Lebensunter -\nhalt sichert.\nBereits jetzt besteht die Möglichkeit, dass Arbeitnehmer*innen ihre geleisteten Arbeitsstunden \nauf Langzeitkonten ansparen. Allerdings besteht bislang kein rechtlicher Anspruch darauf und nur \nein kleiner Teil der Unternehmen und Arbeitnehmer*innen nutzt Langzeitkonten. Wir werden das \nInstrument zu einem persönlichen Zeitkonto weiterentwickeln, um zusätzlich individuelle Ge-\nstaltungsmöglichkeiten entlang des Lebenslaufs zu schaffen. Basis eines solchen Zeitkontos sind \nZeiteinzahlungen der Beschäftigten – auf diese Weise gehen Überstunden nicht verloren, sondern \nverwandeln sich in ein Zeitguthaben, das per Tarifvertrag oder durch den Staat nach dem Prinzip \neines Chancenkontos aufgestockt werden kann.']","Der gesetzliche Mindestlohn soll zunächst auf mindestens zwölf Euro erhöht werden, und die Spielräume der Mindestlohnkommission für zukünftige Erhöhungen sollen ausgeweitet werden. Die Befristung von Arbeitsverhältnissen ohne Sachgrund soll abgeschafft werden, und Leiharbeiter*innen sollen ab dem ersten Tag den gleichen Lohn erhalten wie Festangestellte.",Wir werden den gesetzlichen Mindestlohn zunächst auf mindestens zwölf Euro erhöhen und die Spielräume der Mindestlohnkommission für künftige Erhöhungen ausweiten.,1.0,0.8762223622655059,0.99999999995,1.0
50,Welche Maßnahmen sind geplant bezüglich der Befristung von Arbeitsverhältnissen?,"['Daher setzen wir uns für gerechte Löhne ein. Wir werden die Möglichkeit vereinfachen, Tarifver -\nträge für allgemein verbindlich zu erklären, damit sie für alle Beschäftigten und Arbeitgeber*innen \nin einer Branche gelten. Tarifverträge müssen auch weiter gelten, wenn Betriebe aufgespalten und \nausgelagert werden.\nWir wollen, dass möglichst viele Unternehmen sich an den Tarifverträgen beteiligen. Die Mitglied-\nschaft in Arbeitgeberverbänden ohne Tarifbindung ist unanständig. Wir werden diese Praxis zu-\nrückzudrängen. Ein öffentlicher Auftrag darf nur an Unternehmen vergeben werden, die nach Tarif \nbezahlen. Dazu schaffen wir ein Bundestariftreuegesetz. Eine bessere Tarifbindung ist darüber \nhinaus eine wichtige Voraussetzung, die Lohnangleichung zwischen Ost und West durchzusetzen.\nWer den ganzen Tag arbeitet, muss von seiner Arbeit ohne zusätzliche Unterstützung leben kön-\nnen. Auch das ist eine Frage des Respekts. Wir werden den gesetzlichen Mindestlohn zunächst \nauf mindestens zwölf Euro erhöhen und die Spielräume der Mindestlohnkommission für künftige \nErhöhungen ausweiten.\nDie Befristung von Arbeitsverhältnissen ohne einen Sachgrund werden wir abschaffen und die \nvom Gesetz akzeptierten Gründe für eine Befristung kritisch überprüfen. Leiharbeiter*innen wer -\nden ab dem ersten Tag den gleichen Lohn erhalten wie Festangestellte.'
 'Damit halten wir den Betroffe-\nnen den Rücken frei, um sich auf das Wesentliche konzentrieren zu können: Neue Arbeit zu finden, \num wieder auf eigenen Beinen zu stehen.\nWir schaffen ein Recht auf Weiterbildung und beruflichen Neustart in allen Lebensphasen. Jede*r \neinzelne wird bei den bevorstehenden Veränderungen unterstützt. Wir werden ein Recht schaffen, \ndas es Arbeitnehmer*innen auch mit 40plus ermöglicht, noch einmal einen ganz neuen Beruf zu \nerlernen.\nMit unserem Modell der geförderten Bildungszeit und Bildungsteilzeit werden wir ermöglichen, \ndass alle Erwerbstätigen im Lauf ihres Erwerbslebens auf eigene Initiative und mit staatlicher \nUnterstützung unabhängig vom Betrieb sich weiterbilden oder umschulen können. Wer Bildungs-\nzeit oder Bildungsteilzeit beantragt, erhält ein Recht, sich von seinem Beruf freistellen zu lassen \noder die Arbeitszeit zu reduzieren. Die Bildungszeiten werden wir mit einer finanziellen Förde-\nrung ausgestalten, die Lohneinbußen während der Weiterbildung oder Umschulung angemessen \nkompensiert – und zwar lange genug, um anerkannte Abschlüsse zu erwerben. Bei den Kosten für \ndie Weiterbildungsmaßnahme werden wir diejenigen unterstützen, die die Mittel nicht oder nicht \nvollständig aus eigener Tasche aufbringen können.'
 'Dadurch können sich die Be-\nhörden und die Betroffenen in den ersten Monaten mit voller Energie auf eine sinnvolle Wieder -\naufnahme der Beschäftigung konzentrieren. Die guten Erfahrungen aus diesen vorübergehenden \nMaßnahmen haben uns darin bestätigt, dafür zu sorgen, dass auch in Zukunft Vermögen und \nWohnungsgröße innerhalb der ersten zwei Jahre nicht überprüft werden und das Schonvermögen \nerhöht wird. Das Bürgergeld beinhaltet Mitwirkungspflichten, setzt aber konsequent auf Hilfe und \nErmutigung. Eingliederungsvereinbarungen werden durch eine gemeinsame und auf Augenhöhe \nerarbeitete Teilhabevereinbarung ersetzt. Bei ihrer Umsetzung setzen wir auf Befähigung und Be-\nstärkung und nicht auf Vorgaben und Zwang. Sinnwidrige und unwürdige Sanktionen schaffen wir \nab. Das sozioökonomische und soziokulturelle Existenzminimum muss jederzeit gesichert sein.\nDie Leistungen des Sozialstaates sind soziale Rechte – wer sie benötigt, sollte nicht lange suchen \nmüssen. Unser Ziel ist es, die Leistungen ohne Hürden und Umwege zugänglich zu machen. Wir \nwollen einen Bürgerservice, der nach Lebenslagen berät und alle Leistungen aus einer Hand zu-\ngänglich macht. Er ist digital und aufsuchend, wo der Weg zu beschwerlich ist. Ein zugewandter \nSozialstaat hilft, Rechtsansprüche geltend zu machen, und begleitet auch danach beratend alle \nSchritte.']",Die geplanten Maßnahmen bezüglich der Befristung von Arbeitsverhältnissen umfassen die Abschaffung der Befristung ohne Sachgrund und die kritische Überprüfung der akzeptierten Gründe für eine Befristung. Leiharbeiter*innen sollen ab dem ersten Tag den gleichen Lohn wie Festangestellte erhalten.,Die Befristung von Arbeitsverhältnissen ohne einen Sachgrund werden wir abschaffen und die vom Gesetz akzeptierten Gründe für eine Befristung kritisch überprüfen.,1.0,0.9946567608821177,0.9999999999,1.0
51,Wie soll die Gleitzone der Midi-Jobs angepasst werden?,"['Das Zukunftsprogramm der SPD\nKapitel 3Seite >28\nSPD-Parteivorstand 2021Die Corona-Krise hat erneut gezeigt, dass die soziale Sicherung der Minijobs unzureichend ist. \nUnser Ziel ist, alle Beschäftigungsverhältnisse in die soziale Sicherung einzubeziehen. Dabei wird \nes Übergänge für bestehende Arbeitsverhältnisse und Ausnahmen für bestimmte Gruppen wie \nzum Beispiel Rentner*innen geben. Um die Nettoeinkommen von gering Verdienenden zu erhö-\nhen, heben wir die Gleitzone der Midi-Jobs auf 1.600 Euro an. In dieser Zone zahlen die Arbeitneh-\nmer*innen geringere Beiträge, ohne dass sie dadurch einen geringeren Rentenanspruch haben.\nDen Zugang zur Brückenteilzeit werden wir für mehr Beschäftigte möglich machen. \nCorona hat ein Schlaglicht darauf geworfen, wie groß bei manchen Berufsgruppen die Lücke \nzwischen Wert und Lohn ist. Dazu gehören die sozialen Dienstleistungsberufe. Es verdient große \nAnerkennung, dass immer mehr junge Menschen es sich vorstellen können, soziale Berufe zu er -\ngreifen, Mädchen genauso wie Jungen - es sind Berufe mit Bedeutung und Zukunft. Hier entstehen \ndie meisten Arbeitsplätze.\nIn der Pflege wird enorme und gesellschaftlich wertvolle Arbeit geleistet. Wir wollen die Lohn- und \nArbeitsbedingungen in der Altenpflege und Pflege von Menschen mit Behinderung schnell verbes-\nsern. Unsere Ziele sind allgemeinverbindliche Branchentarifverträge. Wie werden über die Pflege-\nmindestlohnkommission eine weitere Erhöhung der Mindestlöhne verfolgen.'
 'Es hat sich bewährt, sinnvolle und sozial abgesicherte Tätigkeiten zu schaffen. Wir werden den \nsozialen Arbeitsmarkt ausbauen und weiterentwickeln. Auch weiterhin werden wir Arbeitgeber \nmit Lohnkostenzuschüssen unterstützen, die Langzeitarbeitslose sozialversicherungspflichtig ein-\nstellen. \nDie Grundsicherung werden wir grundlegend überarbeiten und zu einem Bürgergeld entwickeln. \nUnser Bürgergeld steht für ein neues Verständnis eines haltgebenden und bürgernahen Sozial-\nstaats. Das Bürgergeld soll digital und unkompliziert zugänglich sein. Bescheide und Schriftwech-\nsel sollen eine verständliche Sprache sprechen. Die Regelsätze im neuen Bürgergeld müssen zu \neinem Leben in Würde ausreichen und zur gesellschaftlichen Teilhabe befähigen. Das Bürgergeld \nmuss absichern, dass eine kaputte Waschmaschine oder eine neue Winterjacke nicht zur untrag-\nbaren Last werden. Die Kriterien zur Regelsatzermittlung werden wir weiterentwickeln und Betrof -\nfene und Sozialverbände mit einbeziehen. \nDas Ziel muss sein, die hilfsbedürftige Lebenslage gemeinsam zu bezwingen und allen eine Be-\nschäftigung und, falls erforderlich, eine Qualifizierung und Weiterbildung zu ermöglichen. Wir set -\nzen auf eine umfassende und passgenaue Unterstützung, die die gesamte Bedarfsgemeinschaft \nin den Blick nimmt - auf Qualität und gute Netzwerke statt auf eine reine Kennzahlenlogik. Wir \nwerden die gesetzlichen, personellen und finanziellen Rahmenbedingungen weiter so verbessern, \ndass die Jobcenter und ihre Beschäftigten diesem Auftrag nachkommen können.'
 'Dadurch können sich die Be-\nhörden und die Betroffenen in den ersten Monaten mit voller Energie auf eine sinnvolle Wieder -\naufnahme der Beschäftigung konzentrieren. Die guten Erfahrungen aus diesen vorübergehenden \nMaßnahmen haben uns darin bestätigt, dafür zu sorgen, dass auch in Zukunft Vermögen und \nWohnungsgröße innerhalb der ersten zwei Jahre nicht überprüft werden und das Schonvermögen \nerhöht wird. Das Bürgergeld beinhaltet Mitwirkungspflichten, setzt aber konsequent auf Hilfe und \nErmutigung. Eingliederungsvereinbarungen werden durch eine gemeinsame und auf Augenhöhe \nerarbeitete Teilhabevereinbarung ersetzt. Bei ihrer Umsetzung setzen wir auf Befähigung und Be-\nstärkung und nicht auf Vorgaben und Zwang. Sinnwidrige und unwürdige Sanktionen schaffen wir \nab. Das sozioökonomische und soziokulturelle Existenzminimum muss jederzeit gesichert sein.\nDie Leistungen des Sozialstaates sind soziale Rechte – wer sie benötigt, sollte nicht lange suchen \nmüssen. Unser Ziel ist es, die Leistungen ohne Hürden und Umwege zugänglich zu machen. Wir \nwollen einen Bürgerservice, der nach Lebenslagen berät und alle Leistungen aus einer Hand zu-\ngänglich macht. Er ist digital und aufsuchend, wo der Weg zu beschwerlich ist. Ein zugewandter \nSozialstaat hilft, Rechtsansprüche geltend zu machen, und begleitet auch danach beratend alle \nSchritte.']","Die Gleitzone der Midi-Jobs soll auf 1.600 Euro angehoben werden, um die Nettoeinkommen von gering Verdienenden zu erhöhen.","Um die Nettoeinkommen von gering Verdienenden zu erhöhen, heben wir die Gleitzone der Midi-Jobs auf 1.600 Euro an.",1.0,0.9430274853030239,0.9999999999,1.0
52,"Welche Maßnahmen sind geplant, um die Arbeitsbedingungen in der Post- und Paketdienstbranche zu verbessern?","['Dafür werden wir eine attraktive, vergütete und schulgeldfreie Ausbildung schaffen, für mehr \nAusbildungskapazitäten an Fachschulen und in den Studiengängen zur sozialen Arbeit und Kind-\nheitspädagogik sorgen, mehr Karriereoptionen für die Fachkräfte schaffen und Beschäftigungsver -\nhältnisse anstreben, die eine eigenständige Existenzsicherung ermöglichen.\nDie Krise hat gezeigt, wie unverzichtbar und wichtig funktionierende Postdienste und Paketdiens-\nte für die Daseinsvorsorge in Deutschland sind. Die Arbeitsbedingungen in dieser Branche sind oft \nschlecht. Es gibt viele ungesicherte Arbeitsverhältnisse durch Scheinselbständigkeit und Subunter -\nnehmertum. Eine Zerschlagung der Deutschen Post und eine vollständige Privatisierung werden \nwir verhindern und unfaire Wettbewerbsvorteile von Digitalkonzernen auch in diesem Bereich \nbeseitigen. Wir werden die Branche sozial und ökologisch ausrichten.\nDer Erfolg der Unternehmen wird von ihren Beschäftigten erarbeitet. Deshalb verbessern wir \nderen Mitbestimmung. Wir werden sie auf Unternehmen in ausländischer Rechtsform erweitern. \nWir werden den Geltungsbereich der Mitbestimmung durch die Absenkung der Schwellenwerte \nder Unternehmensgrößen erweitern. Entscheidungen zur Verlagerung oder Schließungen von Be-\ntriebsstandorten sollen nicht über die Köpfe der Beschäftigten hinweg getroffen werden. Darum \nstärken wir durch eine echte Parität in den Aufsichtsräten den Einfluss der Arbeitnehmer*innen.'
 'Nun werden \nwir im Umkehrschluss die Refinanzierung der Pflegeleistungen an die Geltung von Tarifverträgen \nbinden.\nEs gibt einen gewaltigen Personalmangel in den Krankenhäusern und Pflegeeinrichtungen. Soziale \nArbeit aufwerten heißt für uns auch, dass die Arbeits- und Stressbelastung gesenkt werden muss. \nWir werden deshalb den Vorschlag eines neuen, bundesweiten und einheitlichen Personalbemes-\nsungsrahmens voranbringen. Pfleger*innen müssen sich beruflich weiterentwickeln können.\nAuch die Arbeit mit Kindern und Jugendlichen wird von gut ausgebildeten Fachkräften geleistet. \nErzieher*innen, Lehrer*innen, Sozialpädagog*innen und Beschäftigte in der Jugendhilfe machen \nmit großem Engagement und viel Leidenschaft ihre Arbeit, doch auch hier fehlt es an Personal. \nMit gezielten Impulsen zur Fachkräftesicherung werden wir die Länder beim weiteren Ausbau von \nKitas, Ganztagsbetreuung an Schulen und Jugendeinrichtungen unterstützen. Unser Ziel ist es, \ndie Zahl der Nachwuchskräfte in den erzieherischen Berufen bis 2030 bundesweit zu verdoppeln. \nDafür werden wir eine attraktive, vergütete und schulgeldfreie Ausbildung schaffen, für mehr \nAusbildungskapazitäten an Fachschulen und in den Studiengängen zur sozialen Arbeit und Kind-\nheitspädagogik sorgen, mehr Karriereoptionen für die Fachkräfte schaffen und Beschäftigungsver -\nhältnisse anstreben, die eine eigenständige Existenzsicherung ermöglichen.\nDie Krise hat gezeigt, wie unverzichtbar und wichtig funktionierende Postdienste und Paketdiens-\nte für die Daseinsvorsorge in Deutschland sind. Die Arbeitsbedingungen in dieser Branche sind oft \nschlecht.'
 'Das Zukunftsprogramm der SPD\nKapitel 3Seite >28\nSPD-Parteivorstand 2021Die Corona-Krise hat erneut gezeigt, dass die soziale Sicherung der Minijobs unzureichend ist. \nUnser Ziel ist, alle Beschäftigungsverhältnisse in die soziale Sicherung einzubeziehen. Dabei wird \nes Übergänge für bestehende Arbeitsverhältnisse und Ausnahmen für bestimmte Gruppen wie \nzum Beispiel Rentner*innen geben. Um die Nettoeinkommen von gering Verdienenden zu erhö-\nhen, heben wir die Gleitzone der Midi-Jobs auf 1.600 Euro an. In dieser Zone zahlen die Arbeitneh-\nmer*innen geringere Beiträge, ohne dass sie dadurch einen geringeren Rentenanspruch haben.\nDen Zugang zur Brückenteilzeit werden wir für mehr Beschäftigte möglich machen. \nCorona hat ein Schlaglicht darauf geworfen, wie groß bei manchen Berufsgruppen die Lücke \nzwischen Wert und Lohn ist. Dazu gehören die sozialen Dienstleistungsberufe. Es verdient große \nAnerkennung, dass immer mehr junge Menschen es sich vorstellen können, soziale Berufe zu er -\ngreifen, Mädchen genauso wie Jungen - es sind Berufe mit Bedeutung und Zukunft. Hier entstehen \ndie meisten Arbeitsplätze.\nIn der Pflege wird enorme und gesellschaftlich wertvolle Arbeit geleistet. Wir wollen die Lohn- und \nArbeitsbedingungen in der Altenpflege und Pflege von Menschen mit Behinderung schnell verbes-\nsern. Unsere Ziele sind allgemeinverbindliche Branchentarifverträge. Wie werden über die Pflege-\nmindestlohnkommission eine weitere Erhöhung der Mindestlöhne verfolgen.']","Es sind geplant, eine attraktive, vergütete und schulgeldfreie Ausbildung zu schaffen, mehr Ausbildungskapazitäten in den relevanten Bereichen zu erhöhen und Beschäftigungsverhältnisse anzustreben, die eine eigenständige Existenzsicherung ermöglichen. Zudem soll die Zerschlagung der Deutschen Post verhindert und unfaire Wettbewerbsvorteile von Digitalkonzernen beseitigt werden, um die Arbeitsbedingungen in der Post- und Paketdienstbranche zu verbessern. Die Branche soll auch sozial und ökologisch ausgerichtet werden.",Wir werden die Branche sozial und ökologisch ausrichten. Eine Zerschlagung der Deutschen Post und eine vollständige Privatisierung werden wir verhindern und unfaire Wettbewerbsvorteile von Digitalkonzernen auch in diesem Bereich beseitigen.,0.9,0.9999999999999991,0.9999999999,1.0
53,Wie soll der Kündigungsschutz für Betriebsrät*innen verändert werden?,"['Unser ist Ziel ist, dass deutlich\xa0mehr Beschäftigte in \neiner betrieblichen Altersversorgung abgesichert sind. Dabei\xa0sollten tarifvertraglich vereinbarte \nkollektive Altersversorgungsformen bevorzugt\xa0werden. Zudem setzen wir uns für die vollständi-\nge Abschaffung der Vollverbeitragung\xa0sowie\xa0 der Doppelverbeitragung von Betriebsrenten in der \ngesetzlichen\xa0Krankenversicherung ein.\xa0\nWir wollen allen gesetzlich verpflichtet Versicherten zusätzlich die Möglichkeit\xa0einräumen, sich \nin angemessenem Umfang ergänzend freiwillig in der gesetzlichen\xa0Rentenversicherung zu versi-\nchern.\nEine ergänzende private Altersvorsorge ist kein Ersatz für die gesetzliche Rente. Die\xa0bisherigen Er -\ngebnisse der Riester-Rente sind nicht zufriedenstellend. Wir wollen\xa0daher bei klassischen privaten \nAngeboten der Altersvorsorge bürokratische Hemmnisse\xa0abbauen und Kosten senken. Um den \nBürgerinnen und Bürgern eine attraktive private\xa0Altersvorsorge zu ermöglichen, setzen wir uns für \nein neues standardisiertes Angebot\xa0ein, das kostengünstig ist, digital und grenzüberschreitend \nund (nach schwedischem\xa0Vorbild) auch von einer öffentlichen Institution angeboten wird. Die För -\nderung neuer\xa0Verträge werden wir in Form von Zuschüssen auf untere und mittlere Einkommens-\ngruppen\xa0beschränken.'
 'Wir werden die Schutzfunktion des Arbeitszeitgesetzes \nerhalten. Eine Verlängerung der täglichen Arbeitszeit schließen wir aus. Wenn die Arbeit durch \nProduktivitätsgewinne weniger werden sollte, müssen alle davon profitieren. Da wo Gewerkschaf -\nten für die Absenkung von Arbeitszeit streiten, um mehr selbstbestimmte Zeit zu ermöglichen \noder Beschäftigung zu sichern, stehen wir an ihrer Seite.\nFür viele Menschen ist Selbständigkeit eine attraktive Form der Erwerbstätigkeit. Unternehmer -\ngeist fördert dringend benötigte Innovationen. Wir schaffen ein Klima, das Selbständigkeit positiv \naufnimmt und unterstützt. Dazu gehört, dass offensichtliche Schutzlücken bei kleinen Selbstän-\ndigen und Kreativen beseitigt werden und deren soziale Absicherung verbessert wird. Die Corona-\nKrise hat uns deutlicher denn je vor Augen geführt, wie schnell man ohne eigenes Zutun in Not \ngerät und wie schnell Rücklagen aufgebraucht sind. Wir werden darum Solo-Selbständige, dar -\nunter sind beispielsweise viele Künstler*innen, Autor*innen, Maler*innen, Übersetzer*innen, Ent -\nwickler*innen, besser absichern. Dafür werden wir die Absicherung in der Künstlersozialversiche-\nrung ebenso wie in der Renten-, Kranken- und Arbeitslosenversicherung verbessern. Der Wechsel \nzwischen versicherungspflichtiger Beschäftigung und Selbständigkeit ist keine Ausnahme mehr.'
 'Damit halten wir den Betroffe-\nnen den Rücken frei, um sich auf das Wesentliche konzentrieren zu können: Neue Arbeit zu finden, \num wieder auf eigenen Beinen zu stehen.\nWir schaffen ein Recht auf Weiterbildung und beruflichen Neustart in allen Lebensphasen. Jede*r \neinzelne wird bei den bevorstehenden Veränderungen unterstützt. Wir werden ein Recht schaffen, \ndas es Arbeitnehmer*innen auch mit 40plus ermöglicht, noch einmal einen ganz neuen Beruf zu \nerlernen.\nMit unserem Modell der geförderten Bildungszeit und Bildungsteilzeit werden wir ermöglichen, \ndass alle Erwerbstätigen im Lauf ihres Erwerbslebens auf eigene Initiative und mit staatlicher \nUnterstützung unabhängig vom Betrieb sich weiterbilden oder umschulen können. Wer Bildungs-\nzeit oder Bildungsteilzeit beantragt, erhält ein Recht, sich von seinem Beruf freistellen zu lassen \noder die Arbeitszeit zu reduzieren. Die Bildungszeiten werden wir mit einer finanziellen Förde-\nrung ausgestalten, die Lohneinbußen während der Weiterbildung oder Umschulung angemessen \nkompensiert – und zwar lange genug, um anerkannte Abschlüsse zu erwerben. Bei den Kosten für \ndie Weiterbildungsmaßnahme werden wir diejenigen unterstützen, die die Mittel nicht oder nicht \nvollständig aus eigener Tasche aufbringen können.']",Es gibt keine spezifischen Informationen zur Veränderung des Kündigungsschutzes für Betriebsrät*innen in den bereitgestellten Kontexten.,Wir werden den Kündigungsschutz für Betriebsrät*innen ausweiten und eine Behinderung von Betriebsratsarbeit stärker verfolgen.,1.0,0.0,0.0,0.0
54,"Sollen Unternehmen selbst entscheiden, ob sie ihren Beschäftigten das Arbeiten im Homeoffice erlauben?","['Mit der Digitalisierung wird Arbeit immer häufiger ortsunabhängig erledigt oder über Plattformen \norganisiert. Auch hier müssen Arbeitnehmer*innenrechte unvermindert gültig und wirksam sein. \nGewerkschaften sollen ein digitales Zugangsrecht zum „virtuellen“ Betrieb erhalten. Beschäftigte \nauf Plattformen sollen sich zusammenschließen können, um gemeinsam grundlegende Bedingun-\ngen ihrer Tätigkeit mit den Plattformen aushandeln können. Wir wollen, dass der Arbeitnehmer -\nstatus einfacher geklärt werden kann. Wir werden ein Verbandsklagerecht der Gewerkschaften \nund ein Beschäftigtendatenschutzgesetz einführen.\nDie Corona-Krise hat Teile der Arbeitswelt auf den Kopf gestellt, das Homeoffice hat an Bedeutung \ngewonnen. Der Schreibtisch in den eigenen vier Wänden und Videokonferenzen statt persönlicher \nBegegnung waren anfangs ungewohnt, sind aber inzwischen Alltag und Routine für viele Bür -\nger*innen.\nWir werden einen Rechtsanspruch auf mobile Arbeit einführen. Grundsätzlich sollen Beschäftigte \nbei einer Fünf-Tage-Woche mindestens 24 Tage im Jahr mobil oder im Homeoffice arbeiten kön-\nnen, wenn es die Tätigkeit erlaubt. Klar ist, dass das nicht in Rundum-die-Uhr-Arbeiten ausarten \ndarf – auch im Homeoffice müssen Arbeits- und Ruhezeiten gelten, die Arbeitszeit muss jeden Tag \nvollständig erfasst werden und es braucht ein Recht auf Nichterreichbarkeitszeiten, auf technische \nAusstattung sowie guten Unfallversicherungsschutz. Um betriebliche Regelungen zur mobilen \nArbeit zu fördern, schaffen wir ein Mitbestimmungsrecht zur Einführung und bei der Ausgestal-\ntung mobiler Arbeit.'
 'Wir werden einen Rechtsanspruch auf mobile Arbeit einführen. Grundsätzlich sollen Beschäftigte \nbei einer Fünf-Tage-Woche mindestens 24 Tage im Jahr mobil oder im Homeoffice arbeiten kön-\nnen, wenn es die Tätigkeit erlaubt. Klar ist, dass das nicht in Rundum-die-Uhr-Arbeiten ausarten \ndarf – auch im Homeoffice müssen Arbeits- und Ruhezeiten gelten, die Arbeitszeit muss jeden Tag \nvollständig erfasst werden und es braucht ein Recht auf Nichterreichbarkeitszeiten, auf technische \nAusstattung sowie guten Unfallversicherungsschutz. Um betriebliche Regelungen zur mobilen \nArbeit zu fördern, schaffen wir ein Mitbestimmungsrecht zur Einführung und bei der Ausgestal-\ntung mobiler Arbeit. Der Grundsatz der Freiwilligkeit der mobilen Arbeit für Arbeitnehmer*innen \nist für uns Voraussetzung.\nWir sorgen dafür, dass vom Wandel der Arbeitswelt alle profitieren. Dazu gehört, dass Arbeitszei-\nten besser zum Leben passen und Menschen mehr selbstbestimmte Zeit haben – etwa für Familie, \nsoziales Engagement und Weiterbildung. Wir werden die Schutzfunktion des Arbeitszeitgesetzes \nerhalten. Eine Verlängerung der täglichen Arbeitszeit schließen wir aus. Wenn die Arbeit durch \nProduktivitätsgewinne weniger werden sollte, müssen alle davon profitieren. Da wo Gewerkschaf -\nten für die Absenkung von Arbeitszeit streiten, um mehr selbstbestimmte Zeit zu ermöglichen \noder Beschäftigung zu sichern, stehen wir an ihrer Seite.\nFür viele Menschen ist Selbständigkeit eine attraktive Form der Erwerbstätigkeit. Unternehmer -\ngeist fördert dringend benötigte Innovationen. Wir schaffen ein Klima, das Selbständigkeit positiv \naufnimmt und unterstützt.'
 'Wir werden die Schutzfunktion des Arbeitszeitgesetzes \nerhalten. Eine Verlängerung der täglichen Arbeitszeit schließen wir aus. Wenn die Arbeit durch \nProduktivitätsgewinne weniger werden sollte, müssen alle davon profitieren. Da wo Gewerkschaf -\nten für die Absenkung von Arbeitszeit streiten, um mehr selbstbestimmte Zeit zu ermöglichen \noder Beschäftigung zu sichern, stehen wir an ihrer Seite.\nFür viele Menschen ist Selbständigkeit eine attraktive Form der Erwerbstätigkeit. Unternehmer -\ngeist fördert dringend benötigte Innovationen. Wir schaffen ein Klima, das Selbständigkeit positiv \naufnimmt und unterstützt. Dazu gehört, dass offensichtliche Schutzlücken bei kleinen Selbstän-\ndigen und Kreativen beseitigt werden und deren soziale Absicherung verbessert wird. Die Corona-\nKrise hat uns deutlicher denn je vor Augen geführt, wie schnell man ohne eigenes Zutun in Not \ngerät und wie schnell Rücklagen aufgebraucht sind. Wir werden darum Solo-Selbständige, dar -\nunter sind beispielsweise viele Künstler*innen, Autor*innen, Maler*innen, Übersetzer*innen, Ent -\nwickler*innen, besser absichern. Dafür werden wir die Absicherung in der Künstlersozialversiche-\nrung ebenso wie in der Renten-, Kranken- und Arbeitslosenversicherung verbessern. Der Wechsel \nzwischen versicherungspflichtiger Beschäftigung und Selbständigkeit ist keine Ausnahme mehr.']","Unternehmen sollen nicht selbst entscheiden können, ob sie ihren Beschäftigten das Arbeiten im Homeoffice erlauben, da ein Rechtsanspruch auf mobile Arbeit eingeführt werden soll, der mindestens 24 Tage im Jahr im Homeoffice vorsieht. Es wird betont, dass klare Arbeits- und Ruhezeiten auch im Homeoffice gelten müssen, um die Arbeitsbedingungen zu regeln.","Wir werden einen Rechtsanspruch auf mobile Arbeit einführen. Grundsätzlich sollen Beschäftigte bei einer Fünf-Tage-Woche mindestens 24 Tage im Jahr mobil oder im Homeoffice arbeiten können, wenn es die Tätigkeit erlaubt.",0.8333333333333334,0.9648258200364704,0.99999999995,1.0
55,Wie soll die Arbeitszeit im Homeoffice geregelt werden?,"['Wir werden einen Rechtsanspruch auf mobile Arbeit einführen. Grundsätzlich sollen Beschäftigte \nbei einer Fünf-Tage-Woche mindestens 24 Tage im Jahr mobil oder im Homeoffice arbeiten kön-\nnen, wenn es die Tätigkeit erlaubt. Klar ist, dass das nicht in Rundum-die-Uhr-Arbeiten ausarten \ndarf – auch im Homeoffice müssen Arbeits- und Ruhezeiten gelten, die Arbeitszeit muss jeden Tag \nvollständig erfasst werden und es braucht ein Recht auf Nichterreichbarkeitszeiten, auf technische \nAusstattung sowie guten Unfallversicherungsschutz. Um betriebliche Regelungen zur mobilen \nArbeit zu fördern, schaffen wir ein Mitbestimmungsrecht zur Einführung und bei der Ausgestal-\ntung mobiler Arbeit. Der Grundsatz der Freiwilligkeit der mobilen Arbeit für Arbeitnehmer*innen \nist für uns Voraussetzung.\nWir sorgen dafür, dass vom Wandel der Arbeitswelt alle profitieren. Dazu gehört, dass Arbeitszei-\nten besser zum Leben passen und Menschen mehr selbstbestimmte Zeit haben – etwa für Familie, \nsoziales Engagement und Weiterbildung. Wir werden die Schutzfunktion des Arbeitszeitgesetzes \nerhalten. Eine Verlängerung der täglichen Arbeitszeit schließen wir aus. Wenn die Arbeit durch \nProduktivitätsgewinne weniger werden sollte, müssen alle davon profitieren. Da wo Gewerkschaf -\nten für die Absenkung von Arbeitszeit streiten, um mehr selbstbestimmte Zeit zu ermöglichen \noder Beschäftigung zu sichern, stehen wir an ihrer Seite.\nFür viele Menschen ist Selbständigkeit eine attraktive Form der Erwerbstätigkeit. Unternehmer -\ngeist fördert dringend benötigte Innovationen. Wir schaffen ein Klima, das Selbständigkeit positiv \naufnimmt und unterstützt.'
 'Mit der Digitalisierung wird Arbeit immer häufiger ortsunabhängig erledigt oder über Plattformen \norganisiert. Auch hier müssen Arbeitnehmer*innenrechte unvermindert gültig und wirksam sein. \nGewerkschaften sollen ein digitales Zugangsrecht zum „virtuellen“ Betrieb erhalten. Beschäftigte \nauf Plattformen sollen sich zusammenschließen können, um gemeinsam grundlegende Bedingun-\ngen ihrer Tätigkeit mit den Plattformen aushandeln können. Wir wollen, dass der Arbeitnehmer -\nstatus einfacher geklärt werden kann. Wir werden ein Verbandsklagerecht der Gewerkschaften \nund ein Beschäftigtendatenschutzgesetz einführen.\nDie Corona-Krise hat Teile der Arbeitswelt auf den Kopf gestellt, das Homeoffice hat an Bedeutung \ngewonnen. Der Schreibtisch in den eigenen vier Wänden und Videokonferenzen statt persönlicher \nBegegnung waren anfangs ungewohnt, sind aber inzwischen Alltag und Routine für viele Bür -\nger*innen.\nWir werden einen Rechtsanspruch auf mobile Arbeit einführen. Grundsätzlich sollen Beschäftigte \nbei einer Fünf-Tage-Woche mindestens 24 Tage im Jahr mobil oder im Homeoffice arbeiten kön-\nnen, wenn es die Tätigkeit erlaubt. Klar ist, dass das nicht in Rundum-die-Uhr-Arbeiten ausarten \ndarf – auch im Homeoffice müssen Arbeits- und Ruhezeiten gelten, die Arbeitszeit muss jeden Tag \nvollständig erfasst werden und es braucht ein Recht auf Nichterreichbarkeitszeiten, auf technische \nAusstattung sowie guten Unfallversicherungsschutz. Um betriebliche Regelungen zur mobilen \nArbeit zu fördern, schaffen wir ein Mitbestimmungsrecht zur Einführung und bei der Ausgestal-\ntung mobiler Arbeit.'
 'Wir werden die Schutzfunktion des Arbeitszeitgesetzes \nerhalten. Eine Verlängerung der täglichen Arbeitszeit schließen wir aus. Wenn die Arbeit durch \nProduktivitätsgewinne weniger werden sollte, müssen alle davon profitieren. Da wo Gewerkschaf -\nten für die Absenkung von Arbeitszeit streiten, um mehr selbstbestimmte Zeit zu ermöglichen \noder Beschäftigung zu sichern, stehen wir an ihrer Seite.\nFür viele Menschen ist Selbständigkeit eine attraktive Form der Erwerbstätigkeit. Unternehmer -\ngeist fördert dringend benötigte Innovationen. Wir schaffen ein Klima, das Selbständigkeit positiv \naufnimmt und unterstützt. Dazu gehört, dass offensichtliche Schutzlücken bei kleinen Selbstän-\ndigen und Kreativen beseitigt werden und deren soziale Absicherung verbessert wird. Die Corona-\nKrise hat uns deutlicher denn je vor Augen geführt, wie schnell man ohne eigenes Zutun in Not \ngerät und wie schnell Rücklagen aufgebraucht sind. Wir werden darum Solo-Selbständige, dar -\nunter sind beispielsweise viele Künstler*innen, Autor*innen, Maler*innen, Übersetzer*innen, Ent -\nwickler*innen, besser absichern. Dafür werden wir die Absicherung in der Künstlersozialversiche-\nrung ebenso wie in der Renten-, Kranken- und Arbeitslosenversicherung verbessern. Der Wechsel \nzwischen versicherungspflichtiger Beschäftigung und Selbständigkeit ist keine Ausnahme mehr.']","Die Arbeitszeit im Homeoffice soll durch einen Rechtsanspruch auf mobile Arbeit geregelt werden. Beschäftigte sollen mindestens 24 Tage im Jahr mobil oder im Homeoffice arbeiten können, wobei Arbeits- und Ruhezeiten eingehalten werden müssen. Es wird auch ein Recht auf Nichterreichbarkeitszeiten, technische Ausstattung und Unfallversicherungsschutz gewährt.","Klar ist, dass das nicht in Rundum-die-Uhr-Arbeiten ausarten darf - auch im Homeoffice müssen Arbeits- und Ruhezeiten gelten, die Arbeitszeit muss jeden Tag vollständig erfasst werden und es braucht ein Recht auf Nichterreichbarkeitszeiten, auf technische Ausstattung sowie guten Unfallversicherungsschutz.",1.0,1.0000000000000007,0.9999999999666667,1.0
56,Soll eine Pflicht zur Altersvorsorge eingeführt werden?,"['Unser ist Ziel ist, dass deutlich\xa0mehr Beschäftigte in \neiner betrieblichen Altersversorgung abgesichert sind. Dabei\xa0sollten tarifvertraglich vereinbarte \nkollektive Altersversorgungsformen bevorzugt\xa0werden. Zudem setzen wir uns für die vollständi-\nge Abschaffung der Vollverbeitragung\xa0sowie\xa0 der Doppelverbeitragung von Betriebsrenten in der \ngesetzlichen\xa0Krankenversicherung ein.\xa0\nWir wollen allen gesetzlich verpflichtet Versicherten zusätzlich die Möglichkeit\xa0einräumen, sich \nin angemessenem Umfang ergänzend freiwillig in der gesetzlichen\xa0Rentenversicherung zu versi-\nchern.\nEine ergänzende private Altersvorsorge ist kein Ersatz für die gesetzliche Rente. Die\xa0bisherigen Er -\ngebnisse der Riester-Rente sind nicht zufriedenstellend. Wir wollen\xa0daher bei klassischen privaten \nAngeboten der Altersvorsorge bürokratische Hemmnisse\xa0abbauen und Kosten senken. Um den \nBürgerinnen und Bürgern eine attraktive private\xa0Altersvorsorge zu ermöglichen, setzen wir uns für \nein neues standardisiertes Angebot\xa0ein, das kostengünstig ist, digital und grenzüberschreitend \nund (nach schwedischem\xa0Vorbild) auch von einer öffentlichen Institution angeboten wird. Die För -\nderung neuer\xa0Verträge werden wir in Form von Zuschüssen auf untere und mittlere Einkommens-\ngruppen\xa0beschränken.'
 'Wenn es zu einer Zusammenführung der Altersversorgung \nder Beamt*innen mit der gesetzlichen Rentenversicherung kommt, wird das Gesamtniveau ihrer \nAlterssicherung nicht reduziert.\xa0\nEs darf nicht sein, dass jemand wegen gesundheitlicher Beeinträchtigungen in Armut\xa0gerät. Wir \nwerden daher die Armutsrisiken bei den heutigen\xa0Erwerbsminderungsrentner*innen verringern \nund für sie Verbesserungen erreichen.\xa0\xa0Wir wollen eine geschlechtergerechte Rente. Unterschied-\nliche Arbeitszeiten und\xa0familienbedingte Tätigkeiten bei den Renten werden wir gerechter behan-\ndeln.\xa0Langjährige Pflege von Eltern, Schwiegereltern oder anderen Familienmitgliedern\xa0dürfen sich \nnicht mehr negativ auf die Rente auswirken und die eigene Altersarmut bedeuten. Hier brauchen \nwir mehr Solidarität und Respekt vor dieser schweren\xa0Aufgabe.\xa0\nWir haben es kleinen und mittleren Unternehmen erleichtert, für ihre Beschäftigten in\xa0die be-\ntriebliche Altersversorgung einzusteigen. Unser ist Ziel ist, dass deutlich\xa0mehr Beschäftigte in \neiner betrieblichen Altersversorgung abgesichert sind. Dabei\xa0sollten tarifvertraglich vereinbarte \nkollektive Altersversorgungsformen bevorzugt\xa0werden. Zudem setzen wir uns für die vollständi-\nge Abschaffung der Vollverbeitragung\xa0sowie\xa0 der Doppelverbeitragung von Betriebsrenten in der \ngesetzlichen\xa0Krankenversicherung ein.\xa0\nWir wollen allen gesetzlich verpflichtet Versicherten zusätzlich die Möglichkeit\xa0einräumen, sich \nin angemessenem Umfang ergänzend freiwillig in der gesetzlichen\xa0Rentenversicherung zu versi-\nchern.'
 'In Parlament und Re-\ngierung haben wir uns erfolgreich für die Grundrente eingesetzt. Sie ist ein Fortschritt und schützt \nviele Menschen, die Jahrzehnte für geringe Löhne gearbeitet haben, vor dem Risiko im Alter arm \nzu sein.\xa0\nImmer wieder fordern Arbeitgeber und konservative Kräfte, dass Menschen für eine gute Rente \nnoch länger arbeiten sollen. Wir lehnen eine weitere Anhebung des gesetzlichen\xa0Renteneintritts-\nalters ab, weil sie für viele, die nicht länger arbeiten können, eine Rentenkürzung bedeutet und \nungerecht ist. Den gesetzlichen Anspruch, dass besonders langjährig Versicherte vor Erreichen der \nRegelaltersgrenze abschlagsfrei in Rente gehen können, werden wir beibehalten. Solidarität in der \nAlterssicherung bedeutet für uns zudem, dass auch die Selbstständigen, Beamt*innen, freien Be-\nrufe und Mandatsträger*innen der gesetzlichen Rentenversicherung angehören. Es ist an der Zeit, \ndie Gesamtheit der Erwerbstätigen in die Rentenversicherung aufzunehmen und die Sondersys-\nteme auf lange Sicht zu überwinden. Wenn es zu einer Zusammenführung der Altersversorgung \nder Beamt*innen mit der gesetzlichen Rentenversicherung kommt, wird das Gesamtniveau ihrer \nAlterssicherung nicht reduziert.\xa0\nEs darf nicht sein, dass jemand wegen gesundheitlicher Beeinträchtigungen in Armut\xa0gerät. Wir \nwerden daher die Armutsrisiken bei den heutigen\xa0Erwerbsminderungsrentner*innen verringern \nund für sie Verbesserungen erreichen.\xa0\xa0Wir wollen eine geschlechtergerechte Rente. Unterschied-\nliche Arbeitszeiten und\xa0familienbedingte Tätigkeiten bei den Renten werden wir gerechter behan-\ndeln.']","Ja, die Partei setzt sich für die Abschaffung der Vollverbeitragung und Doppelverbeitragung von Betriebsrenten in der gesetzlichen Krankenversicherung ein, bevorzugt tarifvertraglich vereinbarte kollektive Altersversorgungsformen und fördert ergänzende private Altersvorsorge als Zusatz zur gesetzlichen Rente.",Wir werden eine grundsätzliche Pflicht zur Altersvorsorge einführen und Selbständige schrittweise in die gesetzliche Rentenversicherung integrieren.,0.75,0.8817580541993096,0.3333333333,0.0
57,Wie sollen Solo-Selbständige bei unvorhersehbaren Einnahmeausfällen abgesichert werden?,"['Das Zukunftsprogramm der SPD\nKapitel 3Seite >30\nSPD-Parteivorstand 2021Wer Neues wagt, braucht Sicherheit. Die bestehende freiwillige Weiterversicherung in der Arbeits-\nlosenversicherung bietet ein solches Netz. Wir werden den Zugang verbessern und mehr Sicher -\nheit im Bedarfsfall schaffen. Die Regelungen für die ständigen und nicht ständig Beschäftigten \nzum Beispiel im Bereich des Films und der Theater werden wir deutlich vereinfachen und die \nsozialversicherungspflichtige Beschäftigung stärken und ausbauen. Wir werden eine grundsätz -\nliche Pflicht zur Altersvorsorge einführen und Selbständige schrittweise in die gesetzliche Renten-\nversicherung integrieren. Die Mindestbeiträge zur Krankenversicherung für Selbständige haben \nwir bereits um mehr als die Hälfte gesenkt. Unser Ziel sind einkommensabhängige Beiträge wie \nbei abhängig Beschäftigten.\nWir werden auch Solo-Selbständige besser absichern, deren Geschäftsmodell sie grundsätzlich \nträgt, wo jedoch unvorhersehbare erhebliche Einnahmeausfälle, etwa durch den kurzfristigen \nWegfall von Auftraggebern, zu Notlagen führt. Mit einem Sicherungsgeld schaffen wir einen \nneuen Weg der solidarischen Absicherung für Selbständige in Notlagen, die über branchen- und \nsaisonübliche Schwankungen hinausgehen, durch die Bundesagentur für Arbeit. Das Sicherungs-\ngeld soll mit Leistungen der Arbeitslosenversicherung vergleichbar sein. Das durch Beiträge der \nSelbständigen finanzierte Sicherungsgeld hat dabei Vorrang vor Leistungen der Grundsicherung.'
 'Wir werden die Schutzfunktion des Arbeitszeitgesetzes \nerhalten. Eine Verlängerung der täglichen Arbeitszeit schließen wir aus. Wenn die Arbeit durch \nProduktivitätsgewinne weniger werden sollte, müssen alle davon profitieren. Da wo Gewerkschaf -\nten für die Absenkung von Arbeitszeit streiten, um mehr selbstbestimmte Zeit zu ermöglichen \noder Beschäftigung zu sichern, stehen wir an ihrer Seite.\nFür viele Menschen ist Selbständigkeit eine attraktive Form der Erwerbstätigkeit. Unternehmer -\ngeist fördert dringend benötigte Innovationen. Wir schaffen ein Klima, das Selbständigkeit positiv \naufnimmt und unterstützt. Dazu gehört, dass offensichtliche Schutzlücken bei kleinen Selbstän-\ndigen und Kreativen beseitigt werden und deren soziale Absicherung verbessert wird. Die Corona-\nKrise hat uns deutlicher denn je vor Augen geführt, wie schnell man ohne eigenes Zutun in Not \ngerät und wie schnell Rücklagen aufgebraucht sind. Wir werden darum Solo-Selbständige, dar -\nunter sind beispielsweise viele Künstler*innen, Autor*innen, Maler*innen, Übersetzer*innen, Ent -\nwickler*innen, besser absichern. Dafür werden wir die Absicherung in der Künstlersozialversiche-\nrung ebenso wie in der Renten-, Kranken- und Arbeitslosenversicherung verbessern. Der Wechsel \nzwischen versicherungspflichtiger Beschäftigung und Selbständigkeit ist keine Ausnahme mehr.'
 'Unser ist Ziel ist, dass deutlich\xa0mehr Beschäftigte in \neiner betrieblichen Altersversorgung abgesichert sind. Dabei\xa0sollten tarifvertraglich vereinbarte \nkollektive Altersversorgungsformen bevorzugt\xa0werden. Zudem setzen wir uns für die vollständi-\nge Abschaffung der Vollverbeitragung\xa0sowie\xa0 der Doppelverbeitragung von Betriebsrenten in der \ngesetzlichen\xa0Krankenversicherung ein.\xa0\nWir wollen allen gesetzlich verpflichtet Versicherten zusätzlich die Möglichkeit\xa0einräumen, sich \nin angemessenem Umfang ergänzend freiwillig in der gesetzlichen\xa0Rentenversicherung zu versi-\nchern.\nEine ergänzende private Altersvorsorge ist kein Ersatz für die gesetzliche Rente. Die\xa0bisherigen Er -\ngebnisse der Riester-Rente sind nicht zufriedenstellend. Wir wollen\xa0daher bei klassischen privaten \nAngeboten der Altersvorsorge bürokratische Hemmnisse\xa0abbauen und Kosten senken. Um den \nBürgerinnen und Bürgern eine attraktive private\xa0Altersvorsorge zu ermöglichen, setzen wir uns für \nein neues standardisiertes Angebot\xa0ein, das kostengünstig ist, digital und grenzüberschreitend \nund (nach schwedischem\xa0Vorbild) auch von einer öffentlichen Institution angeboten wird. Die För -\nderung neuer\xa0Verträge werden wir in Form von Zuschüssen auf untere und mittlere Einkommens-\ngruppen\xa0beschränken.']","Solo-Selbständige sollen besser abgesichert werden, indem ein Sicherungsgeld eingeführt wird, das über branchen- und saisonübliche Schwankungen hinausgeht und mit Leistungen der Arbeitslosenversicherung vergleichbar ist. Das Sicherungsgeld wird durch Beiträge der Selbständigen finanziert und hat Vorrang vor Leistungen der Grundsicherung.","Mit einem Sicherungsgeld schaffen wir einen neuen Weg der solidarischen Absicherung für Selbständige in Notlagen, die über branchen- und saisonübliche Schwankungen hinausgehen, durch die Bundesagentur für Arbeit. Das Sicherungsgeld soll mit Leistungen der Arbeitslosenversicherung vergleichbar sein.",1.0,0.9509391831984679,0.9999999999,1.0
58,Soll es eine Ausbildungsgarantie geben?,"['Das Zukunftsprogramm der SPD\nKapitel 3Seite >31\nSPD-Parteivorstand 20213.2. Berufschancen erhöhen\nWir setzen uns für eine Ausbildungsgarantie ein. Junge Berufsanfänger*innen brauchen eine \nChance, in das Berufsleben einzusteigen. Sie verdienen Respekt ebenso wie jene, die einen be-\nruflichen Neustart wagen. Für uns bleibt die Vermittlung junger Menschen in eine betriebliche \nAusbildung oberstes Ziel. Denn die duale Ausbildung ist ein Erfolgsmodell, das wir vollumfänglich \nstärken wollen. Alle Unternehmen, vor allem größere, müssen jedoch mehr Verantwortung für \ndie Schaffung von ausreichend Ausbildungsplätzen übernehmen. Wir unterstützen das Mittel der \nUmlagen bzw. Fonds, beispielsweise branchenbezogen, dort wo unterhalb des Bedarfs ausgebildet \nwird. Alle jenen ohne betrieblichen Ausbildungsplatz ermöglichen wir eine eng an die betriebliche \nPraxis angelehnte Ausbildung in einer Berufsschule oder eine außerschulische Ausbildung. Der \nWechsel in eine betriebliche Ausbildung hat für uns hier zu jedem Zeitpunkt Priorität.\nWir werden zudem unseren Weg fortsetzen, in den Berufen der Gesundheit, Pflege und Erziehung \ndie vollschulischen Ausbildungen dual auszurichten. Damit werden sie kostenfrei und die Auszu-\nbildenden erhalten eine Vergütung. Zudem werden wir die dualen akademischen Ausbildungswe-\nge und damit die Bedeutung der Professionalität in diesen Berufsfeldern stärken, Qualität sichern \nund Karriereoptionen für die Beschäftigten eröffnen.\nDen Lernort Berufsschule werden wird stärken, vor allem im ländlichen Raum und in struktur -\nschwachen Regionen.'
 'Den Weg der Gebührenfreiheit bei der Aufstiegsfortbildung setzen wir fort.\nUnsere Arbeit befindet sich im Wandel. Durch die technologische Entwicklung gehören manche \nBerufsbilder inzwischen der Vergangenheit an oder werden in naher Zukunft verschwinden oder \nsich verändern. Gleichzeitig entstehen neue Berufsbilder, die Zukunft versprechen. Damit alle, die \ndamit verbundenen Möglichkeiten nutzen können, lenken wir unser Augenmerk auf die Weiter -\nbildung.\nWir wollen die Arbeitslosenversicherung zu einer solidarischen Arbeitsversicherung weiterent -\nwickeln. Sie soll nicht erst im Fall der Arbeitslosigkeit auf den Plan treten, sondern dabei helfen, \ndiese gar nicht erst entstehen zu lassen. Die Bundesagentur für Arbeit bauen wir darum zur Bun-\ndesagentur für Arbeit und Qualifizierung um, die ein hochwertiges und individuelles Beratungs-\nangebot gewährleistet. Wir werden einen Anspruch auf Qualifizierung einführen, der bereits nach \ndrei Monaten ohne neue Erwerbsarbeit greift (Arbeitslosengeld Q). Damit halten wir den Betroffe-\nnen den Rücken frei, um sich auf das Wesentliche konzentrieren zu können: Neue Arbeit zu finden, \num wieder auf eigenen Beinen zu stehen.\nWir schaffen ein Recht auf Weiterbildung und beruflichen Neustart in allen Lebensphasen. Jede*r \neinzelne wird bei den bevorstehenden Veränderungen unterstützt. Wir werden ein Recht schaffen, \ndas es Arbeitnehmer*innen auch mit 40plus ermöglicht, noch einmal einen ganz neuen Beruf zu \nerlernen.\nMit unserem Modell der geförderten Bildungszeit und Bildungsteilzeit werden wir ermöglichen, \ndass alle Erwerbstätigen im Lauf ihres Erwerbslebens auf eigene Initiative und mit staatlicher \nUnterstützung unabhängig vom Betrieb sich weiterbilden oder umschulen können.'
 'Damit halten wir den Betroffe-\nnen den Rücken frei, um sich auf das Wesentliche konzentrieren zu können: Neue Arbeit zu finden, \num wieder auf eigenen Beinen zu stehen.\nWir schaffen ein Recht auf Weiterbildung und beruflichen Neustart in allen Lebensphasen. Jede*r \neinzelne wird bei den bevorstehenden Veränderungen unterstützt. Wir werden ein Recht schaffen, \ndas es Arbeitnehmer*innen auch mit 40plus ermöglicht, noch einmal einen ganz neuen Beruf zu \nerlernen.\nMit unserem Modell der geförderten Bildungszeit und Bildungsteilzeit werden wir ermöglichen, \ndass alle Erwerbstätigen im Lauf ihres Erwerbslebens auf eigene Initiative und mit staatlicher \nUnterstützung unabhängig vom Betrieb sich weiterbilden oder umschulen können. Wer Bildungs-\nzeit oder Bildungsteilzeit beantragt, erhält ein Recht, sich von seinem Beruf freistellen zu lassen \noder die Arbeitszeit zu reduzieren. Die Bildungszeiten werden wir mit einer finanziellen Förde-\nrung ausgestalten, die Lohneinbußen während der Weiterbildung oder Umschulung angemessen \nkompensiert – und zwar lange genug, um anerkannte Abschlüsse zu erwerben. Bei den Kosten für \ndie Weiterbildungsmaßnahme werden wir diejenigen unterstützen, die die Mittel nicht oder nicht \nvollständig aus eigener Tasche aufbringen können.']","Ja, die SPD setzt sich für eine Ausbildungsgarantie ein, um jungen Berufsanfänger*innen eine Chance zu geben, in das Berufsleben einzusteigen. Sie legt Wert auf die Vermittlung in eine betriebliche Ausbildung und stärkt die duale Ausbildung.",Wir setzen uns für eine Ausbildungsgarantie ein.,1.0,0.938710854861429,0.99999999995,1.0
59,Was ist Arbeitslosengeld Q,"['Den Weg der Gebührenfreiheit bei der Aufstiegsfortbildung setzen wir fort.\nUnsere Arbeit befindet sich im Wandel. Durch die technologische Entwicklung gehören manche \nBerufsbilder inzwischen der Vergangenheit an oder werden in naher Zukunft verschwinden oder \nsich verändern. Gleichzeitig entstehen neue Berufsbilder, die Zukunft versprechen. Damit alle, die \ndamit verbundenen Möglichkeiten nutzen können, lenken wir unser Augenmerk auf die Weiter -\nbildung.\nWir wollen die Arbeitslosenversicherung zu einer solidarischen Arbeitsversicherung weiterent -\nwickeln. Sie soll nicht erst im Fall der Arbeitslosigkeit auf den Plan treten, sondern dabei helfen, \ndiese gar nicht erst entstehen zu lassen. Die Bundesagentur für Arbeit bauen wir darum zur Bun-\ndesagentur für Arbeit und Qualifizierung um, die ein hochwertiges und individuelles Beratungs-\nangebot gewährleistet. Wir werden einen Anspruch auf Qualifizierung einführen, der bereits nach \ndrei Monaten ohne neue Erwerbsarbeit greift (Arbeitslosengeld Q). Damit halten wir den Betroffe-\nnen den Rücken frei, um sich auf das Wesentliche konzentrieren zu können: Neue Arbeit zu finden, \num wieder auf eigenen Beinen zu stehen.\nWir schaffen ein Recht auf Weiterbildung und beruflichen Neustart in allen Lebensphasen. Jede*r \neinzelne wird bei den bevorstehenden Veränderungen unterstützt. Wir werden ein Recht schaffen, \ndas es Arbeitnehmer*innen auch mit 40plus ermöglicht, noch einmal einen ganz neuen Beruf zu \nerlernen.\nMit unserem Modell der geförderten Bildungszeit und Bildungsteilzeit werden wir ermöglichen, \ndass alle Erwerbstätigen im Lauf ihres Erwerbslebens auf eigene Initiative und mit staatlicher \nUnterstützung unabhängig vom Betrieb sich weiterbilden oder umschulen können.'
 'Es hat sich bewährt, sinnvolle und sozial abgesicherte Tätigkeiten zu schaffen. Wir werden den \nsozialen Arbeitsmarkt ausbauen und weiterentwickeln. Auch weiterhin werden wir Arbeitgeber \nmit Lohnkostenzuschüssen unterstützen, die Langzeitarbeitslose sozialversicherungspflichtig ein-\nstellen. \nDie Grundsicherung werden wir grundlegend überarbeiten und zu einem Bürgergeld entwickeln. \nUnser Bürgergeld steht für ein neues Verständnis eines haltgebenden und bürgernahen Sozial-\nstaats. Das Bürgergeld soll digital und unkompliziert zugänglich sein. Bescheide und Schriftwech-\nsel sollen eine verständliche Sprache sprechen. Die Regelsätze im neuen Bürgergeld müssen zu \neinem Leben in Würde ausreichen und zur gesellschaftlichen Teilhabe befähigen. Das Bürgergeld \nmuss absichern, dass eine kaputte Waschmaschine oder eine neue Winterjacke nicht zur untrag-\nbaren Last werden. Die Kriterien zur Regelsatzermittlung werden wir weiterentwickeln und Betrof -\nfene und Sozialverbände mit einbeziehen. \nDas Ziel muss sein, die hilfsbedürftige Lebenslage gemeinsam zu bezwingen und allen eine Be-\nschäftigung und, falls erforderlich, eine Qualifizierung und Weiterbildung zu ermöglichen. Wir set -\nzen auf eine umfassende und passgenaue Unterstützung, die die gesamte Bedarfsgemeinschaft \nin den Blick nimmt - auf Qualität und gute Netzwerke statt auf eine reine Kennzahlenlogik. Wir \nwerden die gesetzlichen, personellen und finanziellen Rahmenbedingungen weiter so verbessern, \ndass die Jobcenter und ihre Beschäftigten diesem Auftrag nachkommen können.'
 'Das Zukunftsprogramm der SPD\nKapitel 3Seite >33\nSPD-Parteivorstand 20213.3. Solidarität erweitern \nUnser Sozialstaat ist der Garant, auf den sich alle verlassen können müssen, damit unsere Gesell-\nschaft zusammenhält. Er baut auf sozialen Rechten und Pflichten auf. Bürger*innen treten ihm \nnicht als Bittsteller*innen gegenüber. Wir werden den Zugang zum Arbeitslosengeld erleichtern. \nDabei haben wir insbesondere neue Beschäftigungsformen und unterbrochene Erwerbsbiogra-\nphien im Blick. \nWir wollen Lebensleistungen stärker berücksichtigen. Wer länger eingezahlt hat, soll zukünftig \nauch länger Arbeitslosengeld I beziehen. Für Bürger*innen, die trotz bester Unterstützung keine \nPerspektive auf dem ersten Arbeitsmarkt haben, haben wir den sozialen Arbeitsmarkt eingeführt. \nEr ebnet denjenigen, die seit vielen Jahren von Arbeitslosigkeit betroffen sind, den Weg in reguläre \nsozialversicherungspflichtige Beschäftigungsverhältnisse. \nEs hat sich bewährt, sinnvolle und sozial abgesicherte Tätigkeiten zu schaffen. Wir werden den \nsozialen Arbeitsmarkt ausbauen und weiterentwickeln. Auch weiterhin werden wir Arbeitgeber \nmit Lohnkostenzuschüssen unterstützen, die Langzeitarbeitslose sozialversicherungspflichtig ein-\nstellen. \nDie Grundsicherung werden wir grundlegend überarbeiten und zu einem Bürgergeld entwickeln. \nUnser Bürgergeld steht für ein neues Verständnis eines haltgebenden und bürgernahen Sozial-\nstaats. Das Bürgergeld soll digital und unkompliziert zugänglich sein. Bescheide und Schriftwech-\nsel sollen eine verständliche Sprache sprechen.']","Arbeitslosengeld Q ist ein Anspruch auf Qualifizierung, der nach drei Monaten Arbeitslosigkeit greift, um den Betroffenen die Möglichkeit zu geben, sich auf neue Arbeit zu konzentrieren. Es ermöglicht eine Weiterbildung und einen beruflichen Neustart in allen Lebensphasen.","Wir werden einen Anspruch auf Qualifizierung einführen, der bereits nach drei Monaten ohne neue Erwerbsarbeit greift (Arbeitslosengeld Q).",0.8,0.9451655167646543,0.9999999999,1.0
60,Wie sollen Bildungszeit und Bildungsteilzeit gefördert werden?,"['Damit halten wir den Betroffe-\nnen den Rücken frei, um sich auf das Wesentliche konzentrieren zu können: Neue Arbeit zu finden, \num wieder auf eigenen Beinen zu stehen.\nWir schaffen ein Recht auf Weiterbildung und beruflichen Neustart in allen Lebensphasen. Jede*r \neinzelne wird bei den bevorstehenden Veränderungen unterstützt. Wir werden ein Recht schaffen, \ndas es Arbeitnehmer*innen auch mit 40plus ermöglicht, noch einmal einen ganz neuen Beruf zu \nerlernen.\nMit unserem Modell der geförderten Bildungszeit und Bildungsteilzeit werden wir ermöglichen, \ndass alle Erwerbstätigen im Lauf ihres Erwerbslebens auf eigene Initiative und mit staatlicher \nUnterstützung unabhängig vom Betrieb sich weiterbilden oder umschulen können. Wer Bildungs-\nzeit oder Bildungsteilzeit beantragt, erhält ein Recht, sich von seinem Beruf freistellen zu lassen \noder die Arbeitszeit zu reduzieren. Die Bildungszeiten werden wir mit einer finanziellen Förde-\nrung ausgestalten, die Lohneinbußen während der Weiterbildung oder Umschulung angemessen \nkompensiert – und zwar lange genug, um anerkannte Abschlüsse zu erwerben. Bei den Kosten für \ndie Weiterbildungsmaßnahme werden wir diejenigen unterstützen, die die Mittel nicht oder nicht \nvollständig aus eigener Tasche aufbringen können.'
 'Der \nWechsel in eine betriebliche Ausbildung hat für uns hier zu jedem Zeitpunkt Priorität.\nWir werden zudem unseren Weg fortsetzen, in den Berufen der Gesundheit, Pflege und Erziehung \ndie vollschulischen Ausbildungen dual auszurichten. Damit werden sie kostenfrei und die Auszu-\nbildenden erhalten eine Vergütung. Zudem werden wir die dualen akademischen Ausbildungswe-\nge und damit die Bedeutung der Professionalität in diesen Berufsfeldern stärken, Qualität sichern \nund Karriereoptionen für die Beschäftigten eröffnen.\nDen Lernort Berufsschule werden wird stärken, vor allem im ländlichen Raum und in struktur -\nschwachen Regionen. Dafür schließen wir einen Pakt für berufsbildende Schulen von Bund, \nLändern und Schulträgern zusammen mit den Sozialpartnern. Im Vordergrund stehen dabei die \nModernisierung der technischen Ausstattung und eine verbesserte Sicherung des Lehrkräfte-Nach-\nwuchses. Um berufliche und akademische Bildung besser zu verzahnen, werden wir das duale Stu-\ndium besser fördern. Den Weg der Gebührenfreiheit bei der Aufstiegsfortbildung setzen wir fort.\nUnsere Arbeit befindet sich im Wandel. Durch die technologische Entwicklung gehören manche \nBerufsbilder inzwischen der Vergangenheit an oder werden in naher Zukunft verschwinden oder \nsich verändern. Gleichzeitig entstehen neue Berufsbilder, die Zukunft versprechen. Damit alle, die \ndamit verbundenen Möglichkeiten nutzen können, lenken wir unser Augenmerk auf die Weiter -\nbildung.\nWir wollen die Arbeitslosenversicherung zu einer solidarischen Arbeitsversicherung weiterent -\nwickeln. Sie soll nicht erst im Fall der Arbeitslosigkeit auf den Plan treten, sondern dabei helfen, \ndiese gar nicht erst entstehen zu lassen.'
 'Das Zukunftsprogramm der SPD\nKapitel 3Seite >41\nSPD-Parteivorstand 2021Ein gutes Ganztagangebot ist entscheidend für gleiche Chancen – und das muss für alle Kinder zur \nVerfügung stehen. Ganztagsschulen sind Lern- und Lebensorte, wo gute Chancen für alle ermög-\nlicht und sichergestellt werden. Schule erreicht jedes Kind, unabhängig von seiner Herkunft. Der \nRechtsanspruch auf ein ganztägiges Bildungs- und Betreuungsangebot im Grundschulalter ist ein \nwichtiger Beitrag zur Bildungsgerechtigkeit und zudem für viele Eltern der notwendige nächste \nSchritt in der Vereinbarkeit von Familie und Beruf, auf den sie dringend warten. Mehr als 70 Pro-\nzent wünschen sich ein solches Angebot für ihre Kinder. \nDurch die Einschränkung des Präsenzunterrichts während der Pandemie droht sich die Verbindung \nvon Bildungserfolg und Familienhintergrund zu verfestigen und Bildungsbenachteiligungen zu \nverstärken. Aus diesem Grund starten wir die Bundesinitiative Chancengleichheit in der Bildung. \nDurch ein Bundesprogramm für Schulsozialarbeit werden den Kommunen Mittel zur Förderung \nvon Chancenhelfern an jeder Schule bereitgestellt. \nDer Grundsatz der gleichwertigen Lebensverhältnisse ist für uns bei der Weiterentwicklung der \nBund-Länder-Zusammenarbeit maßgebend, damit Kinder und Jugendliche aus wirtschaftlich be-\nnachteiligten Familien nicht alleine gelassen werden. Die Mittel von Bund und Ländern müssen \ndurch die zusätzliche Einführung von Sozialkriterien da ankommen, wo sie am dringendsten ge-\nbraucht werden. \nWir wollen, dass Kinder und Jugendliche sicher aufwachsen.']","Die Bildungszeit und Bildungsteilzeit sollen durch ein Modell mit staatlicher Unterstützung gefördert werden, das es Erwerbstätigen ermöglicht, unabhhängig vom Betrieb Weiterbildungen oder Umschulungen durchzuführen. Arbeitnehmer, die Bildungszeit oder Bildungsteilzeit beantragen, erhalten ein Recht auf Freistellung oder Reduzierung der Arbeitszeit und finanzielle Unterstützung, um Lohneinbußen während der Weiterbildung auszugleichen. Die finanzielle Unterstützung dauert lange genug, um anerkannte Abschlüsse zu erwerben, und Personen, die die Kosten nicht vollständig aus eigener Tasche tragen können, werden unterstützt.","Wer Bildungszeit oder Bildungsteilzeit beantragt, erhält ein Recht, sich von seinem Beruf freistellen zu lassen oder die Arbeitszeit zu reduzieren. Die Bildungszeiten werden wir mit einer finanziellen Förderung ausgestalten, die Lohneinbußen während der Weiterbildung oder Umschulung angemessen kompensiert.",1.0,0.9999991108521179,0.9999999999,1.0
61,Wie soll das Bundesausbildungsförderungsgesetz (BAföG) in Zukunft verändert werden?,"['Das Zukunftsprogramm der SPD\nKapitel 3Seite >32\nSPD-Parteivorstand 2021Mit einem Transformations-Kurzarbeitergeld unterstützen wir die Qualifizierung von Beschäftig-\nten in Betrieben, die sich neu orientieren müssen. \nNeben der individuellen Weiterbildungsförderung wollen wir die Möglichkeiten eines Beschäftig-\ntentransfers stärker fördern, wenn betriebliche Umstrukturierungen oder Betriebsschließungen \nunvermeidlich sind.\nDas Bundesausbildungsförderungsgesetz (BAföG) soll in Zukunft wieder mehr junge Erwachsene \nerreichen. Dafür weiten wir die Förderansprüche aus und streben eine schrittweise Rückkehr zum \nVollzuschuss an. Das neue Kindergeld ist eine Basisabsicherung für alle bis zum Alter von 25 Jah-\nren. Es macht das BAföG elternunabhängiger. Zugleich werden wir das BAföG und das Aufstiegs-\nBAföG besser aufeinander abstimmen und perspektivisch zusammenführen. Die Altersgrenzen im \nBAföG werden wir dazu in einem ersten Schritt aufheben. Und wir brauchen ein Neustart-BAföG, \ndas auch im Erwachsenenalter neue berufliche Wege öffnen und angemessen den Lebensunter -\nhalt sichert.\nBereits jetzt besteht die Möglichkeit, dass Arbeitnehmer*innen ihre geleisteten Arbeitsstunden \nauf Langzeitkonten ansparen. Allerdings besteht bislang kein rechtlicher Anspruch darauf und nur \nein kleiner Teil der Unternehmen und Arbeitnehmer*innen nutzt Langzeitkonten. Wir werden das \nInstrument zu einem persönlichen Zeitkonto weiterentwickeln, um zusätzlich individuelle Ge-\nstaltungsmöglichkeiten entlang des Lebenslaufs zu schaffen.'
 'Die Altersgrenzen im \nBAföG werden wir dazu in einem ersten Schritt aufheben. Und wir brauchen ein Neustart-BAföG, \ndas auch im Erwachsenenalter neue berufliche Wege öffnen und angemessen den Lebensunter -\nhalt sichert.\nBereits jetzt besteht die Möglichkeit, dass Arbeitnehmer*innen ihre geleisteten Arbeitsstunden \nauf Langzeitkonten ansparen. Allerdings besteht bislang kein rechtlicher Anspruch darauf und nur \nein kleiner Teil der Unternehmen und Arbeitnehmer*innen nutzt Langzeitkonten. Wir werden das \nInstrument zu einem persönlichen Zeitkonto weiterentwickeln, um zusätzlich individuelle Ge-\nstaltungsmöglichkeiten entlang des Lebenslaufs zu schaffen. Basis eines solchen Zeitkontos sind \nZeiteinzahlungen der Beschäftigten – auf diese Weise gehen Überstunden nicht verloren, sondern \nverwandeln sich in ein Zeitguthaben, das per Tarifvertrag oder durch den Staat nach dem Prinzip \neines Chancenkontos aufgestockt werden kann.'
 'Das Zukunftsprogramm der SPD\nKapitel 3Seite >40\nSPD-Parteivorstand 2021Der monatliche Basisbetrag dieses neuen Kindergeldes wird bei zirka 250 Euro liegen. Der Höchst -\nbetrag wird sich an den Ausgaben von Familien mit mittleren Einkommen für Bildung und Teilha-\nbe orientieren und mindestens doppelt so hoch sein wie der Basisbetrag. Im Höchstbetrag sind das \nsächliche Existenzminimum inklusive Wohnkostenpauschale sowie Bildungs- und Teilhabekosten \nenthalten. Das neue Kindergeld ersetzt so den Kinderfreibetrag und bündelt bisherige Leistungen.\nJunge Menschen in Ausbildung sollen durch direkte, elternunabhängige Auszahlung des neuen \nKindergeldes finanziell abgesichert werden - mit einem zusätzlichen, auskömmlichen Fördersatz \nan BAföG obendrauf. Wir wollen Hilfen für Kinder, Jugendliche und Familien bündeln, die von \nKrankheit oder Behinderung betroffen sind. Kinder, Jugendliche, junge Erwachsene und Eltern \nmüssen einen einfachen Zugang zu Unterstützungsleistungen haben. Dafür sind weitere Schritte \nnotwendig. Der Kampf gegen Bildungsbenachteiligung muss in allen Systemen konsequent statt -\nfinden. Die erste Bildungseinrichtung im Leben eines Kindes ist heute die Kita. Deshalb werden wir \ndie frühkindliche Bildung weiter ausbauen. \nOhne bezahlbare Wohnheimangebote ist für viele Auszubildende und Studierende eine erfolgrei-\nche Ausbildung nicht möglich. Wir werden sie ausbauen und zudem das Jugendwohnen im Rah-\nmen der Kinder- und Jugendhilfe zukünftig für junge Menschen bis 27 Jahre ermöglichen sowie \nmehr Räume für Jugendarbeit schaffen.']","Das Bundesausbildungsförderungsgesetz (BAföG) soll in Zukunft wieder mehr junge Erwachsene erreichen, indem die Förderansprüche ausgeweitet und eine schrittweise Rückkehr zum Vollzuschuss angestrebt wird. Zudem sollen das BAföG und das Aufstiegs-BAföG besser aufeinander abgestimmt und perspektivisch zusammengeführt werden.",Das Bundesausbildungsförderungsgesetz (BAföG) soll in Zukunft wieder mehr junge Erwachsene erreichen. Dafür weiten wir die Förderansprüche aus und streben eine schrittweise Rückkehr zum Vollzuschuss an.,1.0,0.9639204196623683,0.9999999999,1.0
62,Sollen Studentinnen und Studenten BAföG unabhängig vom Einkommen ihrer Eltern erhalten?,"['Das Zukunftsprogramm der SPD\nKapitel 3Seite >40\nSPD-Parteivorstand 2021Der monatliche Basisbetrag dieses neuen Kindergeldes wird bei zirka 250 Euro liegen. Der Höchst -\nbetrag wird sich an den Ausgaben von Familien mit mittleren Einkommen für Bildung und Teilha-\nbe orientieren und mindestens doppelt so hoch sein wie der Basisbetrag. Im Höchstbetrag sind das \nsächliche Existenzminimum inklusive Wohnkostenpauschale sowie Bildungs- und Teilhabekosten \nenthalten. Das neue Kindergeld ersetzt so den Kinderfreibetrag und bündelt bisherige Leistungen.\nJunge Menschen in Ausbildung sollen durch direkte, elternunabhängige Auszahlung des neuen \nKindergeldes finanziell abgesichert werden - mit einem zusätzlichen, auskömmlichen Fördersatz \nan BAföG obendrauf. Wir wollen Hilfen für Kinder, Jugendliche und Familien bündeln, die von \nKrankheit oder Behinderung betroffen sind. Kinder, Jugendliche, junge Erwachsene und Eltern \nmüssen einen einfachen Zugang zu Unterstützungsleistungen haben. Dafür sind weitere Schritte \nnotwendig. Der Kampf gegen Bildungsbenachteiligung muss in allen Systemen konsequent statt -\nfinden. Die erste Bildungseinrichtung im Leben eines Kindes ist heute die Kita. Deshalb werden wir \ndie frühkindliche Bildung weiter ausbauen. \nOhne bezahlbare Wohnheimangebote ist für viele Auszubildende und Studierende eine erfolgrei-\nche Ausbildung nicht möglich. Wir werden sie ausbauen und zudem das Jugendwohnen im Rah-\nmen der Kinder- und Jugendhilfe zukünftig für junge Menschen bis 27 Jahre ermöglichen sowie \nmehr Räume für Jugendarbeit schaffen.'
 'Die Altersgrenzen im \nBAföG werden wir dazu in einem ersten Schritt aufheben. Und wir brauchen ein Neustart-BAföG, \ndas auch im Erwachsenenalter neue berufliche Wege öffnen und angemessen den Lebensunter -\nhalt sichert.\nBereits jetzt besteht die Möglichkeit, dass Arbeitnehmer*innen ihre geleisteten Arbeitsstunden \nauf Langzeitkonten ansparen. Allerdings besteht bislang kein rechtlicher Anspruch darauf und nur \nein kleiner Teil der Unternehmen und Arbeitnehmer*innen nutzt Langzeitkonten. Wir werden das \nInstrument zu einem persönlichen Zeitkonto weiterentwickeln, um zusätzlich individuelle Ge-\nstaltungsmöglichkeiten entlang des Lebenslaufs zu schaffen. Basis eines solchen Zeitkontos sind \nZeiteinzahlungen der Beschäftigten – auf diese Weise gehen Überstunden nicht verloren, sondern \nverwandeln sich in ein Zeitguthaben, das per Tarifvertrag oder durch den Staat nach dem Prinzip \neines Chancenkontos aufgestockt werden kann.'
 'Das Zukunftsprogramm der SPD\nKapitel 3Seite >32\nSPD-Parteivorstand 2021Mit einem Transformations-Kurzarbeitergeld unterstützen wir die Qualifizierung von Beschäftig-\nten in Betrieben, die sich neu orientieren müssen. \nNeben der individuellen Weiterbildungsförderung wollen wir die Möglichkeiten eines Beschäftig-\ntentransfers stärker fördern, wenn betriebliche Umstrukturierungen oder Betriebsschließungen \nunvermeidlich sind.\nDas Bundesausbildungsförderungsgesetz (BAföG) soll in Zukunft wieder mehr junge Erwachsene \nerreichen. Dafür weiten wir die Förderansprüche aus und streben eine schrittweise Rückkehr zum \nVollzuschuss an. Das neue Kindergeld ist eine Basisabsicherung für alle bis zum Alter von 25 Jah-\nren. Es macht das BAföG elternunabhängiger. Zugleich werden wir das BAföG und das Aufstiegs-\nBAföG besser aufeinander abstimmen und perspektivisch zusammenführen. Die Altersgrenzen im \nBAföG werden wir dazu in einem ersten Schritt aufheben. Und wir brauchen ein Neustart-BAföG, \ndas auch im Erwachsenenalter neue berufliche Wege öffnen und angemessen den Lebensunter -\nhalt sichert.\nBereits jetzt besteht die Möglichkeit, dass Arbeitnehmer*innen ihre geleisteten Arbeitsstunden \nauf Langzeitkonten ansparen. Allerdings besteht bislang kein rechtlicher Anspruch darauf und nur \nein kleiner Teil der Unternehmen und Arbeitnehmer*innen nutzt Langzeitkonten. Wir werden das \nInstrument zu einem persönlichen Zeitkonto weiterentwickeln, um zusätzlich individuelle Ge-\nstaltungsmöglichkeiten entlang des Lebenslaufs zu schaffen.']","Die SPD plant, dass junge Menschen in Ausbildung das neue Kindergeld erhalten und zusätzlich einen angemessenen Fördersatz an BAföG bekommen. Es wird angestrebt, das BAföG elternunabhängiger zu gestalten, um die finanzielle Absicherung von Studierenden zu verbessern. Die Altersgrenzen im BAföG sollen aufgehoben werden, um auch im Erwachsenenalter neue berufliche Wege zu ermöglichen.","Junge Menschen in Ausbildung sollen durch direkte, elternunabhängige Auszahlung des neuen Kindergeldes finanziell abgesichert werden - mit einem zusätzlichen, auskömmlichen Fördersatz an BAföG obendrauf.",0.8333333333333334,0.8781506681865326,0.8333333332916666,1.0
63,Was ist das Ziel des Neustart-BAföG?,"['Die Altersgrenzen im \nBAföG werden wir dazu in einem ersten Schritt aufheben. Und wir brauchen ein Neustart-BAföG, \ndas auch im Erwachsenenalter neue berufliche Wege öffnen und angemessen den Lebensunter -\nhalt sichert.\nBereits jetzt besteht die Möglichkeit, dass Arbeitnehmer*innen ihre geleisteten Arbeitsstunden \nauf Langzeitkonten ansparen. Allerdings besteht bislang kein rechtlicher Anspruch darauf und nur \nein kleiner Teil der Unternehmen und Arbeitnehmer*innen nutzt Langzeitkonten. Wir werden das \nInstrument zu einem persönlichen Zeitkonto weiterentwickeln, um zusätzlich individuelle Ge-\nstaltungsmöglichkeiten entlang des Lebenslaufs zu schaffen. Basis eines solchen Zeitkontos sind \nZeiteinzahlungen der Beschäftigten – auf diese Weise gehen Überstunden nicht verloren, sondern \nverwandeln sich in ein Zeitguthaben, das per Tarifvertrag oder durch den Staat nach dem Prinzip \neines Chancenkontos aufgestockt werden kann.'
 'Das Zukunftsprogramm der SPD\nKapitel 3Seite >32\nSPD-Parteivorstand 2021Mit einem Transformations-Kurzarbeitergeld unterstützen wir die Qualifizierung von Beschäftig-\nten in Betrieben, die sich neu orientieren müssen. \nNeben der individuellen Weiterbildungsförderung wollen wir die Möglichkeiten eines Beschäftig-\ntentransfers stärker fördern, wenn betriebliche Umstrukturierungen oder Betriebsschließungen \nunvermeidlich sind.\nDas Bundesausbildungsförderungsgesetz (BAföG) soll in Zukunft wieder mehr junge Erwachsene \nerreichen. Dafür weiten wir die Förderansprüche aus und streben eine schrittweise Rückkehr zum \nVollzuschuss an. Das neue Kindergeld ist eine Basisabsicherung für alle bis zum Alter von 25 Jah-\nren. Es macht das BAföG elternunabhängiger. Zugleich werden wir das BAföG und das Aufstiegs-\nBAföG besser aufeinander abstimmen und perspektivisch zusammenführen. Die Altersgrenzen im \nBAföG werden wir dazu in einem ersten Schritt aufheben. Und wir brauchen ein Neustart-BAföG, \ndas auch im Erwachsenenalter neue berufliche Wege öffnen und angemessen den Lebensunter -\nhalt sichert.\nBereits jetzt besteht die Möglichkeit, dass Arbeitnehmer*innen ihre geleisteten Arbeitsstunden \nauf Langzeitkonten ansparen. Allerdings besteht bislang kein rechtlicher Anspruch darauf und nur \nein kleiner Teil der Unternehmen und Arbeitnehmer*innen nutzt Langzeitkonten. Wir werden das \nInstrument zu einem persönlichen Zeitkonto weiterentwickeln, um zusätzlich individuelle Ge-\nstaltungsmöglichkeiten entlang des Lebenslaufs zu schaffen.'
 'Das Zukunftsprogramm der SPD\nKapitel 3Seite >40\nSPD-Parteivorstand 2021Der monatliche Basisbetrag dieses neuen Kindergeldes wird bei zirka 250 Euro liegen. Der Höchst -\nbetrag wird sich an den Ausgaben von Familien mit mittleren Einkommen für Bildung und Teilha-\nbe orientieren und mindestens doppelt so hoch sein wie der Basisbetrag. Im Höchstbetrag sind das \nsächliche Existenzminimum inklusive Wohnkostenpauschale sowie Bildungs- und Teilhabekosten \nenthalten. Das neue Kindergeld ersetzt so den Kinderfreibetrag und bündelt bisherige Leistungen.\nJunge Menschen in Ausbildung sollen durch direkte, elternunabhängige Auszahlung des neuen \nKindergeldes finanziell abgesichert werden - mit einem zusätzlichen, auskömmlichen Fördersatz \nan BAföG obendrauf. Wir wollen Hilfen für Kinder, Jugendliche und Familien bündeln, die von \nKrankheit oder Behinderung betroffen sind. Kinder, Jugendliche, junge Erwachsene und Eltern \nmüssen einen einfachen Zugang zu Unterstützungsleistungen haben. Dafür sind weitere Schritte \nnotwendig. Der Kampf gegen Bildungsbenachteiligung muss in allen Systemen konsequent statt -\nfinden. Die erste Bildungseinrichtung im Leben eines Kindes ist heute die Kita. Deshalb werden wir \ndie frühkindliche Bildung weiter ausbauen. \nOhne bezahlbare Wohnheimangebote ist für viele Auszubildende und Studierende eine erfolgrei-\nche Ausbildung nicht möglich. Wir werden sie ausbauen und zudem das Jugendwohnen im Rah-\nmen der Kinder- und Jugendhilfe zukünftig für junge Menschen bis 27 Jahre ermöglichen sowie \nmehr Räume für Jugendarbeit schaffen.']","Das Ziel des Neustart-BAföG ist es, auch im Erwachsenenalter neue berufliche Wege zu ermöglichen und den Lebensunterhalt angemessen zu sichern. Es soll die Altersgrenzen im BAföG aufheben und Langzeitkonten zu persönlichen Zeitkonten weiterentwickeln. Arbeitnehmer*innen können ihre Arbeitsstunden auf Langzeitkonten ansparen, die dann in ein Zeitguthaben umgewandelt werden können.","Und wir brauchen ein Neustart-BAföG, das auch im Erwachsenenalter neue berufliche Wege öffnen und angemessen den Lebensunterhalt sichert.",0.6666666666666666,0.9999990592524187,0.99999999995,1.0
64,Welche Unterstützung gibt es für das Nachholen eines Berufsabschlusses?,"['Damit halten wir den Betroffe-\nnen den Rücken frei, um sich auf das Wesentliche konzentrieren zu können: Neue Arbeit zu finden, \num wieder auf eigenen Beinen zu stehen.\nWir schaffen ein Recht auf Weiterbildung und beruflichen Neustart in allen Lebensphasen. Jede*r \neinzelne wird bei den bevorstehenden Veränderungen unterstützt. Wir werden ein Recht schaffen, \ndas es Arbeitnehmer*innen auch mit 40plus ermöglicht, noch einmal einen ganz neuen Beruf zu \nerlernen.\nMit unserem Modell der geförderten Bildungszeit und Bildungsteilzeit werden wir ermöglichen, \ndass alle Erwerbstätigen im Lauf ihres Erwerbslebens auf eigene Initiative und mit staatlicher \nUnterstützung unabhängig vom Betrieb sich weiterbilden oder umschulen können. Wer Bildungs-\nzeit oder Bildungsteilzeit beantragt, erhält ein Recht, sich von seinem Beruf freistellen zu lassen \noder die Arbeitszeit zu reduzieren. Die Bildungszeiten werden wir mit einer finanziellen Förde-\nrung ausgestalten, die Lohneinbußen während der Weiterbildung oder Umschulung angemessen \nkompensiert – und zwar lange genug, um anerkannte Abschlüsse zu erwerben. Bei den Kosten für \ndie Weiterbildungsmaßnahme werden wir diejenigen unterstützen, die die Mittel nicht oder nicht \nvollständig aus eigener Tasche aufbringen können.'
 'Den Weg der Gebührenfreiheit bei der Aufstiegsfortbildung setzen wir fort.\nUnsere Arbeit befindet sich im Wandel. Durch die technologische Entwicklung gehören manche \nBerufsbilder inzwischen der Vergangenheit an oder werden in naher Zukunft verschwinden oder \nsich verändern. Gleichzeitig entstehen neue Berufsbilder, die Zukunft versprechen. Damit alle, die \ndamit verbundenen Möglichkeiten nutzen können, lenken wir unser Augenmerk auf die Weiter -\nbildung.\nWir wollen die Arbeitslosenversicherung zu einer solidarischen Arbeitsversicherung weiterent -\nwickeln. Sie soll nicht erst im Fall der Arbeitslosigkeit auf den Plan treten, sondern dabei helfen, \ndiese gar nicht erst entstehen zu lassen. Die Bundesagentur für Arbeit bauen wir darum zur Bun-\ndesagentur für Arbeit und Qualifizierung um, die ein hochwertiges und individuelles Beratungs-\nangebot gewährleistet. Wir werden einen Anspruch auf Qualifizierung einführen, der bereits nach \ndrei Monaten ohne neue Erwerbsarbeit greift (Arbeitslosengeld Q). Damit halten wir den Betroffe-\nnen den Rücken frei, um sich auf das Wesentliche konzentrieren zu können: Neue Arbeit zu finden, \num wieder auf eigenen Beinen zu stehen.\nWir schaffen ein Recht auf Weiterbildung und beruflichen Neustart in allen Lebensphasen. Jede*r \neinzelne wird bei den bevorstehenden Veränderungen unterstützt. Wir werden ein Recht schaffen, \ndas es Arbeitnehmer*innen auch mit 40plus ermöglicht, noch einmal einen ganz neuen Beruf zu \nerlernen.\nMit unserem Modell der geförderten Bildungszeit und Bildungsteilzeit werden wir ermöglichen, \ndass alle Erwerbstätigen im Lauf ihres Erwerbslebens auf eigene Initiative und mit staatlicher \nUnterstützung unabhängig vom Betrieb sich weiterbilden oder umschulen können.'
 'Der \nWechsel in eine betriebliche Ausbildung hat für uns hier zu jedem Zeitpunkt Priorität.\nWir werden zudem unseren Weg fortsetzen, in den Berufen der Gesundheit, Pflege und Erziehung \ndie vollschulischen Ausbildungen dual auszurichten. Damit werden sie kostenfrei und die Auszu-\nbildenden erhalten eine Vergütung. Zudem werden wir die dualen akademischen Ausbildungswe-\nge und damit die Bedeutung der Professionalität in diesen Berufsfeldern stärken, Qualität sichern \nund Karriereoptionen für die Beschäftigten eröffnen.\nDen Lernort Berufsschule werden wird stärken, vor allem im ländlichen Raum und in struktur -\nschwachen Regionen. Dafür schließen wir einen Pakt für berufsbildende Schulen von Bund, \nLändern und Schulträgern zusammen mit den Sozialpartnern. Im Vordergrund stehen dabei die \nModernisierung der technischen Ausstattung und eine verbesserte Sicherung des Lehrkräfte-Nach-\nwuchses. Um berufliche und akademische Bildung besser zu verzahnen, werden wir das duale Stu-\ndium besser fördern. Den Weg der Gebührenfreiheit bei der Aufstiegsfortbildung setzen wir fort.\nUnsere Arbeit befindet sich im Wandel. Durch die technologische Entwicklung gehören manche \nBerufsbilder inzwischen der Vergangenheit an oder werden in naher Zukunft verschwinden oder \nsich verändern. Gleichzeitig entstehen neue Berufsbilder, die Zukunft versprechen. Damit alle, die \ndamit verbundenen Möglichkeiten nutzen können, lenken wir unser Augenmerk auf die Weiter -\nbildung.\nWir wollen die Arbeitslosenversicherung zu einer solidarischen Arbeitsversicherung weiterent -\nwickeln. Sie soll nicht erst im Fall der Arbeitslosigkeit auf den Plan treten, sondern dabei helfen, \ndiese gar nicht erst entstehen zu lassen.']","Es gibt finanzielle Unterstützung in Form von geförderten Bildungszeiten und Bildungsteilzeiten, um Lohneinbußen während der Weiterbildung oder Umschulung auszugleichen. Personen, die die Kosten für die Weiterbildungsmaßnahme nicht vollständig aus eigener Tasche aufbringen können, werden unterstützt. Die finanzielle Unterstützung dauert lange genug, um anerkannte Abschlüsse zu erwerben.","Wir schaffen das Recht auf Förderung beim Nachholen eines Berufsabschlusses und führen einen Weiterbildungs-Bonus ein, der die finanziellen Spielräume spürbar erweitert.",1.0,0.9094331198173119,0.99999999995,0.0
65,Wie soll die Vermögensprüfung im Bürgergeld geregelt werden?,"['Die Kriterien zur Regelsatzermittlung werden wir weiterentwickeln und Betrof -\nfene und Sozialverbände mit einbeziehen. \nDas Ziel muss sein, die hilfsbedürftige Lebenslage gemeinsam zu bezwingen und allen eine Be-\nschäftigung und, falls erforderlich, eine Qualifizierung und Weiterbildung zu ermöglichen. Wir set -\nzen auf eine umfassende und passgenaue Unterstützung, die die gesamte Bedarfsgemeinschaft \nin den Blick nimmt - auf Qualität und gute Netzwerke statt auf eine reine Kennzahlenlogik. Wir \nwerden die gesetzlichen, personellen und finanziellen Rahmenbedingungen weiter so verbessern, \ndass die Jobcenter und ihre Beschäftigten diesem Auftrag nachkommen können. Wir schaffen das \nRecht auf Förderung beim Nachholen eines Berufsabschlusses und führen einen Weiterbildungs-\nBonus ein, der die finanziellen Spielräume spürbar erweitert.\nWir haben wegen der Corona-Pandemie die Vermögensprüfung weitestgehend ausgesetzt. Man \nläuft nicht mehr Gefahr, aus der Wohnung ausziehen zu müssen. Dadurch können sich die Be-\nhörden und die Betroffenen in den ersten Monaten mit voller Energie auf eine sinnvolle Wieder -\naufnahme der Beschäftigung konzentrieren. Die guten Erfahrungen aus diesen vorübergehenden \nMaßnahmen haben uns darin bestätigt, dafür zu sorgen, dass auch in Zukunft Vermögen und \nWohnungsgröße innerhalb der ersten zwei Jahre nicht überprüft werden und das Schonvermögen \nerhöht wird. Das Bürgergeld beinhaltet Mitwirkungspflichten, setzt aber konsequent auf Hilfe und \nErmutigung. Eingliederungsvereinbarungen werden durch eine gemeinsame und auf Augenhöhe \nerarbeitete Teilhabevereinbarung ersetzt.'
 'Dadurch können sich die Be-\nhörden und die Betroffenen in den ersten Monaten mit voller Energie auf eine sinnvolle Wieder -\naufnahme der Beschäftigung konzentrieren. Die guten Erfahrungen aus diesen vorübergehenden \nMaßnahmen haben uns darin bestätigt, dafür zu sorgen, dass auch in Zukunft Vermögen und \nWohnungsgröße innerhalb der ersten zwei Jahre nicht überprüft werden und das Schonvermögen \nerhöht wird. Das Bürgergeld beinhaltet Mitwirkungspflichten, setzt aber konsequent auf Hilfe und \nErmutigung. Eingliederungsvereinbarungen werden durch eine gemeinsame und auf Augenhöhe \nerarbeitete Teilhabevereinbarung ersetzt. Bei ihrer Umsetzung setzen wir auf Befähigung und Be-\nstärkung und nicht auf Vorgaben und Zwang. Sinnwidrige und unwürdige Sanktionen schaffen wir \nab. Das sozioökonomische und soziokulturelle Existenzminimum muss jederzeit gesichert sein.\nDie Leistungen des Sozialstaates sind soziale Rechte – wer sie benötigt, sollte nicht lange suchen \nmüssen. Unser Ziel ist es, die Leistungen ohne Hürden und Umwege zugänglich zu machen. Wir \nwollen einen Bürgerservice, der nach Lebenslagen berät und alle Leistungen aus einer Hand zu-\ngänglich macht. Er ist digital und aufsuchend, wo der Weg zu beschwerlich ist. Ein zugewandter \nSozialstaat hilft, Rechtsansprüche geltend zu machen, und begleitet auch danach beratend alle \nSchritte.'
 'Gleich-\nzeitig wird es hohe persönliche Freibeträge geben, so dass sich die Steuerbelastung auf besonders \nvermögende Teile der Bevölkerung konzentriert. Wir stellen sicher, dass mit der Vermögenssteuer \nkeine Arbeitsplätze gefährdet werden. Die Grundlage von Betrieben wird bei der Vermögenssteuer \nverschont. \nDie Erbschaftssteuer ist reformbedürftig. In ihrer gegenwärtigen Form ist sie ungerecht, da sie ver -\nmögende Unternehmenserben bevorzugt. Mit einer effektiven Mindestbesteuerung werden wir \ndie Überprivilegierung großer Betriebsvermögen abschaffen. Auch für vermögenshaltende Fami-\nlienstiftungen werden wir eine Mindestbesteuerung einführen. \nWir werden eine Finanztransaktionssteuer einführen, möglichst im Einklang mit unseren europäi-\nschen Partnern. Zugleich werden wir die von uns maßgeblich mit unterstützten internationalen \nVerhandlungen zur Einführung einer effektiven Mindestbesteuerung und einer fairen Besteuerung \nso genannter Digitalunternehmen zum Abschluss bringen und in Deutschland und Europa umset -\nzen. Google, Amazon, Facebook und andere große Digitalunternehmen müssen einen angemesse-\nnen Beitrag zur Finanzierung des Gemeinwesens leisten. \nWir brauchen einen leistungsfähigen, sicheren und fairen Finanzmarkt, um den Wandel in eine \ndigitale und nachhaltige Wirtschaft finanzieren zu können. Er muss ordentlich reguliert und über -\nwacht werden. Wir werden sicherstellen, dass den Verbraucher*innen die Finanzierungsdienst -\nleistungen kostengünstig angeboten werden und Investitionen in  nachhaltige, klimafreundliche \nProdukte und Produktionsverfahren fördern.']",Die Vermögensprüfung im Bürgergeld wird aufgrund der Corona-Pandemie ausgesetzt. Es wird keine Überprüfung von Vermögen und Wohnungsgröße innerhalb der ersten zwei Jahre geben. Das Schonvermögen wird erhöht.,"Die guten Erfahrungen aus diesen vorübergehenden Maßnahmen haben uns darin bestätigt, dafür zu sorgen, dass auch in Zukunft Vermögen und Wohnungsgröße innerhalb der ersten zwei Jahre nicht überprüft werden und das Schonvermögen erhöht wird.",1.0,0.9317873577332256,0.99999999995,1.0
66,Wie soll die gesetzliche Rente gestärkt werden?,"['Unser ist Ziel ist, dass deutlich\xa0mehr Beschäftigte in \neiner betrieblichen Altersversorgung abgesichert sind. Dabei\xa0sollten tarifvertraglich vereinbarte \nkollektive Altersversorgungsformen bevorzugt\xa0werden. Zudem setzen wir uns für die vollständi-\nge Abschaffung der Vollverbeitragung\xa0sowie\xa0 der Doppelverbeitragung von Betriebsrenten in der \ngesetzlichen\xa0Krankenversicherung ein.\xa0\nWir wollen allen gesetzlich verpflichtet Versicherten zusätzlich die Möglichkeit\xa0einräumen, sich \nin angemessenem Umfang ergänzend freiwillig in der gesetzlichen\xa0Rentenversicherung zu versi-\nchern.\nEine ergänzende private Altersvorsorge ist kein Ersatz für die gesetzliche Rente. Die\xa0bisherigen Er -\ngebnisse der Riester-Rente sind nicht zufriedenstellend. Wir wollen\xa0daher bei klassischen privaten \nAngeboten der Altersvorsorge bürokratische Hemmnisse\xa0abbauen und Kosten senken. Um den \nBürgerinnen und Bürgern eine attraktive private\xa0Altersvorsorge zu ermöglichen, setzen wir uns für \nein neues standardisiertes Angebot\xa0ein, das kostengünstig ist, digital und grenzüberschreitend \nund (nach schwedischem\xa0Vorbild) auch von einer öffentlichen Institution angeboten wird. Die För -\nderung neuer\xa0Verträge werden wir in Form von Zuschüssen auf untere und mittlere Einkommens-\ngruppen\xa0beschränken.'
 'Das Zukunftsprogramm der SPD\nKapitel 3Seite >35\nSPD-Parteivorstand 20213.4. Alter absichern \nFür alle Erwerbstätigen muss eine gute und verlässliche Rente nach vielen Jahren\xa0Arbeit sicher \nsein. Es geht um Respekt und Wertschätzung der Arbeit und darum, sich mit eigener Arbeit eine \ngute eigenständige Absicherung im Alter zu schaffen und von dem erworbenen Lebensstandard \nnicht erheblich einzubüßen. Zentrale Grundlage dafür bleibt für uns die gesetzliche Rentenversi-\ncherung mit ihren verlässlichen Leistungen und ihrer solidarischen Finanzierung.\xa0\nWir wollen die gesetzliche Rente stärken und stehen für eine dauerhaft stabile Rentenleistung und \nein dauerhaftes Rentenniveau von mindestens 48 Prozent. Sollten sich weitere Spielräume erge-\nben, werden wir sie nutzen. Arbeit darf ihren Wert im Alter nicht verlieren. In Parlament und Re-\ngierung haben wir uns erfolgreich für die Grundrente eingesetzt. Sie ist ein Fortschritt und schützt \nviele Menschen, die Jahrzehnte für geringe Löhne gearbeitet haben, vor dem Risiko im Alter arm \nzu sein.\xa0\nImmer wieder fordern Arbeitgeber und konservative Kräfte, dass Menschen für eine gute Rente \nnoch länger arbeiten sollen. Wir lehnen eine weitere Anhebung des gesetzlichen\xa0Renteneintritts-\nalters ab, weil sie für viele, die nicht länger arbeiten können, eine Rentenkürzung bedeutet und \nungerecht ist. Den gesetzlichen Anspruch, dass besonders langjährig Versicherte vor Erreichen der \nRegelaltersgrenze abschlagsfrei in Rente gehen können, werden wir beibehalten.'
 'In Parlament und Re-\ngierung haben wir uns erfolgreich für die Grundrente eingesetzt. Sie ist ein Fortschritt und schützt \nviele Menschen, die Jahrzehnte für geringe Löhne gearbeitet haben, vor dem Risiko im Alter arm \nzu sein.\xa0\nImmer wieder fordern Arbeitgeber und konservative Kräfte, dass Menschen für eine gute Rente \nnoch länger arbeiten sollen. Wir lehnen eine weitere Anhebung des gesetzlichen\xa0Renteneintritts-\nalters ab, weil sie für viele, die nicht länger arbeiten können, eine Rentenkürzung bedeutet und \nungerecht ist. Den gesetzlichen Anspruch, dass besonders langjährig Versicherte vor Erreichen der \nRegelaltersgrenze abschlagsfrei in Rente gehen können, werden wir beibehalten. Solidarität in der \nAlterssicherung bedeutet für uns zudem, dass auch die Selbstständigen, Beamt*innen, freien Be-\nrufe und Mandatsträger*innen der gesetzlichen Rentenversicherung angehören. Es ist an der Zeit, \ndie Gesamtheit der Erwerbstätigen in die Rentenversicherung aufzunehmen und die Sondersys-\nteme auf lange Sicht zu überwinden. Wenn es zu einer Zusammenführung der Altersversorgung \nder Beamt*innen mit der gesetzlichen Rentenversicherung kommt, wird das Gesamtniveau ihrer \nAlterssicherung nicht reduziert.\xa0\nEs darf nicht sein, dass jemand wegen gesundheitlicher Beeinträchtigungen in Armut\xa0gerät. Wir \nwerden daher die Armutsrisiken bei den heutigen\xa0Erwerbsminderungsrentner*innen verringern \nund für sie Verbesserungen erreichen.\xa0\xa0Wir wollen eine geschlechtergerechte Rente. Unterschied-\nliche Arbeitszeiten und\xa0familienbedingte Tätigkeiten bei den Renten werden wir gerechter behan-\ndeln.']","Die gesetzliche Rente soll gestärkt werden, indem mehr Beschäftigte in betriebliche Altersversorgung abgesichert werden, tarifvertraglich vereinbarte kollektive Altersversorgungsformen bevorzugt werden und die Vollverbeitragung sowie Doppelverbeitragung von Betriebsrenten in der gesetzlichen Krankenversicherung abgeschafft werden. Zusätzlich soll gesetzlich verpflichteten Versicherten die Möglichkeit eingeräumt werden, sich ergänzend freiwillig in der gesetzlichen Rentenversicherung zu versichern.",Wir wollen die gesetzliche Rente stärken und stehen für eine dauerhaft stabile Rentenleistung und ein dauerhaftes Rentenniveau von mindestens 48 Prozent.,1.0,1.0,0.5833333333041666,1.0
67,Soll das Renteneintrittsalter angehoben werden?,"['Das Zukunftsprogramm der SPD\nKapitel 3Seite >35\nSPD-Parteivorstand 20213.4. Alter absichern \nFür alle Erwerbstätigen muss eine gute und verlässliche Rente nach vielen Jahren\xa0Arbeit sicher \nsein. Es geht um Respekt und Wertschätzung der Arbeit und darum, sich mit eigener Arbeit eine \ngute eigenständige Absicherung im Alter zu schaffen und von dem erworbenen Lebensstandard \nnicht erheblich einzubüßen. Zentrale Grundlage dafür bleibt für uns die gesetzliche Rentenversi-\ncherung mit ihren verlässlichen Leistungen und ihrer solidarischen Finanzierung.\xa0\nWir wollen die gesetzliche Rente stärken und stehen für eine dauerhaft stabile Rentenleistung und \nein dauerhaftes Rentenniveau von mindestens 48 Prozent. Sollten sich weitere Spielräume erge-\nben, werden wir sie nutzen. Arbeit darf ihren Wert im Alter nicht verlieren. In Parlament und Re-\ngierung haben wir uns erfolgreich für die Grundrente eingesetzt. Sie ist ein Fortschritt und schützt \nviele Menschen, die Jahrzehnte für geringe Löhne gearbeitet haben, vor dem Risiko im Alter arm \nzu sein.\xa0\nImmer wieder fordern Arbeitgeber und konservative Kräfte, dass Menschen für eine gute Rente \nnoch länger arbeiten sollen. Wir lehnen eine weitere Anhebung des gesetzlichen\xa0Renteneintritts-\nalters ab, weil sie für viele, die nicht länger arbeiten können, eine Rentenkürzung bedeutet und \nungerecht ist. Den gesetzlichen Anspruch, dass besonders langjährig Versicherte vor Erreichen der \nRegelaltersgrenze abschlagsfrei in Rente gehen können, werden wir beibehalten.'
 'In Parlament und Re-\ngierung haben wir uns erfolgreich für die Grundrente eingesetzt. Sie ist ein Fortschritt und schützt \nviele Menschen, die Jahrzehnte für geringe Löhne gearbeitet haben, vor dem Risiko im Alter arm \nzu sein.\xa0\nImmer wieder fordern Arbeitgeber und konservative Kräfte, dass Menschen für eine gute Rente \nnoch länger arbeiten sollen. Wir lehnen eine weitere Anhebung des gesetzlichen\xa0Renteneintritts-\nalters ab, weil sie für viele, die nicht länger arbeiten können, eine Rentenkürzung bedeutet und \nungerecht ist. Den gesetzlichen Anspruch, dass besonders langjährig Versicherte vor Erreichen der \nRegelaltersgrenze abschlagsfrei in Rente gehen können, werden wir beibehalten. Solidarität in der \nAlterssicherung bedeutet für uns zudem, dass auch die Selbstständigen, Beamt*innen, freien Be-\nrufe und Mandatsträger*innen der gesetzlichen Rentenversicherung angehören. Es ist an der Zeit, \ndie Gesamtheit der Erwerbstätigen in die Rentenversicherung aufzunehmen und die Sondersys-\nteme auf lange Sicht zu überwinden. Wenn es zu einer Zusammenführung der Altersversorgung \nder Beamt*innen mit der gesetzlichen Rentenversicherung kommt, wird das Gesamtniveau ihrer \nAlterssicherung nicht reduziert.\xa0\nEs darf nicht sein, dass jemand wegen gesundheitlicher Beeinträchtigungen in Armut\xa0gerät. Wir \nwerden daher die Armutsrisiken bei den heutigen\xa0Erwerbsminderungsrentner*innen verringern \nund für sie Verbesserungen erreichen.\xa0\xa0Wir wollen eine geschlechtergerechte Rente. Unterschied-\nliche Arbeitszeiten und\xa0familienbedingte Tätigkeiten bei den Renten werden wir gerechter behan-\ndeln.'
 'Unser ist Ziel ist, dass deutlich\xa0mehr Beschäftigte in \neiner betrieblichen Altersversorgung abgesichert sind. Dabei\xa0sollten tarifvertraglich vereinbarte \nkollektive Altersversorgungsformen bevorzugt\xa0werden. Zudem setzen wir uns für die vollständi-\nge Abschaffung der Vollverbeitragung\xa0sowie\xa0 der Doppelverbeitragung von Betriebsrenten in der \ngesetzlichen\xa0Krankenversicherung ein.\xa0\nWir wollen allen gesetzlich verpflichtet Versicherten zusätzlich die Möglichkeit\xa0einräumen, sich \nin angemessenem Umfang ergänzend freiwillig in der gesetzlichen\xa0Rentenversicherung zu versi-\nchern.\nEine ergänzende private Altersvorsorge ist kein Ersatz für die gesetzliche Rente. Die\xa0bisherigen Er -\ngebnisse der Riester-Rente sind nicht zufriedenstellend. Wir wollen\xa0daher bei klassischen privaten \nAngeboten der Altersvorsorge bürokratische Hemmnisse\xa0abbauen und Kosten senken. Um den \nBürgerinnen und Bürgern eine attraktive private\xa0Altersvorsorge zu ermöglichen, setzen wir uns für \nein neues standardisiertes Angebot\xa0ein, das kostengünstig ist, digital und grenzüberschreitend \nund (nach schwedischem\xa0Vorbild) auch von einer öffentlichen Institution angeboten wird. Die För -\nderung neuer\xa0Verträge werden wir in Form von Zuschüssen auf untere und mittlere Einkommens-\ngruppen\xa0beschränken.']","Die SPD lehnt eine weitere Anhebung des Renteneintrittsalters ab, da dies für viele eine Rentenkürzung bedeuten würde und als ungerecht angesehen wird. Die Partei setzt sich stattdessen für eine gute und verlässliche Rente für alle Erwerbstätigen ein.","Wir lehnen eine weitere Anhebung des gesetzlichen Renteneintritts- alters ab, weil sie für viele, die nicht länger arbeiten können, eine Rentenkürzung bedeutet und ungerecht ist.",1.0,0.9069652011684693,0.99999999995,1.0
68,Welche Gruppen sollen in die gesetzliche Rentenversicherung aufgenommen werden?,"['Wenn es zu einer Zusammenführung der Altersversorgung \nder Beamt*innen mit der gesetzlichen Rentenversicherung kommt, wird das Gesamtniveau ihrer \nAlterssicherung nicht reduziert.\xa0\nEs darf nicht sein, dass jemand wegen gesundheitlicher Beeinträchtigungen in Armut\xa0gerät. Wir \nwerden daher die Armutsrisiken bei den heutigen\xa0Erwerbsminderungsrentner*innen verringern \nund für sie Verbesserungen erreichen.\xa0\xa0Wir wollen eine geschlechtergerechte Rente. Unterschied-\nliche Arbeitszeiten und\xa0familienbedingte Tätigkeiten bei den Renten werden wir gerechter behan-\ndeln.\xa0Langjährige Pflege von Eltern, Schwiegereltern oder anderen Familienmitgliedern\xa0dürfen sich \nnicht mehr negativ auf die Rente auswirken und die eigene Altersarmut bedeuten. Hier brauchen \nwir mehr Solidarität und Respekt vor dieser schweren\xa0Aufgabe.\xa0\nWir haben es kleinen und mittleren Unternehmen erleichtert, für ihre Beschäftigten in\xa0die be-\ntriebliche Altersversorgung einzusteigen. Unser ist Ziel ist, dass deutlich\xa0mehr Beschäftigte in \neiner betrieblichen Altersversorgung abgesichert sind. Dabei\xa0sollten tarifvertraglich vereinbarte \nkollektive Altersversorgungsformen bevorzugt\xa0werden. Zudem setzen wir uns für die vollständi-\nge Abschaffung der Vollverbeitragung\xa0sowie\xa0 der Doppelverbeitragung von Betriebsrenten in der \ngesetzlichen\xa0Krankenversicherung ein.\xa0\nWir wollen allen gesetzlich verpflichtet Versicherten zusätzlich die Möglichkeit\xa0einräumen, sich \nin angemessenem Umfang ergänzend freiwillig in der gesetzlichen\xa0Rentenversicherung zu versi-\nchern.'
 'In Parlament und Re-\ngierung haben wir uns erfolgreich für die Grundrente eingesetzt. Sie ist ein Fortschritt und schützt \nviele Menschen, die Jahrzehnte für geringe Löhne gearbeitet haben, vor dem Risiko im Alter arm \nzu sein.\xa0\nImmer wieder fordern Arbeitgeber und konservative Kräfte, dass Menschen für eine gute Rente \nnoch länger arbeiten sollen. Wir lehnen eine weitere Anhebung des gesetzlichen\xa0Renteneintritts-\nalters ab, weil sie für viele, die nicht länger arbeiten können, eine Rentenkürzung bedeutet und \nungerecht ist. Den gesetzlichen Anspruch, dass besonders langjährig Versicherte vor Erreichen der \nRegelaltersgrenze abschlagsfrei in Rente gehen können, werden wir beibehalten. Solidarität in der \nAlterssicherung bedeutet für uns zudem, dass auch die Selbstständigen, Beamt*innen, freien Be-\nrufe und Mandatsträger*innen der gesetzlichen Rentenversicherung angehören. Es ist an der Zeit, \ndie Gesamtheit der Erwerbstätigen in die Rentenversicherung aufzunehmen und die Sondersys-\nteme auf lange Sicht zu überwinden. Wenn es zu einer Zusammenführung der Altersversorgung \nder Beamt*innen mit der gesetzlichen Rentenversicherung kommt, wird das Gesamtniveau ihrer \nAlterssicherung nicht reduziert.\xa0\nEs darf nicht sein, dass jemand wegen gesundheitlicher Beeinträchtigungen in Armut\xa0gerät. Wir \nwerden daher die Armutsrisiken bei den heutigen\xa0Erwerbsminderungsrentner*innen verringern \nund für sie Verbesserungen erreichen.\xa0\xa0Wir wollen eine geschlechtergerechte Rente. Unterschied-\nliche Arbeitszeiten und\xa0familienbedingte Tätigkeiten bei den Renten werden wir gerechter behan-\ndeln.'
 'Unser ist Ziel ist, dass deutlich\xa0mehr Beschäftigte in \neiner betrieblichen Altersversorgung abgesichert sind. Dabei\xa0sollten tarifvertraglich vereinbarte \nkollektive Altersversorgungsformen bevorzugt\xa0werden. Zudem setzen wir uns für die vollständi-\nge Abschaffung der Vollverbeitragung\xa0sowie\xa0 der Doppelverbeitragung von Betriebsrenten in der \ngesetzlichen\xa0Krankenversicherung ein.\xa0\nWir wollen allen gesetzlich verpflichtet Versicherten zusätzlich die Möglichkeit\xa0einräumen, sich \nin angemessenem Umfang ergänzend freiwillig in der gesetzlichen\xa0Rentenversicherung zu versi-\nchern.\nEine ergänzende private Altersvorsorge ist kein Ersatz für die gesetzliche Rente. Die\xa0bisherigen Er -\ngebnisse der Riester-Rente sind nicht zufriedenstellend. Wir wollen\xa0daher bei klassischen privaten \nAngeboten der Altersvorsorge bürokratische Hemmnisse\xa0abbauen und Kosten senken. Um den \nBürgerinnen und Bürgern eine attraktive private\xa0Altersvorsorge zu ermöglichen, setzen wir uns für \nein neues standardisiertes Angebot\xa0ein, das kostengünstig ist, digital und grenzüberschreitend \nund (nach schwedischem\xa0Vorbild) auch von einer öffentlichen Institution angeboten wird. Die För -\nderung neuer\xa0Verträge werden wir in Form von Zuschüssen auf untere und mittlere Einkommens-\ngruppen\xa0beschränken.']","Alle Erwerbstätigen sollen in die gesetzliche Rentenversicherung aufgenommen werden, einschließlich Selbstständiger, Beamter, freier Berufe und Mandatsträger.","Solidarität in der Alterssicherung bedeutet für uns zudem, dass auch die Selbstständigen, Beamt*innen, freien Berufe und Mandatsträger*innen der gesetzlichen Rentenversicherung angehören.",1.0,0.947551179067951,0.49999999995,1.0
69,Wie soll der Eigenanteil für Pflegebedürftige mit kleinen und mittleren Einkommen geregelt werden?,"['Das Zukunftsprogramm der SPD\nKapitel 3Seite >36\nSPD-Parteivorstand 20213.5. Füreinander einstehen \nEine Gesellschaft des Respekts misst sich auch am Umgang mit den Bürger*innen, die auf andere \nangewiesen sind und gepflegt werden müssen. Wir haben bereits dafür gesorgt, dass Angehörige \nmit einem Einkommen unter 100.000 Euro pro Jahr nicht mehr für die Pflegekosten herangezogen \nwerden. So müssen sich Eltern nicht mehr sorgen, dass ihre Kinder später für ihre Pflege aufkom-\nmen müssen.\xa0\nWir wollen eine Vollversicherung als Bürgerversicherung, die alle pflegerischen Bedarfe und \nLeistungen abdeckt. Ein erster Schritt dorthin ist für uns, für Pflegebedürftige mit kleinen und \nmittleren Einkommen den Eigenanteil zu deckeln, damit Pflege für sie bezahlbar bleibt. Zukünftige \nKostensteigerungen werden solidarisch über einen Mix aus moderat steigenden Pflegeversiche-\nrungsbeiträgen und einem dynamischen Bundeszuschuss finanziert.\xa0\nDie Pflegeinfrastruktur muss bedarfsgerecht ausgebaut werden.\nFür uns ist es außerdem wichtig, dass Länder, Landkreise und Kommunen mehr Möglichkeiten \nerhalten, darüber zu entscheiden, wo und in welcher Trägerschaft Heime entstehen. Um ihren \nSicherstellungsauftrag zu gewährleisten, müssen sie deutlich intensiver in die Entscheidungspro-\nzesse eingebunden werden.\xa0\nBei Pflegebedürftigkeit wollen viele in der eigenen Wohnung bleiben. Dabei sind sie oft auf eine \n24-Stunden-Pflege angewiesen. Dabei entsteht viel Rechtsunsicherheit zu den wechselseitigen \nPflichten und Rechten. Wir werden bei der Pflege und der Hilfe im Alltag für rechtliche Klarheit \nsorgen.'
 'Wir werden eine Bürgerversicherung\xa0einführen. Das bedeutet: Gleich guter \nZugang zur medizinischen Versorgung für alle,\xa0eine solidarische Finanzierung und hohe Qualität \nder Leistungen. Gesundheit ist keine\xa0Ware, deshalb müssen in unserem Gesundheitssystem die \nBürger*innen im Mittelpunkt\xa0stehen. Der Staat muss deshalb sicherstellen, dass die Leistungen \nder\xa0Gesundheitsversorgung den Bedürfnissen derer entsprechen, die sie benötigen. Gute\xa0Arbeits-\nbedingungen und vernünftige Löhne in der Pflege sind dafür eine wichtige\xa0Grundlage.\xa0\nProfessionelle Pflege ist ein höchst anspruchsvoller Beruf. Gute Arbeitsbedingungen und ver -\nnünftige Löhne sind dafür eine wichtige Grundlage. Maßnahmen zur Überwindung\xa0des Personal-\nmangels dürfen nicht dazu führen, dass die Stellen in der Pflege abgewertet werden. Wir wollen \ndie Kommerzialisierung im Gesundheitswesen beenden, denn sie wirkt sich negativ auf die Ver -\nsorgung der Patient*innen und die Arbeitsbedingungen der Beschäftigten aus. Gewinne, die aus \nMitteln der Solidargemeinschaft erwirtschaftet werden, sollen verpflichtend und weitestgehend \nwieder in das Gesundheitssystem zurückfließen. Wir stärken die Kommunen bei der Einrichtung \nund beim Betreiben der integrierten medizinischen Versorgungszentren. Das System der Fallpau-\nschalen werden wir auf den Prüfstand stellen, die Pauschalen überarbeiten und wo nötig abschaf -\nfen. Die Grundkosten der Krankenhäuser und der integrierten medizinischen Versorgungszentren \nwerden wir angemessen finanzieren.'
 'Dadurch können sich die Be-\nhörden und die Betroffenen in den ersten Monaten mit voller Energie auf eine sinnvolle Wieder -\naufnahme der Beschäftigung konzentrieren. Die guten Erfahrungen aus diesen vorübergehenden \nMaßnahmen haben uns darin bestätigt, dafür zu sorgen, dass auch in Zukunft Vermögen und \nWohnungsgröße innerhalb der ersten zwei Jahre nicht überprüft werden und das Schonvermögen \nerhöht wird. Das Bürgergeld beinhaltet Mitwirkungspflichten, setzt aber konsequent auf Hilfe und \nErmutigung. Eingliederungsvereinbarungen werden durch eine gemeinsame und auf Augenhöhe \nerarbeitete Teilhabevereinbarung ersetzt. Bei ihrer Umsetzung setzen wir auf Befähigung und Be-\nstärkung und nicht auf Vorgaben und Zwang. Sinnwidrige und unwürdige Sanktionen schaffen wir \nab. Das sozioökonomische und soziokulturelle Existenzminimum muss jederzeit gesichert sein.\nDie Leistungen des Sozialstaates sind soziale Rechte – wer sie benötigt, sollte nicht lange suchen \nmüssen. Unser Ziel ist es, die Leistungen ohne Hürden und Umwege zugänglich zu machen. Wir \nwollen einen Bürgerservice, der nach Lebenslagen berät und alle Leistungen aus einer Hand zu-\ngänglich macht. Er ist digital und aufsuchend, wo der Weg zu beschwerlich ist. Ein zugewandter \nSozialstaat hilft, Rechtsansprüche geltend zu machen, und begleitet auch danach beratend alle \nSchritte.']","Der Eigenanteil für Pflegebedürftige mit kleinen und mittleren Einkommen soll durch eine Deckelung geregelt werden, um die Pflege bezahlbar zu halten. Zukünftige Kostensteigerungen sollen solidarisch über einen Mix aus moderat steigenden Pflegeversicherungsbeiträgen und einem dynamischen Bundeszuschuss finanziert werden.","Ein erster Schritt dorthin ist für uns, für Pflegebedürftige mit kleinen und mittleren Einkommen den Eigenanteil zu deckeln, damit Pflege für sie bezahlbar bleibt.",1.0,0.9999956238541702,0.9999999999,1.0
70,Was sind die Ziele der Förderung haushaltsnaher Dienstleistungen?,"['Es hat sich bewährt, sinnvolle und sozial abgesicherte Tätigkeiten zu schaffen. Wir werden den \nsozialen Arbeitsmarkt ausbauen und weiterentwickeln. Auch weiterhin werden wir Arbeitgeber \nmit Lohnkostenzuschüssen unterstützen, die Langzeitarbeitslose sozialversicherungspflichtig ein-\nstellen. \nDie Grundsicherung werden wir grundlegend überarbeiten und zu einem Bürgergeld entwickeln. \nUnser Bürgergeld steht für ein neues Verständnis eines haltgebenden und bürgernahen Sozial-\nstaats. Das Bürgergeld soll digital und unkompliziert zugänglich sein. Bescheide und Schriftwech-\nsel sollen eine verständliche Sprache sprechen. Die Regelsätze im neuen Bürgergeld müssen zu \neinem Leben in Würde ausreichen und zur gesellschaftlichen Teilhabe befähigen. Das Bürgergeld \nmuss absichern, dass eine kaputte Waschmaschine oder eine neue Winterjacke nicht zur untrag-\nbaren Last werden. Die Kriterien zur Regelsatzermittlung werden wir weiterentwickeln und Betrof -\nfene und Sozialverbände mit einbeziehen. \nDas Ziel muss sein, die hilfsbedürftige Lebenslage gemeinsam zu bezwingen und allen eine Be-\nschäftigung und, falls erforderlich, eine Qualifizierung und Weiterbildung zu ermöglichen. Wir set -\nzen auf eine umfassende und passgenaue Unterstützung, die die gesamte Bedarfsgemeinschaft \nin den Blick nimmt - auf Qualität und gute Netzwerke statt auf eine reine Kennzahlenlogik. Wir \nwerden die gesetzlichen, personellen und finanziellen Rahmenbedingungen weiter so verbessern, \ndass die Jobcenter und ihre Beschäftigten diesem Auftrag nachkommen können.'
 'Die Pflegeinfrastruktur muss bedarfsgerecht ausgebaut werden.\nFür uns ist es außerdem wichtig, dass Länder, Landkreise und Kommunen mehr Möglichkeiten \nerhalten, darüber zu entscheiden, wo und in welcher Trägerschaft Heime entstehen. Um ihren \nSicherstellungsauftrag zu gewährleisten, müssen sie deutlich intensiver in die Entscheidungspro-\nzesse eingebunden werden.\xa0\nBei Pflegebedürftigkeit wollen viele in der eigenen Wohnung bleiben. Dabei sind sie oft auf eine \n24-Stunden-Pflege angewiesen. Dabei entsteht viel Rechtsunsicherheit zu den wechselseitigen \nPflichten und Rechten. Wir werden bei der Pflege und der Hilfe im Alltag für rechtliche Klarheit \nsorgen.\xa0\nEin besonderes Augenmerk werden wir auf den ländlichen Raum legen. Wir werden im Rahmen \neines Modellprojektes des Bundes Dienstleistungszentren (DLZ) in kleinen Städten und Gemein-\nden schaffen, in denen medizinische und haushaltsnahe Dienstleistungen vermittelt werden. Die \nDLZ erkennen darüber hinaus fehlende Angebote und schaffen in Kooperation mit dem sozialen \nArbeitsmarkt und den vorhandenen Anbietern Abhilfe.\xa0\nWir werden durch eine besondere Förderung der haushaltsnahen Dienstleistungen die Vereinbar -\nkeit von Familie und Beruf verbessern, älteren Menschen helfen, möglichst lange in der eigenen \nWohnung zu leben, Schwarzarbeit bekämpfen und den Personen, die bislang ohne Sozialversiche-\nrung in den privaten Haushalten arbeiten, eine Absicherung bei Arbeitsunfällen oder Krankheit \ngeben. Diese Förderung soll so ausgerichtet sein, dass sie auch von Geringverdiener*innen in An-\nspruch genommen werden kann.'
 'Dadurch können sich die Be-\nhörden und die Betroffenen in den ersten Monaten mit voller Energie auf eine sinnvolle Wieder -\naufnahme der Beschäftigung konzentrieren. Die guten Erfahrungen aus diesen vorübergehenden \nMaßnahmen haben uns darin bestätigt, dafür zu sorgen, dass auch in Zukunft Vermögen und \nWohnungsgröße innerhalb der ersten zwei Jahre nicht überprüft werden und das Schonvermögen \nerhöht wird. Das Bürgergeld beinhaltet Mitwirkungspflichten, setzt aber konsequent auf Hilfe und \nErmutigung. Eingliederungsvereinbarungen werden durch eine gemeinsame und auf Augenhöhe \nerarbeitete Teilhabevereinbarung ersetzt. Bei ihrer Umsetzung setzen wir auf Befähigung und Be-\nstärkung und nicht auf Vorgaben und Zwang. Sinnwidrige und unwürdige Sanktionen schaffen wir \nab. Das sozioökonomische und soziokulturelle Existenzminimum muss jederzeit gesichert sein.\nDie Leistungen des Sozialstaates sind soziale Rechte – wer sie benötigt, sollte nicht lange suchen \nmüssen. Unser Ziel ist es, die Leistungen ohne Hürden und Umwege zugänglich zu machen. Wir \nwollen einen Bürgerservice, der nach Lebenslagen berät und alle Leistungen aus einer Hand zu-\ngänglich macht. Er ist digital und aufsuchend, wo der Weg zu beschwerlich ist. Ein zugewandter \nSozialstaat hilft, Rechtsansprüche geltend zu machen, und begleitet auch danach beratend alle \nSchritte.']","Die Ziele der Förderung haushaltsnaher Dienstleistungen sind die Verbesserung der Vereinbarkeit von Familie und Beruf, die Bekämpfung von Schwarzarbeit und die Absicherung von Personen, die ohne Sozialversicherung in privaten Haushalten arbeiten.","Wir werden durch eine besondere Förderung der haushaltsnahen Dienstleistungen die Vereinbarkeit von Familie und Beruf verbessern, älteren Menschen helfen, möglichst lange in der eigenen Wohnung zu leben, Schwarzarbeit bekämpfen und den Personen, die bislang ohne Sozialversicherung in den privaten Haushalten arbeiten, eine Absicherung bei Arbeitsunfällen oder Krankheit geben. Diese Förderung soll so ausgerichtet sein, dass sie auch von Geringverdiener*innen in Anspruch genommen werden kann.",1.0,1.0000000000000002,0.49999999995,1.0
71,Wie viele Sozialwohnungen sollen jährlich neu gebaut werden?,"['Das Zukunftsprogramm der SPD\nKapitel 3Seite >37\nSPD-Parteivorstand 20213.6. Bezahlbares Wohnen\nEine Wohnung zu finden wird in vielen Lagen zu einer immer größeren Herausforderung – selbst \nmit mittlerem Einkommen.\nWir werden bezahlbaren Wohnraum erhalten und neuen schaffen. Dazu werden wir alle Betei-\nligten an einen Tisch bringen. Kommunale Wohnungsunternehmen und Genossenschaften, aber \nauch private Wohnungsunternehmen und Vermieter*innen, die sich einer sozialverträglichen Ver -\nmietung verpflichtet fühlen, sollten dabei sein wie auch die Bauwirtschaft und die Gewerkschaf -\nten.\nEs gibt eine gemeinsame Verantwortung aller Beteiligten vor allem für den erforderlichen Neubau \nsowie die Quartiersentwicklung und den Klimaschutz. Nach wie vor ist der Neubau von 100.000 \nSozialwohnungen jährlich erforderlich. Daneben führen wir eine neue Wohnungsgemeinnützig-\nkeit ein und fördern damit ein zusätzliches nicht gewinnorientiertes Segment auf dem Wohnungs-\nmarkt.\nIn angespannten Wohnlagen werden wir daneben ein zeitlich befristetes Mietenmoratorium ein-\nführen, das bedeutet: Mieten können für eine bestimmte Zeit nur im Rahmen der Inflationsrate \nerhöht werden. Mietwucher werden wir wirksam unterbinden. Wir werden außerdem die Miet -\npreisbremse entfristen und Schlupflöcher schließen. Das Instrument des qualifizierten Mietspie-\ngels wollen wir bundesweit nach einheitlichen und damit rechtssicheren Kriterien ausgestalten \nund seine Bedeutung stärken. Mietspiegel dürfen keine bloßen Neumietenspiegel sein.'
 'Um die Spekulation mit Wohnraum einzudämmen, werden wir die Eigentü-\nmerstrukturen über ein zentrales Immobilienregister transparent machen.\nWohneigentum dient nicht nur der Versorgung mit Wohnraum, sondern auch der Vermögens- \nund Alterssicherung. Um insbesondere jungen Familien den Weg zu den eigenen vier Wänden zu \nerleichtern, werden wir in angespannten Wohnlagen den Erwerb von Genossenschaftsanteilen \nerleichtern. Wir werden Mietkaufmodelle fördern und ein Programm „Jung-Kauft-Alt“ für den Er -\nwerb von Bestandsimmobilien insbesondere in vom Leerstand betroffenen Ortskernen auflegen.\nMenschen, die in Obdachlosigkeit abgerutscht sind, müssen wir als Gesellschaft nachhaltig helfen. \nDeshalb wollen wir eine flächendeckende Umsetzung von Housing-First-Konzepten in den Städ-\nten und Kommunen voranbringen. Die sehr hohen Erfolgsquoten dieser Projekte ermöglichen die \nRückkehr in die eigene Wohnung und damit ein Leben in Würde.'
 'Dadurch können sich die Be-\nhörden und die Betroffenen in den ersten Monaten mit voller Energie auf eine sinnvolle Wieder -\naufnahme der Beschäftigung konzentrieren. Die guten Erfahrungen aus diesen vorübergehenden \nMaßnahmen haben uns darin bestätigt, dafür zu sorgen, dass auch in Zukunft Vermögen und \nWohnungsgröße innerhalb der ersten zwei Jahre nicht überprüft werden und das Schonvermögen \nerhöht wird. Das Bürgergeld beinhaltet Mitwirkungspflichten, setzt aber konsequent auf Hilfe und \nErmutigung. Eingliederungsvereinbarungen werden durch eine gemeinsame und auf Augenhöhe \nerarbeitete Teilhabevereinbarung ersetzt. Bei ihrer Umsetzung setzen wir auf Befähigung und Be-\nstärkung und nicht auf Vorgaben und Zwang. Sinnwidrige und unwürdige Sanktionen schaffen wir \nab. Das sozioökonomische und soziokulturelle Existenzminimum muss jederzeit gesichert sein.\nDie Leistungen des Sozialstaates sind soziale Rechte – wer sie benötigt, sollte nicht lange suchen \nmüssen. Unser Ziel ist es, die Leistungen ohne Hürden und Umwege zugänglich zu machen. Wir \nwollen einen Bürgerservice, der nach Lebenslagen berät und alle Leistungen aus einer Hand zu-\ngänglich macht. Er ist digital und aufsuchend, wo der Weg zu beschwerlich ist. Ein zugewandter \nSozialstaat hilft, Rechtsansprüche geltend zu machen, und begleitet auch danach beratend alle \nSchritte.']",Die SPD plant jährlich den Neubau von 100.000 Sozialwohnungen.,Nach wie vor ist der Neubau von 100.000 Sozialwohnungen jährlich erforderlich.,1.0,0.8882451775947086,0.9999999999,1.0
72,Wie soll die Mietpreisbremse angepasst werden?,"['Daneben führen wir eine neue Wohnungsgemeinnützig-\nkeit ein und fördern damit ein zusätzliches nicht gewinnorientiertes Segment auf dem Wohnungs-\nmarkt.\nIn angespannten Wohnlagen werden wir daneben ein zeitlich befristetes Mietenmoratorium ein-\nführen, das bedeutet: Mieten können für eine bestimmte Zeit nur im Rahmen der Inflationsrate \nerhöht werden. Mietwucher werden wir wirksam unterbinden. Wir werden außerdem die Miet -\npreisbremse entfristen und Schlupflöcher schließen. Das Instrument des qualifizierten Mietspie-\ngels wollen wir bundesweit nach einheitlichen und damit rechtssicheren Kriterien ausgestalten \nund seine Bedeutung stärken. Mietspiegel dürfen keine bloßen Neumietenspiegel sein. Deshalb \nwerden wir künftig mindestens die vertraglich vereinbarten Mieten der vergangenen acht Jahre \nbei ihrer Aufstellung heranziehen.\nUnsere Bodenpolitik wird am Gemeinwohl orientiert. Bund, Länder und Kommunen sollen öf -\nfentliches Eigentum an Grundstücken sichern und vermehren, um die Spekulation mit Grund und \nBoden zu stoppen. Dazu ist das Vorkaufsrecht für Kommunen zu fairen Preisen wichtig.\nWir werden dazu beitragen, dass kommunale Wohnbauflächen nicht veräußert werden, Flächen \nzurückerworben werden und öffentliches Bauland nur auf dem Weg der Erbpacht für den Woh-\nnungsbau zur Verfügung gestellt wird. Mit der Schaffung von Bodenfonds unter Einbeziehung \nbundeseigener Grundstücke erhalten Kommunen ein Instrument für die nachhaltige Stadtent -\nwicklung und bezahlbaren Wohnungsbau.'
 'Das Zukunftsprogramm der SPD\nKapitel 3Seite >37\nSPD-Parteivorstand 20213.6. Bezahlbares Wohnen\nEine Wohnung zu finden wird in vielen Lagen zu einer immer größeren Herausforderung – selbst \nmit mittlerem Einkommen.\nWir werden bezahlbaren Wohnraum erhalten und neuen schaffen. Dazu werden wir alle Betei-\nligten an einen Tisch bringen. Kommunale Wohnungsunternehmen und Genossenschaften, aber \nauch private Wohnungsunternehmen und Vermieter*innen, die sich einer sozialverträglichen Ver -\nmietung verpflichtet fühlen, sollten dabei sein wie auch die Bauwirtschaft und die Gewerkschaf -\nten.\nEs gibt eine gemeinsame Verantwortung aller Beteiligten vor allem für den erforderlichen Neubau \nsowie die Quartiersentwicklung und den Klimaschutz. Nach wie vor ist der Neubau von 100.000 \nSozialwohnungen jährlich erforderlich. Daneben führen wir eine neue Wohnungsgemeinnützig-\nkeit ein und fördern damit ein zusätzliches nicht gewinnorientiertes Segment auf dem Wohnungs-\nmarkt.\nIn angespannten Wohnlagen werden wir daneben ein zeitlich befristetes Mietenmoratorium ein-\nführen, das bedeutet: Mieten können für eine bestimmte Zeit nur im Rahmen der Inflationsrate \nerhöht werden. Mietwucher werden wir wirksam unterbinden. Wir werden außerdem die Miet -\npreisbremse entfristen und Schlupflöcher schließen. Das Instrument des qualifizierten Mietspie-\ngels wollen wir bundesweit nach einheitlichen und damit rechtssicheren Kriterien ausgestalten \nund seine Bedeutung stärken. Mietspiegel dürfen keine bloßen Neumietenspiegel sein.'
 'Dadurch können sich die Be-\nhörden und die Betroffenen in den ersten Monaten mit voller Energie auf eine sinnvolle Wieder -\naufnahme der Beschäftigung konzentrieren. Die guten Erfahrungen aus diesen vorübergehenden \nMaßnahmen haben uns darin bestätigt, dafür zu sorgen, dass auch in Zukunft Vermögen und \nWohnungsgröße innerhalb der ersten zwei Jahre nicht überprüft werden und das Schonvermögen \nerhöht wird. Das Bürgergeld beinhaltet Mitwirkungspflichten, setzt aber konsequent auf Hilfe und \nErmutigung. Eingliederungsvereinbarungen werden durch eine gemeinsame und auf Augenhöhe \nerarbeitete Teilhabevereinbarung ersetzt. Bei ihrer Umsetzung setzen wir auf Befähigung und Be-\nstärkung und nicht auf Vorgaben und Zwang. Sinnwidrige und unwürdige Sanktionen schaffen wir \nab. Das sozioökonomische und soziokulturelle Existenzminimum muss jederzeit gesichert sein.\nDie Leistungen des Sozialstaates sind soziale Rechte – wer sie benötigt, sollte nicht lange suchen \nmüssen. Unser Ziel ist es, die Leistungen ohne Hürden und Umwege zugänglich zu machen. Wir \nwollen einen Bürgerservice, der nach Lebenslagen berät und alle Leistungen aus einer Hand zu-\ngänglich macht. Er ist digital und aufsuchend, wo der Weg zu beschwerlich ist. Ein zugewandter \nSozialstaat hilft, Rechtsansprüche geltend zu machen, und begleitet auch danach beratend alle \nSchritte.']","Die Mietpreisbremse soll entfristet und Schlupflöcher geschlossen werden, um Mietwucher wirksam zu unterbinden. Zudem wird ein bundesweiter qualifizierter Mietspiegel eingeführt und gestärkt. Mindestens die vertraglich vereinbarten Mieten der vergangenen acht Jahre sollen bei der Mietspiegelerstellung berücksichtigt werden.",Wir werden außerdem die Mietpreisbremse entfristen und Schlupflöcher schließen.,0.8333333333333334,0.9282746491921455,0.99999999995,1.0
73,Wie sollen Kommunen bei der nachhaltigen Stadtentwicklung unterstützt werden?,"['Wir werden die \nUnterstützung von strukturschwachen Regionen durch die Gemeinschaftsaufgabe Verbesserung \nder regionalen Wirtschaftsstruktur (GRW) verstetigen. Ein zentraler Akteur beim Investitionsge-\nschehen sind die Kommunen – ihre Investitionskraft müssen wir erhalten und stärken. Gleichwer -\ntige Lebensverhältnisse zu sichern heißt auch: Soziale Dienstleistungen dürfen nicht abhängig von \nder finanziellen Leistungsfähigkeit der Kommune sein. Dazu brauchen wir flächendeckend starke \nund handlungsfähige Kommunen. Im Zuge der Corona-Pandemie haben wir bereits weitere Schrit -\nte getan, um Kommunen von Sozialausgaben zu entlasten. Ein nötiger Schritt ist, den besonders \nhoch verschuldeten Kommunen einmalig hohe Altschulden abzunehmen. Zudem werden wir das \nProblem der Altschulden vor allem ostdeutscher Wohnungsbaugesellschaften lösen.\nIn Deutschland werden gegenwärtig jährlich über 300 Milliarden Euro im Rahmen der öffentlichen \nAuftragsvergabe umgesetzt. Gerade die öffentliche Hand muss als große Abnehmerin von Produk -\nten und Dienstleistungen Verantwortung übernehmen. Wir werden die öffentliche Beschaffung \nso ausrichten, dass sie Innovationsimpulse setzt und den Zielen des sozial-ökologischen Wandels \ndient. Hierfür sollten die Vergabekriterien stärker auf Innovation, Tarifbindung, Geschlechterge-\nrechtigkeit und klimafreundliche Nachhaltigkeit ausgerichtet werden.\nProduktentwicklungen müssen sich auf den Staat als Nachfrager verlassen können. \nWir müssen besser darin werden, aus Ideen auch Produkte und Dienstleistungen zu machen und \nStart-ups zu fördern.'
 'Wir sehen in dieser Jahrhundertaufgabe riesige Potenziale für \ngute und sichere Arbeitsplätze. Deutschland ist erfolgreich als Exporteur umweltfreundlicher Tech-\nnologien, weil es gelungen ist, Produktionsprozesse nachhaltig und die 20er zu einem Jahrzehnt \nder erneuerbaren Energien zu machen.\xa0\nDen sozial-ökologischen Umbau der Wirtschaft meistern wir, wenn wir wirtschaftlichen Erfolg zu-\nkünftig nicht nur am Bruttoinlandsprodukt messen, sondern am Wohlergehen der gesamten Ge-\nsellschaft und der Natur. Wir richten unsere Politik an den Nachhaltigkeitszielen der Vereinten Na-\ntionen (SDG) aus und werden dazu die Deutsche Nachhaltigkeitsstrategie weiterentwickeln.\xa0Wenn \nder Staat maßgebliche Impulse gibt, durch kluge Spielregeln, die soziale und technische Innovatio-\nnen hervorbringen, durch Förderung von Wissenschaft und Forschung, durch massive und stetige \nInvestitionen in eine moderne Infrastruktur, durch aktive Förderung der Regionen im Wandel und \ndurch Beteiligung der Bürger*innen im Allgemeinen und der Beschäftigten im Besonderen. So wer -\nden Arbeitsplätze zukunftsfähig und neue gute Arbeitsplätze geschaffen. So sichern wir Einkom-\nmen und Perspektiven für alle. Wir wollen einen neuen sozial-ökologischen Gesellschaftsvertrag, \nder dafür sorgt, dass im Wandel niemand abgehängt wird.'
 'Zugleich werden wir Investi-\ntionen in Wärmenetze und Quartierskonzepte staatlich fördern. \nWir werden mit einer langfristig angelegten Industriestrategie Planungssicherheit für den sozial-\nökologischen Umbau unserer Wirtschaft schaffen. Diese Industriestrategie wird in Verbindung mit \ndem European Green Deal in eine gesamteuropäische Lösung eingebettet sein. \nDen Umstieg auf klimaschonende Produktionsprozesse werden wir durch direkte Investitionsför -\nderung staatlich unterstützen und die derzeitigen höheren Kosten von klimaschonenden Techno-\nlogien ausgleichen; klima- und umweltschädliche Subventionen werden wir abbauen. Wir werden \neinen Markt für umweltfreundliche Ausgangsmaterialien schaffen. Die öffentliche Hand als großer \nBauherr von Straßen und Gebäuden wird bis 2030 schrittweise immer mehr und ab 2030 aus-\nschließlich klimaneutrale Grundmaterialien für Bauten beschaffen. Wir werden unsere Industrien \nsichern und die Verlagerung von Produktion und Emissionen ins Ausland durch maßgeschneiderte \nInstrumente unattraktiver machen. Außerdem werden wir dafür sorgen, dass für Unternehmen, \ndie im internationalen Wettbewerb stehen, auch der Industriestrompreis wettbewerbsfähig ist.\nMit Ressourcen werden wir nicht länger verschwenderisch umgehen. Wir werden unsere Wirt -\nschaft zur Kreislaufwirtschaft umbauen. Die Menge an Abfall, die wir in Deutschland produzieren, \nmuss deutlich weniger werden. Neben dem Recycling werden wir ein Rohstoffsicherungskonzept \nerarbeiten, um eine sichere Lieferung der für die umweltfreundliche Produktion nötigen Rohstoffe \nzu gewährleisten.']","Kommunen sollen durch die Gemeinschaftsaufgabe Verbesserung der regionalen Wirtschaftsstruktur (GRW) unterstützt werden, um strukturschwache Regionen zu stärken. Die Investitionskraft der Kommunen soll erhalten und gestärkt werden, um gleichwertige Lebensverhältnisse zu sichern. Die öffentliche Beschaffung soll auf Innovation und Nachhaltigkeit ausgerichtet werden, um den sozial-ökologischen Wandel zu fördern.",Mit der Schaffung von Bodenfonds unter Einbeziehung bundeseigener Grundstücke erhalten Kommunen ein Instrument für die nachhaltige Stadtentwicklung und bezahlbaren Wohnungsbau.,1.0,0.9102296801974551,0.0,0.0
74,Welche Wohnformen sollen gefördert werden?,"['Um die Spekulation mit Wohnraum einzudämmen, werden wir die Eigentü-\nmerstrukturen über ein zentrales Immobilienregister transparent machen.\nWohneigentum dient nicht nur der Versorgung mit Wohnraum, sondern auch der Vermögens- \nund Alterssicherung. Um insbesondere jungen Familien den Weg zu den eigenen vier Wänden zu \nerleichtern, werden wir in angespannten Wohnlagen den Erwerb von Genossenschaftsanteilen \nerleichtern. Wir werden Mietkaufmodelle fördern und ein Programm „Jung-Kauft-Alt“ für den Er -\nwerb von Bestandsimmobilien insbesondere in vom Leerstand betroffenen Ortskernen auflegen.\nMenschen, die in Obdachlosigkeit abgerutscht sind, müssen wir als Gesellschaft nachhaltig helfen. \nDeshalb wollen wir eine flächendeckende Umsetzung von Housing-First-Konzepten in den Städ-\nten und Kommunen voranbringen. Die sehr hohen Erfolgsquoten dieser Projekte ermöglichen die \nRückkehr in die eigene Wohnung und damit ein Leben in Würde.'
 'Das Zukunftsprogramm der SPD\nKapitel 3Seite >37\nSPD-Parteivorstand 20213.6. Bezahlbares Wohnen\nEine Wohnung zu finden wird in vielen Lagen zu einer immer größeren Herausforderung – selbst \nmit mittlerem Einkommen.\nWir werden bezahlbaren Wohnraum erhalten und neuen schaffen. Dazu werden wir alle Betei-\nligten an einen Tisch bringen. Kommunale Wohnungsunternehmen und Genossenschaften, aber \nauch private Wohnungsunternehmen und Vermieter*innen, die sich einer sozialverträglichen Ver -\nmietung verpflichtet fühlen, sollten dabei sein wie auch die Bauwirtschaft und die Gewerkschaf -\nten.\nEs gibt eine gemeinsame Verantwortung aller Beteiligten vor allem für den erforderlichen Neubau \nsowie die Quartiersentwicklung und den Klimaschutz. Nach wie vor ist der Neubau von 100.000 \nSozialwohnungen jährlich erforderlich. Daneben führen wir eine neue Wohnungsgemeinnützig-\nkeit ein und fördern damit ein zusätzliches nicht gewinnorientiertes Segment auf dem Wohnungs-\nmarkt.\nIn angespannten Wohnlagen werden wir daneben ein zeitlich befristetes Mietenmoratorium ein-\nführen, das bedeutet: Mieten können für eine bestimmte Zeit nur im Rahmen der Inflationsrate \nerhöht werden. Mietwucher werden wir wirksam unterbinden. Wir werden außerdem die Miet -\npreisbremse entfristen und Schlupflöcher schließen. Das Instrument des qualifizierten Mietspie-\ngels wollen wir bundesweit nach einheitlichen und damit rechtssicheren Kriterien ausgestalten \nund seine Bedeutung stärken. Mietspiegel dürfen keine bloßen Neumietenspiegel sein.'
 'Daneben führen wir eine neue Wohnungsgemeinnützig-\nkeit ein und fördern damit ein zusätzliches nicht gewinnorientiertes Segment auf dem Wohnungs-\nmarkt.\nIn angespannten Wohnlagen werden wir daneben ein zeitlich befristetes Mietenmoratorium ein-\nführen, das bedeutet: Mieten können für eine bestimmte Zeit nur im Rahmen der Inflationsrate \nerhöht werden. Mietwucher werden wir wirksam unterbinden. Wir werden außerdem die Miet -\npreisbremse entfristen und Schlupflöcher schließen. Das Instrument des qualifizierten Mietspie-\ngels wollen wir bundesweit nach einheitlichen und damit rechtssicheren Kriterien ausgestalten \nund seine Bedeutung stärken. Mietspiegel dürfen keine bloßen Neumietenspiegel sein. Deshalb \nwerden wir künftig mindestens die vertraglich vereinbarten Mieten der vergangenen acht Jahre \nbei ihrer Aufstellung heranziehen.\nUnsere Bodenpolitik wird am Gemeinwohl orientiert. Bund, Länder und Kommunen sollen öf -\nfentliches Eigentum an Grundstücken sichern und vermehren, um die Spekulation mit Grund und \nBoden zu stoppen. Dazu ist das Vorkaufsrecht für Kommunen zu fairen Preisen wichtig.\nWir werden dazu beitragen, dass kommunale Wohnbauflächen nicht veräußert werden, Flächen \nzurückerworben werden und öffentliches Bauland nur auf dem Weg der Erbpacht für den Woh-\nnungsbau zur Verfügung gestellt wird. Mit der Schaffung von Bodenfonds unter Einbeziehung \nbundeseigener Grundstücke erhalten Kommunen ein Instrument für die nachhaltige Stadtent -\nwicklung und bezahlbaren Wohnungsbau.']","Genossenschaftsanteile, Mietkaufmodelle und das Programm ""Jung-Kauft-Alt"" für den Erwerb von Bestandsimmobilien in Leerstand betroffenen Ortskernen sollen gefördert werden.","Wir werden generationenübergreifende, alternative und barrierefreie Wohnformen in Städten und Quartieren fördern.",1.0,0.9297526140373299,0.49999999995,0.0
75,Was sind die zentralen Bereiche der Kindergrundsicherung?,"['Das bedeutet: 15 Monate Anspruch \nauf Unterstützung (Lohnersatz) bei einer Arbeitszeitreduzierung für jeden nahen Angehörigen \nab Pflegegrad 2, auf mehrere Pflegepersonen aufteilbar mit einer Mindestarbeitszeit von 15 bis \n20 Stunden. Wichtig ist, dass Unternehmen gezielt auch die Männer ermutigen, dieses Modell zu \nnutzen. \nWir werden dafür sorgen, dass alle Kinder und Jugendlichen unabhängig von ihrer Herkunft die \ngleichen Chancen haben, das Bestmögliche aus ihrem Leben zu machen. Jedes Kind soll gut und \ngeborgen aufwachsen und alle jungen Menschen sollen gut ins Erwachsenenleben starten. Die \nUnterstützung von Kindern und Familien in Deutschland ist vielfältig. Aber genau dort, wo sie be-\nsonders gebraucht wird, kommt sie oft nicht an. \nWir haben deshalb ein Konzept der Kindergrundsicherung entwickelt, das aus zwei zentralen Be-\nreichen besteht. Zum einen aus einer Infrastruktur, die gerechte Bildung und Teilhabe für alle Kin-\nder ermöglicht. Sie beinhaltet gute und beitragsfreie Kitas, ein Ganztagsangebot für Schulkinder, \neine soziale Infrastruktur für Kinder und Jugendliche und freie Fahrt in Bus und Bahn im Nahver -\nkehr sowie ein Recht auf Mobilität vor allem für den ländlichen Raum. Die Kindergrundsicherung \nbesteht zum anderen aus einem neuen existenzsichernden, automatisch ausgezahlten Kindergeld, \ndas nach Einkommen der Familie gestaffelt ist – je höher der Unterstützungsbedarf, desto höher \ndas Kindergeld. Damit machen wir das Leben der Familien leichter, die es besonders schwer haben.'
 'Denn auch jenseits \ndes Kleinkindalters brauchen Eltern Zeit für ihre Kinder, sei es bei der Einschulung, weil ein Umzug \nansteht oder ein Kind einfach mehr unterstützt werden muss als andere. \nDie dritte Säule ist die dauerhafte Ausweitung der pandemiebedingt erhöhten Kinderkranken-\ntage auf 20 Tage pro Kind, Jahr und Elternteil (als „Elterngeld akut“) - bei mehr als zwei Kindern \nmaximal 45 Tage pro Elternteil und 90 Tage für Alleinerziehende. Kinderkrankentage waren schon \nvor Corona oft zu knapp - gerade bei jüngeren Kindern, die in den ersten Kita-Jahren häufig krank \nwerden. Darüber hinaus soll künftig auch anderer kurzzeitiger Betreuungsbedarf über das „Eltern-\ngeld akut“ organisiert werden können. \nUnser Modell der Familienpflegezeit ist die vierte Säule. Wer Angehörige pflegt, soll dabei unter -\nstützt werden, die Pflege mit Erwerbsarbeit zu kombinieren. Das bedeutet: 15 Monate Anspruch \nauf Unterstützung (Lohnersatz) bei einer Arbeitszeitreduzierung für jeden nahen Angehörigen \nab Pflegegrad 2, auf mehrere Pflegepersonen aufteilbar mit einer Mindestarbeitszeit von 15 bis \n20 Stunden. Wichtig ist, dass Unternehmen gezielt auch die Männer ermutigen, dieses Modell zu \nnutzen. \nWir werden dafür sorgen, dass alle Kinder und Jugendlichen unabhängig von ihrer Herkunft die \ngleichen Chancen haben, das Bestmögliche aus ihrem Leben zu machen. Jedes Kind soll gut und \ngeborgen aufwachsen und alle jungen Menschen sollen gut ins Erwachsenenleben starten. Die \nUnterstützung von Kindern und Familien in Deutschland ist vielfältig.'
 'Das Zukunftsprogramm der SPD\nKapitel 3Seite >40\nSPD-Parteivorstand 2021Der monatliche Basisbetrag dieses neuen Kindergeldes wird bei zirka 250 Euro liegen. Der Höchst -\nbetrag wird sich an den Ausgaben von Familien mit mittleren Einkommen für Bildung und Teilha-\nbe orientieren und mindestens doppelt so hoch sein wie der Basisbetrag. Im Höchstbetrag sind das \nsächliche Existenzminimum inklusive Wohnkostenpauschale sowie Bildungs- und Teilhabekosten \nenthalten. Das neue Kindergeld ersetzt so den Kinderfreibetrag und bündelt bisherige Leistungen.\nJunge Menschen in Ausbildung sollen durch direkte, elternunabhängige Auszahlung des neuen \nKindergeldes finanziell abgesichert werden - mit einem zusätzlichen, auskömmlichen Fördersatz \nan BAföG obendrauf. Wir wollen Hilfen für Kinder, Jugendliche und Familien bündeln, die von \nKrankheit oder Behinderung betroffen sind. Kinder, Jugendliche, junge Erwachsene und Eltern \nmüssen einen einfachen Zugang zu Unterstützungsleistungen haben. Dafür sind weitere Schritte \nnotwendig. Der Kampf gegen Bildungsbenachteiligung muss in allen Systemen konsequent statt -\nfinden. Die erste Bildungseinrichtung im Leben eines Kindes ist heute die Kita. Deshalb werden wir \ndie frühkindliche Bildung weiter ausbauen. \nOhne bezahlbare Wohnheimangebote ist für viele Auszubildende und Studierende eine erfolgrei-\nche Ausbildung nicht möglich. Wir werden sie ausbauen und zudem das Jugendwohnen im Rah-\nmen der Kinder- und Jugendhilfe zukünftig für junge Menschen bis 27 Jahre ermöglichen sowie \nmehr Räume für Jugendarbeit schaffen.']","Die zentralen Bereiche der Kindergrundsicherung umfassen eine Infrastruktur für gerechte Bildung und Teilhabe für alle Kinder sowie ein existenzsicherndes, gestaffeltes Kindergeld nach dem Einkommen der Familie.","Die Kindergrundsicherung besteht zum einen aus einer Infrastruktur, die gerechte Bildung und Teilhabe für alle Kinder ermöglicht. Zum anderen aus einem neuen existenzsichernden, automatisch ausgezahlten Kindergeld, das nach Einkommen der Familie gestaffelt ist.",1.0,0.9999999999999994,0.8333333332916666,1.0
76,Wie sollen die Kinderkrankentage verändert werden?,"['Denn auch jenseits \ndes Kleinkindalters brauchen Eltern Zeit für ihre Kinder, sei es bei der Einschulung, weil ein Umzug \nansteht oder ein Kind einfach mehr unterstützt werden muss als andere. \nDie dritte Säule ist die dauerhafte Ausweitung der pandemiebedingt erhöhten Kinderkranken-\ntage auf 20 Tage pro Kind, Jahr und Elternteil (als „Elterngeld akut“) - bei mehr als zwei Kindern \nmaximal 45 Tage pro Elternteil und 90 Tage für Alleinerziehende. Kinderkrankentage waren schon \nvor Corona oft zu knapp - gerade bei jüngeren Kindern, die in den ersten Kita-Jahren häufig krank \nwerden. Darüber hinaus soll künftig auch anderer kurzzeitiger Betreuungsbedarf über das „Eltern-\ngeld akut“ organisiert werden können. \nUnser Modell der Familienpflegezeit ist die vierte Säule. Wer Angehörige pflegt, soll dabei unter -\nstützt werden, die Pflege mit Erwerbsarbeit zu kombinieren. Das bedeutet: 15 Monate Anspruch \nauf Unterstützung (Lohnersatz) bei einer Arbeitszeitreduzierung für jeden nahen Angehörigen \nab Pflegegrad 2, auf mehrere Pflegepersonen aufteilbar mit einer Mindestarbeitszeit von 15 bis \n20 Stunden. Wichtig ist, dass Unternehmen gezielt auch die Männer ermutigen, dieses Modell zu \nnutzen. \nWir werden dafür sorgen, dass alle Kinder und Jugendlichen unabhängig von ihrer Herkunft die \ngleichen Chancen haben, das Bestmögliche aus ihrem Leben zu machen. Jedes Kind soll gut und \ngeborgen aufwachsen und alle jungen Menschen sollen gut ins Erwachsenenleben starten. Die \nUnterstützung von Kindern und Familien in Deutschland ist vielfältig.'
 'Die Altersgrenzen im \nBAföG werden wir dazu in einem ersten Schritt aufheben. Und wir brauchen ein Neustart-BAföG, \ndas auch im Erwachsenenalter neue berufliche Wege öffnen und angemessen den Lebensunter -\nhalt sichert.\nBereits jetzt besteht die Möglichkeit, dass Arbeitnehmer*innen ihre geleisteten Arbeitsstunden \nauf Langzeitkonten ansparen. Allerdings besteht bislang kein rechtlicher Anspruch darauf und nur \nein kleiner Teil der Unternehmen und Arbeitnehmer*innen nutzt Langzeitkonten. Wir werden das \nInstrument zu einem persönlichen Zeitkonto weiterentwickeln, um zusätzlich individuelle Ge-\nstaltungsmöglichkeiten entlang des Lebenslaufs zu schaffen. Basis eines solchen Zeitkontos sind \nZeiteinzahlungen der Beschäftigten – auf diese Weise gehen Überstunden nicht verloren, sondern \nverwandeln sich in ein Zeitguthaben, das per Tarifvertrag oder durch den Staat nach dem Prinzip \neines Chancenkontos aufgestockt werden kann.'
 'Wir werden ein Vier-Säulen-Modell für mehr Familienzeit einführen. Die erste Säule sind zwei \nWochen Elternschaftszeit direkt nach Geburt eines Kindes, auf die jeder Vater bzw. der/die Part -\nner*in kurzfristig und sozial abgesichert Anspruch hat. Wir werden damit Familien mit Kindern in \nihrer allerersten Phase unterstützen und die Voraussetzungen für eine gerechtere Aufteilung von \nSorgeaufgaben schaffen. \nDie zweite Säule ist die Familienarbeitszeit, mit der wir den derzeitigen Partnerschaftsbonus beim \nElterngeldPlus zu einer flexiblen, geförderten Elternteilzeit nach dem ersten Lebensjahr eines Kin-\ndes ausbauen werden. Wenn in Paarfamilien beide Elternteile gleichzeitig oder Alleinerziehende \netwas weniger als Vollzeit arbeiten, sollen sie zukünftig je zehn Monate ElterngeldPlus erhalten – \nmindestens 200 und höchstens 900 Euro. Diese Leistung kann so lange genutzt werden, wie auch \nder Anspruch auf Elternzeit gilt, also bis zum achten Geburtstag des Kindes. Denn auch jenseits \ndes Kleinkindalters brauchen Eltern Zeit für ihre Kinder, sei es bei der Einschulung, weil ein Umzug \nansteht oder ein Kind einfach mehr unterstützt werden muss als andere. \nDie dritte Säule ist die dauerhafte Ausweitung der pandemiebedingt erhöhten Kinderkranken-\ntage auf 20 Tage pro Kind, Jahr und Elternteil (als „Elterngeld akut“) - bei mehr als zwei Kindern \nmaximal 45 Tage pro Elternteil und 90 Tage für Alleinerziehende. Kinderkrankentage waren schon \nvor Corona oft zu knapp - gerade bei jüngeren Kindern, die in den ersten Kita-Jahren häufig krank \nwerden.']","Die Kinderkrankentage sollen dauerhaft auf 20 Tage pro Kind, Jahr und Elternteil ausgeweitet werden, mit maximal 45 Tagen pro Elternteil bei mehr als zwei Kindern und 90 Tagen für Alleinerziehende.","Die dritte Säule ist die dauerhafte Ausweitung der pandemiebedingt erhöhten Kinderkrankentage auf 20 Tage pro Kind, Jahr und Elternteil (als „Elterngeld akut“) - bei mehr als zwei Kindern maximal 45 Tage pro Elternteil und 90 Tage für Alleinerziehende.",1.0,0.9531775908435572,0.8333333332916666,1.0
77,Wie soll die Familienpflegezeit gestaltet werden?,"['Denn auch jenseits \ndes Kleinkindalters brauchen Eltern Zeit für ihre Kinder, sei es bei der Einschulung, weil ein Umzug \nansteht oder ein Kind einfach mehr unterstützt werden muss als andere. \nDie dritte Säule ist die dauerhafte Ausweitung der pandemiebedingt erhöhten Kinderkranken-\ntage auf 20 Tage pro Kind, Jahr und Elternteil (als „Elterngeld akut“) - bei mehr als zwei Kindern \nmaximal 45 Tage pro Elternteil und 90 Tage für Alleinerziehende. Kinderkrankentage waren schon \nvor Corona oft zu knapp - gerade bei jüngeren Kindern, die in den ersten Kita-Jahren häufig krank \nwerden. Darüber hinaus soll künftig auch anderer kurzzeitiger Betreuungsbedarf über das „Eltern-\ngeld akut“ organisiert werden können. \nUnser Modell der Familienpflegezeit ist die vierte Säule. Wer Angehörige pflegt, soll dabei unter -\nstützt werden, die Pflege mit Erwerbsarbeit zu kombinieren. Das bedeutet: 15 Monate Anspruch \nauf Unterstützung (Lohnersatz) bei einer Arbeitszeitreduzierung für jeden nahen Angehörigen \nab Pflegegrad 2, auf mehrere Pflegepersonen aufteilbar mit einer Mindestarbeitszeit von 15 bis \n20 Stunden. Wichtig ist, dass Unternehmen gezielt auch die Männer ermutigen, dieses Modell zu \nnutzen. \nWir werden dafür sorgen, dass alle Kinder und Jugendlichen unabhängig von ihrer Herkunft die \ngleichen Chancen haben, das Bestmögliche aus ihrem Leben zu machen. Jedes Kind soll gut und \ngeborgen aufwachsen und alle jungen Menschen sollen gut ins Erwachsenenleben starten. Die \nUnterstützung von Kindern und Familien in Deutschland ist vielfältig.'
 'Wir werden ein Vier-Säulen-Modell für mehr Familienzeit einführen. Die erste Säule sind zwei \nWochen Elternschaftszeit direkt nach Geburt eines Kindes, auf die jeder Vater bzw. der/die Part -\nner*in kurzfristig und sozial abgesichert Anspruch hat. Wir werden damit Familien mit Kindern in \nihrer allerersten Phase unterstützen und die Voraussetzungen für eine gerechtere Aufteilung von \nSorgeaufgaben schaffen. \nDie zweite Säule ist die Familienarbeitszeit, mit der wir den derzeitigen Partnerschaftsbonus beim \nElterngeldPlus zu einer flexiblen, geförderten Elternteilzeit nach dem ersten Lebensjahr eines Kin-\ndes ausbauen werden. Wenn in Paarfamilien beide Elternteile gleichzeitig oder Alleinerziehende \netwas weniger als Vollzeit arbeiten, sollen sie zukünftig je zehn Monate ElterngeldPlus erhalten – \nmindestens 200 und höchstens 900 Euro. Diese Leistung kann so lange genutzt werden, wie auch \nder Anspruch auf Elternzeit gilt, also bis zum achten Geburtstag des Kindes. Denn auch jenseits \ndes Kleinkindalters brauchen Eltern Zeit für ihre Kinder, sei es bei der Einschulung, weil ein Umzug \nansteht oder ein Kind einfach mehr unterstützt werden muss als andere. \nDie dritte Säule ist die dauerhafte Ausweitung der pandemiebedingt erhöhten Kinderkranken-\ntage auf 20 Tage pro Kind, Jahr und Elternteil (als „Elterngeld akut“) - bei mehr als zwei Kindern \nmaximal 45 Tage pro Elternteil und 90 Tage für Alleinerziehende. Kinderkrankentage waren schon \nvor Corona oft zu knapp - gerade bei jüngeren Kindern, die in den ersten Kita-Jahren häufig krank \nwerden.'
 'Das Zukunftsprogramm der SPD\nKapitel 3Seite >39\nSPD-Parteivorstand 20213.7. Gut aufwachsen \nKinder und Jugendliche brauchen starke Familien. Sie brauchen Liebe, Zuwendung und viel ge-\nmeinsame Zeit. Die Zukunftsfähigkeit unserer Gesellschaft hängt davon ab, dass sich Menschen \nfür Kinder entscheiden und sie auf ihrem Weg in ein selbständiges Leben bestmöglich begleiten. \nDie Vereinbarkeit von Familienarbeit und Beruf ist für viele noch immer ein täglicher Spagat – hier \nbrauchen Eltern mehr Unterstützung. Das gilt zumal dann, wenn neben der Kindererziehung noch \nAlltagshilfe oder Pflege für ältere Angehörige zu leisten ist.\nIn der Krise ist erneut deutlich geworden, dass Fürsorgearbeit überwiegend von Frauen geleistet \nwird. Wir treten dafür an, dass Familien mehr Zeit füreinander haben, und dass es einfacher wird, \nErwerbs- und Sorgearbeit gerechter zwischen allen Geschlechtern aufzuteilen, und Alleinerziehen-\nde besser unterstützt werden. \nWir werden ein Vier-Säulen-Modell für mehr Familienzeit einführen. Die erste Säule sind zwei \nWochen Elternschaftszeit direkt nach Geburt eines Kindes, auf die jeder Vater bzw. der/die Part -\nner*in kurzfristig und sozial abgesichert Anspruch hat. Wir werden damit Familien mit Kindern in \nihrer allerersten Phase unterstützen und die Voraussetzungen für eine gerechtere Aufteilung von \nSorgeaufgaben schaffen. \nDie zweite Säule ist die Familienarbeitszeit, mit der wir den derzeitigen Partnerschaftsbonus beim \nElterngeldPlus zu einer flexiblen, geförderten Elternteilzeit nach dem ersten Lebensjahr eines Kin-\ndes ausbauen werden.']","Die Familienpflegezeit soll im Rahmen eines Modells mit 15 Monaten Anspruch auf Unterstützung bei einer Arbeitszeitreduzierung für jeden nahen Angehörigen ab Pflegegrad 2 gestaltet werden. Dieser Anspruch ist auf mehrere Pflegepersonen aufteilbar, mit einer Mindestarbeitszeit von 15 bis 20 Stunden. Unternehmen sollen gezielt Männer ermutigen, dieses Modell zu nutzen.","Unser Modell der Familienpflegezeit ist die vierte Säule. Wer Angehörige pflegt, soll dabei unterstützt werden, die Pflege mit Erwerbsarbeit zu kombinieren. Das bedeutet: 15 Monate Anspruch auf Unterstützung (Lohnersatz) bei einer Arbeitszeitreduzierung für jeden nahen Angehörigen ab Pflegegrad 2, auf mehrere Pflegepersonen aufteilbar mit einer Mindestarbeitszeit von 15 bis 20 Stunden.",1.0,0.9647399084588072,0.9999999999666667,1.0
78,Wie hoch ist der monatliche Basisbetrag des neuen Kindergeldes?,"['Das Zukunftsprogramm der SPD\nKapitel 3Seite >40\nSPD-Parteivorstand 2021Der monatliche Basisbetrag dieses neuen Kindergeldes wird bei zirka 250 Euro liegen. Der Höchst -\nbetrag wird sich an den Ausgaben von Familien mit mittleren Einkommen für Bildung und Teilha-\nbe orientieren und mindestens doppelt so hoch sein wie der Basisbetrag. Im Höchstbetrag sind das \nsächliche Existenzminimum inklusive Wohnkostenpauschale sowie Bildungs- und Teilhabekosten \nenthalten. Das neue Kindergeld ersetzt so den Kinderfreibetrag und bündelt bisherige Leistungen.\nJunge Menschen in Ausbildung sollen durch direkte, elternunabhängige Auszahlung des neuen \nKindergeldes finanziell abgesichert werden - mit einem zusätzlichen, auskömmlichen Fördersatz \nan BAföG obendrauf. Wir wollen Hilfen für Kinder, Jugendliche und Familien bündeln, die von \nKrankheit oder Behinderung betroffen sind. Kinder, Jugendliche, junge Erwachsene und Eltern \nmüssen einen einfachen Zugang zu Unterstützungsleistungen haben. Dafür sind weitere Schritte \nnotwendig. Der Kampf gegen Bildungsbenachteiligung muss in allen Systemen konsequent statt -\nfinden. Die erste Bildungseinrichtung im Leben eines Kindes ist heute die Kita. Deshalb werden wir \ndie frühkindliche Bildung weiter ausbauen. \nOhne bezahlbare Wohnheimangebote ist für viele Auszubildende und Studierende eine erfolgrei-\nche Ausbildung nicht möglich. Wir werden sie ausbauen und zudem das Jugendwohnen im Rah-\nmen der Kinder- und Jugendhilfe zukünftig für junge Menschen bis 27 Jahre ermöglichen sowie \nmehr Räume für Jugendarbeit schaffen.'
 'Wir werden ein Vier-Säulen-Modell für mehr Familienzeit einführen. Die erste Säule sind zwei \nWochen Elternschaftszeit direkt nach Geburt eines Kindes, auf die jeder Vater bzw. der/die Part -\nner*in kurzfristig und sozial abgesichert Anspruch hat. Wir werden damit Familien mit Kindern in \nihrer allerersten Phase unterstützen und die Voraussetzungen für eine gerechtere Aufteilung von \nSorgeaufgaben schaffen. \nDie zweite Säule ist die Familienarbeitszeit, mit der wir den derzeitigen Partnerschaftsbonus beim \nElterngeldPlus zu einer flexiblen, geförderten Elternteilzeit nach dem ersten Lebensjahr eines Kin-\ndes ausbauen werden. Wenn in Paarfamilien beide Elternteile gleichzeitig oder Alleinerziehende \netwas weniger als Vollzeit arbeiten, sollen sie zukünftig je zehn Monate ElterngeldPlus erhalten – \nmindestens 200 und höchstens 900 Euro. Diese Leistung kann so lange genutzt werden, wie auch \nder Anspruch auf Elternzeit gilt, also bis zum achten Geburtstag des Kindes. Denn auch jenseits \ndes Kleinkindalters brauchen Eltern Zeit für ihre Kinder, sei es bei der Einschulung, weil ein Umzug \nansteht oder ein Kind einfach mehr unterstützt werden muss als andere. \nDie dritte Säule ist die dauerhafte Ausweitung der pandemiebedingt erhöhten Kinderkranken-\ntage auf 20 Tage pro Kind, Jahr und Elternteil (als „Elterngeld akut“) - bei mehr als zwei Kindern \nmaximal 45 Tage pro Elternteil und 90 Tage für Alleinerziehende. Kinderkrankentage waren schon \nvor Corona oft zu knapp - gerade bei jüngeren Kindern, die in den ersten Kita-Jahren häufig krank \nwerden.'
 'Das bedeutet: 15 Monate Anspruch \nauf Unterstützung (Lohnersatz) bei einer Arbeitszeitreduzierung für jeden nahen Angehörigen \nab Pflegegrad 2, auf mehrere Pflegepersonen aufteilbar mit einer Mindestarbeitszeit von 15 bis \n20 Stunden. Wichtig ist, dass Unternehmen gezielt auch die Männer ermutigen, dieses Modell zu \nnutzen. \nWir werden dafür sorgen, dass alle Kinder und Jugendlichen unabhängig von ihrer Herkunft die \ngleichen Chancen haben, das Bestmögliche aus ihrem Leben zu machen. Jedes Kind soll gut und \ngeborgen aufwachsen und alle jungen Menschen sollen gut ins Erwachsenenleben starten. Die \nUnterstützung von Kindern und Familien in Deutschland ist vielfältig. Aber genau dort, wo sie be-\nsonders gebraucht wird, kommt sie oft nicht an. \nWir haben deshalb ein Konzept der Kindergrundsicherung entwickelt, das aus zwei zentralen Be-\nreichen besteht. Zum einen aus einer Infrastruktur, die gerechte Bildung und Teilhabe für alle Kin-\nder ermöglicht. Sie beinhaltet gute und beitragsfreie Kitas, ein Ganztagsangebot für Schulkinder, \neine soziale Infrastruktur für Kinder und Jugendliche und freie Fahrt in Bus und Bahn im Nahver -\nkehr sowie ein Recht auf Mobilität vor allem für den ländlichen Raum. Die Kindergrundsicherung \nbesteht zum anderen aus einem neuen existenzsichernden, automatisch ausgezahlten Kindergeld, \ndas nach Einkommen der Familie gestaffelt ist – je höher der Unterstützungsbedarf, desto höher \ndas Kindergeld. Damit machen wir das Leben der Familien leichter, die es besonders schwer haben.']",Der monatliche Basisbetrag des neuen Kindergeldes wird bei etwa 250 Euro liegen. Der Höchstbetrag wird sich an den Ausgaben von Familien mit mittleren Einkommen orientieren und mindestens doppelt so hoch sein wie der Basisbetrag.,Der monatliche Basisbetrag dieses neuen Kindergeldes wird bei zirka 250 Euro liegen.,1.0,0.9919186568951578,0.9999999999,1.0
79,An welchen Ausgaben orientiert sich der Höchstbetrag des neuen Kindergeldes und wie hoch ist dieser mindestens?,"['Das Zukunftsprogramm der SPD\nKapitel 3Seite >40\nSPD-Parteivorstand 2021Der monatliche Basisbetrag dieses neuen Kindergeldes wird bei zirka 250 Euro liegen. Der Höchst -\nbetrag wird sich an den Ausgaben von Familien mit mittleren Einkommen für Bildung und Teilha-\nbe orientieren und mindestens doppelt so hoch sein wie der Basisbetrag. Im Höchstbetrag sind das \nsächliche Existenzminimum inklusive Wohnkostenpauschale sowie Bildungs- und Teilhabekosten \nenthalten. Das neue Kindergeld ersetzt so den Kinderfreibetrag und bündelt bisherige Leistungen.\nJunge Menschen in Ausbildung sollen durch direkte, elternunabhängige Auszahlung des neuen \nKindergeldes finanziell abgesichert werden - mit einem zusätzlichen, auskömmlichen Fördersatz \nan BAföG obendrauf. Wir wollen Hilfen für Kinder, Jugendliche und Familien bündeln, die von \nKrankheit oder Behinderung betroffen sind. Kinder, Jugendliche, junge Erwachsene und Eltern \nmüssen einen einfachen Zugang zu Unterstützungsleistungen haben. Dafür sind weitere Schritte \nnotwendig. Der Kampf gegen Bildungsbenachteiligung muss in allen Systemen konsequent statt -\nfinden. Die erste Bildungseinrichtung im Leben eines Kindes ist heute die Kita. Deshalb werden wir \ndie frühkindliche Bildung weiter ausbauen. \nOhne bezahlbare Wohnheimangebote ist für viele Auszubildende und Studierende eine erfolgrei-\nche Ausbildung nicht möglich. Wir werden sie ausbauen und zudem das Jugendwohnen im Rah-\nmen der Kinder- und Jugendhilfe zukünftig für junge Menschen bis 27 Jahre ermöglichen sowie \nmehr Räume für Jugendarbeit schaffen.'
 'Das bedeutet: 15 Monate Anspruch \nauf Unterstützung (Lohnersatz) bei einer Arbeitszeitreduzierung für jeden nahen Angehörigen \nab Pflegegrad 2, auf mehrere Pflegepersonen aufteilbar mit einer Mindestarbeitszeit von 15 bis \n20 Stunden. Wichtig ist, dass Unternehmen gezielt auch die Männer ermutigen, dieses Modell zu \nnutzen. \nWir werden dafür sorgen, dass alle Kinder und Jugendlichen unabhängig von ihrer Herkunft die \ngleichen Chancen haben, das Bestmögliche aus ihrem Leben zu machen. Jedes Kind soll gut und \ngeborgen aufwachsen und alle jungen Menschen sollen gut ins Erwachsenenleben starten. Die \nUnterstützung von Kindern und Familien in Deutschland ist vielfältig. Aber genau dort, wo sie be-\nsonders gebraucht wird, kommt sie oft nicht an. \nWir haben deshalb ein Konzept der Kindergrundsicherung entwickelt, das aus zwei zentralen Be-\nreichen besteht. Zum einen aus einer Infrastruktur, die gerechte Bildung und Teilhabe für alle Kin-\nder ermöglicht. Sie beinhaltet gute und beitragsfreie Kitas, ein Ganztagsangebot für Schulkinder, \neine soziale Infrastruktur für Kinder und Jugendliche und freie Fahrt in Bus und Bahn im Nahver -\nkehr sowie ein Recht auf Mobilität vor allem für den ländlichen Raum. Die Kindergrundsicherung \nbesteht zum anderen aus einem neuen existenzsichernden, automatisch ausgezahlten Kindergeld, \ndas nach Einkommen der Familie gestaffelt ist – je höher der Unterstützungsbedarf, desto höher \ndas Kindergeld. Damit machen wir das Leben der Familien leichter, die es besonders schwer haben.'
 'Die Altersgrenzen im \nBAföG werden wir dazu in einem ersten Schritt aufheben. Und wir brauchen ein Neustart-BAföG, \ndas auch im Erwachsenenalter neue berufliche Wege öffnen und angemessen den Lebensunter -\nhalt sichert.\nBereits jetzt besteht die Möglichkeit, dass Arbeitnehmer*innen ihre geleisteten Arbeitsstunden \nauf Langzeitkonten ansparen. Allerdings besteht bislang kein rechtlicher Anspruch darauf und nur \nein kleiner Teil der Unternehmen und Arbeitnehmer*innen nutzt Langzeitkonten. Wir werden das \nInstrument zu einem persönlichen Zeitkonto weiterentwickeln, um zusätzlich individuelle Ge-\nstaltungsmöglichkeiten entlang des Lebenslaufs zu schaffen. Basis eines solchen Zeitkontos sind \nZeiteinzahlungen der Beschäftigten – auf diese Weise gehen Überstunden nicht verloren, sondern \nverwandeln sich in ein Zeitguthaben, das per Tarifvertrag oder durch den Staat nach dem Prinzip \neines Chancenkontos aufgestockt werden kann.']",Der Höchstbetrag des neuen Kindergeldes orientiert sich an den Ausgaben von Familien mit mittleren Einkommen für Bildung und Teilhabe und ist mindestens doppelt so hoch wie der monatliche Basisbetrag von etwa 250 Euro.,Der Höchstbetrag wird sich an den Ausgaben von Familien mit mittleren Einkommen für Bildung und Teilhabe orientieren und mindestens doppelt so hoch sein wie der Basisbetrag.,1.0,0.9311846888566534,0.9999999999,1.0
80,Sollen bei Bundestagswahlen auch Jugendliche ab 16 Jahren wählen dürfen?,"['Das Freiwillige Soziale \nJahr Digital (FSJdigital) werden wir neu auflegen. Das Engagement in Jugendfreiwilligendiensten \nmuss für junge Menschen unabhängig von ihrer sozialen Herkunft möglich sein. Dafür soll es ein \nbundesweit einheitliches Freiwilligengeld geben, das junge Menschen zusammen mit dem neuen \ngestaffelten Kindergeld elternunabhängig absichert. \nWir werden starke Kinderrechte auf Schutz, Beteiligung und Förderung und den Vorrang des \nKindeswohls im Grundgesetz verankern. Wir werden das Wahlalter für junge Menschen auf 16 \nJahre senken. Kinder und Jugendliche müssen auf allen Ebenen an politischen Prozessen betei-\nligt werden und einen Anspruch auf echte Beteiligung in kommunalen Jugendhilfeausschüssen \nund Landesjugendhilfeausschüssen haben, die gesetzlich in den Kommunalverfassungen veran-\nkert werden müssen. Jugendverbände und bestehende Beteiligungsstrukturen wie Jugendringe, \nKinder- und Jugendparlamente wollen wir dauerhaft und nachhaltig finanzieren und jedes neue \nGesetz einem Jugend-Check unterziehen. \nDie Mitbestimmungsmöglichkeiten von Jugend- und Auszubildenden-Vertretungen (JAV) werden \nwir verbessern, indem ihr Vertretungsrecht auf alle Beschäftigten in Ausbildung ausgedehnt und \ndie Gründung einer JAV erleichtert wird. \nMit einem Bundesprogramm „Gemeindehaus 2.0“ werden wir aufbauend auf dem Netz der Mehr -\ngenerationenhäuser noch mehr Angebote unter einem Dach bündeln: außerschulische Bildung, \nSport, Kultur und Jugendarbeit, Netzwerke für den Kinderschutz, barrierefreie digitale Infrastruk -\ntur für alle Kinder und Jugendlichen, die sie für Bildung und gesellschaftliche Teilhabe benötigen.'
 'Die Mitbestimmungsmöglichkeiten von Jugend- und Auszubildenden-Vertretungen (JAV) werden \nwir verbessern, indem ihr Vertretungsrecht auf alle Beschäftigten in Ausbildung ausgedehnt und \ndie Gründung einer JAV erleichtert wird. \nMit einem Bundesprogramm „Gemeindehaus 2.0“ werden wir aufbauend auf dem Netz der Mehr -\ngenerationenhäuser noch mehr Angebote unter einem Dach bündeln: außerschulische Bildung, \nSport, Kultur und Jugendarbeit, Netzwerke für den Kinderschutz, barrierefreie digitale Infrastruk -\ntur für alle Kinder und Jugendlichen, die sie für Bildung und gesellschaftliche Teilhabe benötigen. \nSelbstbestimmte Räume für die Kinder- und Jugendarbeit müssen unabhängig davon erhalten \nund ausgebaut werden. An Kinder gerichtete Werbung wollen wir reglementieren. Kitas und Schu-\nlen müssen ein werbefreier Raum sein.'
 'Kinder, Jugendliche, junge Erwachsene und Eltern \nmüssen einen einfachen Zugang zu Unterstützungsleistungen haben. Dafür sind weitere Schritte \nnotwendig. Der Kampf gegen Bildungsbenachteiligung muss in allen Systemen konsequent statt -\nfinden. Die erste Bildungseinrichtung im Leben eines Kindes ist heute die Kita. Deshalb werden wir \ndie frühkindliche Bildung weiter ausbauen. \nOhne bezahlbare Wohnheimangebote ist für viele Auszubildende und Studierende eine erfolgrei-\nche Ausbildung nicht möglich. Wir werden sie ausbauen und zudem das Jugendwohnen im Rah-\nmen der Kinder- und Jugendhilfe zukünftig für junge Menschen bis 27 Jahre ermöglichen sowie \nmehr Räume für Jugendarbeit schaffen. \nZur Unterstützung der beruflichen Orientierung und persönlichen Entwicklung, der Stärkung \ndes freiwilligen Engagements muss jeder junge Mensch nach Ende der Schulzeit die Möglichkeit \nhaben, sich für ein Jugendfreiwilligenjahr zu entscheiden. Wir werden einen Rechtsanspruch auf \nFörderung aller Freiwilligendienst-Vereinbarungen für Unter-27-Jährige schaffen, beispielweise \nim Freiwilligen Sozialen Jahr oder in internationalen Freiwilligendiensten. Das Freiwillige Soziale \nJahr Digital (FSJdigital) werden wir neu auflegen. Das Engagement in Jugendfreiwilligendiensten \nmuss für junge Menschen unabhängig von ihrer sozialen Herkunft möglich sein. Dafür soll es ein \nbundesweit einheitliches Freiwilligengeld geben, das junge Menschen zusammen mit dem neuen \ngestaffelten Kindergeld elternunabhängig absichert. \nWir werden starke Kinderrechte auf Schutz, Beteiligung und Förderung und den Vorrang des \nKindeswohls im Grundgesetz verankern.']","Ja, das Wahlprogramm sieht vor, das Wahlalter für junge Menschen auf 16 Jahre zu senken.",Wir werden das Wahlalter für junge Menschen auf 16 Jahre senken.,0.5,0.930074110636849,0.9999999999,1.0
81,"Welche Maßnahmen sind geplant, um Kinder und Jugendliche besser zu schützen?","['Darüber \nhinaus werden wir unabhängige Ombudsstellen einrichten. \nWir werden Präventionsketten und Netzwerke für Kinder und Jugendliche aller Altersgruppen \nschaffen, in denen Jugendhilfe und Gesundheitsdienst, Bildungs- und Gesundheitseinrichtungen, \nöffentliche und freie Träger, Sportvereine und Verbände, Polizei und Familiengerichte auf kommu-\nnaler Ebene verbindlich zusammenwirken. \nSchutzstandards für Kinder und Jugendliche müssen auch im digitalen Raum gelten, also auch \nbeim Schutz der persönlichen Integrität, vor sexueller Belästigung und Gewalt, bei Entwicklungs-\nbeeinträchtigungen und wirtschaftlicher Ausbeutung. Um die Belastungen für Kinder und Jugend-\nliche vor allem in Kinderschutz- oder Familienrechtsverfahren so gering wie möglich zu halten, \nsetzen wir uns für eine kindersensible Justiz ein.'
 'Aus diesem Grund starten wir die Bundesinitiative Chancengleichheit in der Bildung. \nDurch ein Bundesprogramm für Schulsozialarbeit werden den Kommunen Mittel zur Förderung \nvon Chancenhelfern an jeder Schule bereitgestellt. \nDer Grundsatz der gleichwertigen Lebensverhältnisse ist für uns bei der Weiterentwicklung der \nBund-Länder-Zusammenarbeit maßgebend, damit Kinder und Jugendliche aus wirtschaftlich be-\nnachteiligten Familien nicht alleine gelassen werden. Die Mittel von Bund und Ländern müssen \ndurch die zusätzliche Einführung von Sozialkriterien da ankommen, wo sie am dringendsten ge-\nbraucht werden. \nWir wollen, dass Kinder und Jugendliche sicher aufwachsen. Wir werden daher Strafrecht und Prä-\nvention besser verbinden, um Kinder und Jugendliche wirksam zu schützen. Wir brauchen Schutz -\nkonzepte unter anderem mit Kinderschutzbeauftragten für Kitas, Schulen, Jugendhilfe-Einrichtun-\ngen und Vereine und werden das durch vom Bund geförderte Pilotprojekte unterstützen. Darüber \nhinaus werden wir unabhängige Ombudsstellen einrichten. \nWir werden Präventionsketten und Netzwerke für Kinder und Jugendliche aller Altersgruppen \nschaffen, in denen Jugendhilfe und Gesundheitsdienst, Bildungs- und Gesundheitseinrichtungen, \nöffentliche und freie Träger, Sportvereine und Verbände, Polizei und Familiengerichte auf kommu-\nnaler Ebene verbindlich zusammenwirken. \nSchutzstandards für Kinder und Jugendliche müssen auch im digitalen Raum gelten, also auch \nbeim Schutz der persönlichen Integrität, vor sexueller Belästigung und Gewalt, bei Entwicklungs-\nbeeinträchtigungen und wirtschaftlicher Ausbeutung.'
 'Kinder, Jugendliche, junge Erwachsene und Eltern \nmüssen einen einfachen Zugang zu Unterstützungsleistungen haben. Dafür sind weitere Schritte \nnotwendig. Der Kampf gegen Bildungsbenachteiligung muss in allen Systemen konsequent statt -\nfinden. Die erste Bildungseinrichtung im Leben eines Kindes ist heute die Kita. Deshalb werden wir \ndie frühkindliche Bildung weiter ausbauen. \nOhne bezahlbare Wohnheimangebote ist für viele Auszubildende und Studierende eine erfolgrei-\nche Ausbildung nicht möglich. Wir werden sie ausbauen und zudem das Jugendwohnen im Rah-\nmen der Kinder- und Jugendhilfe zukünftig für junge Menschen bis 27 Jahre ermöglichen sowie \nmehr Räume für Jugendarbeit schaffen. \nZur Unterstützung der beruflichen Orientierung und persönlichen Entwicklung, der Stärkung \ndes freiwilligen Engagements muss jeder junge Mensch nach Ende der Schulzeit die Möglichkeit \nhaben, sich für ein Jugendfreiwilligenjahr zu entscheiden. Wir werden einen Rechtsanspruch auf \nFörderung aller Freiwilligendienst-Vereinbarungen für Unter-27-Jährige schaffen, beispielweise \nim Freiwilligen Sozialen Jahr oder in internationalen Freiwilligendiensten. Das Freiwillige Soziale \nJahr Digital (FSJdigital) werden wir neu auflegen. Das Engagement in Jugendfreiwilligendiensten \nmuss für junge Menschen unabhängig von ihrer sozialen Herkunft möglich sein. Dafür soll es ein \nbundesweit einheitliches Freiwilligengeld geben, das junge Menschen zusammen mit dem neuen \ngestaffelten Kindergeld elternunabhängig absichert. \nWir werden starke Kinderrechte auf Schutz, Beteiligung und Förderung und den Vorrang des \nKindeswohls im Grundgesetz verankern.']","Es sind geplante Maßnahmen zur Einrichtung unabhängiger Ombudsstellen, Schaffung von Präventionsketten und Netzwerken für Kinder und Jugendliche, sowie die Einführung von Schutzstandards im digitalen Raum und eine kindersensible Justiz vorgesehen.","Wir werden daher Strafrecht und Prävention besser verbinden, um Kinder und Jugendliche wirksam zu schützen. Wir brauchen Schutzkonzepte unter anderem mit Kinderschutzbeauftragten für Kitas, Schulen, Jugendhilfe-Einrichtungen und Vereine und werden das durch vom Bund geförderte Pilotprojekte unterstützen.",1.0,0.9508833241261613,0.99999999995,1.0
82,Wie sollen Belastungen für Kinder und Jugendliche in Kinderschutz- oder Familienrechtsverfahren verringert werden?,"['Das bedeutet: 15 Monate Anspruch \nauf Unterstützung (Lohnersatz) bei einer Arbeitszeitreduzierung für jeden nahen Angehörigen \nab Pflegegrad 2, auf mehrere Pflegepersonen aufteilbar mit einer Mindestarbeitszeit von 15 bis \n20 Stunden. Wichtig ist, dass Unternehmen gezielt auch die Männer ermutigen, dieses Modell zu \nnutzen. \nWir werden dafür sorgen, dass alle Kinder und Jugendlichen unabhängig von ihrer Herkunft die \ngleichen Chancen haben, das Bestmögliche aus ihrem Leben zu machen. Jedes Kind soll gut und \ngeborgen aufwachsen und alle jungen Menschen sollen gut ins Erwachsenenleben starten. Die \nUnterstützung von Kindern und Familien in Deutschland ist vielfältig. Aber genau dort, wo sie be-\nsonders gebraucht wird, kommt sie oft nicht an. \nWir haben deshalb ein Konzept der Kindergrundsicherung entwickelt, das aus zwei zentralen Be-\nreichen besteht. Zum einen aus einer Infrastruktur, die gerechte Bildung und Teilhabe für alle Kin-\nder ermöglicht. Sie beinhaltet gute und beitragsfreie Kitas, ein Ganztagsangebot für Schulkinder, \neine soziale Infrastruktur für Kinder und Jugendliche und freie Fahrt in Bus und Bahn im Nahver -\nkehr sowie ein Recht auf Mobilität vor allem für den ländlichen Raum. Die Kindergrundsicherung \nbesteht zum anderen aus einem neuen existenzsichernden, automatisch ausgezahlten Kindergeld, \ndas nach Einkommen der Familie gestaffelt ist – je höher der Unterstützungsbedarf, desto höher \ndas Kindergeld. Damit machen wir das Leben der Familien leichter, die es besonders schwer haben.'
 'Darüber \nhinaus werden wir unabhängige Ombudsstellen einrichten. \nWir werden Präventionsketten und Netzwerke für Kinder und Jugendliche aller Altersgruppen \nschaffen, in denen Jugendhilfe und Gesundheitsdienst, Bildungs- und Gesundheitseinrichtungen, \nöffentliche und freie Träger, Sportvereine und Verbände, Polizei und Familiengerichte auf kommu-\nnaler Ebene verbindlich zusammenwirken. \nSchutzstandards für Kinder und Jugendliche müssen auch im digitalen Raum gelten, also auch \nbeim Schutz der persönlichen Integrität, vor sexueller Belästigung und Gewalt, bei Entwicklungs-\nbeeinträchtigungen und wirtschaftlicher Ausbeutung. Um die Belastungen für Kinder und Jugend-\nliche vor allem in Kinderschutz- oder Familienrechtsverfahren so gering wie möglich zu halten, \nsetzen wir uns für eine kindersensible Justiz ein.'
 'Kinder, Jugendliche, junge Erwachsene und Eltern \nmüssen einen einfachen Zugang zu Unterstützungsleistungen haben. Dafür sind weitere Schritte \nnotwendig. Der Kampf gegen Bildungsbenachteiligung muss in allen Systemen konsequent statt -\nfinden. Die erste Bildungseinrichtung im Leben eines Kindes ist heute die Kita. Deshalb werden wir \ndie frühkindliche Bildung weiter ausbauen. \nOhne bezahlbare Wohnheimangebote ist für viele Auszubildende und Studierende eine erfolgrei-\nche Ausbildung nicht möglich. Wir werden sie ausbauen und zudem das Jugendwohnen im Rah-\nmen der Kinder- und Jugendhilfe zukünftig für junge Menschen bis 27 Jahre ermöglichen sowie \nmehr Räume für Jugendarbeit schaffen. \nZur Unterstützung der beruflichen Orientierung und persönlichen Entwicklung, der Stärkung \ndes freiwilligen Engagements muss jeder junge Mensch nach Ende der Schulzeit die Möglichkeit \nhaben, sich für ein Jugendfreiwilligenjahr zu entscheiden. Wir werden einen Rechtsanspruch auf \nFörderung aller Freiwilligendienst-Vereinbarungen für Unter-27-Jährige schaffen, beispielweise \nim Freiwilligen Sozialen Jahr oder in internationalen Freiwilligendiensten. Das Freiwillige Soziale \nJahr Digital (FSJdigital) werden wir neu auflegen. Das Engagement in Jugendfreiwilligendiensten \nmuss für junge Menschen unabhängig von ihrer sozialen Herkunft möglich sein. Dafür soll es ein \nbundesweit einheitliches Freiwilligengeld geben, das junge Menschen zusammen mit dem neuen \ngestaffelten Kindergeld elternunabhängig absichert. \nWir werden starke Kinderrechte auf Schutz, Beteiligung und Förderung und den Vorrang des \nKindeswohls im Grundgesetz verankern.']","Belastungen für Kinder und Jugendliche in Kinderschutz- oder Familienrechtsverfahren sollen verringert werden, indem eine kindersensible Justiz eingeführt wird. Dies soll dazu beitragen, die Belastungen für Kinder und Jugendliche so gering wie möglich zu halten.","Um die Belastungen für Kinder und Jugendliche vor allem in Kinderschutz- oder Familienrechtsverfahren so gering wie möglich zu halten, setzen wir uns für eine kindersensible Justiz ein.",1.0,0.9980342821360738,0.49999999995,1.0
83,Wie soll die Förderung von Frauen und Mädchen im naturwissenschaftlichen und technischen Bereich verbessert werden?,"['Dies werden wir auf alle börsennotierten oder mitbestimmten \nUnternehmen ausweiten und wirksame Sanktionen einführen für alle, die sich nicht daran halten.\nIn Start-ups und den großen Tech-Unternehmen wird im buchstäblichen Sinne unsere Zukunft \nprogrammiert. Frauen sollen daran einen relevanten Anteil haben. Der erste Mensch auf der Welt, \nder eine Maschine programmiert hat, war eine Frau: Ada Lovelace. \nDoch heute sind IT-Berufe in hohem Maße von Männern dominiert, und an der Spitze von Tech-\nUnternehmen in Deutschland sind Frauen noch seltener vertreten als im Durchschnitt der Unter -\nnehmen. Wir wollen, dass Mädchen und junge Frauen früh erfahren, dass Technik und Unterneh-\nmensgründung etwas für sie sein kann und setzen uns weiterhin für die Förderung von Frauen \nund Mädchen im naturwissenschaftlichen und technischen Bereich (MINT) ein. Wir wollen einen \nbesseren Zugang für Frauen zu Gründungskapital und eine umfassende und koordinierte Förder -\nstrategie, um geschlechtsbezogene Barrieren insbesondere für digitalisierungsbezogene Unter -\nnehmensgründungen abzubauen. \nWenn der Einsatz von Algorithmen, zum Beispiel bei der Personalrekrutierung, über das Leben \noder die Chancen von Menschen mitentscheidet, dürfen sie niemals diskriminieren. Wir wollen \nverantwortungsvolle Künstliche Intelligenzen (KI) und Algorithmen, die vorurteilsfrei program-\nmiert sind und auf diskriminierungsfreien Datenlagen basieren. Dies soll regelmäßig geprüft und \nzertifiziert werden.'
 'Wir werden uns für verlässliche Karrierewe-\nge und weniger Befristungen in der Wissenschaft einsetzen. Wir wollen, dass Promovierende für \nihre tatsächliche Arbeitszeit bezahlt werden, unabhängig vom Fach. Es muss gelten: 100 Prozent \nGehalt für 100 Prozent Arbeit. Wir werden für eine deutlich bessere Vereinbarkeit von Familie und \nBeruf sorgen, neue, dauerhafte Beschäftigungsmöglichkeiten unterhalb der Professur schaffen \nund den Tenure-Track ausweiten.\nWir haben den Zielwert gesamtstaatlicher, also öffentlicher und privater Ausgaben für Forschung \nund Entwicklung, von drei Prozent des BIP bereits in den letzten Jahren übertroffen und wollen ihn \nweiter auf mindestens 3,5 Prozent steigern. Wir werden dazu die Innovationsförderung aufsto-\ncken, die Forschung in die mittelständische Praxis mit Partnerschafts- und Kooperationsförderun-\ngen vorantreiben und die Förder- und Kreditprogramme für den Mittelstand im Bereich Umwelt-, \nKlima- und Ressourcenschutz ausbauen. Kleine und mittlere Unternehmen (KMU) werden einen \nniederschwelligen Zugang zu Fördermitteln erhalten. \nEine besondere Bedeutung kommt dem Austausch von wissenschaftlichen Erkenntnissen mit der \nGesellschaft zu. Wir werden deshalb mehr Fördergelder für Open Science und Wissenschaftskom-\nmunikation bereithalten.\nDamit Europa im internationalen technologischen Wettbewerb bestehen und seine Souveränität \nbehaupten kann, werden wir in der Europäischen Union gemeinsam weiter geschlossen voran-\ngehen. Wir setzen uns für ein neu geordnetes Wettbewerbs- und Beihilferecht ein, das Wettbe-\nwerbsnachteile gegenüber anderen großen Wirtschaftsräumen verringert.'
 'Das reicht aber nicht. Wir werden das Entgelttransparenz -\ngesetz so weiterentwickeln, dass es Unternehmen und Verwaltungen verpflichtet, Löhne und \nGehälter im Sinne der Geschlechtergerechtigkeit zu überprüfen und Verfahren festzulegen, mit \ndenen Ungleichheit bei der Entlohnung beseitigt wird, ohne dass sich Betroffene selbst darum \nkümmern müssen. Wir werden eine entsprechende Regelung auch auf europäischer Ebene voran-\ntreiben.\nErfolgreiches Wirtschaften braucht geschlechterparitätische und kulturell vielfältige Arbeitsteams. \nDas gilt selbstverständlich auch an den Unternehmensspitzen. Wir haben bisher eine Quote für \nAufsichtsräte eingeführt und geregelt, dass in größeren Vorständen von börsennotierten und \nparitätisch mitbestimmten großen Unternehmen mindestens eine Frau vertreten sein muss. Wir \nwollen, dass an der Spitze von Unternehmen und in den Führungsebenen darunter genauso viele \nFrauen wie Männer vertreten sind. Dies werden wir auf alle börsennotierten oder mitbestimmten \nUnternehmen ausweiten und wirksame Sanktionen einführen für alle, die sich nicht daran halten.\nIn Start-ups und den großen Tech-Unternehmen wird im buchstäblichen Sinne unsere Zukunft \nprogrammiert. Frauen sollen daran einen relevanten Anteil haben. Der erste Mensch auf der Welt, \nder eine Maschine programmiert hat, war eine Frau: Ada Lovelace. \nDoch heute sind IT-Berufe in hohem Maße von Männern dominiert, und an der Spitze von Tech-\nUnternehmen in Deutschland sind Frauen noch seltener vertreten als im Durchschnitt der Unter -\nnehmen.']","Die Förderung von Frauen und Mädchen im naturwissenschaftlichen und technischen Bereich soll durch eine bessere Zugangsmöglichkeit zu Gründungskapital und eine umfassende Förderstrategie zur Überwindung geschlechtsbezogener Barrieren in digitalen Unternehmensgründungen verbessert werden. Es wird angestrebt, dass Frauen einen relevanten Anteil in Start-ups und großen Tech-Unternehmen haben, um die Unterrepräsentation in IT-Berufen und Führungspositionen abzubauen.","Wir wollen, dass Mädchen und junge Frauen früh erfahren, dass Technik und Unternehmensgründung etwas für sie sein kann und setzen uns weiterhin für die Förderung von Frauen und Mädchen im naturwissenschaftlichen und technischen Bereich (MINT) ein.",1.0,0.9999999999999994,0.8333333332916666,1.0
84,Wie sollen Algorithmen in Bezug auf Diskriminierung gestaltet werden?,"['Wir fördern die Entwick -\nlung von Anonymisierungstechniken und setzen uns für strafbewehrte Verbote von De-Anonymi-\nsierung ein. Der Staat muss beim Datenteilen mit gutem Beispiel vorangehen und einen breiten \nDatenzugang im Sinne von Open-Data ermöglichen. Wir werden die Behörden dabei unterstützen, \ndas umzusetzen.\xa0\nOnline-Handel und Plattformökonomie verändern den Handel dramatisch. Damit nicht nur die \ngroßen Digitalkonzerne profitieren, werden wir Plattformen für den regionalen Handel und regio-\nnale Dienstleistungen fördern. Der Handel vor Ort darf steuerlich nicht gegenüber dem Online-\nhandel ins Hintertreffen geraten. Darum haben wir dafür gesorgt, dass digitale Handelsplattfor -\nmen dafür in Haftung genommen werden, wenn Händler*innen, die über die Plattform Geschäfte \nabwickeln, die Umsatzsteuer nicht zahlen. Wir werden weiterhin konsequent gegen Steuerbetrug \nim Onlinehandel vorgehen. Maßnahmen gegen Lohn-, Sozial- und Umweltdumping werden wir \nvorantreiben.\nJeden Tag bekommen wir Dinge von Algorithmen vorgeschlagen: Neue Songs, Turnschuhe oder \nRouten von A nach B. Selbstlernende Systeme und Algorithmen treffen Entscheidungen für eine \nVielzahl von Menschen. Sie können unser Leben und unseren Alltag erleichtern. Aber sie müssen \ntransparent und diskriminierungsfrei angelegt werden. Die Zielsetzung einer algorithmischen Ent -\nscheidung muss klar und überprüfbar definiert sein. Hierfür brauchen wir eine stringente Regulie-\nrung und Aufsicht.\xa0\nCybersicherheit ist die Grundlage für eine erfolgreiche Digitalisierung.'
 'Dies werden wir auf alle börsennotierten oder mitbestimmten \nUnternehmen ausweiten und wirksame Sanktionen einführen für alle, die sich nicht daran halten.\nIn Start-ups und den großen Tech-Unternehmen wird im buchstäblichen Sinne unsere Zukunft \nprogrammiert. Frauen sollen daran einen relevanten Anteil haben. Der erste Mensch auf der Welt, \nder eine Maschine programmiert hat, war eine Frau: Ada Lovelace. \nDoch heute sind IT-Berufe in hohem Maße von Männern dominiert, und an der Spitze von Tech-\nUnternehmen in Deutschland sind Frauen noch seltener vertreten als im Durchschnitt der Unter -\nnehmen. Wir wollen, dass Mädchen und junge Frauen früh erfahren, dass Technik und Unterneh-\nmensgründung etwas für sie sein kann und setzen uns weiterhin für die Förderung von Frauen \nund Mädchen im naturwissenschaftlichen und technischen Bereich (MINT) ein. Wir wollen einen \nbesseren Zugang für Frauen zu Gründungskapital und eine umfassende und koordinierte Förder -\nstrategie, um geschlechtsbezogene Barrieren insbesondere für digitalisierungsbezogene Unter -\nnehmensgründungen abzubauen. \nWenn der Einsatz von Algorithmen, zum Beispiel bei der Personalrekrutierung, über das Leben \noder die Chancen von Menschen mitentscheidet, dürfen sie niemals diskriminieren. Wir wollen \nverantwortungsvolle Künstliche Intelligenzen (KI) und Algorithmen, die vorurteilsfrei program-\nmiert sind und auf diskriminierungsfreien Datenlagen basieren. Dies soll regelmäßig geprüft und \nzertifiziert werden.'
 'Wir werden weiterhin konsequent gegen Steuerbetrug \nim Onlinehandel vorgehen. Maßnahmen gegen Lohn-, Sozial- und Umweltdumping werden wir \nvorantreiben.\nJeden Tag bekommen wir Dinge von Algorithmen vorgeschlagen: Neue Songs, Turnschuhe oder \nRouten von A nach B. Selbstlernende Systeme und Algorithmen treffen Entscheidungen für eine \nVielzahl von Menschen. Sie können unser Leben und unseren Alltag erleichtern. Aber sie müssen \ntransparent und diskriminierungsfrei angelegt werden. Die Zielsetzung einer algorithmischen Ent -\nscheidung muss klar und überprüfbar definiert sein. Hierfür brauchen wir eine stringente Regulie-\nrung und Aufsicht.\xa0\nCybersicherheit ist die Grundlage für eine erfolgreiche Digitalisierung. Das Bundesamt für Sicher -\nheit in der Informationstechnik als zentrale, unabhängige und ausschließlich präventiv ausgerich-\ntete Cybersicherheitsbehörde werden wir stärken und die Verschlüsselungsforschung ausbauen. \nWir wollen Hersteller darauf verpflichten, Softwareprodukte, digitale Dienste und technische \nGeräte so zu konzipieren, dass sie sicher sind (Security by Design) und dass sie bei den Standard-\neinstellungen die sicherste Variante wählen (Security by Default). Digitale Hintertüren sollen nicht \noffen gehalten werden.\nDas Recht auf informationelle Selbstbestimmung werden wir schützen. Die Datenschutzgrund-\nverordnung ist ein wichtiger Meilenstein und muss in ihrer Durchsetzung praxisnah verbessert \nwerden. Wir brauchen daher gut ausgestattete, effektiv arbeitende Datenschutzaufsichtsbehör -\nden. Privatheit und Datenschutz schaffen Vertrauen und sichern individuelle und kollektive Frei-\nheitsräume.']","Algorithmen müssen transparent und diskriminierungsfrei programmiert werden, mit klaren und überprüfbaren Zielsetzungen. Eine stringente Regulierung und Aufsicht sind erforderlich, um dies sicherzustellen. Maßnahmen zur regelmäßigen Prüfung und Zertifizierung der Algorithmen sind notwendig.","Wir wollen verantwortungsvolle Künstliche Intelligenzen (KI) und Algorithmen, die vorurteilsfrei programmiert sind und auf diskriminierungsfreien Datenlagen basieren. Dies soll regelmäßig geprüft und zertifiziert werden.",1.0,0.9424122432238917,0.9999999999666667,1.0
85,Wie soll der Zugang zu Verhütungsmitteln gestaltet werden?,"['Wir werden Schwerpunktstaatsanwaltschaften für Femizide einrich-\nten – also zur Verfolgung von Morden an Frauen, die begangen wurden, weil sie Frauen sind und \nsetzen uns gesellschaftlich dafür ein, dass Femizide auch als solche benannt werden und nicht als \n„ Verbrechen aus Leidenschaft“ oder „Familientragödie“ .\nPaare, die sich für Kinder entscheiden, brauchen Versorgungssicherheit und die freie Wahl des Ge-\nburtsortes. Ob nun stationär oder ambulant in der Klinik, im Geburtshaus oder in den eigenen vier \nWänden. Für eine gute Geburtsbegleitung ist ein Betreuungsschlüssel für Hebammen notwendig, \nder eine Eins-zu-eins-Betreuung im Kreißsaal vorsieht. Daher muss auch die Geburtshilfe aus dem \nSystem der „diagnosebezogenen Fallpauschalen“ entlassen werden. Zudem setzen wir uns für \neine leistungsgerechte Vergütung der freiberuflichen Hebammen ein, die ihre verantwortungsvol-\nlen Aufgaben umfassend berücksichtigt. \nIn der Familienplanung müssen Menschen selbstbestimmte Entscheidungen treffen können – \neigenständig, partnerschaftlich, und unabhängig vom Einkommen. Wir werden deshalb für einen \nkostenfreien Zugang zu Verhütungsmitteln sorgen und gezielt die Erforschung von Verhütungs-\nmethoden für Männer fördern. \nFrauen und Paare, die sich in einer Konfliktsituation für einen Schwangerschaftsabbruch entschei-\nden, brauchen Zugang zu Informationen und einer wohnortnahen, guten medizinischen Versor -\ngung – das gilt ambulant wie stationär.'
 'Zudem setzen wir uns für \neine leistungsgerechte Vergütung der freiberuflichen Hebammen ein, die ihre verantwortungsvol-\nlen Aufgaben umfassend berücksichtigt. \nIn der Familienplanung müssen Menschen selbstbestimmte Entscheidungen treffen können – \neigenständig, partnerschaftlich, und unabhängig vom Einkommen. Wir werden deshalb für einen \nkostenfreien Zugang zu Verhütungsmitteln sorgen und gezielt die Erforschung von Verhütungs-\nmethoden für Männer fördern. \nFrauen und Paare, die sich in einer Konfliktsituation für einen Schwangerschaftsabbruch entschei-\nden, brauchen Zugang zu Informationen und einer wohnortnahen, guten medizinischen Versor -\ngung – das gilt ambulant wie stationär. Deshalb müssen Länder und Kommunen dafür sorgen, \ndass Krankenhäuser, die öffentliche Mittel erhalten, Schwangerschaftsabbrüche als Grundversor -\ngung anbieten. Wir erkennen die Verantwortung und das Selbstbestimmungsrecht von Frauen an \nund wollen auch deshalb den Paragraphen 219a abschaffen. Zudem stellen wir in Hinblick auf die \nParagraphen 218 ff. fest: Schwangerschaftskonflikte gehören nicht ins Strafrecht. \nIn der Familie wird füreinander Verantwortung übernommen. Die Ehe ist und bleibt dafür attrak -\ntiv. Deshalb haben wir die Ehe für alle durchgesetzt. Zugleich ist klar, Verantwortung hängt nicht \nam Trauschein. Wir werden vielfältige Familienmodelle rechtlich absichern.'
 'Personalisierte Medizin bewirkt eine Veränderung im Verhältnis von \nBehandlung und Diagnostik. In der Zukunft wird es mehr Produkte geben, bei denen ein diagnos-\ntischer Test mit einem Medikament als Einheit angeboten wird. Diese Leistungen müssen allen \nBürger*innen zur Verfügung stehen - auch bei Medikamenten brauchen wir einen Sicherstellungs-\nauftrag.\nFrauen, Männer und Kinder haben besondere gesundheitliche Bedürfnisse, die bei ihrer\xa0Gesund-\nheitsversorgung und der Prävention berücksichtigt werden müssen. Doch die Gesundheitsfor -\nschung, Ausbildung und Versorgungspraxis orientieren sich zumeist an Daten von weißen, männli-\nchen erwachsenen Probanden– das werden wir ändern.\xa0Wir werden darüber hinaus Programme in \nden Bereichen Prävention und Krankheitsfrüherkennung fördern, die die Besonderheiten verschie-\ndener Altersgruppen und Geschlechter berücksichtigen.\nEine qualitativ hochwertige Gesundheitsversorgung kann am besten durch eine\xa0Neuordnung der \nRollenverteilung zwischen ambulantem und stationärem Sektor, durch\xa0eine Überwindung der Sek -\ntorengrenzen und eine gute Koordination und Kooperation der medizinischen, psychotherapeuti-\nschen und pflegerischen Berufe gelingen. Wir brauchen darum eine stärkere Öffnung von Kranken-\nhäusern für ambulante, teambasierte und interdisziplinäre Formen der Versorgung. \nDie Corona-Krise hat gezeigt: Der öffentliche Gesundheitsdienst braucht bessere\xa0Rahmenbedin-\ngungen, eine bessere Ausstattung, auch mit Blick auf die digitale\xa0Infrastruktur – Hardware eben-\nso wie Software, und eine konkurrenzfähige Vergütung.']","Die Partei setzt sich für einen kostenfreien Zugang zu Verhütungsmitteln ein und fördert die Erforschung von Verhütungsmethoden für Männer. Zudem sollen Frauen und Paare Zugang zu Informationen und medizinischer Versorgung bei Schwangerschaftsabbrüchen erhalten. Krankenhäuser, die öffentliche Mittel erhalten, sollen Schwangerschaftsabbrüche als Grundversorgung anbieten.",Wir werden deshalb für einen kostenfreien Zugang zu Verhütungsmitteln sorgen und gezielt die Erforschung von Verhütungsmethoden für Männer fördern.,1.0,0.8686818080572135,0.99999999995,1.0
86,Was soll in Bezug auf Paragraph 219a geändert werden?,"['Wir erkennen die Verantwortung und das Selbstbestimmungsrecht von Frauen an \nund wollen auch deshalb den Paragraphen 219a abschaffen. Zudem stellen wir in Hinblick auf die \nParagraphen 218 ff. fest: Schwangerschaftskonflikte gehören nicht ins Strafrecht. \nIn der Familie wird füreinander Verantwortung übernommen. Die Ehe ist und bleibt dafür attrak -\ntiv. Deshalb haben wir die Ehe für alle durchgesetzt. Zugleich ist klar, Verantwortung hängt nicht \nam Trauschein. Wir werden vielfältige Familienmodelle rechtlich absichern. Mit der Verantwor -\ntungsgemeinschaft schaffen wir nach dem Vorbild des französischen „Pacte civil de solidarité \n(PACS) eine Möglichkeit des füreinander Einstehens für alle, zu deren Lebenssituation das klas-\nsische Ehe-Modell nicht passt. Mit der Verantwortungsgemeinschaft unterstützen wir beispiels-\nweise Regenbogenfamilien zusätzlich darin, füreinander Sorge zu tragen und Verantwortung zu \nübernehmen, wenn sich mehrere Menschen mit oder anstelle der biologischen Eltern um Kinder \nkümmern. \nWir schaffen ein modernes Abstammungsrecht. Wir setzen uns ein für gleiche Rechte von gleich-\ngeschlechtlichen Partner*innen in der Ehe, insbesondere bei Adoptionen.'
 'Zudem setzen wir uns für \neine leistungsgerechte Vergütung der freiberuflichen Hebammen ein, die ihre verantwortungsvol-\nlen Aufgaben umfassend berücksichtigt. \nIn der Familienplanung müssen Menschen selbstbestimmte Entscheidungen treffen können – \neigenständig, partnerschaftlich, und unabhängig vom Einkommen. Wir werden deshalb für einen \nkostenfreien Zugang zu Verhütungsmitteln sorgen und gezielt die Erforschung von Verhütungs-\nmethoden für Männer fördern. \nFrauen und Paare, die sich in einer Konfliktsituation für einen Schwangerschaftsabbruch entschei-\nden, brauchen Zugang zu Informationen und einer wohnortnahen, guten medizinischen Versor -\ngung – das gilt ambulant wie stationär. Deshalb müssen Länder und Kommunen dafür sorgen, \ndass Krankenhäuser, die öffentliche Mittel erhalten, Schwangerschaftsabbrüche als Grundversor -\ngung anbieten. Wir erkennen die Verantwortung und das Selbstbestimmungsrecht von Frauen an \nund wollen auch deshalb den Paragraphen 219a abschaffen. Zudem stellen wir in Hinblick auf die \nParagraphen 218 ff. fest: Schwangerschaftskonflikte gehören nicht ins Strafrecht. \nIn der Familie wird füreinander Verantwortung übernommen. Die Ehe ist und bleibt dafür attrak -\ntiv. Deshalb haben wir die Ehe für alle durchgesetzt. Zugleich ist klar, Verantwortung hängt nicht \nam Trauschein. Wir werden vielfältige Familienmodelle rechtlich absichern.'
 'Die Altersgrenzen im \nBAföG werden wir dazu in einem ersten Schritt aufheben. Und wir brauchen ein Neustart-BAföG, \ndas auch im Erwachsenenalter neue berufliche Wege öffnen und angemessen den Lebensunter -\nhalt sichert.\nBereits jetzt besteht die Möglichkeit, dass Arbeitnehmer*innen ihre geleisteten Arbeitsstunden \nauf Langzeitkonten ansparen. Allerdings besteht bislang kein rechtlicher Anspruch darauf und nur \nein kleiner Teil der Unternehmen und Arbeitnehmer*innen nutzt Langzeitkonten. Wir werden das \nInstrument zu einem persönlichen Zeitkonto weiterentwickeln, um zusätzlich individuelle Ge-\nstaltungsmöglichkeiten entlang des Lebenslaufs zu schaffen. Basis eines solchen Zeitkontos sind \nZeiteinzahlungen der Beschäftigten – auf diese Weise gehen Überstunden nicht verloren, sondern \nverwandeln sich in ein Zeitguthaben, das per Tarifvertrag oder durch den Staat nach dem Prinzip \neines Chancenkontos aufgestockt werden kann.']","Der Paragraph 219a soll abgeschafft werden, um das Selbstbestimmungsrecht von Frauen anzuerkennen.",Wir erkennen die Verantwortung und das Selbstbestimmungsrecht von Frauen an und wollen auch deshalb den Paragraphen 219a abschaffen.,1.0,0.9299197051431093,0.99999999995,1.0
87,Welche Reformen sind im Bereich des Abstammungsrechts geplant?,"['Für bestehende Ehen werden wir zudem ein \nWahlrecht einführen.\nDie steuerliche Abzugsfähigkeit von Manager*innengehältern werden wir begrenzen, und zwar \nauf das 15-fache des Durchschnittseinkommens der Beschäftigten in dem Betrieb, in dem die \n Manager*in beschäftigt ist. \nBislang gilt bei förderwürdigen Aufwendungen wie zum Beispiel Spenden: Je höher das Einkom-\nmen, desto höher die Steuerrückerstattung. Zukünftig soll jede*r eine einkommensunabhängige \nSteuerminderung erhalten. \nWir wollen die Vermögensteuer wieder in Kraft setzen, auch um die Finanzkraft der Länder für \nwichtige Zukunftsaufgaben zu verbessern. Wer sehr viel Vermögen hat, muss einen größeren Bei-\ntrag zur Finanzierung unseres Gemeinwesens leisten. Deshalb werden wir unter anderem einen \nmaßvollen, einheitlichen Steuersatz von einem Prozent für sehr hohe Vermögen einführen. Gleich-\nzeitig wird es hohe persönliche Freibeträge geben, so dass sich die Steuerbelastung auf besonders \nvermögende Teile der Bevölkerung konzentriert. Wir stellen sicher, dass mit der Vermögenssteuer \nkeine Arbeitsplätze gefährdet werden. Die Grundlage von Betrieben wird bei der Vermögenssteuer \nverschont. \nDie Erbschaftssteuer ist reformbedürftig. In ihrer gegenwärtigen Form ist sie ungerecht, da sie ver -\nmögende Unternehmenserben bevorzugt. Mit einer effektiven Mindestbesteuerung werden wir \ndie Überprivilegierung großer Betriebsvermögen abschaffen. Auch für vermögenshaltende Fami-\nlienstiftungen werden wir eine Mindestbesteuerung einführen.'
 'Wir erkennen die Verantwortung und das Selbstbestimmungsrecht von Frauen an \nund wollen auch deshalb den Paragraphen 219a abschaffen. Zudem stellen wir in Hinblick auf die \nParagraphen 218 ff. fest: Schwangerschaftskonflikte gehören nicht ins Strafrecht. \nIn der Familie wird füreinander Verantwortung übernommen. Die Ehe ist und bleibt dafür attrak -\ntiv. Deshalb haben wir die Ehe für alle durchgesetzt. Zugleich ist klar, Verantwortung hängt nicht \nam Trauschein. Wir werden vielfältige Familienmodelle rechtlich absichern. Mit der Verantwor -\ntungsgemeinschaft schaffen wir nach dem Vorbild des französischen „Pacte civil de solidarité \n(PACS) eine Möglichkeit des füreinander Einstehens für alle, zu deren Lebenssituation das klas-\nsische Ehe-Modell nicht passt. Mit der Verantwortungsgemeinschaft unterstützen wir beispiels-\nweise Regenbogenfamilien zusätzlich darin, füreinander Sorge zu tragen und Verantwortung zu \nübernehmen, wenn sich mehrere Menschen mit oder anstelle der biologischen Eltern um Kinder \nkümmern. \nWir schaffen ein modernes Abstammungsrecht. Wir setzen uns ein für gleiche Rechte von gleich-\ngeschlechtlichen Partner*innen in der Ehe, insbesondere bei Adoptionen.'
 'Das Zukunftsprogramm der SPD\nKapitel 2Seite >23\nSPD-Parteivorstand 2021Das geltende Steuerrecht befördert die klassische Arbeitsteilung zwischen Männern und Frauen. \nDas werden wir ändern und das Steuerrecht stärker auf Partnerschaftlichkeit ausrichten sowie \ndie Steuerlast bei unterschiedlich hohen Einkommen zwischen den Eheleuten gerecht verteilen. \nDas Ehegattensplitting bildet die gesellschaftliche Realität nicht mehr ab und schließt viele Haus-\nhalte mit Kindern von dem gewährten Steuervorteil aus. Nutznießer sind stattdessen vor allem \nAlleinverdiener-Ehepaare mit hohen Einkommen unabhängig von der Kinderzahl. Wir werden das \nEhegattensplitting für neu geschlossene Ehen ändern. Die allermeisten Haushalte mit Kindern \nwerden durch die Kindergrundsicherung finanziell bessergestellt werden. Normalverdienende \nauch ohne Kinder werden keine Einbußen erleiden. Für bestehende Ehen werden wir zudem ein \nWahlrecht einführen.\nDie steuerliche Abzugsfähigkeit von Manager*innengehältern werden wir begrenzen, und zwar \nauf das 15-fache des Durchschnittseinkommens der Beschäftigten in dem Betrieb, in dem die \n Manager*in beschäftigt ist. \nBislang gilt bei förderwürdigen Aufwendungen wie zum Beispiel Spenden: Je höher das Einkom-\nmen, desto höher die Steuerrückerstattung. Zukünftig soll jede*r eine einkommensunabhängige \nSteuerminderung erhalten. \nWir wollen die Vermögensteuer wieder in Kraft setzen, auch um die Finanzkraft der Länder für \nwichtige Zukunftsaufgaben zu verbessern.']","Im Bereich des Abstammungsrechts ist geplant, ein modernes Abstammungsrecht zu schaffen, das gleiche Rechte für gleichgeschlechtliche Partner*innen in der Ehe, insbesondere bei Adoptionen, gewährleistet.","Wir schaffen ein modernes Abstammungsrecht. Wir setzen uns ein für gleiche Rechte von gleichgeschlechtlichen Partner*innen in der Ehe, insbesondere bei Adoptionen.",1.0,0.9632635821349073,0.49999999995,1.0
88,"Wie soll Homo-, Bi-, Trans- und Interphobie bekämpft werden?","['Wir stellen uns konsequent gegen Diskriminierung und Gewalt. Wir werden einen nationalen Ak -\ntionsplan gegen Homo-, Bi-, Trans- und Interphobie und Gewalt gegen LSBTIQ* einführen und uns \nauf europäischer Ebene für die Ächtung solcher Diskriminierung einsetzen. Wir fördern den Kampf \ngegen Gewalt und Diskriminierung, die sich gegen queere Menschen richtet - in Deutschland und \nder Europäischen Union. Wir werden darauf hinwirken, dass die diskriminierende Richtlinie der \nBundesärztekammer zur Blutspende abgeschafft wird. \nIn unserer Gesellschaft soll das tägliche Miteinander von Menschen mit und ohne Behinderungen \nselbstverständlich werden. Menschen mit Behinderungen sollen bessere Chancen auf dem Ar -\nbeitsmarkt erhalten. Auch für sie gilt das Recht auf gute Arbeit. Das werden wir durch die Stärkung \nder Schwerbehindertenvertretungen und die Weiterentwicklung der Ausgleichsabgabe unterstüt -\nzen. Viele Menschen mit Behinderungen sind gut oder sogar sehr gut ausgebildet und in Zeiten \ndes Fachkräftemangels begehrte Arbeitskräfte. Wir setzen uns dafür ein, dass eine einheitliche \nAnsprechstelle für Arbeitgeber*innen kleiner und mittlerer Unternehmen geschaffen wird, die bei \nFragen beispielsweise zu Barrierefreiheit oder Lohnzuschüssen berät. \nDas gesellschaftliche Leben muss auf allen Ebenen für Menschen mit Behinderung inklusiv ge-\nstaltet werden. Dabei ist Barrierefreiheit unverzichtbar. Wir werden vor allem die Kommunen bei \ndieser Aufgabe unterstützen. Der große Mangel an barrierefreien bzw. armen Wohnraum, porthal-\nlen und anderen Freizeiteinrichtungen muss behoben werden.'
 'Das Zukunftsprogramm der SPD\nKapitel 3Seite >44\nSPD-Parteivorstand 2021Kein Gericht sollte künftig mehr über die Anpassung des Personenstandes entscheiden. Psycholo-\ngische Gutachten zur Feststellung der Geschlechtsidentität werden wir abschaffen. Jeder Mensch \nsollte selbst über sein Leben bestimmen können. Wir wollen, dass trans-, inter- und nicht binä-\nre Menschen im Recht gleich behandelt werden, deshalb werden wir das Transsexuellengesetz \nreformieren. Das Diskriminierungsverbot wegen der geschlechtlichen und sexuellen Identität \nwerden wir in Art. 3 Abs. 3 GG aufnehmen. Die gleichberechtigte Teilhabe aller Geschlechter und \nIdentitäten ist ein Gewinn für die ganze Gesellschaft. So können alte Rollen- und Denkmuster auf -\ngebrochen werden. Wir setzen uns für die Anerkennung und Gleichstellung von Lesben, Schwulen, \nBisexuellen, Trans-, Inter- und queeren Menschen (LSBTIQ*) ein. Wir setzen uns die rechtliche Ab -\nsicherung von LSBTIQ*-Familien und Trans* und Inter*Personen zum Ziel.\nWir stellen uns konsequent gegen Diskriminierung und Gewalt. Wir werden einen nationalen Ak -\ntionsplan gegen Homo-, Bi-, Trans- und Interphobie und Gewalt gegen LSBTIQ* einführen und uns \nauf europäischer Ebene für die Ächtung solcher Diskriminierung einsetzen. Wir fördern den Kampf \ngegen Gewalt und Diskriminierung, die sich gegen queere Menschen richtet - in Deutschland und \nder Europäischen Union. Wir werden darauf hinwirken, dass die diskriminierende Richtlinie der \nBundesärztekammer zur Blutspende abgeschafft wird. \nIn unserer Gesellschaft soll das tägliche Miteinander von Menschen mit und ohne Behinderungen \nselbstverständlich werden.'
 'Dafür werden wir die Arbeit der Antidiskriminierungsstelle des \nBundes stärken und das Allgemeine Gleichbehandlungsgesetz modernisieren. Gleichzeitig wer -\nden wir nachdrücklich gegen Rassismus, Rechtsextremismus, Antisemitismus, Antiziganismus, \nIslamfeindlichkeit, Antifeminismus, Sexismus und LSBTIQ*-Feindlichkeit vorgehen. Ein besserer \nAustausch und ein abgestimmtes Vorgehen, zum Beispiel durch die Schaffung einer Bund-Länder-\nKommission, ist ein wichtiger Schritt. Zudem müssen Straftaten in diesem Bereich konsequenter \nerfasst und geahndet werden.\nIntegration ist eine permanente gesellschaftliche, wie auch staatliche Aufgabe. Wir möchten allen \nMenschen, die neu zu uns kommen, den Anspruch auf Integrations- und Beteiligungsangebote ge-\nwährleisten. Für das Miteinander stärken wir die Integrations- und Sprachkurse für alle zugewan-\nderten Menschen in Deutschland, zu denen sie – ungeachtet ihrer Staatsangehörigkeit und ihres \nAufenthaltsstatus – von Tag eins an Zugang haben sollen. Alle Kinder müssen unmittelbar die \nMöglichkeit erhalten, eine Kita zu besuchen; auch die Schulpflicht gilt unmittelbar für alle Kinder. \nGut integrierten Menschen ohne gesicherten Aufenthalt wollen wir ein dauerhaftes Bleiberecht \nermöglichen. Familien gehören zusammen.\nAuch die Integration klappt am besten mit der Familie. Die Regelungen für den Familiennachzug \nzu subsidiär Schutzberechtigten wollen wir daher wieder an die für Flüchtlinge angleichen. Da-\nbei werden wir auch Regelungen für den Geschwisternachzug zu unbegleiteten minderjährigen \nFlüchtlingen schaffen.']","Homo-, Bi-, Trans- und Interphobie sollen durch die Einführung eines nationalen Aktionsplans bekämpft werden, der sich auch auf europäischer Ebene für die Ächtung solcher Diskriminierung einsetzt. Die diskriminierende Richtlinie der Bundesärztekammer zur Blutspende soll abgeschafft werden. Es wird sich für die Anerkennung und Gleichstellung von LSBTIQ*-Menschen eingesetzt.","Wir werden einen nationalen Aktionsplan gegen Homo-, Bi-, Trans- und Interphobie und Gewalt gegen LSBTIQ* einführen und uns auf europäischer Ebene für die Ächtung solcher Diskriminierung einsetzen.",1.0,0.9983854447087449,0.99999999995,1.0
89,Wie sollen die Chancen von Menschen mit Behinderungen auf dem Arbeitsmarkt verbessert werden?,"['Viele Menschen mit Behinderungen sind gut oder sogar sehr gut ausgebildet und in Zeiten \ndes Fachkräftemangels begehrte Arbeitskräfte. Wir setzen uns dafür ein, dass eine einheitliche \nAnsprechstelle für Arbeitgeber*innen kleiner und mittlerer Unternehmen geschaffen wird, die bei \nFragen beispielsweise zu Barrierefreiheit oder Lohnzuschüssen berät. \nDas gesellschaftliche Leben muss auf allen Ebenen für Menschen mit Behinderung inklusiv ge-\nstaltet werden. Dabei ist Barrierefreiheit unverzichtbar. Wir werden vor allem die Kommunen bei \ndieser Aufgabe unterstützen. Der große Mangel an barrierefreien bzw. armen Wohnraum, porthal-\nlen und anderen Freizeiteinrichtungen muss behoben werden. Wir werden ein Bundesprogramm \nBarrierefreiheit initiieren, das über entsprechende Ressourcen verfügen muss.'
 'Es hat sich bewährt, sinnvolle und sozial abgesicherte Tätigkeiten zu schaffen. Wir werden den \nsozialen Arbeitsmarkt ausbauen und weiterentwickeln. Auch weiterhin werden wir Arbeitgeber \nmit Lohnkostenzuschüssen unterstützen, die Langzeitarbeitslose sozialversicherungspflichtig ein-\nstellen. \nDie Grundsicherung werden wir grundlegend überarbeiten und zu einem Bürgergeld entwickeln. \nUnser Bürgergeld steht für ein neues Verständnis eines haltgebenden und bürgernahen Sozial-\nstaats. Das Bürgergeld soll digital und unkompliziert zugänglich sein. Bescheide und Schriftwech-\nsel sollen eine verständliche Sprache sprechen. Die Regelsätze im neuen Bürgergeld müssen zu \neinem Leben in Würde ausreichen und zur gesellschaftlichen Teilhabe befähigen. Das Bürgergeld \nmuss absichern, dass eine kaputte Waschmaschine oder eine neue Winterjacke nicht zur untrag-\nbaren Last werden. Die Kriterien zur Regelsatzermittlung werden wir weiterentwickeln und Betrof -\nfene und Sozialverbände mit einbeziehen. \nDas Ziel muss sein, die hilfsbedürftige Lebenslage gemeinsam zu bezwingen und allen eine Be-\nschäftigung und, falls erforderlich, eine Qualifizierung und Weiterbildung zu ermöglichen. Wir set -\nzen auf eine umfassende und passgenaue Unterstützung, die die gesamte Bedarfsgemeinschaft \nin den Blick nimmt - auf Qualität und gute Netzwerke statt auf eine reine Kennzahlenlogik. Wir \nwerden die gesetzlichen, personellen und finanziellen Rahmenbedingungen weiter so verbessern, \ndass die Jobcenter und ihre Beschäftigten diesem Auftrag nachkommen können.'
 'Wir stellen uns konsequent gegen Diskriminierung und Gewalt. Wir werden einen nationalen Ak -\ntionsplan gegen Homo-, Bi-, Trans- und Interphobie und Gewalt gegen LSBTIQ* einführen und uns \nauf europäischer Ebene für die Ächtung solcher Diskriminierung einsetzen. Wir fördern den Kampf \ngegen Gewalt und Diskriminierung, die sich gegen queere Menschen richtet - in Deutschland und \nder Europäischen Union. Wir werden darauf hinwirken, dass die diskriminierende Richtlinie der \nBundesärztekammer zur Blutspende abgeschafft wird. \nIn unserer Gesellschaft soll das tägliche Miteinander von Menschen mit und ohne Behinderungen \nselbstverständlich werden. Menschen mit Behinderungen sollen bessere Chancen auf dem Ar -\nbeitsmarkt erhalten. Auch für sie gilt das Recht auf gute Arbeit. Das werden wir durch die Stärkung \nder Schwerbehindertenvertretungen und die Weiterentwicklung der Ausgleichsabgabe unterstüt -\nzen. Viele Menschen mit Behinderungen sind gut oder sogar sehr gut ausgebildet und in Zeiten \ndes Fachkräftemangels begehrte Arbeitskräfte. Wir setzen uns dafür ein, dass eine einheitliche \nAnsprechstelle für Arbeitgeber*innen kleiner und mittlerer Unternehmen geschaffen wird, die bei \nFragen beispielsweise zu Barrierefreiheit oder Lohnzuschüssen berät. \nDas gesellschaftliche Leben muss auf allen Ebenen für Menschen mit Behinderung inklusiv ge-\nstaltet werden. Dabei ist Barrierefreiheit unverzichtbar. Wir werden vor allem die Kommunen bei \ndieser Aufgabe unterstützen. Der große Mangel an barrierefreien bzw. armen Wohnraum, porthal-\nlen und anderen Freizeiteinrichtungen muss behoben werden.']","Die Chancen von Menschen mit Behinderungen auf dem Arbeitsmarkt sollen verbessert werden, indem eine einheitliche Ansprechstelle für Arbeitgeber*innen kleiner und mittlerer Unternehmen geschaffen wird, die bei Fragen zur Barrierefreiheit oder Lohnzuschüssen berät. Zudem wird die Förderung der Barrierefreiheit im gesellschaftlichen Leben und die Behebung des Mangels an barrierefreiem Wohnraum und Freizeiteinrichtungen unterstützt. Ein Bundesprogramm Barrierefreiheit wird initiiert, um entsprechende Ressourcen bereitzustellen.",Menschen mit Behinderungen sollen bessere Chancen auf dem Arbeitsmarkt erhalten. Das werden wir durch die Stärkung der Schwerbehindertenvertretungen und die Weiterentwicklung der Ausgleichsabgabe unterstützen.,1.0,1.0000000000000009,0.3333333333,1.0
90,Soll das Blutspendeverbot für schwule und bisexuelle Männer aufgehoben werden?,"['Das Zukunftsprogramm der SPD\nKapitel 3Seite >44\nSPD-Parteivorstand 2021Kein Gericht sollte künftig mehr über die Anpassung des Personenstandes entscheiden. Psycholo-\ngische Gutachten zur Feststellung der Geschlechtsidentität werden wir abschaffen. Jeder Mensch \nsollte selbst über sein Leben bestimmen können. Wir wollen, dass trans-, inter- und nicht binä-\nre Menschen im Recht gleich behandelt werden, deshalb werden wir das Transsexuellengesetz \nreformieren. Das Diskriminierungsverbot wegen der geschlechtlichen und sexuellen Identität \nwerden wir in Art. 3 Abs. 3 GG aufnehmen. Die gleichberechtigte Teilhabe aller Geschlechter und \nIdentitäten ist ein Gewinn für die ganze Gesellschaft. So können alte Rollen- und Denkmuster auf -\ngebrochen werden. Wir setzen uns für die Anerkennung und Gleichstellung von Lesben, Schwulen, \nBisexuellen, Trans-, Inter- und queeren Menschen (LSBTIQ*) ein. Wir setzen uns die rechtliche Ab -\nsicherung von LSBTIQ*-Familien und Trans* und Inter*Personen zum Ziel.\nWir stellen uns konsequent gegen Diskriminierung und Gewalt. Wir werden einen nationalen Ak -\ntionsplan gegen Homo-, Bi-, Trans- und Interphobie und Gewalt gegen LSBTIQ* einführen und uns \nauf europäischer Ebene für die Ächtung solcher Diskriminierung einsetzen. Wir fördern den Kampf \ngegen Gewalt und Diskriminierung, die sich gegen queere Menschen richtet - in Deutschland und \nder Europäischen Union. Wir werden darauf hinwirken, dass die diskriminierende Richtlinie der \nBundesärztekammer zur Blutspende abgeschafft wird. \nIn unserer Gesellschaft soll das tägliche Miteinander von Menschen mit und ohne Behinderungen \nselbstverständlich werden.'
 'Wir stellen uns konsequent gegen Diskriminierung und Gewalt. Wir werden einen nationalen Ak -\ntionsplan gegen Homo-, Bi-, Trans- und Interphobie und Gewalt gegen LSBTIQ* einführen und uns \nauf europäischer Ebene für die Ächtung solcher Diskriminierung einsetzen. Wir fördern den Kampf \ngegen Gewalt und Diskriminierung, die sich gegen queere Menschen richtet - in Deutschland und \nder Europäischen Union. Wir werden darauf hinwirken, dass die diskriminierende Richtlinie der \nBundesärztekammer zur Blutspende abgeschafft wird. \nIn unserer Gesellschaft soll das tägliche Miteinander von Menschen mit und ohne Behinderungen \nselbstverständlich werden. Menschen mit Behinderungen sollen bessere Chancen auf dem Ar -\nbeitsmarkt erhalten. Auch für sie gilt das Recht auf gute Arbeit. Das werden wir durch die Stärkung \nder Schwerbehindertenvertretungen und die Weiterentwicklung der Ausgleichsabgabe unterstüt -\nzen. Viele Menschen mit Behinderungen sind gut oder sogar sehr gut ausgebildet und in Zeiten \ndes Fachkräftemangels begehrte Arbeitskräfte. Wir setzen uns dafür ein, dass eine einheitliche \nAnsprechstelle für Arbeitgeber*innen kleiner und mittlerer Unternehmen geschaffen wird, die bei \nFragen beispielsweise zu Barrierefreiheit oder Lohnzuschüssen berät. \nDas gesellschaftliche Leben muss auf allen Ebenen für Menschen mit Behinderung inklusiv ge-\nstaltet werden. Dabei ist Barrierefreiheit unverzichtbar. Wir werden vor allem die Kommunen bei \ndieser Aufgabe unterstützen. Der große Mangel an barrierefreien bzw. armen Wohnraum, porthal-\nlen und anderen Freizeiteinrichtungen muss behoben werden.'
 'Wir werden Schwerpunktstaatsanwaltschaften für Femizide einrich-\nten – also zur Verfolgung von Morden an Frauen, die begangen wurden, weil sie Frauen sind und \nsetzen uns gesellschaftlich dafür ein, dass Femizide auch als solche benannt werden und nicht als \n„ Verbrechen aus Leidenschaft“ oder „Familientragödie“ .\nPaare, die sich für Kinder entscheiden, brauchen Versorgungssicherheit und die freie Wahl des Ge-\nburtsortes. Ob nun stationär oder ambulant in der Klinik, im Geburtshaus oder in den eigenen vier \nWänden. Für eine gute Geburtsbegleitung ist ein Betreuungsschlüssel für Hebammen notwendig, \nder eine Eins-zu-eins-Betreuung im Kreißsaal vorsieht. Daher muss auch die Geburtshilfe aus dem \nSystem der „diagnosebezogenen Fallpauschalen“ entlassen werden. Zudem setzen wir uns für \neine leistungsgerechte Vergütung der freiberuflichen Hebammen ein, die ihre verantwortungsvol-\nlen Aufgaben umfassend berücksichtigt. \nIn der Familienplanung müssen Menschen selbstbestimmte Entscheidungen treffen können – \neigenständig, partnerschaftlich, und unabhängig vom Einkommen. Wir werden deshalb für einen \nkostenfreien Zugang zu Verhütungsmitteln sorgen und gezielt die Erforschung von Verhütungs-\nmethoden für Männer fördern. \nFrauen und Paare, die sich in einer Konfliktsituation für einen Schwangerschaftsabbruch entschei-\nden, brauchen Zugang zu Informationen und einer wohnortnahen, guten medizinischen Versor -\ngung – das gilt ambulant wie stationär.']","Ja, die SPD plant, die diskriminierende Richtlinie der Bundesärztekammer zur Blutspende abzuschaffen.","Wir werden darauf hinwirken, dass die diskriminierende Richtlinie der Bundesärztekammer zur Blutspende abgeschafft wird.",1.0,0.8701724397903073,0.99999999995,1.0
91,Wie soll die Integrations von Zugewanderten verbessert werden?,"['Alle Kinder müssen unmittelbar die \nMöglichkeit erhalten, eine Kita zu besuchen; auch die Schulpflicht gilt unmittelbar für alle Kinder. \nGut integrierten Menschen ohne gesicherten Aufenthalt wollen wir ein dauerhaftes Bleiberecht \nermöglichen. Familien gehören zusammen.\nAuch die Integration klappt am besten mit der Familie. Die Regelungen für den Familiennachzug \nzu subsidiär Schutzberechtigten wollen wir daher wieder an die für Flüchtlinge angleichen. Da-\nbei werden wir auch Regelungen für den Geschwisternachzug zu unbegleiteten minderjährigen \nFlüchtlingen schaffen. Jeder, der bei uns lebt, soll das Recht haben, für seinen Lebensunterhalt zu \nsorgen. Arbeitsverbote werden wir daher abschaffen. \nAuch der Zustand von jahrelanger Kettenduldungen ist ein Integrationshemmnis und muss durch \nStichtagsregelung beendet werden, um Menschen eine Perspektive zu geben. Die zwangsweise \nRückführung von Menschen in Länder, in denen ihnen Gefahr für Leib und Leben droht, lehnen wir \nab.\nGleichwohl muss unsere Integrationsfähigkeit weit mehr als die Finanzierung von Sprach- und In-\ntegrationskursen umfassen. Und es geht auch nicht nur um neu Zugezogene. Auch die Kinder und \nEnkel der damals so genannten „Gastarbeiter*innen“ und Vertragsarbeiter*innen“ der 60er Jahre \nerfahren noch heute Diskriminierung im Alltag. \nDer öffentliche Dienst muss Vorbild in Sachen Integration sein. Im Sinne der Chancengleichheit ist \ndarauf zu achten, dass auch marginalisierte Personengruppen Zugang zu Stellen im öffentlichen \nDienst erhalten und dass es allen Beschäftigten gleichermaßen möglich ist, sich fortzubilden und \naufzusteigen.'
 'Dafür werden wir die Arbeit der Antidiskriminierungsstelle des \nBundes stärken und das Allgemeine Gleichbehandlungsgesetz modernisieren. Gleichzeitig wer -\nden wir nachdrücklich gegen Rassismus, Rechtsextremismus, Antisemitismus, Antiziganismus, \nIslamfeindlichkeit, Antifeminismus, Sexismus und LSBTIQ*-Feindlichkeit vorgehen. Ein besserer \nAustausch und ein abgestimmtes Vorgehen, zum Beispiel durch die Schaffung einer Bund-Länder-\nKommission, ist ein wichtiger Schritt. Zudem müssen Straftaten in diesem Bereich konsequenter \nerfasst und geahndet werden.\nIntegration ist eine permanente gesellschaftliche, wie auch staatliche Aufgabe. Wir möchten allen \nMenschen, die neu zu uns kommen, den Anspruch auf Integrations- und Beteiligungsangebote ge-\nwährleisten. Für das Miteinander stärken wir die Integrations- und Sprachkurse für alle zugewan-\nderten Menschen in Deutschland, zu denen sie – ungeachtet ihrer Staatsangehörigkeit und ihres \nAufenthaltsstatus – von Tag eins an Zugang haben sollen. Alle Kinder müssen unmittelbar die \nMöglichkeit erhalten, eine Kita zu besuchen; auch die Schulpflicht gilt unmittelbar für alle Kinder. \nGut integrierten Menschen ohne gesicherten Aufenthalt wollen wir ein dauerhaftes Bleiberecht \nermöglichen. Familien gehören zusammen.\nAuch die Integration klappt am besten mit der Familie. Die Regelungen für den Familiennachzug \nzu subsidiär Schutzberechtigten wollen wir daher wieder an die für Flüchtlinge angleichen. Da-\nbei werden wir auch Regelungen für den Geschwisternachzug zu unbegleiteten minderjährigen \nFlüchtlingen schaffen.'
 'Gleichwohl muss unsere Integrationsfähigkeit weit mehr als die Finanzierung von Sprach- und In-\ntegrationskursen umfassen. Und es geht auch nicht nur um neu Zugezogene. Auch die Kinder und \nEnkel der damals so genannten „Gastarbeiter*innen“ und Vertragsarbeiter*innen“ der 60er Jahre \nerfahren noch heute Diskriminierung im Alltag. \nDer öffentliche Dienst muss Vorbild in Sachen Integration sein. Im Sinne der Chancengleichheit ist \ndarauf zu achten, dass auch marginalisierte Personengruppen Zugang zu Stellen im öffentlichen \nDienst erhalten und dass es allen Beschäftigten gleichermaßen möglich ist, sich fortzubilden und \naufzusteigen. Wir brauchen darum neben zielgruppenspezifischen Formulierungen von Stellen-\nausschreibungen, Anerkennung von Vielfaltskompetenzen, Anerkennung von im Ausland erwor -\nbenen Qualifikationen sowie Entgeltgerechtigkeit auch ein Partizipations- und Integrationsgesetz, \ndas staatliche Institutionen zu einem Prozess der interkulturellen Öffnung verpflichtet.']","Die Integration von Zugewanderten soll durch den Zugang zu Kitas und Schulpflicht für alle Kinder, das Bleiberecht für gut integrierte Menschen ohne gesicherten Aufenthalt und die Familienzusammenführung verbessert werden. Zudem sollen Arbeitsverbote abgeschafft und die jahrelangen Kettenduldungen durch eine Stichtagsregelung beendet werden.","Wir möchten allen Menschen, die neu zu uns kommen, den Anspruch auf Integrations- und Beteiligungsangebote gewährleisten. Für das Miteinander stärken wir die Integrations- und Sprachkurse für alle zugewanderten Menschen in Deutschland, zu denen sie – ungeachtet ihrer Staatsangehörigkeit und ihres Aufenthaltsstatus – von Tag eins an Zugang haben sollen.",1.0,0.9965326493291548,0.9999999999666667,1.0
92,Welche Änderungen sind beim Familiennachzug geplant?,"['Alle Kinder müssen unmittelbar die \nMöglichkeit erhalten, eine Kita zu besuchen; auch die Schulpflicht gilt unmittelbar für alle Kinder. \nGut integrierten Menschen ohne gesicherten Aufenthalt wollen wir ein dauerhaftes Bleiberecht \nermöglichen. Familien gehören zusammen.\nAuch die Integration klappt am besten mit der Familie. Die Regelungen für den Familiennachzug \nzu subsidiär Schutzberechtigten wollen wir daher wieder an die für Flüchtlinge angleichen. Da-\nbei werden wir auch Regelungen für den Geschwisternachzug zu unbegleiteten minderjährigen \nFlüchtlingen schaffen. Jeder, der bei uns lebt, soll das Recht haben, für seinen Lebensunterhalt zu \nsorgen. Arbeitsverbote werden wir daher abschaffen. \nAuch der Zustand von jahrelanger Kettenduldungen ist ein Integrationshemmnis und muss durch \nStichtagsregelung beendet werden, um Menschen eine Perspektive zu geben. Die zwangsweise \nRückführung von Menschen in Länder, in denen ihnen Gefahr für Leib und Leben droht, lehnen wir \nab.\nGleichwohl muss unsere Integrationsfähigkeit weit mehr als die Finanzierung von Sprach- und In-\ntegrationskursen umfassen. Und es geht auch nicht nur um neu Zugezogene. Auch die Kinder und \nEnkel der damals so genannten „Gastarbeiter*innen“ und Vertragsarbeiter*innen“ der 60er Jahre \nerfahren noch heute Diskriminierung im Alltag. \nDer öffentliche Dienst muss Vorbild in Sachen Integration sein. Im Sinne der Chancengleichheit ist \ndarauf zu achten, dass auch marginalisierte Personengruppen Zugang zu Stellen im öffentlichen \nDienst erhalten und dass es allen Beschäftigten gleichermaßen möglich ist, sich fortzubilden und \naufzusteigen.'
 'Das Zukunftsprogramm der SPD\nKapitel 2Seite >23\nSPD-Parteivorstand 2021Das geltende Steuerrecht befördert die klassische Arbeitsteilung zwischen Männern und Frauen. \nDas werden wir ändern und das Steuerrecht stärker auf Partnerschaftlichkeit ausrichten sowie \ndie Steuerlast bei unterschiedlich hohen Einkommen zwischen den Eheleuten gerecht verteilen. \nDas Ehegattensplitting bildet die gesellschaftliche Realität nicht mehr ab und schließt viele Haus-\nhalte mit Kindern von dem gewährten Steuervorteil aus. Nutznießer sind stattdessen vor allem \nAlleinverdiener-Ehepaare mit hohen Einkommen unabhängig von der Kinderzahl. Wir werden das \nEhegattensplitting für neu geschlossene Ehen ändern. Die allermeisten Haushalte mit Kindern \nwerden durch die Kindergrundsicherung finanziell bessergestellt werden. Normalverdienende \nauch ohne Kinder werden keine Einbußen erleiden. Für bestehende Ehen werden wir zudem ein \nWahlrecht einführen.\nDie steuerliche Abzugsfähigkeit von Manager*innengehältern werden wir begrenzen, und zwar \nauf das 15-fache des Durchschnittseinkommens der Beschäftigten in dem Betrieb, in dem die \n Manager*in beschäftigt ist. \nBislang gilt bei förderwürdigen Aufwendungen wie zum Beispiel Spenden: Je höher das Einkom-\nmen, desto höher die Steuerrückerstattung. Zukünftig soll jede*r eine einkommensunabhängige \nSteuerminderung erhalten. \nWir wollen die Vermögensteuer wieder in Kraft setzen, auch um die Finanzkraft der Länder für \nwichtige Zukunftsaufgaben zu verbessern.'
 'Das Zukunftsprogramm der SPD\nKapitel 3Seite >39\nSPD-Parteivorstand 20213.7. Gut aufwachsen \nKinder und Jugendliche brauchen starke Familien. Sie brauchen Liebe, Zuwendung und viel ge-\nmeinsame Zeit. Die Zukunftsfähigkeit unserer Gesellschaft hängt davon ab, dass sich Menschen \nfür Kinder entscheiden und sie auf ihrem Weg in ein selbständiges Leben bestmöglich begleiten. \nDie Vereinbarkeit von Familienarbeit und Beruf ist für viele noch immer ein täglicher Spagat – hier \nbrauchen Eltern mehr Unterstützung. Das gilt zumal dann, wenn neben der Kindererziehung noch \nAlltagshilfe oder Pflege für ältere Angehörige zu leisten ist.\nIn der Krise ist erneut deutlich geworden, dass Fürsorgearbeit überwiegend von Frauen geleistet \nwird. Wir treten dafür an, dass Familien mehr Zeit füreinander haben, und dass es einfacher wird, \nErwerbs- und Sorgearbeit gerechter zwischen allen Geschlechtern aufzuteilen, und Alleinerziehen-\nde besser unterstützt werden. \nWir werden ein Vier-Säulen-Modell für mehr Familienzeit einführen. Die erste Säule sind zwei \nWochen Elternschaftszeit direkt nach Geburt eines Kindes, auf die jeder Vater bzw. der/die Part -\nner*in kurzfristig und sozial abgesichert Anspruch hat. Wir werden damit Familien mit Kindern in \nihrer allerersten Phase unterstützen und die Voraussetzungen für eine gerechtere Aufteilung von \nSorgeaufgaben schaffen. \nDie zweite Säule ist die Familienarbeitszeit, mit der wir den derzeitigen Partnerschaftsbonus beim \nElterngeldPlus zu einer flexiblen, geförderten Elternteilzeit nach dem ersten Lebensjahr eines Kin-\ndes ausbauen werden.']","Beim Familiennachzug sind geplante Änderungen, die Regelungen für den Familiennachzug zu subsidiär Schutzberechtigten wieder an die für Flüchtlinge anzugleichen und Regelungen für den Geschwisternachzug zu unbegleiteten minderjährigen Flüchtlingen zu schaffen. Jeder, der in Deutschland lebt, soll das Recht haben, für seinen Lebensunterhalt zu sorgen, daher werden Arbeitsverbote abgeschafft. Der Familiennachzug wird als wichtiger Bestandteil der Integration angesehen.",Die Regelungen für den Familiennachzug zu subsidiär Schutzberechtigten wollen wir daher wieder an die für Flüchtlinge angleichen. Dabei werden wir auch Regelungen für den Geschwisternachzug zu unbegleiteten minderjährigen Flüchtlingen schaffen.,1.0,0.9887136791658017,0.9999999999,1.0
93,Was ist die Haltung zu zwangsweisen Rückführung von Menschen in nicht sichere Herkunftsländer?,"['Deshalb werden wir ein funktionsfähiges Europäisches Asylsystem mit dem notwendigen \nGleichgewicht zwischen Verantwortung und Solidarität voranbringen, das eine Reform des Dublin-\nSystems hin zu einem solidarischen Verteilungsmechanismus beinhaltet und das Recht auf Asyl \nvollumfänglich wahrt und gewährt. Das Asylsystem soll weiter europäisiert und das Europäische \nUnterstützungsbüro für Asylfragen zu einer vollwertigen europäischen Asylagentur ausgebaut \nwerden. \nWir werden die Genfer Flüchtlingskonvention verteidigen. Pushbacks sind eine eklatante Verlet -\nzung des Völkerrechts. Seenotrettung ist eine Verpflichtung aus dem internationalen Seerecht und \ndarf nicht kriminalisiert werden, sondern sollte auch staatlich durch die EU gewährleistet werden. \nIm Rahmen eines umfassenden Ansatzes sollten legale Migrationswege geschaffen und die Ursa-\nchen von Flucht und Vertreibung bekämpft werden. Wir werden eine Brücke zu lokalen Akteuren \nbauen und die Aufnahmebereitschaft von europäischen Kommunen und Städten fördern und \nunterstützen. Dies soll durch Bundeskontingente möglich gemacht und damit auch die Bereit -\nschaft vieler Kommunen im Rahmen der Initiative „Sichere Häfen“ aufgegriffen werden. Zusätzlich \nsoll die Europäische Union ein Impfkontingent für  \nGeflüchtete einrichten.\nWir setzen uns ein für eine EU-weite Ratifizierung der Istanbul-Konvention des Europarats als ver -\nbindliche Rechtsnorm gegen Gewalt an Frauen.'
 'Alle Kinder müssen unmittelbar die \nMöglichkeit erhalten, eine Kita zu besuchen; auch die Schulpflicht gilt unmittelbar für alle Kinder. \nGut integrierten Menschen ohne gesicherten Aufenthalt wollen wir ein dauerhaftes Bleiberecht \nermöglichen. Familien gehören zusammen.\nAuch die Integration klappt am besten mit der Familie. Die Regelungen für den Familiennachzug \nzu subsidiär Schutzberechtigten wollen wir daher wieder an die für Flüchtlinge angleichen. Da-\nbei werden wir auch Regelungen für den Geschwisternachzug zu unbegleiteten minderjährigen \nFlüchtlingen schaffen. Jeder, der bei uns lebt, soll das Recht haben, für seinen Lebensunterhalt zu \nsorgen. Arbeitsverbote werden wir daher abschaffen. \nAuch der Zustand von jahrelanger Kettenduldungen ist ein Integrationshemmnis und muss durch \nStichtagsregelung beendet werden, um Menschen eine Perspektive zu geben. Die zwangsweise \nRückführung von Menschen in Länder, in denen ihnen Gefahr für Leib und Leben droht, lehnen wir \nab.\nGleichwohl muss unsere Integrationsfähigkeit weit mehr als die Finanzierung von Sprach- und In-\ntegrationskursen umfassen. Und es geht auch nicht nur um neu Zugezogene. Auch die Kinder und \nEnkel der damals so genannten „Gastarbeiter*innen“ und Vertragsarbeiter*innen“ der 60er Jahre \nerfahren noch heute Diskriminierung im Alltag. \nDer öffentliche Dienst muss Vorbild in Sachen Integration sein. Im Sinne der Chancengleichheit ist \ndarauf zu achten, dass auch marginalisierte Personengruppen Zugang zu Stellen im öffentlichen \nDienst erhalten und dass es allen Beschäftigten gleichermaßen möglich ist, sich fortzubilden und \naufzusteigen.'
 'Die \ngravierenden Menschenrechtsverletzungen gegenüber Minderheiten, insbesondere uigurischen \nMuslimen, verurteilen wir. Für Honkong muss das international verbriefte Prinzip „Ein Land – zwei \nSysteme“ gewahrt bleiben. Wir betrachten mit großer Sorge den wachsenden Druck auf Taiwan.\nWir unterstützen die Menschen in Belarus in ihrem Wunsch nach Demokratie und Freiheit. Gewalt \nund Repression der Sicherheitskräfte müssen beendet, alle politischen Gefangenen freigelassen \nund demokratische Neuwahlen unter der Aufsicht der OSZE durchgeführt werden.\nDen innen- und außenpolitischen Kurs der türkischen Regierung betrachten wir mit Sorge. Die \nTürkei muss rechtstaatliche, demokratische und völkerrechtliche Prinzipien einhalten. Eine Intensi-\nvierung des EU-Türkei-Dialogs, der auch diese Fragen kritisch erörtert, ist dringend notwendig.\nIsraels Sicherheit und Existenzrecht ist Teil der Staatsräson Deutschlands. Auch aufgrund dieser \nbesonderen Verantwortung werden wir zusammen mit unseren europäischen Partnern und den \nUSA neue Initiativen zur Wiederbelebung des Nahost-Friedensprozesses unterstützen. Auf Grund-\nlage der Vereinbarungen von Oslo ist und bleibt für uns das Ziel die friedliche Koexistenz zweier \nsouveräner und lebensfähiger Staaten im Rahmen einer Verhandlungslösung.\nDie Normalisierung der Beziehungen zwischen Israel und einigen Staaten in der Region sind er -\nmutigende Signale, dass Fortschritte zum Frieden möglich sind. Einseitige Schritte von allen Seiten \nerschweren die Friedensbemühungen und müssen unterbleiben. Von der palästinensischen Seite \nfordern wir das Ende des Terrors.']","Die Haltung zu zwangsweisen Rückführungen von Menschen in nicht sichere Herkunftsländer ist klar abgelehnt, da sie als Verletzung des Völkerrechts betrachtet wird. Es wird betont, dass das Recht auf Asyl vollumfänglich gewährt und gewahrt werden soll. Es werden legale Migrationswege geschaffen und die Ursachen von Flucht und Vertreibung bekämpft.","Die zwangsweise Rückführung von Menschen in Länder, in denen ihnen Gefahr für Leib und Leben droht, lehnen wir ab.",0.8333333333333334,0.9964582004202397,0.99999999995,1.0
94,"Soll es in Deutschland generell möglich sein, neben der deutschen eine zweite Staatsbürgerschaft zu haben?","['Dadurch können sich die Be-\nhörden und die Betroffenen in den ersten Monaten mit voller Energie auf eine sinnvolle Wieder -\naufnahme der Beschäftigung konzentrieren. Die guten Erfahrungen aus diesen vorübergehenden \nMaßnahmen haben uns darin bestätigt, dafür zu sorgen, dass auch in Zukunft Vermögen und \nWohnungsgröße innerhalb der ersten zwei Jahre nicht überprüft werden und das Schonvermögen \nerhöht wird. Das Bürgergeld beinhaltet Mitwirkungspflichten, setzt aber konsequent auf Hilfe und \nErmutigung. Eingliederungsvereinbarungen werden durch eine gemeinsame und auf Augenhöhe \nerarbeitete Teilhabevereinbarung ersetzt. Bei ihrer Umsetzung setzen wir auf Befähigung und Be-\nstärkung und nicht auf Vorgaben und Zwang. Sinnwidrige und unwürdige Sanktionen schaffen wir \nab. Das sozioökonomische und soziokulturelle Existenzminimum muss jederzeit gesichert sein.\nDie Leistungen des Sozialstaates sind soziale Rechte – wer sie benötigt, sollte nicht lange suchen \nmüssen. Unser Ziel ist es, die Leistungen ohne Hürden und Umwege zugänglich zu machen. Wir \nwollen einen Bürgerservice, der nach Lebenslagen berät und alle Leistungen aus einer Hand zu-\ngänglich macht. Er ist digital und aufsuchend, wo der Weg zu beschwerlich ist. Ein zugewandter \nSozialstaat hilft, Rechtsansprüche geltend zu machen, und begleitet auch danach beratend alle \nSchritte.'
 'Alle Kinder müssen unmittelbar die \nMöglichkeit erhalten, eine Kita zu besuchen; auch die Schulpflicht gilt unmittelbar für alle Kinder. \nGut integrierten Menschen ohne gesicherten Aufenthalt wollen wir ein dauerhaftes Bleiberecht \nermöglichen. Familien gehören zusammen.\nAuch die Integration klappt am besten mit der Familie. Die Regelungen für den Familiennachzug \nzu subsidiär Schutzberechtigten wollen wir daher wieder an die für Flüchtlinge angleichen. Da-\nbei werden wir auch Regelungen für den Geschwisternachzug zu unbegleiteten minderjährigen \nFlüchtlingen schaffen. Jeder, der bei uns lebt, soll das Recht haben, für seinen Lebensunterhalt zu \nsorgen. Arbeitsverbote werden wir daher abschaffen. \nAuch der Zustand von jahrelanger Kettenduldungen ist ein Integrationshemmnis und muss durch \nStichtagsregelung beendet werden, um Menschen eine Perspektive zu geben. Die zwangsweise \nRückführung von Menschen in Länder, in denen ihnen Gefahr für Leib und Leben droht, lehnen wir \nab.\nGleichwohl muss unsere Integrationsfähigkeit weit mehr als die Finanzierung von Sprach- und In-\ntegrationskursen umfassen. Und es geht auch nicht nur um neu Zugezogene. Auch die Kinder und \nEnkel der damals so genannten „Gastarbeiter*innen“ und Vertragsarbeiter*innen“ der 60er Jahre \nerfahren noch heute Diskriminierung im Alltag. \nDer öffentliche Dienst muss Vorbild in Sachen Integration sein. Im Sinne der Chancengleichheit ist \ndarauf zu achten, dass auch marginalisierte Personengruppen Zugang zu Stellen im öffentlichen \nDienst erhalten und dass es allen Beschäftigten gleichermaßen möglich ist, sich fortzubilden und \naufzusteigen.'
 'Dafür werden wir die Arbeit der Antidiskriminierungsstelle des \nBundes stärken und das Allgemeine Gleichbehandlungsgesetz modernisieren. Gleichzeitig wer -\nden wir nachdrücklich gegen Rassismus, Rechtsextremismus, Antisemitismus, Antiziganismus, \nIslamfeindlichkeit, Antifeminismus, Sexismus und LSBTIQ*-Feindlichkeit vorgehen. Ein besserer \nAustausch und ein abgestimmtes Vorgehen, zum Beispiel durch die Schaffung einer Bund-Länder-\nKommission, ist ein wichtiger Schritt. Zudem müssen Straftaten in diesem Bereich konsequenter \nerfasst und geahndet werden.\nIntegration ist eine permanente gesellschaftliche, wie auch staatliche Aufgabe. Wir möchten allen \nMenschen, die neu zu uns kommen, den Anspruch auf Integrations- und Beteiligungsangebote ge-\nwährleisten. Für das Miteinander stärken wir die Integrations- und Sprachkurse für alle zugewan-\nderten Menschen in Deutschland, zu denen sie – ungeachtet ihrer Staatsangehörigkeit und ihres \nAufenthaltsstatus – von Tag eins an Zugang haben sollen. Alle Kinder müssen unmittelbar die \nMöglichkeit erhalten, eine Kita zu besuchen; auch die Schulpflicht gilt unmittelbar für alle Kinder. \nGut integrierten Menschen ohne gesicherten Aufenthalt wollen wir ein dauerhaftes Bleiberecht \nermöglichen. Familien gehören zusammen.\nAuch die Integration klappt am besten mit der Familie. Die Regelungen für den Familiennachzug \nzu subsidiär Schutzberechtigten wollen wir daher wieder an die für Flüchtlinge angleichen. Da-\nbei werden wir auch Regelungen für den Geschwisternachzug zu unbegleiteten minderjährigen \nFlüchtlingen schaffen.']",Das Wahlprogramm spricht sich nicht explizit für oder gegen die Möglichkeit einer zweiten Staatsbürgerschaft aus. Es konzentriert sich hauptsächlich auf Maßnahmen zur Integration und Teilhabe von Menschen in Deutschland.,"Unsere Gesellschaft des Respekts braucht ein modernes Staatsangehörigkeitsrecht. Nachdem wir bereits dafür gesorgt haben, dass grundsätzlich alle in Deutschland geborenen Kinder mit der Geburt auch deutsche Staatsbürger*innen sind, werden wir auch die generelle Möglichkeit von Mehrstaatigkeit gesetzlich verankern.",1.0,0.0,0.0,0.0
95,Soll die Regelaufenthaltsdauer bei Einbürgerungen verändert werden?,"['Die Altersgrenzen im \nBAföG werden wir dazu in einem ersten Schritt aufheben. Und wir brauchen ein Neustart-BAföG, \ndas auch im Erwachsenenalter neue berufliche Wege öffnen und angemessen den Lebensunter -\nhalt sichert.\nBereits jetzt besteht die Möglichkeit, dass Arbeitnehmer*innen ihre geleisteten Arbeitsstunden \nauf Langzeitkonten ansparen. Allerdings besteht bislang kein rechtlicher Anspruch darauf und nur \nein kleiner Teil der Unternehmen und Arbeitnehmer*innen nutzt Langzeitkonten. Wir werden das \nInstrument zu einem persönlichen Zeitkonto weiterentwickeln, um zusätzlich individuelle Ge-\nstaltungsmöglichkeiten entlang des Lebenslaufs zu schaffen. Basis eines solchen Zeitkontos sind \nZeiteinzahlungen der Beschäftigten – auf diese Weise gehen Überstunden nicht verloren, sondern \nverwandeln sich in ein Zeitguthaben, das per Tarifvertrag oder durch den Staat nach dem Prinzip \neines Chancenkontos aufgestockt werden kann.'
 'Die Kriterien zur Regelsatzermittlung werden wir weiterentwickeln und Betrof -\nfene und Sozialverbände mit einbeziehen. \nDas Ziel muss sein, die hilfsbedürftige Lebenslage gemeinsam zu bezwingen und allen eine Be-\nschäftigung und, falls erforderlich, eine Qualifizierung und Weiterbildung zu ermöglichen. Wir set -\nzen auf eine umfassende und passgenaue Unterstützung, die die gesamte Bedarfsgemeinschaft \nin den Blick nimmt - auf Qualität und gute Netzwerke statt auf eine reine Kennzahlenlogik. Wir \nwerden die gesetzlichen, personellen und finanziellen Rahmenbedingungen weiter so verbessern, \ndass die Jobcenter und ihre Beschäftigten diesem Auftrag nachkommen können. Wir schaffen das \nRecht auf Förderung beim Nachholen eines Berufsabschlusses und führen einen Weiterbildungs-\nBonus ein, der die finanziellen Spielräume spürbar erweitert.\nWir haben wegen der Corona-Pandemie die Vermögensprüfung weitestgehend ausgesetzt. Man \nläuft nicht mehr Gefahr, aus der Wohnung ausziehen zu müssen. Dadurch können sich die Be-\nhörden und die Betroffenen in den ersten Monaten mit voller Energie auf eine sinnvolle Wieder -\naufnahme der Beschäftigung konzentrieren. Die guten Erfahrungen aus diesen vorübergehenden \nMaßnahmen haben uns darin bestätigt, dafür zu sorgen, dass auch in Zukunft Vermögen und \nWohnungsgröße innerhalb der ersten zwei Jahre nicht überprüft werden und das Schonvermögen \nerhöht wird. Das Bürgergeld beinhaltet Mitwirkungspflichten, setzt aber konsequent auf Hilfe und \nErmutigung. Eingliederungsvereinbarungen werden durch eine gemeinsame und auf Augenhöhe \nerarbeitete Teilhabevereinbarung ersetzt.'
 'Dadurch können sich die Be-\nhörden und die Betroffenen in den ersten Monaten mit voller Energie auf eine sinnvolle Wieder -\naufnahme der Beschäftigung konzentrieren. Die guten Erfahrungen aus diesen vorübergehenden \nMaßnahmen haben uns darin bestätigt, dafür zu sorgen, dass auch in Zukunft Vermögen und \nWohnungsgröße innerhalb der ersten zwei Jahre nicht überprüft werden und das Schonvermögen \nerhöht wird. Das Bürgergeld beinhaltet Mitwirkungspflichten, setzt aber konsequent auf Hilfe und \nErmutigung. Eingliederungsvereinbarungen werden durch eine gemeinsame und auf Augenhöhe \nerarbeitete Teilhabevereinbarung ersetzt. Bei ihrer Umsetzung setzen wir auf Befähigung und Be-\nstärkung und nicht auf Vorgaben und Zwang. Sinnwidrige und unwürdige Sanktionen schaffen wir \nab. Das sozioökonomische und soziokulturelle Existenzminimum muss jederzeit gesichert sein.\nDie Leistungen des Sozialstaates sind soziale Rechte – wer sie benötigt, sollte nicht lange suchen \nmüssen. Unser Ziel ist es, die Leistungen ohne Hürden und Umwege zugänglich zu machen. Wir \nwollen einen Bürgerservice, der nach Lebenslagen berät und alle Leistungen aus einer Hand zu-\ngänglich macht. Er ist digital und aufsuchend, wo der Weg zu beschwerlich ist. Ein zugewandter \nSozialstaat hilft, Rechtsansprüche geltend zu machen, und begleitet auch danach beratend alle \nSchritte.']",Die Regelaufenthaltsdauer bei Einbürgerungen wird in den bereitgestellten Informationen nicht erwähnt.,Wir wollen bestehende Hürden bei Einbürgerungen abschaffen und hierfür auch die geltende Regelaufenthaltsdauer von bisher acht Jahren verkürzen.,1.0,0.0,0.0,0.0
96,"Wie sollen Vereine, Projekte und Initiativen gegen die Feinde der offenen Gesellschaft unterstützt werden?","['Breiten- und Leistungssport werden wir fördern. Wir \nstehen als Sozialdemokraten*innen für einen Sport, der unsere Verfassungswerte auch in nationa-\nlen und internationalen Wettbewerben vorlebt. Wir werden auch in den kommenden Jahren den \nSpitzensport fördern. Darüber hinaus verlieren wir die Belange und Sorgen unserer Vereine vor Ort \nnicht aus dem Blick. Bund, Bundesländer und Kommunen sind gleichermaßen aufgefordert, die \nBasis des Sports bei der Überwindung der pandemiebedingten Probleme in besonderer Weise zu \nunterstützen. \nZu einer lebendigen Demokratie gehört eine starke Zivilgesellschaft und ein zeitgemäßes Gemein-\nnützigkeitsrecht. Daher werden wir prüfen, welche weiteren gesellschaftspolitisch bedeutsamen \nBereiche in den Katalog gemeinnütziger Zwecke aufgenommen werden können und sicherstellen, \ndass steuerbegünstigte Körperschaften wie Vereine bei der Verfolgung ihrer satzungsmäßigen \nZwecke auch politisch tätig sein können und z.B. der Aufruf eines Sportvereins zu einer Demons-\ntration gegen Rassismus und Fremdenfeindlichkeit möglich ist, ohne diese steuerliche Vergünsti-\ngung zu verlieren.\nExtremisten und Terroristen bedrohen unsere freie Gesellschaft. Um dieser erheblichen Gefahr \nwirksam begegnen zu können, muss der Verfassungsschutz die Rolle eines demokratischen Früh-\nwarnsystems erfüllen. Verfassungsfeindliche Organisationen werden wir verbieten. Wo Religions-\nfreiheit missbraucht wird und in religiösen Fanatismus umschlägt, müssen staatliche Sicherheits-\nbehörden konsequent eingreifen.'
 'Das Zukunftsprogramm der SPD\nKapitel 3Seite >47\nSPD-Parteivorstand 20213.10. Demokratie stärken\nDemokratie ist verletzlich. Sie zu schützen ist erforderlich. Deshalb müssen wir unsere Demokratie \nwehrhaft gegen ihre Feinde machen. Dabei hat sich die ausdifferenzierte föderale Sicherheits-\nstruktur bewährt. Wir werden sie weiter verbessern durch eine wirkungsvollere Zusammenarbeit \ndes Bundes mit den Ländern. \nDemokratie ist die Basis einer Gesellschaft, die allen die Chance bietet, in Freiheit und Sicherheit \nzu leben. Mit einem Demokratiefördergesetz werden wir Vereine, Projekte und Initiativen langfris-\ntig fördern und sie besser wappnen gegen die Feinde unserer offenen Gesellschaft. Wir werden das \nBundesprogramm „Demokratie leben!“ weiter ausbauen und hierüber Präventionsprojekte auf \nBundes-, Landes und kommunaler Ebene fördern. Auch politische Bildung ist unverzichtbar. Dafür \nsetzen wir uns innerhalb und außerhalb der schulischen Bildung für verstärkten und einfacheren \nZugang zu politischen Bildungsmöglichkeiten und Demokratieförderung ein. Wir werden Arbeit -\nnehmer*innen verstärkt in die Lage versetzen, ihren gesetzlichen Bildungsurlaub zu nutzen, um \nsich einfacher für ihr ehrenamtliches Engagement freistellen zu lassen.\nMillionen Bürger*innen engagieren sich ehrenamtlich in (Sport-)Vereinen, der freiwilligen Feuer -\nwehr, Kirchen- und Religionsgemeinschaften, Tafeln, Frauennotrufen, Flüchtlingsorganisationen, \ndem THW und anderen Organisationen. Mit ihrer Arbeit tragen sie dazu bei, dass unser Gemein-\nwesen funktioniert.'
 'der Aufruf eines Sportvereins zu einer Demons-\ntration gegen Rassismus und Fremdenfeindlichkeit möglich ist, ohne diese steuerliche Vergünsti-\ngung zu verlieren.\nExtremisten und Terroristen bedrohen unsere freie Gesellschaft. Um dieser erheblichen Gefahr \nwirksam begegnen zu können, muss der Verfassungsschutz die Rolle eines demokratischen Früh-\nwarnsystems erfüllen. Verfassungsfeindliche Organisationen werden wir verbieten. Wo Religions-\nfreiheit missbraucht wird und in religiösen Fanatismus umschlägt, müssen staatliche Sicherheits-\nbehörden konsequent eingreifen. Mit aller Konsequenz und Härte werden wir weiter gegen Terror \nund Gewalt vorgehen. Dafür haben wir die gesetzlichen Grundlagen geschaffen.\nRechtsextremismus in Sicherheitsbehörden oder auch bei der Bundeswehr bekämpfen wir kon-\nsequent. Der Entstehung von rassistischen Denkmustern im Polizeialltag wirken wir durch die \nErmöglichung von mehr Supervision, Fort- und Weiterbildungen sowie guten Arbeitsbedingungen \nentgegen. Wir unterstützen die Einrichtungen von Schwerpunktstaatsanwaltschaften zur Verfol-\ngung von Antisemitismus und Rassismus.']","Vereine, Projekte und Initiativen sollen langfristig gefördert und besser gegen die Feinde der offenen Gesellschaft gewappnet werden. Dies beinhaltet die Ausweitung des Bundesprogramms ""Demokratie leben!"" und die Förderung von politischer Bildung. Der Zugang zu politischer Bildungsmöglichkeiten soll erleichtert werden.","Mit einem Demokratiefördergesetz werden wir Vereine, Projekte und Initiativen langfristig fördern und sie besser wappnen gegen die Feinde unserer offenen Gesellschaft.",1.0,0.9713148881932742,0.5833333333041666,1.0
97,Wie soll der Zugang zu politischen Bildungsmöglichkeiten verbessert werden?,"['Dafür werden wir eine attraktive, vergütete und schulgeldfreie Ausbildung schaffen, für mehr \nAusbildungskapazitäten an Fachschulen und in den Studiengängen zur sozialen Arbeit und Kind-\nheitspädagogik sorgen, mehr Karriereoptionen für die Fachkräfte schaffen und Beschäftigungsver -\nhältnisse anstreben, die eine eigenständige Existenzsicherung ermöglichen.\nDie Krise hat gezeigt, wie unverzichtbar und wichtig funktionierende Postdienste und Paketdiens-\nte für die Daseinsvorsorge in Deutschland sind. Die Arbeitsbedingungen in dieser Branche sind oft \nschlecht. Es gibt viele ungesicherte Arbeitsverhältnisse durch Scheinselbständigkeit und Subunter -\nnehmertum. Eine Zerschlagung der Deutschen Post und eine vollständige Privatisierung werden \nwir verhindern und unfaire Wettbewerbsvorteile von Digitalkonzernen auch in diesem Bereich \nbeseitigen. Wir werden die Branche sozial und ökologisch ausrichten.\nDer Erfolg der Unternehmen wird von ihren Beschäftigten erarbeitet. Deshalb verbessern wir \nderen Mitbestimmung. Wir werden sie auf Unternehmen in ausländischer Rechtsform erweitern. \nWir werden den Geltungsbereich der Mitbestimmung durch die Absenkung der Schwellenwerte \nder Unternehmensgrößen erweitern. Entscheidungen zur Verlagerung oder Schließungen von Be-\ntriebsstandorten sollen nicht über die Köpfe der Beschäftigten hinweg getroffen werden. Darum \nstärken wir durch eine echte Parität in den Aufsichtsräten den Einfluss der Arbeitnehmer*innen.'
 'Die Mitbestimmungsmöglichkeiten von Jugend- und Auszubildenden-Vertretungen (JAV) werden \nwir verbessern, indem ihr Vertretungsrecht auf alle Beschäftigten in Ausbildung ausgedehnt und \ndie Gründung einer JAV erleichtert wird. \nMit einem Bundesprogramm „Gemeindehaus 2.0“ werden wir aufbauend auf dem Netz der Mehr -\ngenerationenhäuser noch mehr Angebote unter einem Dach bündeln: außerschulische Bildung, \nSport, Kultur und Jugendarbeit, Netzwerke für den Kinderschutz, barrierefreie digitale Infrastruk -\ntur für alle Kinder und Jugendlichen, die sie für Bildung und gesellschaftliche Teilhabe benötigen. \nSelbstbestimmte Räume für die Kinder- und Jugendarbeit müssen unabhängig davon erhalten \nund ausgebaut werden. An Kinder gerichtete Werbung wollen wir reglementieren. Kitas und Schu-\nlen müssen ein werbefreier Raum sein.'
 'Das Zukunftsprogramm der SPD\nKapitel 3Seite >47\nSPD-Parteivorstand 20213.10. Demokratie stärken\nDemokratie ist verletzlich. Sie zu schützen ist erforderlich. Deshalb müssen wir unsere Demokratie \nwehrhaft gegen ihre Feinde machen. Dabei hat sich die ausdifferenzierte föderale Sicherheits-\nstruktur bewährt. Wir werden sie weiter verbessern durch eine wirkungsvollere Zusammenarbeit \ndes Bundes mit den Ländern. \nDemokratie ist die Basis einer Gesellschaft, die allen die Chance bietet, in Freiheit und Sicherheit \nzu leben. Mit einem Demokratiefördergesetz werden wir Vereine, Projekte und Initiativen langfris-\ntig fördern und sie besser wappnen gegen die Feinde unserer offenen Gesellschaft. Wir werden das \nBundesprogramm „Demokratie leben!“ weiter ausbauen und hierüber Präventionsprojekte auf \nBundes-, Landes und kommunaler Ebene fördern. Auch politische Bildung ist unverzichtbar. Dafür \nsetzen wir uns innerhalb und außerhalb der schulischen Bildung für verstärkten und einfacheren \nZugang zu politischen Bildungsmöglichkeiten und Demokratieförderung ein. Wir werden Arbeit -\nnehmer*innen verstärkt in die Lage versetzen, ihren gesetzlichen Bildungsurlaub zu nutzen, um \nsich einfacher für ihr ehrenamtliches Engagement freistellen zu lassen.\nMillionen Bürger*innen engagieren sich ehrenamtlich in (Sport-)Vereinen, der freiwilligen Feuer -\nwehr, Kirchen- und Religionsgemeinschaften, Tafeln, Frauennotrufen, Flüchtlingsorganisationen, \ndem THW und anderen Organisationen. Mit ihrer Arbeit tragen sie dazu bei, dass unser Gemein-\nwesen funktioniert.']",Der Zugang zu politischen Bildungsmöglichkeiten soll durch verstärkte politische Bildung innerhalb und außerhalb der schulischen Bildung erleichtert werden. Dies beinhaltet die Förderung von Präventionsprojekten auf verschiedenen politischen Ebenen und die Unterstützung von Arbeitnehmer*innen bei der Nutzung ihres gesetzlichen Bildungsurlaubs für ehrenamtliches Engagement.,"Wir werden Arbeitnehmer*innen verstärkt in die Lage versetzen, ihren gesetzlichen Bildungsurlaub zu nutzen, um sich einfacher für ihr ehrenamtliches Engagement freistellen zu lassen.",0.5,0.9889900355910258,0.3333333333,1.0
98,Wie soll das Gemeinnützigkeitsrecht weiterentwickelt werden?,"['Breiten- und Leistungssport werden wir fördern. Wir \nstehen als Sozialdemokraten*innen für einen Sport, der unsere Verfassungswerte auch in nationa-\nlen und internationalen Wettbewerben vorlebt. Wir werden auch in den kommenden Jahren den \nSpitzensport fördern. Darüber hinaus verlieren wir die Belange und Sorgen unserer Vereine vor Ort \nnicht aus dem Blick. Bund, Bundesländer und Kommunen sind gleichermaßen aufgefordert, die \nBasis des Sports bei der Überwindung der pandemiebedingten Probleme in besonderer Weise zu \nunterstützen. \nZu einer lebendigen Demokratie gehört eine starke Zivilgesellschaft und ein zeitgemäßes Gemein-\nnützigkeitsrecht. Daher werden wir prüfen, welche weiteren gesellschaftspolitisch bedeutsamen \nBereiche in den Katalog gemeinnütziger Zwecke aufgenommen werden können und sicherstellen, \ndass steuerbegünstigte Körperschaften wie Vereine bei der Verfolgung ihrer satzungsmäßigen \nZwecke auch politisch tätig sein können und z.B. der Aufruf eines Sportvereins zu einer Demons-\ntration gegen Rassismus und Fremdenfeindlichkeit möglich ist, ohne diese steuerliche Vergünsti-\ngung zu verlieren.\nExtremisten und Terroristen bedrohen unsere freie Gesellschaft. Um dieser erheblichen Gefahr \nwirksam begegnen zu können, muss der Verfassungsschutz die Rolle eines demokratischen Früh-\nwarnsystems erfüllen. Verfassungsfeindliche Organisationen werden wir verbieten. Wo Religions-\nfreiheit missbraucht wird und in religiösen Fanatismus umschlägt, müssen staatliche Sicherheits-\nbehörden konsequent eingreifen.'
